ID	intent	text	domain	label
3231353537353934	IN:GET_WEATHER	Kannst du mir das Wetter für den Hauptstadtbezirk New Yorks nennen?	weather	38
3231353537353734	IN:GET_WEATHER	Zeig mir das Wetter in Orlando?	weather	38
3231353537353331	IN:GET_WEATHER	Wie ist das Wetter in South Yorkshire, England?	weather	38
3231353537343532	IN:GET_WEATHER	Wie wird das Wetter am Donnerstag und Freitag?	weather	38
3231353537333333	IN:GET_WEATHER	Wie wird nächstes Wochenende das Wetter?	weather	38
3231353537313933	IN:GET_WEATHER	Wird das Wetter morgen gut sein?	weather	38
3231353536383732	IN:GET_WEATHER	Wie wird das Wetter dieses Wochenende?	weather	38
3231353536383532	IN:GET_WEATHER	Wie wird das Wetter für den nächsten Montag, der ein Feiertag ist?	weather	38
3231353536363431	IN:GET_WEATHER	Teile mir mit, wie das Wetter in Mexiko sein wird.	weather	38
3231353536343134	IN:GET_WEATHER	Sag mir die Vorhersage für Deutschland?	weather	38
3231353536303633	IN:GET_WEATHER	Sag mir das Wetter für Berlin, Deutschland	weather	38
3231353535393932	IN:GET_WEATHER	Kommt die Sonne raus?	weather	38
3231353535393538	IN:GET_WEATHER	Wird es heute Nachmittag heiß?	weather	38
3231353535393532	IN:GET_WEATHER	Wird heute ein weiterer heißer Tag?	weather	38
3231353535393233	IN:GET_WEATHER	Bleibt diese kalte Temperatur den ganzen Abend über?	weather	38
3231353535383634	IN:GET_WEATHER	Sollte ich dieses Wochenende Sonne erwarten?	weather	38
3231303133323536	IN:GET_WEATHER	Wird es Freitag bewölkt	weather	38
3138383937343937	IN:GET_WEATHER	Sollte ich einen Regenschirm mitbringen	weather	38
3135363338363838	IN:GET_WEATHER	Wann wird es schneien	weather	38
3135343634313239	IN:GET_WEATHER	Wird es an Weihnachten kalt werden?	weather	38
3134313630333332	IN:GET_WEATHER	Temperatur in Celsius in Manila heute Abend	weather	38
3134313630333037	IN:GET_WEATHER	Temperatur London Celsius	weather	38
3134313630323338	IN:GET_WEATHER	Wie kalt ist es in Shanghai in Fahrenheit	weather	38
3134313630323237	IN:GET_WEATHER	Sind es heute Abend über 16 Grad Celsius	weather	38
3231363332383039	IN:UPDATE_ALARM	Stelle meinen nächsten Wecker auf eine Stunde später ein.	alarm	39
3231363332313437	IN:UPDATE_ALARM	Ändere meinen Wecker für morgen auf 8:00 Uhr	alarm	39
3231363332313136	IN:UPDATE_ALARM	Ich muss meinen Wecker ändern	alarm	39
3231363332313030	IN:UPDATE_ALARM	Aktualisiere meinen Wecker auf Freitag 18:00 Uhr.	alarm	39
3231353939343932	IN:UPDATE_ALARM	Verschiebe den Wecker auf 20:00 Uhr am Samstag	alarm	39
39353639323637	IN:UPDATE_ALARM	Ändere den Wecker zu 10:00 Uhr	alarm	39
39353530323932	IN:UPDATE_ALARM	Ändere den Wecker zu 4:00 Uhr	alarm	39
39353433303436	IN:UPDATE_ALARM	Ändere bitte den Wecker zu 6:00 Uhr	alarm	39
3231353939353336	IN:UPDATE_ALARM	Ändere meinen Wecker für „Murdock Msyteries" und stelle ihn für den 5. Juni	alarm	39
39343732383933	IN:UPDATE_ALARM	Wiederhole den Wecker jeden Tag	alarm	39
3132353832313934	IN:REPLAY_MUSIC	Spiele diesen Song noch einmal	music	40
3132353830383936	IN:REPLAY_MUSIC	Starte den Titel neu	music	40
3132353732383833	IN:REPLAY_MUSIC	Kann ich das erste Lied noch einmal anhören	music	40
39353736363831	IN:REPLAY_MUSIC	Spiele das letzte auf Spotify gespielte Album erneut.	music	40
39353638313432	IN:REPLAY_MUSIC	Spiele den aktuellen Song nochmal.	music	40
39353537353431	IN:REPLAY_MUSIC	Spiele das Lied einfach nochmal	music	40
39353534383534	IN:REPLAY_MUSIC	Spiele das Lied nochmal	music	40
39353530303238	IN:REPLAY_MUSIC	Spiele dieses Lied nochmal.	music	40
39353239303037	IN:REPLAY_MUSIC	Kannst du dieses Lied bitte wiederholen?	music	40
39353036303930	IN:REPLAY_MUSIC	Wiederhole Maniac von Jhene Aiko	music	40
3231373530343432	IN:GET_DATE_TIME_EVENT	Ich möchte, dass du mir sagst wann dieses Event beginnt	event	41
3231373530323335	IN:GET_DATE_TIME_EVENT	Wann beginnt diese Veranstaltung?	event	41
3231373530343737	IN:GET_DATE_TIME_EVENT	Kannst du mir sagen wann An Evening with Debra Messing beginnt	event	41
3231373530343039	IN:GET_DATE_TIME_EVENT	Ich bitte dich, mir zu sagen wann das zweite Event beginnt	event	41
3231373530373635	IN:GET_DATE_TIME_EVENT	Ich möchte, dass du mir sagst wann das letzte Event beginnt	event	41
3139393831373335	IN:GET_DATE_TIME_EVENT	Wann ist das Schulkonzert	event	41
3232353332373533	IN:CREATE_CALL	Rufe Christina Harvey an	calling	42
3232353332373036	IN:CREATE_CALL	Rufe Horace Tyler an	calling	42
3232353332313438	IN:CREATE_CALL	Rufe Karl an	calling	42
3232353332303932	IN:CREATE_CALL	Rufe Brad an	calling	42
3232353331343334	IN:CREATE_CALL	Wähle die 555-7533	calling	42
3232353331343233	IN:CREATE_CALL	Wähle 555-0522	calling	42
3232353331333936	IN:CREATE_CALL	Bitte wähle 5551575	calling	42
3232353331333636	IN:CREATE_CALL	Ich würde mit meinem Handy gerne 5685552987 anrufen	calling	42
3232353331333634	IN:CREATE_CALL	Kannst du die 814-555-0487 mit meinem Handy anrufen	calling	42
3232353331323937	IN:CREATE_CALL	Bitte rufe 3105555774 von meinem Handy an	calling	42
3232353331323638	IN:CREATE_CALL	Ich möchte 555-9463 über Pixel anrufen	calling	42
3232353139313332	IN:CREATE_CALL	Rufe Emilia Morse an	calling	42
3232353138373236	IN:CREATE_CALL	Ich würde gerne mit meinen Cousins und Cousinen Britney, John, Jacob und Michaela auf Whatsapp telefonieren	calling	42
3232353138373038	IN:CREATE_CALL	Ich möchte gerne mit meinen Cousinen Ashlyn, Linda, Chloe, und Angel über Whatsapp telefonieren	calling	42
3232353138363939	IN:CREATE_CALL	Starte einen Videoanruf mit meinen Freunden Jackson, Miguel, Dylan und Kaitlyn per Messenger	calling	42
3232353138353636	IN:CREATE_CALL	Ich möchte einen Anruf mit Phillip Leonard und Kody Frye über Slack	calling	42
3232353138343935	IN:CREATE_CALL	Wähle bitte James Torres, Marissa Welch und Natasha Fleming	calling	42
3232353138333233	IN:CREATE_CALL	Ich würde gerne Brian und Louis anrufen	calling	42
3232353138323131	IN:CREATE_CALL	Erstelle für mich einen Videoanruf mit Reagan, Charles und Alina	calling	42
3232353138313633	IN:CREATE_CALL	Starte einen Anruf mit den Drama-Nerds	calling	42
3232353137373830	IN:CREATE_CALL	Führe einen Videoanruf mit Knitting durch	calling	42
3232353038323035	IN:CREATE_CALL	Ich möchte meine Fotographen-Gruppe anrufen	calling	42
3232343534323138	IN:CREATE_CALL	Könntest du einen Videoanruf starten	calling	42
3232343534323132	IN:CREATE_CALL	Kannst du WhatsApp-Kontake anrufen	calling	42
3232343430303039	IN:CREATE_CALL	Klingel Phillip an	calling	42
3232333730383137	IN:CREATE_CALL	Wähle Roses Oma	calling	42
3232333730373835	IN:CREATE_CALL	Ruf Kaitlyn Dukes Schwester an	calling	42
3232333730373734	IN:CREATE_CALL	Ruf den Partner von Melanie Suarez an	calling	42
3232333730363234	IN:CREATE_CALL	Wähle die Nummer von Maverick Olsons Frau	calling	42
3232333730333931	IN:CREATE_CALL	Könntest du Hadley Peterson, Marianas Mutter, anrufen	calling	42
3232333730333736	IN:CREATE_CALL	Rufe Brooks Opa Daniela Cummings an	calling	42
3232333636343237	IN:CREATE_CALL	Rufe meinen Papa über WhatsApp an	calling	42
3232333636333531	IN:CREATE_CALL	Whatsapp Anruf des Handys der Nichte	calling	42
3232333636333330	IN:CREATE_CALL	Rufe meine Enkelin per Videoanruf bei Whatsapp an	calling	42
3232333636333138	IN:CREATE_CALL	Rufe Geschwisterkind im WhatsApp Videochat an	calling	42
3232333636323637	IN:CREATE_CALL	Rufe meinen WhatsApp-Kontakt Freund an	calling	42
3232333636313234	IN:CREATE_CALL	Ruf Christopher Thomas über WhatsApp an	calling	42
3232333636303935	IN:CREATE_CALL	Rufe Wesley über Whatsapp an	calling	42
3232333635393533	IN:CREATE_CALL	Rufe Scarlet über Whatsapp an	calling	42
3232333635393031	IN:CREATE_CALL	Rufe Stephanie Cruz auf Whatsapp an	calling	42
3232333635383734	IN:CREATE_CALL	Rufe Scarlett auf Whatsapp an	calling	42
3232333635383639	IN:CREATE_CALL	Whatsapp Videoanruf Royal	calling	42
3232333635363032	IN:CREATE_CALL	Rufe Valeria Walter an, rufe Madden Leonard per Whatsapp an	calling	42
3232333635353231	IN:CREATE_CALL	Rufe meinen WhatsApp-Kontakt Alexa Delgado an	calling	42
3232333635353136	IN:CREATE_CALL	Rufe meinen WhatsApp-Kontakt Finn Crawford an	calling	42
3232333635333837	IN:CREATE_CALL	Rufe Kevin Potter aus meinen Whatsapp Kontakten an	calling	42
3232333635333832	IN:CREATE_CALL	Ruf Destiny Mcconnell aus meinen Whatsapp-Kontakten an	calling	42
3232333635323838	IN:CREATE_CALL	Rufe per Whatsapp Kendall Holden an	calling	42
3232333635323336	IN:CREATE_CALL	Ruf Gunnar auf WhatsApp an	calling	42
3232333635323231	IN:CREATE_CALL	Rufe Jaden Downs per Videoanruf auf Whatsapp an	calling	42
3232333635323138	IN:CREATE_CALL	Ruf Mackenzie Stevens per Video auf WhatsApp an	calling	42
3232333239333335	IN:CREATE_CALL	Wir werden jetzt Kaleb Price anrufen	calling	42
3232313933383030	IN:CREATE_CALL	Kontaktiere Andrea Cordova auf WhatsApp	calling	42
3232313933373336	IN:CREATE_CALL	Kannst du Victor Short auf WhatsApp anrufen	calling	42
3232313933373333	IN:CREATE_CALL	Ruf Elaina Baxter bitte mit Messenger an	calling	42
3232313933363637	IN:CREATE_CALL	Rufe James Petersen mit Messenger an	calling	42
3232313933363534	IN:CREATE_CALL	WhatsApp-Anruf an Leonel Frederick	calling	42
3232313933363030	IN:CREATE_CALL	Versuche Jose Dunn mit WhatsApp anzurufen	calling	42
3232313536383634	IN:CREATE_CALL	Rufe meinen Vater River Robertson über WeChat an	calling	42
3232313536383131	IN:CREATE_CALL	Beginne einen Anruf mit Elizabeth über WeChat	calling	42
3232313536373436	IN:CREATE_CALL	Rufe Kenneth WhatsApp an	calling	42
3232313536363334	IN:CREATE_CALL	Rufe Matias Gould über WhatsApp an	calling	42
3232313536353831	IN:CREATE_CALL	Rufe Dominic Lutz per Whatsapp an	calling	42
3232313332343833	IN:CREATE_CALL	Rufe Stanley und Clayton an	calling	42
3232313332343732	IN:CREATE_CALL	Rufe Baker und Myers an	calling	42
3232313332333832	IN:CREATE_CALL	Rufe Ella und Juliana an	calling	42
3232313332333137	IN:CREATE_CALL	Rufe Samantha und Payton an	calling	42
3232313332333037	IN:CREATE_CALL	Rufe Brown und Garcia an	calling	42
3231373538373339	IN:CREATE_CALL	Rufe sofort Deborah an	calling	42
3231373538353837	IN:CREATE_CALL	Wähle sofort Matthew	calling	42
3231373538333538	IN:CREATE_CALL	Rufe die dritte Dayana an	calling	42
3231373538303938	IN:CREATE_CALL	Rufe Michelle Nummer drei an	calling	42
3231373538303130	IN:CREATE_CALL	Rufe Victoria vier an	calling	42
3231373537393532	IN:CREATE_CALL	Rufe Nummer vier an	calling	42
3231373438343035	IN:CREATE_CALL	Rufe Jerome James an	calling	42
3231373438333934	IN:CREATE_CALL	Rufe Lizbeth Hatfield an	calling	42
3231373330323035	IN:CREATE_CALL	Rufe stattdessen Nicholas an	calling	42
3231373330313639	IN:CREATE_CALL	Rufe stattdessen Arturo Berry an	calling	42
3231373330313536	IN:CREATE_CALL	Rufe stattdessen Jack an	calling	42
3231373330313139	IN:CREATE_CALL	Rufe stattdessen Aria Duke an	calling	42
3231373236383131	IN:CREATE_CALL	Rufe Elliot an	calling	42
3231373234323739	IN:CREATE_CALL	Rufe bitte John an	calling	42
3231373232323838	IN:CREATE_CALL	Rufe meine Großmutter Melissa per WhatsApp an	calling	42
3231373232323532	IN:CREATE_CALL	Lass uns Elias Valdez per Whatsapp anrufen	calling	42
3231373232323331	IN:CREATE_CALL	Rufe Guillermo Hernandez per WhatsApp an	calling	42
3231373232313037	IN:CREATE_CALL	Sprich mit Janet per WhatsApp	calling	42
3231373131363635	IN:CREATE_CALL	Rufe Miriam Anastasia Randall für mich an	calling	42
3231373131353836	IN:CREATE_CALL	Rufe Ezekiel Daxton Farley für mich an	calling	42
3231373131353530	IN:CREATE_CALL	Ruf Remington Kayson Merritt für mich an	calling	42
3231373131333035	IN:CREATE_CALL	Ruf jetzt Ahmad A Wu an	calling	42
3231373131323237	IN:CREATE_CALL	Ich möchte BB Guerra anrufen	calling	42
3231373131313634	IN:CREATE_CALL	Kannst du Stephanie R Krueger anrufen	calling	42
3231373131313439	IN:CREATE_CALL	Ich möchte Amy R Woodward anrufen	calling	42
3231373131303631	IN:CREATE_CALL	Ruf jetzt Joseph Peck Nguyen an	calling	42
3231373131303238	IN:CREATE_CALL	Ich würde gerne Nicole Gilmore Shelton anrufen	calling	42
3231373131303035	IN:CREATE_CALL	Rufe Melissa David Alvarez an	calling	42
3231373130393436	IN:CREATE_CALL	Ich möchte Lucia Claire Guerra anrufen	calling	42
3231363734353934	IN:CREATE_CALL	Bitte ruf meinen Stiefvater an	calling	42
3231363734353435	IN:CREATE_CALL	Rufe Jeremy an	calling	42
3231363734353234	IN:CREATE_CALL	Rufe meine Großmutter an	calling	42
3231363734353034	IN:CREATE_CALL	Rufe bitte meine Tochter an	calling	42
3231363734313439	IN:CREATE_CALL	Rufe Tammy an	calling	42
3231363733383539	IN:CREATE_CALL	Rufe mein Mädchen an	calling	42
3231363733383439	IN:CREATE_CALL	Rufe das Handy meiner Großmutter an	calling	42
3231363733373834	IN:CREATE_CALL	Kannst du meinen Bruder John anrufen	calling	42
3231363037333538	IN:CREATE_CALL	Rufe Connor E an	calling	42
3231363037323735	IN:CREATE_CALL	Rufe meinen Bruder Felix an	calling	42
3231353436363036	IN:CREATE_CALL	Rufe Paul an	calling	42
3231353436353431	IN:CREATE_CALL	Ruf Genny an	calling	42
3231353436333930	IN:CREATE_CALL	Rufe meine Tante an	calling	42
3231353436333734	IN:CREATE_CALL	Ruf jetzt meinen Freund an	calling	42
3231353436333732	IN:CREATE_CALL	Rufe jetzt Baxter an	calling	42
3231353436323031	IN:CREATE_CALL	Ruf bitte meine Schwester an	calling	42
3231353436303035	IN:CREATE_CALL	Rufe Nathan aus meinen Kontakten an	calling	42
3231353435393837	IN:CREATE_CALL	Rufe Polly an	calling	42
3231353138343136	IN:CREATE_CALL	Rufe Brant Shopp per Facetime an	calling	42
3231353138333938	IN:CREATE_CALL	Rufe Enid Requa jetzt an ja	calling	42
3231353036363530	IN:CREATE_CALL	Rufe Ok Skripkos Enkel an	calling	42
3231353036353232	IN:CREATE_CALL	Rufe Monty Melbys Sohn an	calling	42
3231353036343839	IN:CREATE_CALL	Rufe Aubrees Schwester an	calling	42
3231353036343831	IN:CREATE_CALL	Ruf Candy Boykins Nichte an	calling	42
3231353036343735	IN:CREATE_CALL	Rufe den Onkel von Dorathy Jon Postemski an	calling	42
3231353036343538	IN:CREATE_CALL	Ruf Veras Tante an	calling	42
3231353036343438	IN:CREATE_CALL	Ruf Lias Mom an	calling	42
3231353036343132	IN:CREATE_CALL	Rufe Laronda Menettes Freund an	calling	42
3231353036333537	IN:CREATE_CALL	Ruf die Mutter von Cami Lawrenz an	calling	42
3231353036313933	IN:CREATE_CALL	Rufe Tori Bortles Großmutter an	calling	42
3231353036313134	IN:CREATE_CALL	Rufe Jennie Montis Enkelin an	calling	42
3231353035393739	IN:CREATE_CALL	Rufe Francene Haldanes Vater an	calling	42
3231353035383631	IN:CREATE_CALL	Rufe Jamies Enkel an	calling	42
3231353035383436	IN:CREATE_CALL	Rufe Ariahs Mama an	calling	42
3231353035383037	IN:CREATE_CALL	Rufe Vena Deangelo Vranicars Geschwisterkind an	calling	42
3231343937303533	IN:CREATE_CALL	Rufe Russ an	calling	42
3231343937303435	IN:CREATE_CALL	Rufe Katy an	calling	42
3231343435323730	IN:CREATE_CALL	Ich würde gerne mit Elsa sprechen, bitte	calling	42
3231333535323835	IN:CREATE_CALL	Verbinde mich mit Brandon An	calling	42
3231333535323630	IN:CREATE_CALL	Schreibe Brandon ein paar Zeilen	calling	42
3231333534373239	IN:CREATE_CALL	Versuche, Jordan anzurufen	calling	42
3231333534363437	IN:CREATE_CALL	Versuche Ira Gonzales anzurufen	calling	42
3231333534343533	IN:CREATE_CALL	Ich möchte gern mit Angelica Lara sprechen	calling	42
3231333532333434	IN:CREATE_CALL	Rufe Mama an	calling	42
3231333532323733	IN:CREATE_CALL	Starte jetzt einen Anruf mit meiner Familie	calling	42
3231333532313536	IN:CREATE_CALL	Erstelle einen Gruppenanruf	calling	42
3231333531333238	IN:CREATE_CALL	Verbinde den Anruf mit meinem Vorgesetzten	calling	42
3231333437383436	IN:CREATE_CALL	Ich wollte einen Anruf tätigen	calling	42
3231333433393631	IN:CREATE_CALL	Bitte starte einen Anruf mit all meinen Freunden	calling	42
3231333431323332	IN:CREATE_CALL	Rufe Lexi an	calling	42
3231333430333832	IN:CREATE_CALL	Bitte beginne einen Anruf mit Papa	calling	42
3231333430313032	IN:CREATE_CALL	Ich muss Eric anrufen	calling	42
3231333430303237	IN:CREATE_CALL	Familien-Gruppenanruf bitte	calling	42
3231333339393637	IN:CREATE_CALL	Tritt mit Pam durch einen Anruf in Kontakt	calling	42
3231333133333134	IN:CREATE_CALL	Rufe das Handy des Ehepartners an	calling	42
3231333133313631	IN:CREATE_CALL	Verbinde mich mit Stiefbruder	calling	42
3231333131353936	IN:CREATE_CALL	Rufe Enkel an	calling	42
3231333131303336	IN:CREATE_CALL	Beginne Anruf an Mommy	calling	42
3231333130353433	IN:CREATE_CALL	Bitte ruf meine Tanten an.	calling	42
3231333130343237	IN:CREATE_CALL	Rufe Stiefmutter an	calling	42
3231333130323532	IN:CREATE_CALL	Ich möchte meine Oma Joe anrufen	calling	42
3231333130303737	IN:CREATE_CALL	Ich muss mit meinen Schwestern sprechen, bitte rufe sie sofort an	calling	42
3231333130303533	IN:CREATE_CALL	Ruf meine Nichten an	calling	42
3231333130303335	IN:CREATE_CALL	Rufe mein Enkelkind an.	calling	42
3231333039373435	IN:CREATE_CALL	Rufe den Neffen an	calling	42
3231333039373333	IN:CREATE_CALL	Starte einen Anruf mit den Stiefschwestern	calling	42
3231333039353336	IN:CREATE_CALL	Rufe jetzt Söhne an	calling	42
3231333039323638	IN:CREATE_CALL	Starte Videoanruf mit Stiefsöhnen	calling	42
3231333039313039	IN:CREATE_CALL	Ruf Ehepartner an	calling	42
3231303233393135	IN:CREATE_CALL	Rufe Bob per Videoanruf an	calling	42
3231303232353137	IN:CREATE_CALL	Starte einen Videoanruf mit Scott und Tomas	calling	42
3231303138313231	IN:CREATE_CALL	Rufe Mayra an.	calling	42
3231303136383038	IN:CREATE_CALL	Rufe meine Cousins an	calling	42
3231303135323038	IN:CREATE_CALL	Rufe John an und sag ihm ich schaffe es nicht.	calling	42
3232353332373330	IN:CREATE_CALL	Ruf Nick Mcgee an	calling	42
3232353332373031	IN:CREATE_CALL	Ruf Janis Singleton an	calling	42
3232353332333636	IN:CREATE_CALL	Rufe Roberto Carlos an	calling	42
3232353332313533	IN:CREATE_CALL	Ruf Christina an	calling	42
3232353332313234	IN:CREATE_CALL	Ruf Gabriel an	calling	42
3232353331343238	IN:CREATE_CALL	Rufe 6745557224 auf meinem Pixel an	calling	42
3232353331333133	IN:CREATE_CALL	Kannst du mit WhatsApp die 7105553393 anrufen	calling	42
3232353331333130	IN:CREATE_CALL	Ruf die 7105553393 an	calling	42
3232353331323939	IN:CREATE_CALL	Kannst du die 555-3726 vom Handy aus anrufen	calling	42
3232353331323437	IN:CREATE_CALL	Ruf die 3895555049 an	calling	42
3232353331323434	IN:CREATE_CALL	Wähle 5558156 auf dem Messenger über mein Handy	calling	42
3232353139313837	IN:CREATE_CALL	Ruf mein Geschwisterchen auf WhatsApp an	calling	42
3232353139313437	IN:CREATE_CALL	Wähle Selena Mills	calling	42
3232353138373033	IN:CREATE_CALL	Initiiere einen Videoanruf mit meinen Freunden Viviana, Graham, Alex und Zion auf Skype	calling	42
3232353138363031	IN:CREATE_CALL	Würdest du Breanna und Jarrett Carter über WhatsApp anrufen	calling	42
3232353138353932	IN:CREATE_CALL	Ruf meine Tante Zackary Conley und meine Mutter Angelo an	calling	42
3232353138353630	IN:CREATE_CALL	Beginne einen Anruf mit Elias Roach und Skylar Coffey	calling	42
3232353138353438	IN:CREATE_CALL	Starte einen Videoanruf mit Byron Jacobs, Alexia Bates und Tommy Salazar	calling	42
3232353138353132	IN:CREATE_CALL	Starte einen Anruf mit Briana Sherman und Angelique Mcclure über Messenger	calling	42
3232353138343934	IN:CREATE_CALL	Kannst du Tyree Payne, Jimmy George und Annika Everett anrufen	calling	42
3232353138343336	IN:CREATE_CALL	Starte einen Videochat mit Maddison Donovan, Evan Cote, Hugo Guzman und Patrick Chang	calling	42
3232353138343139	IN:CREATE_CALL	Beginne einen Anruf mit Hayden Greene, Danielle Kelly, Mary Brewer und Pamela Contreras über Hangouts	calling	42
3232353138333737	IN:CREATE_CALL	Erstelle einen Anruf für mich, Corbin, Jordyn und Kiana	calling	42
3232353137393534	IN:CREATE_CALL	Führe einen Anruf mit Musikern durch	calling	42
3232353137383530	IN:CREATE_CALL	Rufe Goth an	calling	42
3232353137373631	IN:CREATE_CALL	Ruf Favorit fünf Gruppe an	calling	42
3232353137373337	IN:CREATE_CALL	Rufe meine Los Angeles Gruppe über Skype an	calling	42
3232353137373038	IN:CREATE_CALL	Ich möchte einen Videoanruf mit meiner Asian Professionals Gruppe machen	calling	42
3232353137363636	IN:CREATE_CALL	Ruf Edgar, Jacquelyn, Moses und Colin an	calling	42
3232353038323336	IN:CREATE_CALL	Lass uns einen Anruf mit der Design-Code-Gruppe über Line machen	calling	42
3232343534323136	IN:CREATE_CALL	Kannst du einen Videoanruf starten	calling	42
3232343430303337	IN:CREATE_CALL	Rufe Graham an	calling	42
3232343339393730	IN:CREATE_CALL	Klingel Braxton Shah an	calling	42
3232333730383338	IN:CREATE_CALL	Rufe Ethan Tuckers Enkelin an	calling	42
3232333730383135	IN:CREATE_CALL	Ruf den Opa von Max Black an	calling	42
3232333730373933	IN:CREATE_CALL	Rufe den Großvater von Judah James an	calling	42
3232333730353933	IN:CREATE_CALL	Beginne einen Anruf mit Mark Meyers' Papa	calling	42
3232333730353231	IN:CREATE_CALL	Ruf Jennifer Currys Dad an	calling	42
3232333730343633	IN:CREATE_CALL	Rufe Dakota Stephens' Mutter an	calling	42
3232333730343334	IN:CREATE_CALL	Ruf Alexa Delgados Freund an	calling	42
3232333730343135	IN:CREATE_CALL	Rufe Elaina Baxters Vater an	calling	42
3232333636303237	IN:CREATE_CALL	Rufe Mateo Barrera über WhatsApp an	calling	42
3232333635393834	IN:CREATE_CALL	Rufe Gemma Stafford über WhatsApp an	calling	42
3232333635363638	IN:CREATE_CALL	Ruf Lennon im Whatsapp Videochat an	calling	42
3231353134363533	IN:GET_SUNSET	Wann ist der neunte Sonnenuntergang	weather	43
3231313235343131	IN:GET_SUNSET	Um wie viel Uhr ist Sonnenuntergang?	weather	43
3132353934313432	IN:GET_SUNSET	Wann geht heute die Sonne unter	weather	43
3231373530323536	IN:GET_LOCATION	Wo ist das zweite Event?	event	44
3139343333373034	IN:GET_LOCATION	Wo wurde George Lucas geboren?	people	44
3139343333343936	IN:GET_LOCATION	Woher kommt Akira Kurosawa?	people	44
3139343332353531	IN:GET_LOCATION	Wo ist Steve Jobs aufgewachsen?	people	44
3138393935343034	IN:GET_LOCATION	Wo lebt Miguel?	people	44
3138393839393936	IN:GET_LOCATION	Wo ist Michaels Schule?	people	44
3138393837303232	IN:GET_LOCATION	Wie lautet meine Arbeitsadresse?	people	44
3138393836393334	IN:GET_LOCATION	Lebt Lili in Asheville	people	44
3138393836383433	IN:GET_LOCATION	Stimmt es, das Paul in Garden Grove lebt?	people	44
3138393836353730	IN:GET_LOCATION	Wo arbeitet Kade	people	44
3138393836343638	IN:GET_LOCATION	Wo lebt Kus?	people	44
3138393836333131	IN:GET_LOCATION	Wo lebt James jetzt?	people	44
3138393836313134	IN:GET_LOCATION	Lebt Bill immer noch in Ogden?	people	44
3138393835343433	IN:GET_LOCATION	Wo lebt Patty?	people	44
3138393835333533	IN:GET_LOCATION	Was ist Lis Haus-Adresse?	people	44
3139343333363134	IN:GET_LOCATION	Wo wurde Chris Rock geboren?	people	44
3139343332353036	IN:GET_LOCATION	Wo ist Justin Timberlake aufgewachsen?	people	44
3138393836393235	IN:GET_LOCATION	Wer weiß, wo Jack jetzt lebt	people	44
3138393836353430	IN:GET_LOCATION	Lebt Hanna noch immer in Charleston	people	44
3138393835363733	IN:GET_LOCATION	Wo lebt Vanessa?	people	44
3138393835363335	IN:GET_LOCATION	Wo lebt Brad?	people	44
3138393835333733	IN:GET_LOCATION	Lebt Larry in San Leandro?	people	44
3138393835333537	IN:GET_LOCATION	Lebt Lili in Ägypten?	people	44
3138393835323632	IN:GET_LOCATION	In welcher Stadt lebt Ahmed ?	people	44
3138393835313433	IN:GET_LOCATION	Lebt Ben in Springfield?	people	44
3138393834373939	IN:GET_LOCATION	Lebt Liz in New York City	people	44
3138393834373030	IN:GET_LOCATION	Wo lebt Mia?	people	44
3138393834363237	IN:GET_LOCATION	Lebt Alex in Bemont	people	44
3138393739383038	IN:GET_LOCATION	Wo in Seattle lebt Jane?	people	44
3232343533313335	IN:SET_RSVP_NO	Ändere meinen Status zu gehe nicht zu Sleeping Beauty Dreams	event	45
3232343532363737	IN:SET_RSVP_NO	Ändere meinen Status zu gehe nicht zum Dia de los Muertos	event	45
3232323232323030	IN:SET_RSVP_NO	Ändere meinen Status auf kann nicht zu diesem Event gehen	event	45
3232323232313137	IN:SET_RSVP_NO	Bitte antworte nein zu Bon Iver im Gorge Amphitheater	event	45
3232343533323037	IN:SET_RSVP_NO	Ändere meinen Status zu gehe nicht zu diesem Event	event	45
3232343533313831	IN:SET_RSVP_NO	Gehe nicht zu Paws to Party	event	45
3232343533303732	IN:SET_RSVP_NO	gehe nicht zu diesem Event	event	45
3232343532363233	IN:SET_RSVP_NO	Ich gehe nicht zu Po' Boy Pop-Up	event	45
3232343532303436	IN:SET_RSVP_NO	Ändere meinen Status zu gehe nicht zu Burning Man	event	45
3232323232313839	IN:SET_RSVP_NO	Antworte bitte nein an Feast of San Gennaro	event	45
3232343532373939	IN:SET_RSVP_NO	Markiere mich als gehe nicht zum dritten Event	event	45
3231343030383937	IN:DELETE_REMINDER	Entferne bitte meine Erinnerung, Klarinette zu üben.	reminder	48
3231323431313932	IN:DELETE_REMINDER	Lösche die Erinnerung, den Zahnarzt anzurufen	reminder	48
3231323430373539	IN:DELETE_REMINDER	Lösche meine Erinnerung Toilettenpapier zu kaufen.	reminder	48
3231323430363333	IN:DELETE_REMINDER	Entferne meine Erinnerungen für heute	reminder	48
3231323430353234	IN:DELETE_REMINDER	Lösche die Erinnerung an den Geburtstag meiner Mutter	reminder	48
3231323430323135	IN:DELETE_REMINDER	Entferne die Erinnerung meine Handyrechnung zu bezahlen.	reminder	48
3231323339373530	IN:DELETE_REMINDER	Entferne alle meine Erinnerungen	reminder	48
3231323339303537	IN:DELETE_REMINDER	Lösche meine Dienstags-Erinnerung.	reminder	48
3231323338303235	IN:DELETE_REMINDER	Lösche alle meine Erinnerungen	reminder	48
3231323337313333	IN:DELETE_REMINDER	Lösche Erinnerung für morgen	reminder	48
3231323337303939	IN:DELETE_REMINDER	Lösche bitte meine Erinnerung für Bacon kaufen	reminder	48
3231323336343832	IN:DELETE_REMINDER	Lösche die Erinnerung, Eier zu kaufen	reminder	48
3231323336343635	IN:DELETE_REMINDER	Lösche alle meine Erinnerungen	reminder	48
3231323336343430	IN:DELETE_REMINDER	Entferne meine Erinnerung, mit dem Hund Gassi zu gehen	reminder	48
3231323333373530	IN:DELETE_REMINDER	Bitte lösche alle meine ESPN-Erinnerungen	reminder	48
