ID	intent	text	domain	label
39353037313834	IN:PREVIOUS_TRACK_MUSIC	Bitte wiederhole das letzte Lied	music	81
39343933313732	IN:PREVIOUS_TRACK_MUSIC	Kannst du das letzte Lied nochmal spielen?	music	81
39343930333331	IN:PREVIOUS_TRACK_MUSIC	Spiel das letzte Lied bitte noch einmal	music	81
39343635373732	IN:PREVIOUS_TRACK_MUSIC	Spiele den vorherigen Track noch mal ab	music	81
3135323933373932	IN:SUBTRACT_TIME_TIMER	Bitte entferne 10 Minuten vom Timer	timer	82
39353732313934	IN:SUBTRACT_TIME_TIMER	Bitte verkürze meinen Timer um 10 Minuten	timer	82
39353638333132	IN:SUBTRACT_TIME_TIMER	Kürze den Timer um 5 Minuten.	timer	82
39353532303432	IN:SUBTRACT_TIME_TIMER	Ziehe 1 Minute vom Timer ab	timer	82
39353236393931	IN:SUBTRACT_TIME_TIMER	Verkürze den aktuellen Timer um die Hälfte	timer	82
39343935323936	IN:SUBTRACT_TIME_TIMER	Ziehe zehn Minuten vom aktuellen Timer ab.	timer	82
39343839393834	IN:SUBTRACT_TIME_TIMER	Zieh 15 Minuten ab	timer	82
39343738373138	IN:SUBTRACT_TIME_TIMER	Zieh 15 Minuten von meinem Timer ab	timer	82
3132353635303331	IN:QUESTION_MUSIC	In welchem Jahr kam das raus?	music	83
39353735303632	IN:QUESTION_MUSIC	Wer hat „No problem" gesungen?	music	83
39353730383932	IN:QUESTION_MUSIC	Welches Album erzielt den höchsten Umsatz in den USA in diesem Jahr?	music	83
39343635343632	IN:QUESTION_MUSIC	Wer singt „I Can See Clearly Now"?	music	83
3231363336373338	IN:SILENCE_ALARM	Schalte den Alarm auf stumm.	alarm	85
3231363336363737	IN:SILENCE_ALARM	Ausschalten	alarm	85
3231363336363533	IN:SILENCE_ALARM	Ruhe.	alarm	85
3231363336353630	IN:SILENCE_ALARM	Schalt meine Alarme aus.	alarm	85
3231353535373236	IN:SILENCE_ALARM	Stoppe den Alarm	alarm	85
39353439303239	IN:SILENCE_ALARM	Beende den Alarm	alarm	85
39353338383930	IN:SILENCE_ALARM	Alarm jetzt löschen	alarm	85
39353135313235	IN:SILENCE_ALARM	Bitte schalte den Wecker aus.	alarm	85
39353134313737	IN:SILENCE_ALARM	Ich muss den Wecker abstellen	alarm	85
39343935343030	IN:SILENCE_ALARM	Lösche meinen nächsten Alarm.	alarm	85
39343731393137	IN:SILENCE_ALARM	Bitte schalte meinen Alarm aus	alarm	85
39343932373638	IN:CREATE_ALARM	Bitte stelle einen Wecker für 5 Uhr morgens	alarm	87
39343839303338	IN:CREATE_ALARM	Stelle einen Alarm alle 5 Minuten für 30 Minuten	alarm	87
39343837383531	IN:CREATE_ALARM	stell einen Wecker auf heute 15 Uhr	alarm	87
39343836383533	IN:CREATE_ALARM	Stelle einen Wecker jede Minute für die nächsten 60 Minuten ein	alarm	87
39343836343231	IN:CREATE_ALARM	ERSTELLE EINEN ALARM, DER 45 MINUTEN LANG ALLE 5 MINUTEN KLINGELT	alarm	87
39343737383538	IN:CREATE_ALARM	Könntest du bitte meinen Wecker für jeden Samstag auf 4 Uhr morgens stellen?	alarm	87
39343735363538	IN:CREATE_ALARM	Einen Wecker alle 7 Minuten setzen.	alarm	87
39343733303533	IN:CREATE_ALARM	Stell einen Wecker auf 7:30 Uhr.	alarm	87
39343731343137	IN:CREATE_ALARM	stell bitte einen Wecker auf 12 Uhr mittags	alarm	87
39343731333035	IN:CREATE_ALARM	Stelle einen Wecker auf morgen 10:30 Uhr.	alarm	87
39343638323938	IN:CREATE_ALARM	Stell einen Alarm für 7 Minuten ein, mit einer Warnung die nach 5 Minuten ertönt.	alarm	87
39343636383131	IN:CREATE_ALARM	Stell für jeden Tag dieser Woche einen Wecker auf 9.:30 Uhr.	alarm	87
3232343330353530	IN:CREATE_ALARM	Stelle den Wecker auf 6 Uhr morgens	alarm	87
3232333238363037	IN:CREATE_ALARM	Stell den Wecker für 15 Minuten ab jetzt	alarm	87
3232323630383139	IN:CREATE_ALARM	Stell den Wecker für ein Wochenende	alarm	87
3232323630383038	IN:CREATE_ALARM	Wiederkehrender Alarm für jeden Mittwoch, 19 Uhr	alarm	87
3232313432323534	IN:CREATE_ALARM	Stell den Wecker auf 11 Minuten ab dieser Sekunde	alarm	87
3232313432323434	IN:CREATE_ALARM	Kannst du den Wecker auf 5 Minuten ab jetzt stellen	alarm	87
3231363337343033	IN:CREATE_ALARM	Ich brauch einen neuen Alarm für heute Nachmittag.	alarm	87
3231363337323131	IN:CREATE_ALARM	Stell für morgen den Wecker	alarm	87
3231363337313337	IN:CREATE_ALARM	Richte einen Alarm ein.	alarm	87
3231363337303933	IN:CREATE_ALARM	Stelle bitte meinen Alarm ein	alarm	87
3231363336333734	IN:CREATE_ALARM	Ich muss um 07.00 Uhr aufwachen	alarm	87
3231363336333231	IN:CREATE_ALARM	Erstelle einen Wecker für 5 Uhr morgens	alarm	87
3231363336333030	IN:CREATE_ALARM	Weck mich morgens auf	alarm	87
3231363336323438	IN:CREATE_ALARM	Stelle den Wecker auf 14 Uhr	alarm	87
3231363336323432	IN:CREATE_ALARM	Stelle den Wecker für die nächste Woche auf 5 Uhr morgens	alarm	87
3231363336303933	IN:CREATE_ALARM	Ich muss um 7 Uhr aufwachen	alarm	87
3231363335393130	IN:CREATE_ALARM	Erstelle einen neuen Alarm für morgen Abend um 20 Uhr.	alarm	87
3231363335383230	IN:CREATE_ALARM	Stelle den Wecker auf Dienstag 15 Uhr	alarm	87
3231363335373038	IN:CREATE_ALARM	Stell den Wecker auf Sonntag 9 Uhr	alarm	87
3231363335343834	IN:CREATE_ALARM	Stell den Wecker für den 7. Juni	alarm	87
3231363335343332	IN:CREATE_ALARM	Erstelle einen Alarm für morgen Nachmittag um 15 Uhr	alarm	87
3231363335333937	IN:CREATE_ALARM	Kannst du den Wecker für den 22. März auf 5 Uhr morgens stellen?	alarm	87
3231363335333130	IN:CREATE_ALARM	Bitte stell den Wecker für den 12. Juni	alarm	87
3231363335323031	IN:CREATE_ALARM	Setze einen Alarm für den 10. Oktober	alarm	87
3231363335313634	IN:CREATE_ALARM	Erstelle einen neuen Alarm für den ersten Januar nächsten Jahres um 15 Uhr.	alarm	87
3231363335313030	IN:CREATE_ALARM	Weck mich am 2. um 7 Uhr morgens	alarm	87
3231363335303835	IN:CREATE_ALARM	Aktiviere einen Alarm am 16. Juli	alarm	87
3231363335303737	IN:CREATE_ALARM	Erstelle einen Alarm für den 4. Mai	alarm	87
3231363334383936	IN:CREATE_ALARM	Stelle den Wecker täglich auf 6 Uhr morgens	alarm	87
3231363334383431	IN:CREATE_ALARM	Setze jeden Samstag, 12 Uhr einen Alarm	alarm	87
3231363334373031	IN:CREATE_ALARM	Ich brauche einen wöchentlichen Alarm für montags, 5 Uhr	alarm	87
3231363334363730	IN:CREATE_ALARM	Wiederhole den Alarm jeden Montag um 16 Uhr	alarm	87
3231363334363436	IN:CREATE_ALARM	Bitte einen wiederkehrenden Alarm, donnerstags um 9 Uhr.	alarm	87
3231363334363239	IN:CREATE_ALARM	Wiederhole den Alarm an allen Wochentagen um 4 Uhr morgens	alarm	87
3231363334313933	IN:CREATE_ALARM	Stell den Wecker auf morgen, 7 Uhr	alarm	87
3231363333383536	IN:CREATE_ALARM	Setze heute Nachmittag um 15 Uhr einen Alarm, um das Auto wegzufahren	alarm	87
3231363333383433	IN:CREATE_ALARM	Setze täglich einen Alarm um 8 Uhr, um zur Arbeit zu gehen	alarm	87
3231363333363730	IN:CREATE_ALARM	Neuer Alarm, um mich aufzuwecken	alarm	87
3231363333343336	IN:CREATE_ALARM	Stell den Wecker für heute 23 Uhr und Mitternacht ein	alarm	87
3231363333333838	IN:CREATE_ALARM	Erstelle für morgen 17 Uhr und 18 Uhr einen Alarm	alarm	87
3231363333323235	IN:CREATE_ALARM	Erstelle einen Alarm für 16:15 Uhr und 19:00 Uhr	alarm	87
3231363333313737	IN:CREATE_ALARM	Stelle den Wecker für morgen auf 6 und 7 Uhr	alarm	87
3231363333313631	IN:CREATE_ALARM	Heute zwei Alarme, 12 und 2	alarm	87
3231363332393335	IN:CREATE_ALARM	Setze einen neuen Alarm für Dienstag um 6 Uhr morgens und um 18 Uhr	alarm	87
3231363039323438	IN:CREATE_ALARM	Stell mir einen neuen Alarm für 2460 ein	alarm	87
3231363039303439	IN:CREATE_ALARM	Erstelle einen Alarm für 15:55 Uhr	alarm	87
3231363038383736	IN:CREATE_ALARM	Stell einen Alarm für 12:35 Uhr	alarm	87
3231363038353137	IN:CREATE_ALARM	Stell einen Alarm für 8.45 Uhr.	alarm	87
3231363038313534	IN:CREATE_ALARM	Löse um 23:45 Uhr einen Alarm aus	alarm	87
3231363038313338	IN:CREATE_ALARM	Erinnerung mit Signalton um 21:10	alarm	87
3231363037383431	IN:CREATE_ALARM	Stell mir einen neuen Alarm für 21:05 ein	alarm	87
3231363037373934	IN:CREATE_ALARM	Stelle einen Alarm für 22:40 Uhr ein	alarm	87
3231363031393631	IN:CREATE_ALARM	Erinnere mich um 16:30 Uhr.	alarm	87
3231363031383435	IN:CREATE_ALARM	Stell den Wecker auf genau 14.01 Uhr.	alarm	87
3231363031383232	IN:CREATE_ALARM	Kannst du den Wecker auf 6 Uhr abends stellen?	alarm	87
3231363031353737	IN:CREATE_ALARM	Wecke mich morgen früh	alarm	87
3231363031353139	IN:CREATE_ALARM	Erstelle bitte einen Alarm für Freitag	alarm	87
3231363031343839	IN:CREATE_ALARM	Könntest du einen Alarm für nächsten Dienstag einstellen?	alarm	87
3231363031343036	IN:CREATE_ALARM	Weck mich nächsten Dienstag bitte um 8.	alarm	87
3231363031333232	IN:CREATE_ALARM	Füge einen Alarm für den 2. Juli hinzu	alarm	87
3231363030373837	IN:CREATE_ALARM	Stell bitte für 2 Monate freitags um 6 Uhr morgens einen Alarm ein	alarm	87
3231363030363130	IN:CREATE_ALARM	Kannst du jeden Montag einen Alarm um 7 Uhr morgens einstellen?	alarm	87
3231363030353234	IN:CREATE_ALARM	Erstelle einen Erinnerungsalarm für morgen Mittag.	alarm	87
3231363030353034	IN:CREATE_ALARM	Stell den Wecker auf Freitagnachmittag, 16 Uhr	alarm	87
3231363030343636	IN:CREATE_ALARM	Erstelle einen Alarm für nächsten Dienstag, um um 18 Uhr das Paket abzuholen.	alarm	87
3231363030343038	IN:CREATE_ALARM	Stell einen „Zeit zum Spielen"-Alarm um 19 Uhr	alarm	87
3231363030323537	IN:CREATE_ALARM	Erstelle einen Alarm zum Schlafengehen	alarm	87
3231353939363936	IN:CREATE_ALARM	Stelle wiederkehrende Alarme für sonntags um 10 Uhr morgens und 2 Uhr nachmittags	alarm	87
3231353939363530	IN:CREATE_ALARM	Stelle zwei Wochen lang täglich zwei Alarme um 6 und 9 Uhr ein	alarm	87
3231353939353832	IN:CREATE_ALARM	Kannst du bitte für Freitag, 7 und 8 Uhr einen Alarm erstellen?	alarm	87
3231353535323237	IN:CREATE_ALARM	Kannst du bitte einen Alarm für 7:00 Uhr einstellen?	alarm	87
3231353535303031	IN:CREATE_ALARM	Erstelle einen Alarm für Donnerstag Morgen	alarm	87
3231353534393839	IN:CREATE_ALARM	Den Wecker auf Freitag, 15:30 Uhr stellen	alarm	87
3231353534393633	IN:CREATE_ALARM	Stell einen Alarm für Samstag, 23 Uhr.	alarm	87
3231353534383232	IN:CREATE_ALARM	Erstell einen neuen Alarm für Samstag.	alarm	87
3231353534363531	IN:CREATE_ALARM	Schalte den Alarm für morgen früh ein	alarm	87
3231353534353832	IN:CREATE_ALARM	Stell einen Alarm ein, der am 26. März 2019 um 21 Uhr losgeht	alarm	87
3231353534353632	IN:CREATE_ALARM	Stell einen Alarm für den 25. Dezember ein.	alarm	87
3231353534333032	IN:CREATE_ALARM	Ich möchte, dass der Wecker am 15. Mai um 10 Uhr klingelt	alarm	87
3231353534323533	IN:CREATE_ALARM	Bitte stell den Alarm für den 5. Juli ein.	alarm	87
3231353533353738	IN:CREATE_ALARM	Alarme erstellen für montags um 7:15 und 7:30 morgens.	alarm	87
3231353533353537	IN:CREATE_ALARM	Stell einen täglich wiederholenden Alarm für 7 Uhr und 7:10 Uhr ein.	alarm	87
3231353533353030	IN:CREATE_ALARM	Stell den Wecker auf 8:00 Uhr und 9:00 Uhr	alarm	87
3231353533343338	IN:CREATE_ALARM	Erstell Alarme für jeden Tag um 7 Uhr und 7:30 Uhr	alarm	87
3231353533343336	IN:CREATE_ALARM	Stell für Dienstag um 3 und 4 Uhr morgens einen Alarm ein, der sich wiederholt	alarm	87
3231353533333634	IN:CREATE_ALARM	Stell Alarme für heute, 20 Uhr und 23 Uhr ein	alarm	87
3231353533323933	IN:CREATE_ALARM	Stell Alarme für Sonntag um 8 und 9 Uhr ein	alarm	87
3231353533323435	IN:CREATE_ALARM	Erstell einen Alarm für Freitag um 11 Uhr und dann um 23 Uhr.	alarm	87
3231353533313832	IN:CREATE_ALARM	Erstelle einen Alarm für 8 Uhr morgen und 10 Uhr am Freitag	alarm	87
3231353533313630	IN:CREATE_ALARM	Erstelle zwei neue Alarme für mich, einen um 12 Uhr und einen um 17 Uhr	alarm	87
3231353532333731	IN:CREATE_ALARM	Stell den Wecker jeden Montag auf 3:30	alarm	87
3231353532333338	IN:CREATE_ALARM	Stell mir einen Alarm für die nächsten 5 Tage um 8 Uhr ein	alarm	87
3231353532333133	IN:CREATE_ALARM	Bitte stell einen wiederkehrenden Alarm für Wochentage um 7 Uhr ein.	alarm	87
3231353532333037	IN:CREATE_ALARM	Wiederhole den Alarm jeden Montag um 6:00 Uhr	alarm	87
3231353532323634	IN:CREATE_ALARM	Stell mir einen täglichen Alarm um 18 Uhr ein.	alarm	87
3231353532323430	IN:CREATE_ALARM	Bitte setze einen Alarm jeden Donnerstagabend um 18 Uhr	alarm	87
3231353532313530	IN:CREATE_ALARM	Kann ich einen Alarm für dienstags 19 Uhr haben?	alarm	87
3231353532313234	IN:CREATE_ALARM	Stell einen wiederkehrenden Alarm, der um 12 mittags klingelt	alarm	87
3231353532303739	IN:CREATE_ALARM	Stelle einen wiederholenden Alarm jeden Freitag um 15 Uhr für 4 Wochen	alarm	87
3231353532303136	IN:CREATE_ALARM	Ich brauche einen wöchentlichen Alarm für Montag um 6	alarm	87
3231353531393934	IN:CREATE_ALARM	Stelle den Wecker, sodass er immer dienstags um 9 Uhr klingelt	alarm	87
3231353531393037	IN:CREATE_ALARM	Bitte füge einen Alarm hinzu, der jeden Tag um 12 Uhr mittags losgeht.	alarm	87
3231353531373835	IN:CREATE_ALARM	Erstell einen Alarm, der jeden Dienstag um 4 Uhr klingelt.	alarm	87
3231353531373731	IN:CREATE_ALARM	Einen Alarm an Wochentagen ab dem 20. Mai um 19 Uhr wiederholen	alarm	87
3231353531353937	IN:CREATE_ALARM	Stell den Bett-Alarm auf 2 Uhr morgens	alarm	87
3231353531353136	IN:CREATE_ALARM	Ich möchte einen Weckruf-Alarm für morgen früh	alarm	87
3231353531343732	IN:CREATE_ALARM	Stell einen Nickerchen-Alarm um 15 Uhr ein.	alarm	87
3231353531323239	IN:CREATE_ALARM	Stelle einen Alarm für 9 Uhr ein, um die Mülltonnen rauszustellen	alarm	87
3231353531323137	IN:CREATE_ALARM	Erstell mir für morgen früh um 7 Uhr einen Alarm namens „Für die Arbeit aufstehen"	alarm	87
3231353531313039	IN:CREATE_ALARM	Alarm „Fitnessstudio-Alarm" morgen um 16 Uhr	alarm	87
3231353531303131	IN:CREATE_ALARM	Stelle einen Alarm für 15:00 Uhr ein und nenne ihn „Nickerchen"	alarm	87
3231353530393939	IN:CREATE_ALARM	Stelle einen Frühaufsteher-Alarm für morgen früh um sechs ein.	alarm	87
3231353438383635	IN:CREATE_ALARM	Setze einen Alarm.	alarm	87
3231353438373938	IN:CREATE_ALARM	Ich brauche einen Alarm für morgen Nachmittag	alarm	87
3231353438373639	IN:CREATE_ALARM	Stelle einen neuen Alarm für morgen Abend ein.	alarm	87
3136363730363433	IN:CREATE_ALARM	Starte den Alarm um 17:30 Uhr	alarm	87
3136353036333230	IN:CREATE_ALARM	Stell meinen Schlummeralarm auf 1 Stunde	alarm	87
3136353036313038	IN:CREATE_ALARM	Neuer Alarm um 6 Uhr	alarm	87
3135333031303931	IN:CREATE_ALARM	Stell meinen Verhütungs-Alarm ein	alarm	87
3135333030363337	IN:CREATE_ALARM	Stell meinen Wecker morgen auf 5 Uhr	alarm	87
3135323939303939	IN:CREATE_ALARM	Stelle einen Alarm in einer Stunde ein	alarm	87
3135323936383835	IN:CREATE_ALARM	Zweiter Alarm 20 Minuten später	alarm	87
3135323936303032	IN:CREATE_ALARM	Wiederkehrender Alarm auf 6 Uhr, bitte	alarm	87
3135323935383733	IN:CREATE_ALARM	Stell den Kurzschlaf-Alarm auf 16:00 Uhr	alarm	87
3135323935353534	IN:CREATE_ALARM	Stell einen Alarm auf 30 Minuten ab jetzt	alarm	87
3135323839353032	IN:CREATE_ALARM	Stell einen Alarm ein, der eine Stunde lang alle 10 Minuten klingelt	alarm	87
3132363137383335	IN:CREATE_ALARM	Schalte meinen Wecker ein	alarm	87
3132353938393635	IN:CREATE_ALARM	Stelle für heute ein paar weitere Alarme ein	alarm	87
39353831383434	IN:CREATE_ALARM	Wecker um 9 Uhr morgens, jeden Tag diese Woche	alarm	87
39353738353439	IN:CREATE_ALARM	Stell einen Alarm für 16 Uhr.	alarm	87
39353736393039	IN:CREATE_ALARM	Stell den Wecker auf 19:30 Uhr	alarm	87
39353734373837	IN:CREATE_ALARM	Stell meinen Wecker auf heute Abend, 23 Uhr	alarm	87
39353731313538	IN:CREATE_ALARM	Stelle den Wecker auf morgen 7 und 7:30 Uhr.	alarm	87
39353731303334	IN:CREATE_ALARM	Ich brauche einen Alarm um 13:00 Uhr.	alarm	87
39353730393435	IN:CREATE_ALARM	Stell den Wecker auf heute sechs Uhr.	alarm	87
39353639333934	IN:CREATE_ALARM	Stell  alle halbe Stunde einen Alarm ein	alarm	87
39353634383335	IN:CREATE_ALARM	Stell einen Wecker für das Mittagessen	alarm	87
39353634323132	IN:CREATE_ALARM	Stelle einen Wecker, der über 15 Minuten jede Minute klingelt	alarm	87
39353633393233	IN:CREATE_ALARM	Stelle einen zusätzlichen Wecker auf 7:30 Uhr	alarm	87
39353633383133	IN:CREATE_ALARM	Stelle einen Wecker für morgen, 5 Uhr	alarm	87
39353633343135	IN:CREATE_ALARM	Stell einen Wecker ab jetzt für eine Stunde.	alarm	87
39353631393932	IN:CREATE_ALARM	Stelle einen Alarm für morgen, 05.00 Uhr ein	alarm	87
39353537313730	IN:CREATE_ALARM	Stell für 25 Minuten alle 5 Minuten einen Alarm ein	alarm	87
39353535323530	IN:CREATE_ALARM	Stelle Alarme für 7:00 Uhr an jedem Wochentag ein	alarm	87
39353532323732	IN:CREATE_ALARM	Stell einen Alarm für heute um 15 Uhr ein	alarm	87
39353530373332	IN:CREATE_ALARM	Stell den Wecker auf morgen 7 Uhr.	alarm	87
39353433303438	IN:CREATE_ALARM	Stell den Wecker für Donnerstag und Freitag auf 5 Uhr morgens	alarm	87
39353430353238	IN:CREATE_ALARM	Stell den Wecker für die nächsten 5 Tage auf 7:00 Uhr.	alarm	87
39353339303536	IN:CREATE_ALARM	Stell den Wecker auf eine Stunde vor der Party	alarm	87
39353334333537	IN:CREATE_ALARM	Stell den Wecker auf morgen früh, 4:30 Uhr	alarm	87
39353333323932	IN:CREATE_ALARM	Stell einen Alarm ein, der jeden Tag um 9:15 Uhr klingelt	alarm	87
39353332393035	IN:CREATE_ALARM	Stell drei Alarme für morgen: 7 Uhr, 9 Uhr und 11 Uhr ein	alarm	87
39353330373934	IN:CREATE_ALARM	Stell den Wecker auf 4 Uhr.	alarm	87
39353234363838	IN:CREATE_ALARM	Erstelle einen Alarm für jeden Freitag um 20 Uhr	alarm	87
39353138333237	IN:CREATE_ALARM	Stell den Wecker auf 6:30 Uhr	alarm	87
39353135303434	IN:CREATE_ALARM	Stell einen Alarm auf morgen, 7 Uhr.	alarm	87
39353134323337	IN:CREATE_ALARM	Stell einen Alarm für die Snackzeit ein	alarm	87
39353133353839	IN:CREATE_ALARM	Neuer Alarm für den Filmwettbewerb morgen um 8	alarm	87
39353130353139	IN:CREATE_ALARM	Stelle den Wecker ab jetzt auf eine Stunde ein.	alarm	87
39353039323833	IN:CREATE_ALARM	Stell den Wecker auf 1 Stunde vor meiner Reservierung zum Abendessen bei Redstone ein	alarm	87
39353039313432	IN:CREATE_ALARM	Schalte alle Wecker ein	alarm	87
39353033373432	IN:CREATE_ALARM	Stelle einen Alarm für morgen, 15:00 Uhr ein	alarm	87
39353030353832	IN:CREATE_ALARM	Stell den Wecker morgen Abend auf 18 Uhr	alarm	87
39343936383536	IN:CREATE_ALARM	Stell den Wecker auf 10 Minuten.	alarm	87
39343935343239	IN:CREATE_ALARM	Alarm für Montag bis Freitag um 6 Uhr 30 morgens einstellen?	alarm	87
39343932363138	IN:CREATE_ALARM	Erstell einen Alarm für Montag, 4 Uhr	alarm	87
39343931333832	IN:CREATE_ALARM	Stelle einen täglichen Alarm für 5 Uhr morgens ein	alarm	87
39343931323336	IN:CREATE_ALARM	Stellst du den Wecker auf morgen, 07:00 Uhr ein?	alarm	87
39343835323832	IN:CREATE_ALARM	Stelle den Wecker so, dass er um 15 Uhr klingelt und dann über eine Stunde alle 2 Minuten	alarm	87
39343831363733	IN:CREATE_ALARM	Stelle den Wecker morgen zum Sonnenaufgang	alarm	87
39343831363430	IN:CREATE_ALARM	Bitte stell den Wecker auf 8:30 Uhr	alarm	87
39343735323033	IN:CREATE_ALARM	Setze einen Alarm, der alle 20 Minuten klingelt.	alarm	87
39343638303033	IN:CREATE_ALARM	Bitte stell einen neuen Alarm in 20 Minuten	alarm	87
39343636383239	IN:CREATE_ALARM	Stell einen Alarm für Sonntagmittag ein	alarm	87
39343635363336	IN:CREATE_ALARM	Stell einen Alarm ein, der jeden Tag um 12 Uhr klingelt	alarm	87
3138393839353832	IN:GET_EDUCATION_DEGREE	Welchen Abschluss hat Ivy gemacht?	people	88
3231363734323634	IN:GET_CALL_CONTACT	Wen habe ich diese Woche angerufen?	calling	90
3231303137343632	IN:GET_CALL_CONTACT	Wer ruft gerade an?	calling	90
3231303136313538	IN:GET_CALL_CONTACT	Wer hat mich heute Mittag angerufen?	calling	90
39343730363432	IN:RESTART_TIMER	Setze den Timer für das Training zurück.	timer	91
3232333730393431	IN:RESTART_TIMER	Starte den Timer „Fußbad" neu.	timer	91
3136343732353432	IN:RESTART_TIMER	Wiederhol den letzten Timer	timer	91
3132363138333237	IN:RESTART_TIMER	Stoppuhr zurücksetzen.	timer	91
39343839363837	IN:RESTART_TIMER	Starte den vorherigen Timer neu.	timer	91
39343838303834	IN:RESTART_TIMER	Starte diesen Timer neu	timer	91
39343832373936	IN:RESTART_TIMER	Stell den Timer neu ein, wenn ich fertig bin	timer	91
39343732303432	IN:RESTART_TIMER	Setze meinen zweiten Timer zurück	timer	91
3138393931313730	IN:GET_EMPLOYER	Wer ist der Arbeitgeber von Peter?	people	92
3138393837303238	IN:GET_EMPLOYER	Arbeitet Kathy in High Point?	people	92
3138393834383032	IN:GET_EMPLOYER	Arbeitet Monica noch bei Target?	people	92
3138393834363333	IN:GET_EMPLOYER	Arbeitet Kathy bei US Gold Gymnastics	people	92
3138393834323735	IN:GET_EMPLOYER	Wer arbeitet mit Judy zusammen für das Gage County?	people	92
3138393934303637	IN:GET_EMPLOYER	Für wen arbeitet Li?	people	92
3138393933363638	IN:GET_EMPLOYER	Für wen arbeitest du?	people	92
3138393933353836	IN:GET_EMPLOYER	Wo arbeitet Monika?	people	92
3138393932373239	IN:GET_EMPLOYER	Für welches Unternehmen arbeitet Mary?	people	92
3138393932353737	IN:GET_EMPLOYER	Für wen arbeitet Wallace?	people	92
3138393932343134	IN:GET_EMPLOYER	Für wen arbeitet Sarah jetzt?	people	92
3138393932323935	IN:GET_EMPLOYER	Arbeitet Chris noch für das NYS Dept. of Conservation?	people	92
3138393931393938	IN:GET_EMPLOYER	Arbeitet Jeff bei Wells Fargo?	people	92
3138393931323933	IN:GET_EMPLOYER	Hat Danielle je für NHU gearbeitet?	people	92
3138393931323231	IN:GET_EMPLOYER	Habe ich je für McDonald’s gearbeitet?	people	92
3138393931313631	IN:GET_EMPLOYER	Arbeitet Tina bei Kaiser Permanente?	people	92
3138393931313532	IN:GET_EMPLOYER	Arbeitet Chase noch bei Buda Juice?	people	92
3138393833313132	IN:GET_EMPLOYER	Arbeitet Jeremy bei Taco Bell?	people	92
3231323430343235	IN:GET_REMINDER	Habe ich Erinnerungen?	reminder	93
3231323430323334	IN:GET_REMINDER	Erinnerung für Samstagmorgen anzeigen	reminder	93
3231323338313636	IN:GET_REMINDER	Zeig mir alle meine Erinnerungen für heute.	reminder	93
3231323337383233	IN:GET_REMINDER	Zeige mir alle Erinnerungen.	reminder	93
3231323337313237	IN:GET_REMINDER	Zeig mir bitte meine Erinnerungen an	reminder	93
3231323336373834	IN:GET_REMINDER	Zeig alle Erinnerungen für morgen an.	reminder	93
3231323336333830	IN:GET_REMINDER	Was sind meine Erinnerungen für die Woche?	reminder	93
3231323336303932	IN:GET_REMINDER	Zeig meine Erinnerungen für diese Woche an	reminder	93
3231323335383837	IN:GET_REMINDER	Lies mir alle Erinnerungen vor.	reminder	93
3231323335353930	IN:GET_REMINDER	Habe ich für morgen irgendwelche Erinnerungen eingestellt?	reminder	93
3231323335353439	IN:GET_REMINDER	Zeige mir alle vergangenen Erinnerungen dieser Woche	reminder	93
3231323335333237	IN:GET_REMINDER	Zeig mir alle meine Erinnerungen für nächsten Dienstag	reminder	93
3231323334373331	IN:GET_REMINDER	Hatte ich irgendwelche Erinnerungen für heute?	reminder	93
3231323334343833	IN:GET_REMINDER	Kannst du Erinnerungen an Anfangszeiten von Treffen für nächste Woche finden?	reminder	93
3231323334343432	IN:GET_REMINDER	Welche Erinnerungen habe ich dieses Wochenende, die mit Chris zu tun haben?	reminder	93
3231323334303831	IN:GET_REMINDER	Spiel alle Erinnerungen ab	reminder	93
3231323333393732	IN:GET_REMINDER	Welche Erinnerungen habe ich noch für den Rest des Tages?	reminder	93
3231323333393438	IN:GET_REMINDER	Sag mir meine Erinnerungen zu Unterkünften für die Tagung in Huntsville nächsten Monat.	reminder	93
3231323333373730	IN:GET_REMINDER	Zeig mir die Erinnerungen an die Abgabefristen für Hausaufgaben.	reminder	93
3231323333363134	IN:GET_REMINDER	Welche Erinnerungen habe ich für Tage, an denen ich mein Gehalt bekomme?	reminder	93
3231323333303934	IN:GET_REMINDER	Habe ich irgendwelche Erinnerungen an Arzttermine?	reminder	93
3231323332323538	IN:GET_REMINDER	Wann ist meine nächste Erinnerung für den nächsten Haarfärbetermin?	reminder	93
3231323332323234	IN:GET_REMINDER	Gibt es morgen irgendwelche Erinnerungen für Gary?	reminder	93
3231323331383233	IN:GET_REMINDER	Ist die Erinnerung an das Ballspiel eingerichtet oder wurde sie gelöscht?	reminder	93
3231323331363938	IN:GET_REMINDER	Ich möchte, dass du mir alle Erinnerungen zeigst, die ich für diese Woche mit meinen Freunden habe.	reminder	93
3231323331353231	IN:GET_REMINDER	Habe ich irgendwelche Erinnerungen für morgen?	reminder	93
3231323330373932	IN:GET_REMINDER	Zeige Erinnerungen an Studiendarlehenszahlungen einschließlich der Termine und Rückzahlungs-Links an	reminder	93
3231323330333335	IN:GET_REMINDER	Zeig mir Erinnerungen, die auf 15 Minuten vor Meetings gesetzt wurden	reminder	93
3231323330323137	IN:GET_REMINDER	Habe ich irgendwelche Erinnerungen für Haustiere eingestellt?	reminder	93
3231323239393533	IN:GET_REMINDER	Kannst du mir die Erinnerung von Krissy vorlesen?	reminder	93
3231323239383034	IN:GET_REMINDER	Was für Erinnerungen habe ich für die Gruppe DS?	reminder	93
3231323238363331	IN:GET_REMINDER	Liste bitte alle Erinnerungen für die nächste Woche auf.	reminder	93
3231323237383036	IN:GET_REMINDER	Welche Erinnerungen habe ich für diesen Freitag?	reminder	93
3231323237363234	IN:GET_REMINDER	Lies mir alle meine Erinnerungen von Mittwoch vor.	reminder	93
3231323237363134	IN:GET_REMINDER	Welche Erinnerungen habe ich für Samstagnachmittag?	reminder	93
3231323237333837	IN:GET_REMINDER	Zeig mir die Erinnerungen für heute	reminder	93
3231323236323134	IN:GET_REMINDER	Hab ich am Wochenende irgendwelche Erinnerungen mit Stephanie?	reminder	93
3231323235323032	IN:GET_REMINDER	Suche alle meine Erinnerungen zum Bezahlen meiner Rechnungen für diesen Monat	reminder	93
3231323234383733	IN:GET_REMINDER	Zeig alle Erinnerungen für August.	reminder	93
3231323234333533	IN:GET_REMINDER	Sag mir die Erinnerung, wann der Elektriker nächste Woche vorbeikommen würde.	reminder	93
3231323234323239	IN:GET_REMINDER	Zeig mir alle meine Erinnerungen in dieser Woche für Sophie in Massachusetts	reminder	93
3231323234313039	IN:GET_REMINDER	Ich möchte alle Erinnerungen, die mit „Micheala" gekennzeichnet sind, heraussuchen	reminder	93
3231323233353839	IN:GET_REMINDER	Welche Erinnerungen habe ich für meine Urlaubswoche eingestellt?	reminder	93
3231323233343337	IN:GET_REMINDER	Kannst du mir alle Erinnerungen für Arbeitstreffen diese Woche nennen?	reminder	93
