ID	intent	text	domain	label
3138383931333238	IN:GET_INFO_RECIPES	Wie lange muss Hackbraten garen?	recipes	28
3138383931323937	IN:GET_INFO_RECIPES	Was ist die richtige Temperatur, mit der man Hühnchen kochen sollte?	recipes	28
3137353932383836	IN:GET_INFO_RECIPES	Wie viel Gramm Zucker hat Orangensaft?	recipes	28
3137353031323231	IN:GET_INFO_RECIPES	Woraus ist Pepperoni gemacht?	recipes	28
3137353031323033	IN:GET_INFO_RECIPES	Wie viele Kalorien hat ein Oreo?	recipes	28
3135323939353437	IN:GET_INFO_RECIPES	Welche Temperatur ist am besten zum scharfen Anbraten?	recipes	28
3135323835333637	IN:GET_INFO_RECIPES	Wie viele Kalorien hat ein Stück Wassermelone?	recipes	28
3133343634363531	IN:GET_INFO_RECIPES	Wie viele Messlöffel gibt man in die Kaffeemaschine?	recipes	28
3133343634353530	IN:GET_INFO_RECIPES	Wie lange muss ein Braten im Ofen bleiben?	recipes	28
3133343634333533	IN:GET_INFO_RECIPES	Wie viele Kalorien hat ein Bananensplit?	recipes	28
3133343439363435	IN:GET_INFO_RECIPES	Wie bereitet man einen ganzen Truthahn zu?	recipes	28
3133343139333330	IN:GET_INFO_RECIPES	Wie viele Eier brauch ich für ein Omelett?	recipes	28
3133343139323732	IN:GET_INFO_RECIPES	Portionsgröße von Espresso-Käsekuchen-Brownies	recipes	28
3133343138373434	IN:GET_INFO_RECIPES	Was bedeutet al dente?	recipes	28
3133343138363830	IN:GET_INFO_RECIPES	Was kann ich heute Abend zu den Schweinekoteletts machen?	recipes	28
3133343138353137	IN:GET_INFO_RECIPES	Bei welcher Temperatur brät man Steak?	recipes	28
3133343133343637	IN:GET_INFO_RECIPES	Wie viele Transfette sind in einem Twinkie?	recipes	28
3133343132353435	IN:GET_INFO_RECIPES	Was ist in einem Burrito?	recipes	28
3133343130383839	IN:GET_INFO_RECIPES	Wie mache ich Kuchen saftig?	recipes	28
3133343130333339	IN:GET_INFO_RECIPES	Welche Zutaten braucht man für Orangenhühnchen?	recipes	28
3133343130333030	IN:GET_INFO_RECIPES	Bei welcher Temperatur kocht man Hühnchen?	recipes	28
3133343130313832	IN:GET_INFO_RECIPES	Wie lange gart man Hühnerbrust ohne Knochen im Ofen?	recipes	28
3133323738333336	IN:GET_INFO_RECIPES	Ich möchte französisches Brot backen. Was benötige ich dazu?	recipes	28
3133323738323131	IN:GET_INFO_RECIPES	Wie viele Kalorien hat ein Stück Rührkuchen?	recipes	28
3133323735363136	IN:GET_INFO_RECIPES	Woher weiß man, wann Pasta fertig ist?	recipes	28
3133323735353232	IN:GET_INFO_RECIPES	Wie lange muss ich Kekse backen?	recipes	28
3133323735333237	IN:GET_INFO_RECIPES	Bei welcher Temperatur sollten Hähnchenschenkel gegart werden?	recipes	28
3133323734363737	IN:GET_INFO_RECIPES	Was sind die Zutaten für einen Vanillekuchen?	recipes	28
3133303534343431	IN:GET_INFO_RECIPES	Wie lange muss man einen Pfundkuchen backen?	recipes	28
3133303534333934	IN:GET_INFO_RECIPES	Wie viele Kalorien hat ein Smoothie?	recipes	28
3133303534323136	IN:GET_INFO_RECIPES	Die besten Popcorn-Toppings	recipes	28
3133303534323039	IN:GET_INFO_RECIPES	Wie koche ich Lachs?	recipes	28
3133303534313839	IN:GET_INFO_RECIPES	Wie bereitet man den besten Veggie-Burger zu?	recipes	28
3132383135323231	IN:GET_INFO_RECIPES	Was sind die Zutaten einer Remoulade?	recipes	28
3132363338373139	IN:GET_INFO_RECIPES	Was ist besser zum Kochen? Eier, Milch oder Sahne?	recipes	28
3132363337323138	IN:GET_INFO_RECIPES	Wie viele Kalorien haben Spaghetti?	recipes	28
3132363333383837	IN:GET_INFO_RECIPES	Wie viele Kalorien hat ein Stück Red-Velvet-Cake?	recipes	28
3132363239393831	IN:GET_INFO_RECIPES	Welche Art von Schokolade enthält ein Schokoladenkuchen?	recipes	28
3132363239383036	IN:GET_INFO_RECIPES	Wie viele Teelöffel Vanille kommen in den Kuchen?	recipes	28
3132363238303434	IN:GET_INFO_RECIPES	Was muss ich für eine Buttercreme-Glasur einkaufen?	recipes	28
3132363236393931	IN:GET_INFO_RECIPES	Wie viele Kalorien hat eine Flunder?	recipes	28
3132363235393433	IN:GET_INFO_RECIPES	Mache aus einer halben Tasse frische Petersilie getrocknete Petersilie	recipes	28
3132363234323836	IN:GET_INFO_RECIPES	Welche Gemüsearten sind gute Proteinquellen?	recipes	28
3132353535303336	IN:GET_INFO_RECIPES	Wie wiege ich die Zutaten für einen Kuchen ab?	recipes	28
3132353534383432	IN:GET_INFO_RECIPES	Wie viel Protein ist in Tofu?	recipes	28
39343632323635	IN:GET_INFO_RECIPES	Wie viel Mehl braucht man?	recipes	28
39343632313231	IN:GET_INFO_RECIPES	Was gehört in Texas-Tacos?	recipes	28
39343632313031	IN:GET_INFO_RECIPES	Bei welcher Temperatur sollte ein Truthahn ruhen?	recipes	28
39343631393638	IN:GET_INFO_RECIPES	Was gehört in eine Enchilada?	recipes	28
39343631383434	IN:GET_INFO_RECIPES	Wie lange dauert es, einen fertig gekochten Schinken aufzuwärmen?	recipes	28
39343630393930	IN:GET_INFO_RECIPES	Wie viele Kalorien hat ein Pfirsichkuchen?	recipes	28
39343630373638	IN:GET_INFO_RECIPES	Wie heiß sollte gekochtes Schweinefleisch sein?	recipes	28
39343630353432	IN:GET_INFO_RECIPES	Sollte ich zum Braten von Knoblauch Olivenöl oder Pflanzenöl verwenden?	recipes	28
39343539383033	IN:GET_INFO_RECIPES	Was sind die Zutaten für Kekse mit Schokostückchen?	recipes	28
39343539363338	IN:GET_INFO_RECIPES	Wie macht man Mandelmilch selber?	recipes	28
39343539343230	IN:GET_INFO_RECIPES	Wie lange dauert es, einen Apfelkuchen zu backen?	recipes	28
39343539343130	IN:GET_INFO_RECIPES	Temperatur für ein englisch gebratenes Steak	recipes	28
39343539303732	IN:GET_INFO_RECIPES	Wie viele Kohlenhydrate hat gegrillter Käse?	recipes	28
39343538393438	IN:GET_INFO_RECIPES	Wie macht man arabische Tahini-Sauce?	recipes	28
39343538363137	IN:GET_INFO_RECIPES	Wie viel Gramm Rinderhackfleisch brauche ich für Frikadellen?	recipes	28
39343538353130	IN:GET_INFO_RECIPES	Woraus wird Pesto gemacht?	recipes	28
39343538343430	IN:GET_INFO_RECIPES	Was ist in Russischen Eiern enthalten?	recipes	28
39343538343036	IN:GET_INFO_RECIPES	Was sind die Zutaten für Pad Thai?	recipes	28
39343538323134	IN:GET_INFO_RECIPES	Wie viel Salz sollte man zu einem Chili-Rezept hinzufügen?	recipes	28
39343537373431	IN:GET_INFO_RECIPES	Sollte ich den Herd auf die höchste Stufe stellen, um Schweinefleisch zu braten?	recipes	28
39343537303339	IN:GET_INFO_RECIPES	Wie lange sollte ich dies marinieren?	recipes	28
39343536393438	IN:GET_INFO_RECIPES	Gib mir die Zutaten für Zuckerplätzchen	recipes	28
39343536383932	IN:GET_INFO_RECIPES	Wie viele Kalorien hat ein Stück Pizza?	recipes	28
39343536383334	IN:GET_INFO_RECIPES	Welche Art Käse brauche ich, um Pizza zu backen?	recipes	28
39343536383132	IN:GET_INFO_RECIPES	Wie viel Käse kommt in Lasagne?	recipes	28
39343536363230	IN:GET_INFO_RECIPES	Auf welcher Schiene soll ich meine Pizza backen?	recipes	28
39343536353033	IN:GET_INFO_RECIPES	Wie bleibt Chicken Fried Steak knusprig?	recipes	28
39343536323532	IN:GET_INFO_RECIPES	Sag mir dir Zutaten für Kürbis-Cupcakes	recipes	28
39343535333936	IN:GET_INFO_RECIPES	Wie viele Kalorien hat ein Stück Schokoladenkuchen?	recipes	28
39343535323739	IN:GET_INFO_RECIPES	Wie viel Zucker ist in einem Stück Pizza?	recipes	28
39343535323438	IN:GET_INFO_RECIPES	Ich brauche eine Liste von Zutaten für eine selbstgemachte Pecan Pie	recipes	28
39343535313130	IN:GET_INFO_RECIPES	Wie viel Milch braucht man, um Eier schaumig zu schlagen?	recipes	28
39343534353331	IN:GET_INFO_RECIPES	Wie viel Zucker kommt in French Toast rein?	recipes	28
39343534333036	IN:GET_INFO_RECIPES	Soll ich das Huhn zuerst braten oder in den Ofen schieben?	recipes	28
39343534303332	IN:GET_INFO_RECIPES	Wie lang backt man Lasagne?	recipes	28
39343533393737	IN:GET_INFO_RECIPES	Welche Zutaten brauche ich, um Kekse mit Schokostückchen zu backen?	recipes	28
39343533373039	IN:GET_INFO_RECIPES	Wie viele Kalorien haben Eclairs?	recipes	28
39343533363331	IN:GET_INFO_RECIPES	Bei welcher Temperatur brät man Hühnchen?	recipes	28
39343533343630	IN:GET_INFO_RECIPES	Was sind die Nährwertangaben für Hühnchen?	recipes	28
39343533343232	IN:GET_INFO_RECIPES	Was ist in Rinderbrühe enthalten?	recipes	28
39343532393731	IN:GET_INFO_RECIPES	Wie lange wird dieses Rezept gebacken?	recipes	28
39343532363134	IN:GET_INFO_RECIPES	Wie lange koche ich Brokkoli?	recipes	28
39343532343737	IN:GET_INFO_RECIPES	Bei welcher Temperatur wird Rindfleisch normalerweise gegart?	recipes	28
39343532323833	IN:GET_INFO_RECIPES	Wie viele Teelöffel Zimt werden benötigt?	recipes	28
39343532313338	IN:GET_INFO_RECIPES	Wie viel scharfe Soße wird bei Hot Wings benötigt?	recipes	28
39343532303039	IN:GET_INFO_RECIPES	Zutaten für Chicken Pot Pie	recipes	28
39343531363238	IN:GET_INFO_RECIPES	Welche Art Fleisch ist am zartesten?	recipes	28
39343531353731	IN:GET_INFO_RECIPES	Wie viel Zeit brauche ich, um Roastbeef zu braten?	recipes	28
39343531343138	IN:GET_INFO_RECIPES	Bei welcher Temperatur kocht man ein Filet Wellington?	recipes	28
39343531333831	IN:GET_INFO_RECIPES	Wie viele Kalorien hat eine Calzone?	recipes	28
39343530363634	IN:GET_INFO_RECIPES	Wie mache ich meine Kekse saftig?	recipes	28
39343530313733	IN:GET_INFO_RECIPES	Was sind die Zutaten für Gulasch?	recipes	28
3138393839383435	IN:GET_LIFE_EVENT	Hat John die Highschool abgeschlossen?	people	29
39353633343732	IN:DISLIKE_MUSIC	Ich mag dieses Lied nicht und möchte es nicht hören	music	30
3231363331303733	IN:DELETE_ALARM	Alle Alarme nach 15 Uhr müssen gelöscht werden	alarm	31
3231363330393836	IN:DELETE_ALARM	Lösch alle eingestellten Alarme.	alarm	31
3231363330393832	IN:DELETE_ALARM	Lösch alle eingestellten Alarme.	alarm	31
3231363330393231	IN:DELETE_ALARM	Lösch alle meine Alarme.	alarm	31
3231353938373731	IN:DELETE_ALARM	Lösch den Alarm für morgen	alarm	31
3231353439323032	IN:DELETE_ALARM	Lösch meinen Alarm für morgen	alarm	31
3231353439303738	IN:DELETE_ALARM	Lösche meinen Alarm für morgen früh	alarm	31
3231353438393633	IN:DELETE_ALARM	Lösch alle zukünftigen Alarme	alarm	31
39353432393735	IN:DELETE_ALARM	Alle meine Alarme löschen.	alarm	31
39353130323637	IN:DELETE_ALARM	Lösch meine Alarme	alarm	31
39353030323539	IN:DELETE_ALARM	Lösch den aktuellen Alarm.	alarm	31
3232343533373132	IN:SET_RSVP_YES	Antworte mit „ja" an WomenNow Bay Area	event	32
3232343533373030	IN:SET_RSVP_YES	Antworte in Bezug auf das fünfte Event mit „ja"	event	32
3232343533323531	IN:SET_RSVP_YES	Ich möchte zum Children's Fest gehen	event	32
3232343533313838	IN:SET_RSVP_YES	Setze meinen Status auf „unterwegs zu Planet Home"	event	32
39353434343436	IN:ADD_TO_PLAYLIST_MUSIC	Speicher diesen Song in meiner guten Playlist	music	33
39353034303631	IN:ADD_TO_PLAYLIST_MUSIC	Füg es zu Pandora hinzu	music	33
3231323831323935	IN:GET_MESSAGE	Was stand in der Nachricht, die Cam mir gestern geschickt hat?	messaging	34
3231323739383735	IN:GET_MESSAGE	Lies mir Papas Nachrichten von gestern vor	messaging	34
3231323738353830	IN:GET_MESSAGE	Lies meine Nachrichten	messaging	34
3231323738343438	IN:GET_MESSAGE	Habe ich diese Woche Nachrichten von Kevin Lee Ox erhalten	messaging	34
3231323737333930	IN:GET_MESSAGE	Spiel alle Nachrichten von heute ab	messaging	34
3232353833393633	IN:GET_MESSAGE	Habe ich vom Studienabschluss-Thread seit Dienstag neue Nachrichten bekommen	messaging	34
3232353833393238	IN:GET_MESSAGE	Haben mir meine Eltern etwas geschickt	messaging	34
3232353833313036	IN:GET_MESSAGE	Haben mich Ella und Zachary Fletcher heute angeschrieben?	messaging	34
3232353832333433	IN:GET_MESSAGE	Suche meine Nachrichten von meinem Partner Brooklynn	messaging	34
3232353832333132	IN:GET_MESSAGE	Zeig mit Nachrichten von meinem Lebenspartner Emery	messaging	34
3232353832323939	IN:GET_MESSAGE	Zeig mir Nachrichten von meinem Enkel Sergio	messaging	34
3232353832313738	IN:GET_MESSAGE	Zeige meine Nachrichten von meinem Opa Victoria	messaging	34
3232353832313737	IN:GET_MESSAGE	Zeige die Nachrichten von meiner besseren Hälfte Tristan	messaging	34
3232353832303031	IN:GET_MESSAGE	Zeige mir die Nachrichten von Rubens Frau	messaging	34
3232353831393539	IN:GET_MESSAGE	Suche meine Nachrichten von Aria	messaging	34
3232353735313330	IN:GET_MESSAGE	Hat Tom mir etwas über WhatsApp geschickt?	messaging	34
3232353734373935	IN:GET_MESSAGE	Zeig mir Nachrichten von Ian auf Facebook	messaging	34
3232353734353031	IN:GET_MESSAGE	Zeig mir Nachrichten von Leonid über den Messenger an	messaging	34
3232343436353134	IN:GET_MESSAGE	Hat Cole Gohr mir irgendwas geschickt?	messaging	34
3232343436343230	IN:GET_MESSAGE	Hat mir George Lakoff irgendwelche Nachrichten geschickt?	messaging	34
3231333637383938	IN:GET_MESSAGE	Lies Nachrichten von einem anderen Status.	messaging	34
3231333637373131	IN:GET_MESSAGE	Lies neue Nachricht vor.	messaging	34
3231333637333236	IN:GET_MESSAGE	Lies diese Nachricht weiter vor.	messaging	34
3231323739323634	IN:GET_MESSAGE	Hat mich MJ heute angeschrieben?	messaging	34
3231323739303536	IN:GET_MESSAGE	Hat mir mein Cousin heute eine Nachricht geschickt?	messaging	34
3231323738393930	IN:GET_MESSAGE	Was stand noch mal in dieser Nachricht?	messaging	34
3231323738323737	IN:GET_MESSAGE	Hat sich mein Enkel diese Woche bei mir gemeldet?	messaging	34
3231323737343232	IN:GET_MESSAGE	Was war gestern meine letzte Nachricht?	messaging	34
3231323737333735	IN:GET_MESSAGE	Kann ich alle Nachrichten an Telina aus dem letzten Jahr angezeigt bekommen?	messaging	34
3132353936363033	IN:GET_MESSAGE	Lies die Nachricht	messaging	34
3139393737313533	IN:GET_EVENT	Irgendwelche Konzerte diese Woche?	event	35
3139393736393234	IN:GET_EVENT	Was ist heute Abend los?	event	35
3139393736383030	IN:GET_EVENT	Was kann man dieses Wochenende unternehmen	event	35
3139393736373937	IN:GET_EVENT	Etwas zum Unternehmen	event	35
3139393736373137	IN:GET_EVENT	Irgendwas Spannendes, was es diesen Monat gibt	event	35
3139393736333830	IN:GET_EVENT	Partys, die morgen stattfinden	event	35
3232323232353133	IN:GET_EVENT	Ich möchte familienfreundliche Events sehen	event	35
3232323232343735	IN:GET_EVENT	Such mir ein paar familienfreundliche Events heraus	event	35
3232323232333233	IN:GET_EVENT	Kannst du mir mehr Events zeigen, die anders sind als dieses?	event	35
3232323232323832	IN:GET_EVENT	Kannst du mehr Events wie diese zeigen?	event	35
3232323232303039	IN:GET_EVENT	Kannst du mir meine bisherigen Events zeigen?	event	35
3231373530343335	IN:GET_EVENT	Zeige mir weitere Musikkonzerte	event	35
3231373530333432	IN:GET_EVENT	Zeig mir andere Live-Musik-Events	event	35
3231373530313238	IN:GET_EVENT	Empfehle mir Events in Petersburg	event	35
3231373530313032	IN:GET_EVENT	Empfiehl mir ein paar Fußballspiele, die an Halloween in Portland stattfinden	event	35
3231373530303738	IN:GET_EVENT	Empfiehl mir ein paar Events in Buffalo	event	35
3231353232303339	IN:GET_EVENT	Haben meine Freunde dieses Wochenende irgendwelche Events?	event	35
3231343937363539	IN:GET_EVENT	Welche Basketballspiele finden gerade statt?	event	35
3231343937363335	IN:GET_EVENT	Welche Sportspiele finden statt?	event	35
3231343937323934	IN:GET_EVENT	Gibt es morgen Abend irgendwelche Baseballspiele	event	35
3231343937323838	IN:GET_EVENT	Welche Softball-Spiele finden am Donnerstag statt?	event	35
3139393930313936	IN:GET_EVENT	Dinge, die man heute in Venice Beach machen kann	event	35
3139393930303839	IN:GET_EVENT	Was ist heute Abend in Kansas City los?	event	35
3139393839393432	IN:GET_EVENT	Kann man heute Abend in Bay Ridge irgendetwas unternehmen?	event	35
3139393839393237	IN:GET_EVENT	Dinge, die man heute Abend in Sanibel unternehmen kann	event	35
3139393839383831	IN:GET_EVENT	Veranstaltungen in Texas	event	35
3139393839373233	IN:GET_EVENT	Live-Musik morgen in Kalamazoo	event	35
3139393839353834	IN:GET_EVENT	Findet an diesem Wochenende irgendwas Gutes in Hattiesburg statt?	event	35
3139393839343934	IN:GET_EVENT	Was ist am letzten Dezemberwochenende in Detroit los?	event	35
3139393839343635	IN:GET_EVENT	Was ist heute Abend um 22 Uhr in Boston los?	event	35
3139393839333830	IN:GET_EVENT	Was kann man in Maui machen?	event	35
3139393839323336	IN:GET_EVENT	Comedy-Shows in Vegas nächste Woche	event	35
3139393838393537	IN:GET_EVENT	Zeig mir alle Konzerte für nächstes Wochenende in Grand Prairie	event	35
3139393838393435	IN:GET_EVENT	Veranstaltungen in Philadelphia heute	event	35
3139393838393136	IN:GET_EVENT	Partys in Minneapolis morgen	event	35
3139393838373831	IN:GET_EVENT	Die Downtown-DeLand-Events beginnen dieses Wochenende nach 22.00 Uhr.	event	35
3139393838343531	IN:GET_EVENT	Ist morgen irgendwas in Baltimore los?	event	35
3139393838343431	IN:GET_EVENT	Was ist das Coolste, das dieses Wochenende in Napa stattfindet?	event	35
3139393838343333	IN:GET_EVENT	Dinge, die man in San Diego unternehmen kann	event	35
3139393838333133	IN:GET_EVENT	Gibt es Events, die am Mittwoch in Albuquerque stattfinden?	event	35
3139393838323838	IN:GET_EVENT	Was ist an diesem vierten Juli in Beaverton, Oregon, los?	event	35
3139393838313138	IN:GET_EVENT	Was ist morgen in Keller los?	event	35
3139393837393539	IN:GET_EVENT	Dinge, die man an Silvester in Cedar Hill, TN unternehmen kann	event	35
3139393837393034	IN:GET_EVENT	FIndet heute Abend etwas in Ann Arbor statt?	event	35
3139393837373535	IN:GET_EVENT	Events in Silverlake heute Abend	event	35
3139393837363632	IN:GET_EVENT	Was steht nächste Woche Dienstag in Baton Rouge, LA an?	event	35
3139393837303830	IN:GET_EVENT	Veranstaltungen heute Abend in Jacksonville	event	35
3139393836383134	IN:GET_EVENT	Was kann man heute Abend in Portland unternehmen?	event	35
3139393836353535	IN:GET_EVENT	Steht dieses Wochenende in San Francisco irgendetwas an?	event	35
3139393836323334	IN:GET_EVENT	Was kann man nächste Woche in Seattle unternehmen?	event	35
3139393836323032	IN:GET_EVENT	Dinge, die man in Chicago am 7. Dezember machen kann	event	35
3139393836313532	IN:GET_EVENT	Gibt es am kommenden Wochenende irgendwelche besonderen Events in Daytona Beach?	event	35
3139393835383032	IN:GET_EVENT	Läuft dieses Wochenende in Waikiki irgendwas Cooles?	event	35
3139393835333337	IN:GET_EVENT	Was ist heute Abend in Las Vegas los?	event	35
3139393835323039	IN:GET_EVENT	Musikkonzerte, die diese Woche in Ann Arbor stattfinden	event	35
3139393835313930	IN:GET_EVENT	Was läuft heute Abend in Baltimore?	event	35
3139393834373530	IN:GET_EVENT	Was ist im März in Colorado los?	event	35
3139393834363238	IN:GET_EVENT	Veranstaltungen in Waco	event	35
3139393834353232	IN:GET_EVENT	Was ist dieses Wochenende in Eugene los?	event	35
3139393834343533	IN:GET_EVENT	Was kann man nächsten Monat in Kent unternehmen?	event	35
3139393834343338	IN:GET_EVENT	Events in der Innenstadt von Appleton im April	event	35
3139393834323931	IN:GET_EVENT	Festivals in Raleigh nächsten Monat	event	35
3139393834323836	IN:GET_EVENT	Veranstaltungen in Denver	event	35
3139393834323436	IN:GET_EVENT	Kunstfestivals im Jahr 2018	event	35
3139393834303730	IN:GET_EVENT	Was ist heute Abend in Portland los?	event	35
3139393833393331	IN:GET_EVENT	Konzerte in San Jose	event	35
3139393833393037	IN:GET_EVENT	Was kann ich an diesem Wochenende machen?	event	35
3139393833383034	IN:GET_EVENT	Das Beste, was man morgen Abend tun kann	event	35
3139393833373436	IN:GET_EVENT	An welchen Veranstaltungen kann ich nächste Woche teilnehmen?	event	35
3139393833373339	IN:GET_EVENT	Was ist nächstes Wochenende in Dallas los?	event	35
3139393833363137	IN:GET_EVENT	Was ist dieses Wochenende in Honolulu los?	event	35
3139393833353935	IN:GET_EVENT	Veranstaltungen an diesem Wochenende	event	35
3139393833353639	IN:GET_EVENT	Was kann man morgen Abend Lustiges machen?	event	35
3139393833333233	IN:GET_EVENT	interessante Dinge, die man heute machen kann	event	35
3139393833313937	IN:GET_EVENT	Was für amüsante Veranstaltungen wird es diese Woche in Montgomery County, Pennsylvania, geben?	event	35
3139393833313836	IN:GET_EVENT	Was ist am Dienstagabend los?	event	35
3139393833313137	IN:GET_EVENT	Broadway-Shows, die diesen Monat Premiere haben	event	35
3139393832383138	IN:GET_EVENT	Events in Portland, bitte	event	35
3139393832373536	IN:GET_EVENT	Sportveranstaltungen in Hardy morgen	event	35
3139393832363439	IN:GET_EVENT	Was findet heute Abend in Chicago statt?	event	35
3139393832353534	IN:GET_EVENT	Was findet heute Abend in Chicago statt?	event	35
3139393832313338	IN:GET_EVENT	Was ist diese Woche in LA los?	event	35
3139393831353432	IN:GET_EVENT	Such mir etwas, das ich tun kann	event	35
3139393831353034	IN:GET_EVENT	Aktivitäten in Detroit im April	event	35
3139393831343137	IN:GET_EVENT	Was ist morgen los	event	35
3139393831343131	IN:GET_EVENT	Veranstaltungen in Des Moines.	event	35
3139393831323931	IN:GET_EVENT	Dinge, die heute zu erledigen sind	event	35
3139393831323830	IN:GET_EVENT	Konzerte in Knoxville im Dezember	event	35
3139393831323430	IN:GET_EVENT	Was sind die aktuellen Veranstaltungen in Washington DC?	event	35
3139393830373034	IN:GET_EVENT	Sag mir, welche kulinarischen Feste im September in Des Moines stattfinden werden	event	35
3139393830353939	IN:GET_EVENT	Konzerte in New York nächstes Wochenende	event	35
3139393830333830	IN:GET_EVENT	Dinnertheater-Aufführungen heute Abend in New Hope	event	35
3139393830323332	IN:GET_EVENT	Was kann man abends in Orange County unternehmen?	event	35
3139393830323235	IN:GET_EVENT	Was kann man am Freitag in Houston machen?	event	35
3139393830313937	IN:GET_EVENT	Unterhaltsame Dinge, die man in Schenectady tun kann	event	35
3139393830313837	IN:GET_EVENT	Dinge, die man heute in NYC unternehmen kann	event	35
3139393830313435	IN:GET_EVENT	Ist dieses Wochenende irgendwas los, was Spaß macht?	event	35
3139393830313334	IN:GET_EVENT	Comedy-Veranstaltungen nach 21 Uhr morgen	event	35
3139393739393333	IN:GET_EVENT	Welche Konzerte sind diesen Monat im Programm?	event	35
3139393739393239	IN:GET_EVENT	Gibt es in dieser Woche irgendwas Interessantes?	event	35
3139393739393138	IN:GET_EVENT	Welche Events gibt es dieses Wochenende in Newport?	event	35
3139393739383935	IN:GET_EVENT	Ist diese Woche irgendwas in Detroit los?	event	35
3139393739353638	IN:GET_EVENT	Ist nächstes Wochenende in New York etwas los?	event	35
3139393739343436	IN:GET_EVENT	Finde ein Konzert für mich	event	35
3139393739343332	IN:GET_EVENT	Was kann ich dieses Wochenende in New York unternehmen?	event	35
3139393739333832	IN:GET_EVENT	Was ist heute Abend in Hartford, Connecticut, los?	event	35
3139393739333433	IN:GET_EVENT	Aktivitäten in Rochester diese Woche	event	35
3139393739303138	IN:GET_EVENT	Such nach Konzerten morgen in Melbourne	event	35
3139393738393831	IN:GET_EVENT	Ist heute Abend irgendwas in den Stockyards los?	event	35
3139393738383737	IN:GET_EVENT	Was kann man im Dezember in Nord-Utah tun?	event	35
3139393738373736	IN:GET_EVENT	Bandauftritte in Memphis	event	35
3139393738363138	IN:GET_EVENT	Was gibt es nächste Woche in Milwaukee?	event	35
3139393738353735	IN:GET_EVENT	Veranstaltungen nächsten Monat in Los Angeles	event	35
3139393738353333	IN:GET_EVENT	Was kann man diese Woche in Los Angeles unternehmen?	event	35
3139393738333932	IN:GET_EVENT	Was kann man dieses Wochenende unternehmen?	event	35
3139393738323534	IN:GET_EVENT	Was kann man heute unternehmen?	event	35
3139393738303731	IN:GET_EVENT	Was kann ich diesen Samstag unternehmen?	event	35
3139393737383131	IN:GET_EVENT	Liste die heutigen Veranstaltungen auf	event	35
3139393737363932	IN:GET_EVENT	Filme, die heute Abend laufen	event	35
3139393737343533	IN:GET_EVENT	Events am Sonntag	event	35
3139393737333637	IN:GET_EVENT	Irgendwelche Partys, die ich besuchen sollte?	event	35
3139393737313539	IN:GET_EVENT	Gibt es dieses Wochenende coole Partys?	event	35
3139393736393632	IN:GET_EVENT	Was soll ich dieses Wochenende unternehmen?	event	35
3139393736373634	IN:GET_EVENT	Was kann ich unternehmen?	event	35
3139393736363837	IN:GET_EVENT	Konzerte am Sonntag	event	35
3139393736343735	IN:GET_EVENT	Was kann ich nächste Woche unternehmen?	event	35
3231353438343739	IN:HOLD_CALL	Anruf von Polly in der Warteschleife halten.	calling	36
3231353438323238	IN:HOLD_CALL	Videoanruf halten	calling	36
3138393930303630	IN:GET_EDUCATION_TIME	Wann hat Larry seinen Collegeabschluss erhalten?	people	37
3138393930303438	IN:GET_EDUCATION_TIME	Wie lange hat Bill Gates studiert?	people	37
3138393839393436	IN:GET_EDUCATION_TIME	Seit wann ist Ahmed in der Grundschule?	people	37
3138393931343830	IN:GET_EDUCATION_TIME	Wann hat Robert seinen Abschluss gemacht?	people	37
3138393931303530	IN:GET_EDUCATION_TIME	Hat Jessica schon einmal das Forrect College besucht?	people	37
3138393930383636	IN:GET_EDUCATION_TIME	In welchem Jahr hat Mia ihren Abschluss an der Wirtschaftshochschule gemacht?	people	37
3138393839363436	IN:GET_EDUCATION_TIME	Wann hat Danielle an der University of Chicago angefangen?	people	37
39343930303234	IN:GET_WEATHER	Wie kalt wird es heute Abend?	weather	38
39343836343230	IN:GET_WEATHER	Das Wetter morgen in Houston?	weather	38
39343836313636	IN:GET_WEATHER	Was ist die durchschnittliche Temperatur diesen Monat?	weather	38
39343834373036	IN:GET_WEATHER	Wie ist die Temperatur in Michigan	weather	38
39343834353239	IN:GET_WEATHER	Wie ist der Wind heute?	weather	38
39343834303830	IN:GET_WEATHER	Wie ist das Wetter in Edison um 10 Uhr morgens?	weather	38
39343833323739	IN:GET_WEATHER	Wird es bis in die Nacht regnen?	weather	38
39343832373334	IN:GET_WEATHER	Wie ist aktuell die Temperatur auf Island?	weather	38
39343832353633	IN:GET_WEATHER	Wie ist das Wetter gerade in Portland?	weather	38
39343830323238	IN:GET_WEATHER	Was sind heute die niedrigsten Werte?	weather	38
39343739303937	IN:GET_WEATHER	Wie warm wird es diese Woche	weather	38
39343738303337	IN:GET_WEATHER	Gib mir die Wettervorhersage für diese Woche.	weather	38
39343737393730	IN:GET_WEATHER	Ziehen diese Woche irgendwelche Stürme in meine Richtung?	weather	38
39343737373530	IN:GET_WEATHER	Nähert sich den USA ein Orkan?	weather	38
3232353035323031	IN:GET_WEATHER	Wie ist das Wetter um Mitternacht	weather	38
