ID	intent	text	domain	label
3232353138353830	IN:CREATE_CALL	Könntest du Kiera Farley und Nolan Fernandez anrufen?	calling	42
3232353138343937	IN:CREATE_CALL	Mach einen Anruf mit Sean Hogan, Chelsey Mcgee, Nathanael Jennings und Kade Solis	calling	42
3232353138343932	IN:CREATE_CALL	Ich möchte einen Videoanruf mit Cheyenne Reynolds und Wesley Hopkins starten	calling	42
3232353138343739	IN:CREATE_CALL	Starte einen Sprachanruf mit Sawyer Page und Benjamin Munoz	calling	42
3232353138343035	IN:CREATE_CALL	Kontaktiere Carson Jordan und Steve Conner per Videochat	calling	42
3232353138323330	IN:CREATE_CALL	Bitte ruf Rebecca, Rene, Heather und Alison an	calling	42
3232353138313238	IN:CREATE_CALL	Könntest du mich mit dem Chat Spieltermin meiner Tochter auf Wechat verbinden?	calling	42
3232353137383436	IN:CREATE_CALL	Geschäft per Video anrufen	calling	42
3232353137383435	IN:CREATE_CALL	Starte einen Videoanruf mit Visual Arts	calling	42
3232353137383430	IN:CREATE_CALL	Kannst du mich mit der Gruppe Coffee Lovers verbinden?	calling	42
3232353137373535	IN:CREATE_CALL	Beginne einen Videochat mit der Gruppe meiner Biologie-Klasse	calling	42
3232353137363838	IN:CREATE_CALL	Bitte starte einen Anruf mit meiner Lerngruppe auf WhatsApp	calling	42
3232353137363336	IN:CREATE_CALL	Fange ein Telefongespräch mit Brendon, Caitlyn, Grant und Leslie an	calling	42
3232333730383331	IN:CREATE_CALL	Ruf die Frau von Ruth Pacheco an	calling	42
3232333730383035	IN:CREATE_CALL	Könntest du Evelyn Glenns Vater Peyton anrufen?	calling	42
3232333730373739	IN:CREATE_CALL	Ruf die Mutter von Christopher Thomas an	calling	42
3232333730363936	IN:CREATE_CALL	Ruf den Onkel von Iker Khan an	calling	42
3232333730363638	IN:CREATE_CALL	Ruf die Mutter von Jessica Dominguez an	calling	42
3232333730363339	IN:CREATE_CALL	Ruf den Vater von Peyton Jensen an	calling	42
3232333730353039	IN:CREATE_CALL	Ruf den Ehepartner von Hudson an	calling	42
3232333730333639	IN:CREATE_CALL	Ruf Noras Tante an	calling	42
3232333636333737	IN:CREATE_CALL	Auf Whatsapp Großvater anrufen	calling	42
3232333636313835	IN:CREATE_CALL	Ruf Papa mit Videoanruf auf WhatsApp an.	calling	42
3232333636313330	IN:CREATE_CALL	Ruf Ezekiel Macdonald über WhatsApp an	calling	42
3232333636303931	IN:CREATE_CALL	Ruf Jayla über WhatsApp an	calling	42
3232333636303037	IN:CREATE_CALL	Ruf Tanner Atkinson auf Whatsapp an	calling	42
3232333636303033	IN:CREATE_CALL	Starte einen WhatsApp-Anruf an Victoria Curtis	calling	42
3232333635393237	IN:CREATE_CALL	Ruf Reagan Webster via Whatsapp-Video an	calling	42
3232333635393136	IN:CREATE_CALL	John McGuire auf WhatsApp per Video anrufen	calling	42
3232333635383637	IN:CREATE_CALL	Ruf Winston per WhatsApp-Video an	calling	42
3232333635363732	IN:CREATE_CALL	Ruf Lincoln per Videochat über WhatsApp an	calling	42
3232333635363533	IN:CREATE_CALL	Rufe Mason über den Videochat von WhatsApp an	calling	42
3232333635363439	IN:CREATE_CALL	Ruf Pedro per WhatsApp-Videochat an	calling	42
3232333635353936	IN:CREATE_CALL	Ruf Ariel Rosario und Finn Crawford per Whatsapp an	calling	42
3232333635353635	IN:CREATE_CALL	Rufe Amiyah und Naomi über WhatsApp an	calling	42
3232333635343635	IN:CREATE_CALL	Ruf meinen WhatsApp-Kontakt Russell an	calling	42
3232333635343434	IN:CREATE_CALL	Ruf meinen WhatsApp-Kontakt Fatima an	calling	42
3232333635333630	IN:CREATE_CALL	Ruf Gianna aus meinen Whatsapp-Kontakten an	calling	42
3232333635333432	IN:CREATE_CALL	Ruf Jaxson aus meinen WhatsApp-Kontakten an	calling	42
3232333635333238	IN:CREATE_CALL	Ruf Frances aus meinen WhatsApp-Kontakten an	calling	42
3232333635323136	IN:CREATE_CALL	Ruf Kate Bowman per Video auf WhatsApp an	calling	42
3232333635313938	IN:CREATE_CALL	Ruf Kallie Davis per Video auf WhatsApp an	calling	42
3232333635313738	IN:CREATE_CALL	ruf Gunner Burns mit Video in WhatsApp an	calling	42
3232333635313530	IN:CREATE_CALL	Starte einen Videoanruf mit Aaron auf Whatsapp	calling	42
3232313933383431	IN:CREATE_CALL	Kannst du den Messenger benutzen, um Jeremiah anzurufen?	calling	42
3232313933383330	IN:CREATE_CALL	Ruf Zachariah über Messenger an	calling	42
3232313933373430	IN:CREATE_CALL	Ruf Melissa Maldonado über WhatsApp an	calling	42
3232313933373236	IN:CREATE_CALL	Kannst du Jayceon Hendrix via WhatsApp anrufen?	calling	42
3232313933373233	IN:CREATE_CALL	Kannst du bitte Clara Wilcox über den Messenger anrufen?	calling	42
3232313933363235	IN:CREATE_CALL	Ruf Alexander Hinton über Whatsapp an	calling	42
3232313933353932	IN:CREATE_CALL	Kannst du Mark Meyers über WhatsApp anrufen?	calling	42
3232313536383037	IN:CREATE_CALL	Ruf Katherine über Hangouts an	calling	42
3232313536383033	IN:CREATE_CALL	Starte einen Hangouts-Anruf mit Mary	calling	42
3232313536373737	IN:CREATE_CALL	Starte einen Anruf mit Linda über WeChat	calling	42
3232313536373731	IN:CREATE_CALL	Ruf James über WeChat an	calling	42
3232313536373631	IN:CREATE_CALL	Ruf Larry über WhatsApp an	calling	42
3232313536363531	IN:CREATE_CALL	Ruf Jayce Haynes per WhatsApp an	calling	42
3232313536353936	IN:CREATE_CALL	Ruf Tatum Floyd per WhatsApp an	calling	42
3232313332343634	IN:CREATE_CALL	Ruf Escobar und Madden an	calling	42
3232313332343234	IN:CREATE_CALL	Ruf Sawyer und Wong an.	calling	42
3232313332343231	IN:CREATE_CALL	Ruf Gonzales und Chavez an	calling	42
3232313332333233	IN:CREATE_CALL	Ruf Liliana und Bailey an	calling	42
3231373538373633	IN:CREATE_CALL	Ruf bitte umgehend Patrick an	calling	42
3231373538373539	IN:CREATE_CALL	Ruf bitte sofort Richardson an	calling	42
3231373538373532	IN:CREATE_CALL	Rufe sofort Hughes an	calling	42
3231373538373430	IN:CREATE_CALL	Rufe sofort Jonathan an	calling	42
3231373538363737	IN:CREATE_CALL	Bitte ruf sofort Edgar Lucas an	calling	42
3231373538363631	IN:CREATE_CALL	Ruf sofort Caden Carter an	calling	42
3231373538363530	IN:CREATE_CALL	Ruf sofort Keith Chung an	calling	42
3231373538353635	IN:CREATE_CALL	Ruf jetzt gleich Pierce an	calling	42
3231373538313232	IN:CREATE_CALL	Ruf Daniel unter der Nummer zwei an	calling	42
3231373538313230	IN:CREATE_CALL	Ruf Joseph vier an	calling	42
3231373438333931	IN:CREATE_CALL	Ruf Peyton Castaneda an	calling	42
3231373330363233	IN:CREATE_CALL	Mache einen Anruf über WhatsApp an Jonathan	calling	42
3231373330353939	IN:CREATE_CALL	Ruf Kaila Obrien über WhatsApp an.	calling	42
3231373330323130	IN:CREATE_CALL	Ruf stattdessen Ronald an	calling	42
3231373330313434	IN:CREATE_CALL	Ruf stattdessen Sydney Roth an	calling	42
3231373330313432	IN:CREATE_CALL	Ruf stattdessen Guillermo Hernandez an	calling	42
3231373237303032	IN:CREATE_CALL	Bitte ruf Amy an	calling	42
3231373236383834	IN:CREATE_CALL	Kannst du Stacey anrufen?	calling	42
3231373234353734	IN:CREATE_CALL	Rufe sie an	calling	42
3231373232323538	IN:CREATE_CALL	Ruf Jane über WhatsApp an	calling	42
3231373232323533	IN:CREATE_CALL	Rufe meinen Freund Andy Nelson über WhatsApp an	calling	42
3231373232323432	IN:CREATE_CALL	Rufen wir Catalina über WhatsApp an	calling	42
3231373131363936	IN:CREATE_CALL	Ich will William Landon Bennett anrufen	calling	42
3231373131363436	IN:CREATE_CALL	Ruf Jayla Carole Bautista für mich an	calling	42
3231373131363339	IN:CREATE_CALL	Ich möchte Sawyer Autumn Lowery anrufen	calling	42
3231373131353532	IN:CREATE_CALL	Ich möchte Blake Johnathan Benson anrufen	calling	42
3231373131343939	IN:CREATE_CALL	Ruf Andrew Larsen Randolph an	calling	42
3231373131343732	IN:CREATE_CALL	Ich will Christopher Clark Archer anrufen	calling	42
3231373131343339	IN:CREATE_CALL	Ruf Christine Shaffer Wang jetzt an	calling	42
3231373131343138	IN:CREATE_CALL	Ich möchte Timothy Bass Carson anrufen	calling	42
3231373131333834	IN:CREATE_CALL	Kannst du Daniel Figueroa Woodard anrufen?	calling	42
3231373131333630	IN:CREATE_CALL	Ruf Stephanie Conrad Escobar an	calling	42
3231373131313337	IN:CREATE_CALL	Ich würde gern Mary M. Welch anrufen	calling	42
3231373131313036	IN:CREATE_CALL	Ich möchte Betty B. Arroyo anrufen	calling	42
3231373130393330	IN:CREATE_CALL	Ich möchte gerne Lola Valeria White anrufen	calling	42
3231373130383834	IN:CREATE_CALL	Ich möchte gerne Benjamin Jude Mcintosh anrufen	calling	42
3231363734373336	IN:CREATE_CALL	Ruf bitte meine Frau an.	calling	42
3231363734373138	IN:CREATE_CALL	Ruf Papa an	calling	42
3231363734353731	IN:CREATE_CALL	Ruf meine Mama an	calling	42
3231363734343933	IN:CREATE_CALL	Hey, ruf Bob für mich an	calling	42
3231363734333633	IN:CREATE_CALL	Ruf Fred an	calling	42
3231363734333431	IN:CREATE_CALL	Ruf meine Freundin an	calling	42
3231363734333337	IN:CREATE_CALL	Ruf Papa an	calling	42
3231363734333335	IN:CREATE_CALL	Bitte ruf John an	calling	42
3231363734323131	IN:CREATE_CALL	Ruf Gita an.	calling	42
3231363137383832	IN:CREATE_CALL	Los, ruf Victor an	calling	42
3231363037343330	IN:CREATE_CALL	Ruf Ana L. an	calling	42
3231363037333934	IN:CREATE_CALL	Ruf Donovan W. an	calling	42
3231363037333435	IN:CREATE_CALL	Ruf Eli C. an	calling	42
3231363037333430	IN:CREATE_CALL	Ruf Cecily U. an	calling	42
3231363037333135	IN:CREATE_CALL	Ruf meinen Opa Moises an	calling	42
3231363037323433	IN:CREATE_CALL	Ruf meine Frau Alexis an	calling	42
3231363033393637	IN:CREATE_CALL	Eigene Nummer anrufen	calling	42
3231353835313732	IN:CREATE_CALL	Kannst du bitte meine Mutter anrufen?	calling	42
3231353834393933	IN:CREATE_CALL	Bitte ruf meinen Steuerberater an.	calling	42
3231353436373130	IN:CREATE_CALL	Ich möchte meine Frau anrufen	calling	42
3231353436373034	IN:CREATE_CALL	Ruf meinen Bruder Paul an.	calling	42
3231353436353830	IN:CREATE_CALL	Ruf meine Tante für mich an.	calling	42
3231353436353037	IN:CREATE_CALL	Verbinde mich per Videoanruf mit Mama	calling	42
3231353436333838	IN:CREATE_CALL	Kontaktiere Papa	calling	42
3231353436333539	IN:CREATE_CALL	Starte Anruf an meinen Bruder	calling	42
3231353436333536	IN:CREATE_CALL	Ruf Jessica an.	calling	42
3231353436333330	IN:CREATE_CALL	Ruf Cameron an	calling	42
3231353436333035	IN:CREATE_CALL	Ruf Sana an.	calling	42
3231353436303037	IN:CREATE_CALL	Ollie anrufen.	calling	42
3231353435393333	IN:CREATE_CALL	Ruf meine Mutter an.	calling	42
3231353138343230	IN:CREATE_CALL	Ruf Cleta Reaver über facetime an	calling	42
3231353138343038	IN:CREATE_CALL	Starte einen Facetime-Anruf mit Lorelei Weyers	calling	42
3231353036373333	IN:CREATE_CALL	Ruf Juliettes Tochter an	calling	42
3231353036363735	IN:CREATE_CALL	Ruf Juliannas Tante an	calling	42
3231353036353838	IN:CREATE_CALL	Ruf den Mann von Floretta Crase an	calling	42
3231353036353639	IN:CREATE_CALL	Ruf das Kind von Sloane an	calling	42
3231353036353238	IN:CREATE_CALL	Ruf Karissa Nienows Enkelin an.	calling	42
3231353036343335	IN:CREATE_CALL	Ruf Alma Rhos Enkelin an.	calling	42
3231353036343037	IN:CREATE_CALL	Ruf die Tante von Lyle X Pendley an	calling	42
3231353036333635	IN:CREATE_CALL	Ruf den Ehegatten von Kellee Aguino an	calling	42
3231353036333438	IN:CREATE_CALL	Ruf Marlin Scobles Tante an.	calling	42
3231353036323936	IN:CREATE_CALL	Ruf den Freund von Earnestine Kirkpatric an	calling	42
3231353036323833	IN:CREATE_CALL	Ruf Natalies Nichte an	calling	42
3231353036323733	IN:CREATE_CALL	Ruf den Freund von Ivy an	calling	42
3231353036323434	IN:CREATE_CALL	Ruf Lunas Bruder an	calling	42
3231353036323431	IN:CREATE_CALL	Ruf Briellas Tante an	calling	42
3231353036313730	IN:CREATE_CALL	Ruf die Mutter von Russell Perches an	calling	42
3231353036313236	IN:CREATE_CALL	Ruf die Tante von Lorenzo Lenard Laurelli an	calling	42
3231353036303834	IN:CREATE_CALL	Ruf Jazmins Enkelin an	calling	42
3231353036303737	IN:CREATE_CALL	Ruf Yaretzis Freundin an	calling	42
3231353036303433	IN:CREATE_CALL	Ruf Cassidys Tochter an	calling	42
3231353036303134	IN:CREATE_CALL	Ruf den Sohn von Keila Sun an	calling	42
3231353035383831	IN:CREATE_CALL	Ruf den Papa von Pasty Inks an	calling	42
3231353035383632	IN:CREATE_CALL	Ruf Arielles Partner an	calling	42
3231343939343338	IN:CREATE_CALL	Ruf den Hausarzt an	calling	42
3231343434303535	IN:CREATE_CALL	Ruf Jenna Pierce an	calling	42
3231333535323733	IN:CREATE_CALL	Mit An ira verbinden	calling	42
3231333535323035	IN:CREATE_CALL	Versuch Angelica Shelby anzurufen	calling	42
3231333535323031	IN:CREATE_CALL	Versuch, Ng Angelica anzurufen	calling	42
3231333535313635	IN:CREATE_CALL	Ruf Madison an	calling	42
3231333534363639	IN:CREATE_CALL	Versuch Nancy Austin anzurufen.	calling	42
3231333534363533	IN:CREATE_CALL	versuche, Sakura Kerry anzurufen	calling	42
3231333534353334	IN:CREATE_CALL	Kannst du versuchen, Brian anzurufen?	calling	42
3231333534343338	IN:CREATE_CALL	Versuch, Sherman Austin anzurufen	calling	42
3231333534343239	IN:CREATE_CALL	Starte einen Video-Anruf mit Ava Ira	calling	42
3231333534323938	IN:CREATE_CALL	Ich muss einen guten Freund anrufen	calling	42
3231333532343432	IN:CREATE_CALL	Kannst du Cade anrufen?	calling	42
3231333532333437	IN:CREATE_CALL	Ruf Lisa an	calling	42
3231333532313137	IN:CREATE_CALL	BEGINNE TELEFONAT MIT JENNY	calling	42
3231333532303034	IN:CREATE_CALL	Mache einen Anruf	calling	42
3231333531353633	IN:CREATE_CALL	Ich will jetzt John anrufen	calling	42
3231333531323930	IN:CREATE_CALL	Ruf bitte Kelly an	calling	42
3231333531323231	IN:CREATE_CALL	Kevin anrufen	calling	42
3231333439323735	IN:CREATE_CALL	Organisiere einen Gruppenanruf	calling	42
3231333432333435	IN:CREATE_CALL	Ruf einen Freund an	calling	42
3231333432303634	IN:CREATE_CALL	Erstelle einen Gruppenanruf mit der Familie	calling	42
3231333432303034	IN:CREATE_CALL	Ruf Bella an	calling	42
3231333431363437	IN:CREATE_CALL	Starte Anruf an Sam	calling	42
3231333431363238	IN:CREATE_CALL	Bitte ruf jetzt Roger an	calling	42
3231333431353435	IN:CREATE_CALL	Ruf den Sohn an	calling	42
3231333431333534	IN:CREATE_CALL	Ruf bitte Jane an	calling	42
3231333431303937	IN:CREATE_CALL	Jessica anrufen	calling	42
3231333339353331	IN:CREATE_CALL	Ich möchte jetzt Mika anrufen.	calling	42
3231333133303530	IN:CREATE_CALL	Bitte ruf Mama an	calling	42
3231333131393833	IN:CREATE_CALL	Ich möchte einen Videoanruf mit meinem Bruder starten	calling	42
3231333131333434	IN:CREATE_CALL	Ruf meine Kumpels an	calling	42
3231333130383031	IN:CREATE_CALL	Ruf meine Mutter an	calling	42
3231333130353032	IN:CREATE_CALL	Stiefbruder anrufen	calling	42
3231333130323937	IN:CREATE_CALL	Schick meinen Schwiegervätern eine Einladung zum Telefonieren	calling	42
3231333039393238	IN:CREATE_CALL	Hole meine Cousins und Cousinen ans Telefon	calling	42
3231333039313235	IN:CREATE_CALL	Beginne jetzt, meine Töchter anzurufen	calling	42
3231333039313034	IN:CREATE_CALL	Starte einen Videoanruf mit meinen Cousins	calling	42
3231333039303839	IN:CREATE_CALL	Stiefkinder kontaktieren	calling	42
3231333039303831	IN:CREATE_CALL	Töchter anrufen	calling	42
3231303232333034	IN:CREATE_CALL	Starte einen Videoanruf mit Joe	calling	42
3231303232303038	IN:CREATE_CALL	Ruf Wilkerson an.	calling	42
3231303230393437	IN:CREATE_CALL	Starte einen Videoanruf mit meiner Frau.	calling	42
3231303230353530	IN:CREATE_CALL	Videoanruf mit Jenn, jetzt bitte	calling	42
3231303135343931	IN:CREATE_CALL	Gruppenanruf mit Mark und Melissa starten	calling	42
39343834393530	IN:GET_SUNSET	Wann geht heute Abend die Sonne unter?	weather	43
3231343532333131	IN:GET_SUNSET	Wann dämmert es morgen Abend?	weather	43
3231313235343039	IN:GET_SUNSET	Sag mir, wann die Sonne untergeht.	weather	43
3138393837303537	IN:GET_LOCATION	Was ist Davids neue Adresse seit dem Umzug?	people	44
3138393836393039	IN:GET_LOCATION	Wo arbeitet David?	people	44
3138393836383637	IN:GET_LOCATION	Was ist die Arbeitsadresse von Jessie?	people	44
3138393836373438	IN:GET_LOCATION	Wohnt Kathie noch in der Riverview Street?	people	44
3138393836363638	IN:GET_LOCATION	Wo wohnt Michael?	people	44
3138393836363436	IN:GET_LOCATION	In welchem Teil der Stadt lebt mein Ex-Freund Sam derzeit?	people	44
3138393836363338	IN:GET_LOCATION	Wo hat die Marine meinen kleinen Bruder Nathan dieses Jahr stationiert?	people	44
3138393836353336	IN:GET_LOCATION	Wie lautet die Adresse von Jeff?	people	44
3138393836343035	IN:GET_LOCATION	Wohnt Jack immer noch in Livermore?	people	44
3138393836323737	IN:GET_LOCATION	Lebt Joan noch in Atlanta?	people	44
3138393836313338	IN:GET_LOCATION	Finde heraus, ob Corrie in South Orange lebt	people	44
3138393835393739	IN:GET_LOCATION	Wohnt George in Minot?	people	44
3138393835393435	IN:GET_LOCATION	Wohnt Sam immer noch am selben Ort?	people	44
3138393835373432	IN:GET_LOCATION	Wo lebt Jayson?	people	44
3138393835373230	IN:GET_LOCATION	Lebt Beth noch in Columbus?	people	44
3138393835363731	IN:GET_LOCATION	Wo lebt Marina?	people	44
3138393835363239	IN:GET_LOCATION	Wo wohnt Andy?	people	44
3138393835353832	IN:GET_LOCATION	Wo hat Destriva gelebt, als sie ein Kind war?	people	44
3138393835343233	IN:GET_LOCATION	In welcher Stadt lebt Mark?	people	44
3138393835333734	IN:GET_LOCATION	Wo wohnt Pam?	people	44
3138393835333437	IN:GET_LOCATION	Wo wohnt Dany momentan?	people	44
3138393835333333	IN:GET_LOCATION	Leben die Smiths in Butler?	people	44
3138393835323736	IN:GET_LOCATION	Sag mir, wo Kim lebt	people	44
3138393835303932	IN:GET_LOCATION	Wo in Kent wohnt Lisa?	people	44
3138393834383637	IN:GET_LOCATION	Lebt Sam Perez in Fort Worth?	people	44
3138393834383430	IN:GET_LOCATION	Wo lebt meine Ex-Frau?	people	44
3138393834373732	IN:GET_LOCATION	In welcher Stadt arbeitet Lance?	people	44
3138393738323336	IN:GET_LOCATION	Lebt Freddy Smith immer noch in Minnesota?	people	44
3232343532393533	IN:SET_RSVP_NO	Setze meinen Status auf „geht nicht zum C-ID Night Market"	event	45
3232343532383634	IN:SET_RSVP_NO	Antworte in Bezug auf Giants at Patriots mit „nein"	event	45
3232343532373431	IN:SET_RSVP_NO	Setze meinen Status auf „geht nicht zu Unicorn"	event	45
3232343532353731	IN:SET_RSVP_NO	Gehe nicht zu Bark in the Park	event	45
3232343532323930	IN:SET_RSVP_NO	Setze meinen Status auf „geht nicht zu Brickpalooza"	event	45
3232343532323236	IN:SET_RSVP_NO	Antworte in Bezug auf Comic Con mit „nein"	event	45
3232323232313537	IN:SET_RSVP_NO	Antworte in Bezug auf dieses Event mit „nein"	event	45
3231323338393533	IN:DELETE_REMINDER	Lösche die Erinnerungen für heute.	reminder	48
3231323338373434	IN:DELETE_REMINDER	Lösche alle Erinnerungen.	reminder	48
3231323337393535	IN:DELETE_REMINDER	Sag meine Erinnerung für das Abendessen Freitag um 17 Uhr ab	reminder	48
3231323337363630	IN:DELETE_REMINDER	Lösche heute alle Erinnerungen	reminder	48
3231323337303734	IN:DELETE_REMINDER	Lösche die Erinnerung, am Sonntag Insecure zu schauen	reminder	48
3231323337303231	IN:DELETE_REMINDER	Lösche alle meine Erinnerungen für Freitag.	reminder	48
3231323336363839	IN:DELETE_REMINDER	Verschiebe die Erinnerung in den Papierkorb	reminder	48
3231323335343735	IN:DELETE_REMINDER	Lösche meine Erinnerung, morgen Klamotten zu kaufen.	reminder	48
3231323335323831	IN:DELETE_REMINDER	Lösch meine nächste Erinnerung.	reminder	48
3231323335313736	IN:DELETE_REMINDER	Lösche alle verbliebenen Erinnerungen	reminder	48
3231323335303630	IN:DELETE_REMINDER	Lösch die Erinnerung daran, morgen ein Treffen in Bezug auf die Brautparty meiner Freundin zu haben.	reminder	48
3231323335303139	IN:DELETE_REMINDER	Lösche die Erinnerung, dass ich am Samstag mit dem Hund rausgehen muss	reminder	48
3231323334383334	IN:DELETE_REMINDER	Lösch die Erinnerung an das Streichen unseres Hauses diesen Monat.	reminder	48
3231323333383730	IN:DELETE_REMINDER	Bitte lösch die Erinnerungen, Mama anzurufen, für den Monat Oktober	reminder	48
3231323333333438	IN:DELETE_REMINDER	Lösch die Erinnerung, dass ich im Oktober einen Arzttermin habe.	reminder	48
3231323332343632	IN:DELETE_REMINDER	Lösich die Erinnerung, ihn morgen zum Mittagessen zu treffen.	reminder	48
3231323331393035	IN:DELETE_REMINDER	Lösche den Alarm fürs Keksebacken für den Kuchenbasar am Freitag	reminder	48
3231323331393032	IN:DELETE_REMINDER	Lösch alle Erinnerungen für die nächsten 4 Stunden.	reminder	48
3231323331383631	IN:DELETE_REMINDER	Kannst du die Erinnerung für morgen, Paola zu besuchen, löschen?	reminder	48
3231323331373939	IN:DELETE_REMINDER	Lösche die Erinnerung an das Familienabendessen diese Woche	reminder	48
3231323331363238	IN:DELETE_REMINDER	Lösche meine neueste Erinnerung.	reminder	48
3231323331343938	IN:DELETE_REMINDER	Lösche alle Erinnerungen für die Arbeit nächste Woche, weil ich nicht dort bin.	reminder	48
3231323331333936	IN:DELETE_REMINDER	Erinnere mich nicht mehr daran, Blumen für Oma abzuholen	reminder	48
3231323239383333	IN:DELETE_REMINDER	Lösch alle Erinnerungen, die ich für Februar bis Juli erstellt habe	reminder	48
3231323239353735	IN:DELETE_REMINDER	Lösch alle Erinnerungen.	reminder	48
3231323239343833	IN:DELETE_REMINDER	Lösche alle meine Erinnerungen an die Pläne zum Abendessen, die ich für die nächsten zwei Wochen in der Zeit zwischen 17 und 22 Uhr eingestellt habe	reminder	48
3231323238393034	IN:DELETE_REMINDER	Bitte lösch die Erinnerung, die ich für 15 Minuten vor meinem Hockeyspiel eingestellt habe	reminder	48
3231323238333733	IN:DELETE_REMINDER	Lösche die Erinnerung an den Kauf von Lebensmitteln an diesem Donnerstag	reminder	48
3231323238313934	IN:DELETE_REMINDER	Lösche alle meine 30-minütigen Erinnerungen an die Autoabholung nächste Woche	reminder	48
3231323237363032	IN:DELETE_REMINDER	Lösche alle Erinnerungen für die nächsten 2 Stunden	reminder	48
3231323237313033	IN:DELETE_REMINDER	Vergiss die Erinnerung für mein Racquetball-Spiel um 14:00 Uhr.	reminder	48
3231323236363131	IN:DELETE_REMINDER	Lösch alle Erinnerungen für die Abholung von Rezepten.	reminder	48
3231323236323331	IN:DELETE_REMINDER	Entferne die Erinnerung für den Brunch am Sonntag aus meinem Kalender	reminder	48
3231323235353535	IN:DELETE_REMINDER	Lösche den Terminalarm für meine Spamassage	reminder	48
3231323234383430	IN:DELETE_REMINDER	Lösch die Erinnerung, dass ich mit Pauli am Sonntag ins Kino gehe	reminder	48
3231323234373034	IN:DELETE_REMINDER	Bitte lösche alle meine Erinnerungen für Montag	reminder	48
3231323234353730	IN:DELETE_REMINDER	Lösch die Erinnerungen, die ich für das Abendessen mit Felix habe	reminder	48
3231323234353433	IN:DELETE_REMINDER	Lösch die Erinnerung daran, Blumen für Jeremys Geburtstag am Freitag zu kaufen.	reminder	48
3231323234343830	IN:DELETE_REMINDER	Lösch meine Erinnerungen für Mittagessen.	reminder	48
3231323234333334	IN:DELETE_REMINDER	Lösche die Erinnerung an das morgige Abendessen.	reminder	48
3231323234303137	IN:DELETE_REMINDER	Lösch alle Erinnerungen, die ich nächstes Wochenende habe.	reminder	48
3231323234303035	IN:DELETE_REMINDER	Lösch die Erinnerung, dem Fußballteam wegen des Spiels eine E-Mail zu schreiben	reminder	48
3231323231363039	IN:DELETE_REMINDER	Lösch alle Erinnerungen für nächsten Dienstag.	reminder	48
3231313535353632	IN:DELETE_REMINDER	Lösch alle Benachrichtigungen daran, diese Woche Mittagessen für die Arbeit zu bestellen.	reminder	48
3231313535323634	IN:DELETE_REMINDER	Lösch die Erinnerung an das Treffen mit Carlos morgen um 10 Uhr.	reminder	48
3231313534393637	IN:DELETE_REMINDER	Lösch meine Erinnerung für Sonntag.	reminder	48
3231313533393136	IN:DELETE_REMINDER	Lösche meine Erinnerung daran, meine Medizin zu nehmen	reminder	48
3231313532363735	IN:DELETE_REMINDER	Lösche die Erinnerung: Fußball Montag Abend.	reminder	48
3231313532363637	IN:DELETE_REMINDER	Lösch die Erinnerung für das Baseballspiel heute Abend. Es regnet.	reminder	48
3231313532353838	IN:DELETE_REMINDER	Lösche bitte die Erinnerung für den Arzttermin am 18. August.	reminder	48
3231313531383137	IN:DELETE_REMINDER	Lösch die Erinnerung an meinen Friseurtermin	reminder	48
3231313531333330	IN:DELETE_REMINDER	Lösch die Erinnerung, die ich diesen Monat für Phils Geburtstag hatte	reminder	48
3231313531313836	IN:DELETE_REMINDER	Lösch meine Erinnerung für das Yoga morgen.	reminder	48
3231313530333435	IN:DELETE_REMINDER	Lösch die Erinnerung daran, Stifte zu kaufen	reminder	48
3231313530323536	IN:DELETE_REMINDER	Lösch meine Erinnerung an das Abendessen	reminder	48
3231313530313030	IN:DELETE_REMINDER	Lösch die Erinnerung daran, morgen die Kinder abzuholen.	reminder	48
3231313530303530	IN:DELETE_REMINDER	Lösch den Alarm für die Erinnerung an die Fotoaufnahmen am Dienstag.	reminder	48
3231313437343036	IN:DELETE_REMINDER	Lösche die Erinnerung an meinen Arzttermin.	reminder	48
3231313437333136	IN:DELETE_REMINDER	Lösche meine Erinnerung an die Party am Freitag	reminder	48
3231313436313336	IN:DELETE_REMINDER	Lösch die Erinnerung an das Frühstück	reminder	48
3231313435363039	IN:DELETE_REMINDER	Lösch meine Erinnerung, heute Abend Oma anzurufen.	reminder	48
3231313434313537	IN:DELETE_REMINDER	Lösch die Erinnerung, den Telefonnachrichtendienst anzurufen.	reminder	48
3231313433363833	IN:DELETE_REMINDER	Lösche meine Erinnerung für die Wäsche heute Abend.	reminder	48
3231313433353037	IN:DELETE_REMINDER	Lösche meine Meeting-Erinnerung für heute	reminder	48
39343837313536	IN:CREATE_TIMER	MEINE TOCHTER MUSS IN 4 STUNDEN WIEDER ESSEN, BITTE STELL EINEN TIMER EIN	timer	49
39343832383736	IN:CREATE_TIMER	Stell einen neuen Timer für eine Stunde ein.	timer	49
39343831303632	IN:CREATE_TIMER	Ich brauche einen 6-minütigen Timer	timer	49
39343830333034	IN:CREATE_TIMER	Starte den Timer jetzt!	timer	49
39343830303737	IN:CREATE_TIMER	Starte in einer Minute einen Timer für 5 Minuten	timer	49
39343739373631	IN:CREATE_TIMER	Starte einen Timer-Countdown für 1 Minute	timer	49
39343736373433	IN:CREATE_TIMER	Beginne damit, meine Zeit zu stoppen!	timer	49
39343736333532	IN:CREATE_TIMER	Richte eine Timer für 21 Minuten ein.	timer	49
39343734313934	IN:CREATE_TIMER	Stelle einen Timer auf zwei Stunden.	timer	49
39343731303137	IN:CREATE_TIMER	Stelle 60 Minuten zum Laufen ein.	timer	49
