ID	intent	text	domain	label
3138393836353830	IN:GET_LOCATION	ขอที่อยู่ที่ทำงานของเจสัน	people	44
3231373530343339	IN:GET_LOCATION	ฉันต้องการให้คุณบอกสถานที่สำหรับอีเวนต์นี้	event	44
3231373530333636	IN:GET_LOCATION	บอกที่ตั้งของฟรีอินโทรทูเรกิให้ฉันหน่อย	event	44
3139343333363731	IN:GET_LOCATION	อัล ปาชิโนเติบโตที่ไหน	people	44
3139343333353434	IN:GET_LOCATION	ทอม แบรดดี้ เกิดที่ไหน	people	44
3139343333303736	IN:GET_LOCATION	ตอนนี้ โอเจ ซิมป์สัน อาศัยอยู่ที่ไหน?	people	44
3139343333303637	IN:GET_LOCATION	เมแกน มาร์เคิล มาจากไหน?	people	44
3139343332373630	IN:GET_LOCATION	เมลาเนีย ทรัมป์ เกิดที่ไหน	people	44
3232343533363939	IN:SET_RSVP_NO	ตอบกลับว่าไม่สำหรับงานกิจกรรมที่ห้าได้	event	45
3232343533313630	IN:SET_RSVP_NO	ทำเครื่องหมายว่าฉันไม่ไป NW Indigenous Peoples: Sharing Powwow Ways	event	45
3232343533313336	IN:SET_RSVP_NO	เปลี่ยนสถานะของฉันเป็นไม่ไป สำหรับงานอีเว้นท์ที่ 5	event	45
3232323232313631	IN:SET_RSVP_NO	ฉันไม่สนใจ Plate by Plate อีกต่อไปแล้ว	event	45
3232323232313134	IN:SET_RSVP_NO	ตอบกลับว่าไม่ไป Planet Home	event	45
3232343533313934	IN:SET_RSVP_NO	ตอบรับคำเชิญว่า ไม่ไป เดย์-ทริปล่องเรือที่เกาะเบลก	event	45
3232343533363838	IN:SET_RSVP_NO	ตอบไม่สำหรับ Oktoberfest	event	45
3232343533303237	IN:SET_RSVP_NO	ไม่จอง Two Door Cinema Club	event	45
3231343132373439	IN:DELETE_REMINDER	ลบเลย	reminder	48
3231333932373837	IN:DELETE_REMINDER	ช่วยลบเตือนความจำเกี่ยวกับแมตช์ฟุตบอลของเราหน่อย	reminder	48
3231323338393933	IN:DELETE_REMINDER	ยกเลิกเตือนความจำเรื่องปาร์ตี้ในวันอาทิตย์	reminder	48
3231323335373838	IN:DELETE_REMINDER	ยกเลิกเตือนความจำให้ซื้อนม	reminder	48
3231323334383634	IN:DELETE_REMINDER	ฉันต้องกำหนดตารางการประชุมในวันพรุ่งนี้ใหม่ ดังนั้นช่วยลบเตือนความจำนั้นให้หน่อย	reminder	48
3231323332343939	IN:DELETE_REMINDER	กรุณาลบการแจ้งเตือนเกี่ยวกับการประชุมวันนี้	reminder	48
3231323332343539	IN:DELETE_REMINDER	ลบเตือนความจำเกี่ยวกับการโทรหาพ่อ	reminder	48
3231323331393734	IN:DELETE_REMINDER	ช่วยลบการซื้อของขวัญออกจากรายการสิ่งที่ต้องทำในสัปดาห์หน้าของฉันให้หน่อย	reminder	48
3231323330303932	IN:DELETE_REMINDER	ลบการแจ้งเตือนที่ให้คืนอุปกรณ์สำนักงานในวันพุธ	reminder	48
3231323237303133	IN:DELETE_REMINDER	ลบเตือนความจำให้ต่อสัญญากล่องจดหมายออก	reminder	48
3231323236373532	IN:DELETE_REMINDER	ลบเตือนความจำเกี่ยวกับการกินฮัมมัสในตู้เย็นให้หมด	reminder	48
3231323235333630	IN:DELETE_REMINDER	ลบเตือนความจำสำหรับการท่องเที่ยวด้วยรสบัสสุดสัปดาห์ที่จะถึงนี้	reminder	48
3231323234383232	IN:DELETE_REMINDER	ลบเตือนความจำเกี่ยวกับการซื้ออาหารหมาเพราะสามีของฉันซื้อมาแล้ว	reminder	48
3231323231353239	IN:DELETE_REMINDER	ยกเลิกการแจ้งเตือนทั้งหมดที่ตั้งไว้สำหรับวันที่ 20 ตุลาคม	reminder	48
3231313535373432	IN:DELETE_REMINDER	ยกเลิกเตือนความจำทั้งหมดที่ฉันมีก่อน 9.00 น. วันอาทิตย์	reminder	48
3231313535353636	IN:DELETE_REMINDER	ลบเตือนความจำสำหรับยิมในช่วงที่เหลือของสัปดาห์นี้	reminder	48
3231313535303436	IN:DELETE_REMINDER	ยกเลิกการแจ้งเตือนให้เปลี่ยนน้ำมัน	reminder	48
3231313530353639	IN:DELETE_REMINDER	ลบการแจ้งเตือนเกี่ยวกับอาหารแมว	reminder	48
3231313439393933	IN:DELETE_REMINDER	ลบเตือนความจำทั้งหมดของสัปดาห์หน้า	reminder	48
3231313439343637	IN:DELETE_REMINDER	ลบการแจ้งเตือนให้โทรหาแซมคืนนี้	reminder	48
3231313437373731	IN:DELETE_REMINDER	ฉันไปคอนเสิร์ตไม่ได้แล้ว ยกเลิกการแจ้งเตือน	reminder	48
3231313437373639	IN:DELETE_REMINDER	ลบการแจ้งเตือนให้ไปรับหลานสาวของฉัน	reminder	48
3231333933313839	IN:DELETE_REMINDER	ปิดการแจ้งเตือนที่ฉันตั้งไว้ ให้ไปหาคุณยาย	reminder	48
3231323430353530	IN:DELETE_REMINDER	ลบการแจ้งเตือนเกี่ยวกับ มื้อเย็นของเจย์	reminder	48
3231323337343736	IN:DELETE_REMINDER	ลบการแจ้งเตือนทั้งหมดสำหรับวันอาทิตย์	reminder	48
3231323331333730	IN:DELETE_REMINDER	ลบการแจ้งเตือนของฉัน สำหรับงานแต่งงานของนาตาลี	reminder	48
3231323236313730	IN:DELETE_REMINDER	ช่วยยกเลิกการแจ้งเตือนสำหรับนัดมื้อกลางวันวันอาทิตย์นี้ให้หน่อย เพราะเพื่อนของฉันติดธุระด่วนพอดี	reminder	48
3231323235313537	IN:DELETE_REMINDER	ลบการเตือนปาร์ตี้วันเกิด	reminder	48
3231323233343031	IN:DELETE_REMINDER	ยกเลิกการแจ้งเตือนทั้งหมดที่ฉันมีอยู่	reminder	48
3231323233303334	IN:DELETE_REMINDER	ลบการแจ้งเตือนที่จะต้องส่งอีเมลไปยังโรงเรียนลูกชาย	reminder	48
3231313437363634	IN:DELETE_REMINDER	ยกเลิกการแจ้งเตือนที่ให้ไปรับของขวัญสำหรับงานปาร์ตี้ของแพตตี้	reminder	48
3231313435343239	IN:DELETE_REMINDER	ลบการแจ้งเตือนของฉันที่ให้ ทำความสะอาดบ้าน ตอน 9 โมง	reminder	48
3231313434393835	IN:DELETE_REMINDER	ลบการแจ้งเตือนที่ต้องไปรับน้องสาวของฉัน	reminder	48
3231323339333334	IN:DELETE_REMINDER	ยกเลิกการแจ้งเตือนของฉันให้พาสุนัขไปเดิน	reminder	48
3231323338353636	IN:DELETE_REMINDER	การแจ้งเตือนของฉันเสร็จแล้ว โปรดลบ	reminder	48
3231323337313333	IN:DELETE_REMINDER	ยกเลิกการแจ้งเตือนสำหรับวันพรุ่งนี้	reminder	48
3231323336363136	IN:DELETE_REMINDER	ยกเลิกการเตือนให้ซื้อน้ำส้มคั้นของฉัน	reminder	48
3231323335353031	IN:DELETE_REMINDER	ลบการแจ้งเตือนของฉันทั้งหมด	reminder	48
3231323334393033	IN:DELETE_REMINDER	ลบเตือนความจำเรื่องเดตกับแอชลีย์ในคืนวันเสาร์	reminder	48
3231323332313536	IN:DELETE_REMINDER	ยกเลิกการเตือนสำหรับละครในวันที่ 23 สิงหาคม	reminder	48
3231323332313336	IN:DELETE_REMINDER	ลบการแจ้งเตือนการออกไปปั่นจักรยาน	reminder	48
3231323331393937	IN:DELETE_REMINDER	ฉันไม่ต้องการได้รับการเตือนเกี่ยวกับงานวันเปิดเรียนอีกต่อไป	reminder	48
3231323331393035	IN:DELETE_REMINDER	ยกเลิกการเตือนให้ทำคุ้กกี้สำหรับวันขายขนมวันศุกร์	reminder	48
3232343333323130	IN:CREATE_TIMER	เริ่มตัวจับเวลาโดยให้ทำงาน 5 นาที	timer	49
3232343333313538	IN:CREATE_TIMER	แนะนำนาฬิกาจับเวลาที่ใช้ได้ 7 วินาที	timer	49
3232343330363330	IN:CREATE_TIMER	สร้างตัวจับเวลาตัวหนึ่งเป็นเวลาสิบสองนาที และอีกตัวหนึ่งเป็นเวลา 10 วินาที และอีกตัวหนึ่งเป็นเวลา 60 วินาที	timer	49
3232323930313238	IN:CREATE_TIMER	สร้างนาฬิกาจับเวลาไข่	timer	49
3232323730313837	IN:CREATE_TIMER	ตั้งตัวจับเวลาหกนาทีและตัวจับเวลาเจ็ดนาทีและตัวจับเวลา 30 วินาที	timer	49
3232323530313934	IN:CREATE_TIMER	สร้างตัวจับเวลาสำหรับไข่เป็นเวลา 22 นาที	timer	49
3231363032343038	IN:CREATE_TIMER	ช่วยเริ่มตัวจับเวลาสองตัวให้ฉันหน่อย	timer	49
3230303431383538	IN:CREATE_TIMER	ช่วยตั้งตัวจับเวลาเป็นเวลา 19 เดือนให้หน่อย	timer	49
3136343732313739	IN:CREATE_TIMER	ช่วยตั้งตัวจับเวลาหน่อย	timer	49
3136343035303537	IN:CREATE_TIMER	ตั้งการจับเวลาไว้ 30 นาที ฉันไม่อยากทิ้งยาย้อมผมไว้นานเกินไป	timer	49
3135323937333138	IN:CREATE_TIMER	จับเวลาใน 1 ชั่วโมง	timer	49
3135323936303433	IN:CREATE_TIMER	ตั้งตัวจับเวลาอีกตัวเป็นเวลา 10 นาที	timer	49
3135323934373239	IN:CREATE_TIMER	ตั้งตัวจับเวลาไว้ 30 นาที	timer	49
3135323931393537	IN:CREATE_TIMER	จับเวลา 2 นาที	timer	49
3135323931383732	IN:CREATE_TIMER	จับเวลา 25 นาทีสำหรับเค้ก	timer	49
3135323930333330	IN:CREATE_TIMER	จับเวลา 15 นาที	timer	49
3135323839363332	IN:CREATE_TIMER	ตั้งตัวจับเวลาให้ดังในตอนเช้าตรู่	timer	49
3133373439323238	IN:CREATE_TIMER	คุณช่วยจับเวลาให้ฉันได้มั้ย	timer	49
39353737353637	IN:CREATE_TIMER	ตั้งตัวจับเวลาสำหรับการเดินทางของฉัน	timer	49
39353735333435	IN:CREATE_TIMER	ช่วยตั้งตัวจับเวลาให้เตือนในอีก 20 นาทีได้ไหม	timer	49
39353734333533	IN:CREATE_TIMER	เริ่มตัวจับเวลาตอนนี้เลย	timer	49
39353730393036	IN:CREATE_TIMER	ตั้งตัวจับเวลาเป็นเวลาหนึ่งชั่วโมงเมื่อถึงเวลา 20.00 น.	timer	49
39353635343231	IN:CREATE_TIMER	จับเวลา 2 นาที 30 วินาที	timer	49
39353634303837	IN:CREATE_TIMER	ช่วยเริ่มตัวจับเวลาอีกตัวให้หน่อย	timer	49
39353633313436	IN:CREATE_TIMER	ตั้งตัวจับเวลาเป็นเวลา 15 นาที	timer	49
39353536333835	IN:CREATE_TIMER	ตั้งตัวจับเวลาของฉันตามเวลาปกติให้หน่อย	timer	49
39353533393635	IN:CREATE_TIMER	ฉันต้องการตั้งตัวจับเวลาเป็นเวลา 5 นาที	timer	49
39353530313536	IN:CREATE_TIMER	ตั้งตัวจับเวลาเป็นเวลา 45 วินาที	timer	49
39353430363239	IN:CREATE_TIMER	ตั้งตัวจับเวลาไว้ที่สองชั่วโมง	timer	49
39353331313932	IN:CREATE_TIMER	เริ่มตั้งตัวจับเวลาใหม่เป็นเวลา 20 นาที	timer	49
39353330333531	IN:CREATE_TIMER	กรุณาจับเวลา 3 ชั่วโมง	timer	49
39353233383936	IN:CREATE_TIMER	ตั้งตัวจับเวลาของฉันเป็น 02.00 น.	timer	49
39353233363534	IN:CREATE_TIMER	ตั้งตัวจับเวลาเป็น 40 นาที	timer	49
39353231333739	IN:CREATE_TIMER	ตั้งตัวจับเวลาหนึ่งนาทีให้หน่อย	timer	49
39353135343339	IN:CREATE_TIMER	ตั้งการจับเวลา 1 นาที	timer	49
39353032303337	IN:CREATE_TIMER	ตั้งตัวจับเวลาเป็นเวลา 6 นาที	timer	49
39353030363737	IN:CREATE_TIMER	ตั้งการจับเวลา 33 นาทีและเตือน	timer	49
39343832383736	IN:CREATE_TIMER	ตั้งจับเวลาใหม่ 1 ชั่วโมง	timer	49
39343831343731	IN:CREATE_TIMER	ตั้งตัวจับเวลาเป็นเวลา 11 นาที	timer	49
39343831303632	IN:CREATE_TIMER	ฉันต้องการการจับเวลา 6 นาที	timer	49
39343738333139	IN:CREATE_TIMER	ตั้งตัวจับเวลาเป็นเวลา 15 นาทีอีกครั้ง	timer	49
39343733383735	IN:CREATE_TIMER	ตั้งตัวจับเวลาเป็นเวลา 60 นาที	timer	49
39343732333136	IN:CREATE_TIMER	ตั้งตัวจับเวลาของฉันเป็น 60 นาที	timer	49
3232323930343032	IN:CREATE_TIMER	ตั้งการจับเวลา นำไก่เข้าตู้เย็น	timer	49
3135323938363833	IN:CREATE_TIMER	ตั้งจับเวลา 10 นาที	timer	49
3135323933383030	IN:CREATE_TIMER	ช่วยจับเวลา 4 นาทีหน่อย	timer	49
39353733393032	IN:CREATE_TIMER	ตั้งการจับเวลาออกกำลังกาย 30 นาที	timer	49
39353638333938	IN:CREATE_TIMER	เริ่มต้นจับเวลา 10 นาที	timer	49
39353637323730	IN:CREATE_TIMER	ตั้งเวลาออกกำลังกายเป็นเวลา 20 นาที	timer	49
39353630313339	IN:CREATE_TIMER	เริ่มจับเวลา	timer	49
39353533333231	IN:CREATE_TIMER	ตั้งจับเวลา 2 นาที	timer	49
39353436313931	IN:CREATE_TIMER	ตั้งการจับเวลา พักกลางวัน 15 นาที	timer	49
39343736333532	IN:CREATE_TIMER	ตั้งการจับเวลา 21 นาที	timer	49
3232323930333538	IN:CREATE_TIMER	ตั้งการจับเวลาไว้ 10 วินาที ใช้ชื่อว่ากลั้นหายใจ	timer	49
3231363736353439	IN:UPDATE_METHOD_CALL	เปลี่ยนนี่เป็นการโทรแบบวิดีโอ	calling	51
3231363736333231	IN:UPDATE_METHOD_CALL	เปลี่ยนเป็นวิดีโอคอล	calling	51
3231363736313238	IN:UPDATE_METHOD_CALL	ทำให้เป็นวิดีโอคอล	calling	51
3231363736303332	IN:UPDATE_METHOD_CALL	ช่วยเปลี่ยนวิดีโอคอลเป็นการโทรแบบเสียงให้หน่อย	calling	51
3231353438353232	IN:UPDATE_METHOD_CALL	เปลี่ยนการโทรด้วยเสียงกับ Oskar เป็นวิดีโอคอล	calling	51
3231353438343937	IN:UPDATE_METHOD_CALL	ทำให้การโทรแบบเสียงเป็นวิดีโอคอล	calling	51
3231353336383531	IN:UPDATE_METHOD_CALL	ช่วยเปลี่ยนการโทรแบบเสียงให้เป็นวิดีโอคอลได้ไหม	calling	51
3231353336383138	IN:UPDATE_METHOD_CALL	สลับจากการโทรเป็นวิดีโอคอล	calling	51
3132353638313136	IN:REMOVE_FROM_PLAYLIST_MUSIC	กรุณาลบเพลงปัจจุบัน	music	53
39343731303839	IN:REMOVE_FROM_PLAYLIST_MUSIC	อย่าเล่นเพลงของ Justin Bieber อีก	music	53
39353237313537	IN:REMOVE_FROM_PLAYLIST_MUSIC	ช่วยลบ 5 เพลงแรกออกไปหน่อย	music	53
39343936373638	IN:REMOVE_FROM_PLAYLIST_MUSIC	ลบเพลงจากเพลย์ลิสต์ของฉัน	music	53
39353630353734	IN:REMOVE_FROM_PLAYLIST_MUSIC	ลบเพลงนั้นออกจากเพลย์ลิสต์ของฉัน	music	53
39353233393331	IN:REMOVE_FROM_PLAYLIST_MUSIC	ฉันไม่ต้องการฟังเพลงนั้นอีกเลย	music	53
3232353330343131	IN:GET_CONTACT	ช่วยค้นหา Wesley Valdez ให้ฉันหน่อย	people	54
3232353330333933	IN:GET_CONTACT	คุณช่วยหาเฮลี่ ดายเออร์ได้มั้ย	people	54
3231393232363639	IN:GET_CONTACT	แสดงแอพพลิเคชั่นของเพื่อน	people	54
3231343630393130	IN:GET_CONTACT	แสดงวันเกิดของลูกพี่ลูกน้องคนแรก	people	54
3231343630373838	IN:GET_CONTACT	บอกวันเกิดหลานๆ ครอบครัว Wonderling หน่อย	people	54
3231343630373736	IN:GET_CONTACT	แสดงวันเกิดของพ่อแม่ Lindsay ให้ฉันดูหน่อย	people	54
3231343630373234	IN:GET_CONTACT	มีคนเกิดวันที่ 7 พฤศจิกายนกี่คน	people	54
3231343630363836	IN:GET_CONTACT	เขยหรือสะใภ้คนไหนของครอบครัว Koda เกิดวันศุกร์หน้า	people	54
3231343630363835	IN:GET_CONTACT	ฉันขอดูวันเกิดของป้าของ Kerry Austin หน่อย	people	54
3231343533323532	IN:GET_CONTACT	ใกล้จะถึงวันเกิดของใครบ้าง	people	54
3231313734343031	IN:GET_CONTACT	เพื่อนของฉันเกิดในเดือนธันวาคมกี่คน	people	54
3139393231323836	IN:GET_CONTACT	Kenzie มีพี่สาวน้องสาวไหม	people	54
3139343333363130	IN:GET_CONTACT	มิเชล โอบาม่ามีพี่น้องมั้ย	people	54
3138393834353437	IN:GET_CONTACT	ใครทำงานที่ Wells Fargo	people	54
3138393834353137	IN:GET_CONTACT	ใครทำงานที่ฮูลู	people	54
3138393834333734	IN:GET_CONTACT	บอกฉันว่าใครทำงานที่เบอร์เกอร์ คิง	people	54
3138393834333639	IN:GET_CONTACT	บอกฉันว่าใครทำงานที่อาร์ลิงตัน โตโยต้า	people	54
3138393834333134	IN:GET_CONTACT	ฉันรู้จักใครที่ทำงานที่ npl บ้างไหม	people	54
3138393834323031	IN:GET_CONTACT	ใครทำงานที่ DOE	people	54
3138393833383433	IN:GET_CONTACT	ค้นหาว่าใครทำงานที่ธนาคารบราเดสโก้	people	54
3138393833363534	IN:GET_CONTACT	ใครทำงานที่ Starbucks	people	54
3138393833343630	IN:GET_CONTACT	ฉันมีเพื่อนที่ทำงานที่ธนาคาร Chase Bank ไหม	people	54
3138393833343335	IN:GET_CONTACT	ใครทำงานที่อะมาซอน	people	54
3138393833333437	IN:GET_CONTACT	ใครทำงานกับ Toyota ตอนนี้	people	54
3138393833303033	IN:GET_CONTACT	บอกฉันว่าใครทำงานที่เอ็กซ์เพรสชั่น	people	54
3138393832373538	IN:GET_CONTACT	ใครทำงานกับ Disney World ในขณะนี้	people	54
3138393832363633	IN:GET_CONTACT	ใครที่ทำงานให้กับ Lowes	people	54
3138393832363238	IN:GET_CONTACT	ฉันมีเพื่อนทีเรียนจบจาก Humbolt State ไหม	people	54
3138393832343430	IN:GET_CONTACT	คนที่เคยเรียนที่ University of Nebraska	people	54
3138393832343239	IN:GET_CONTACT	เพื่อนคนไหนเคยเรียนที่ Harvard	people	54
3138393832323237	IN:GET_CONTACT	บอกฉันว่าใครเรียนจบจากพรินซ์ตัน	people	54
3138393831393234	IN:GET_CONTACT	ใครเคยเรียนที่มหาวิทยาลัยบอสตัน	people	54
3138393831363930	IN:GET_CONTACT	มีคนในครอบครัวของฉันคนไหนจบจากเยลไหม	people	54
3138393831333737	IN:GET_CONTACT	มีเพื่อนของฉันคนไหนเรียนที่ UW-Waukesha บ้างไหม	people	54
3138393831323030	IN:GET_CONTACT	เพื่อนคนไหนเคยเรียนที่ KU บ้าง	people	54
3138393831313830	IN:GET_CONTACT	มีเพื่อนของฉันเรียนที่มหาวิทยาลัยโคลัมเบียกี่คน	people	54
3138393831313330	IN:GET_CONTACT	เพื่อนคนไหนของฉันเรียนจบจาก ONU บ้าง	people	54
3138393830323036	IN:GET_CONTACT	รู้จักใครในฝรั่งเศสบ้าง	people	54
3138393830313836	IN:GET_CONTACT	มีเพื่อนของฉันเข้าเรียนที่ Baylor บ้างไหม	people	54
3138393739363138	IN:GET_CONTACT	มีเพื่อนของฉันคนไหนมาจากชิคาโกไหม	people	54
3138393739353630	IN:GET_CONTACT	หมอจัดกระดูกของฉันอยู่ในไทการ์ดหรือเปล่า	people	54
3138393739343738	IN:GET_CONTACT	ฉันรู้จักคนที่อาศัยอยู่ในออสเตรเลียบ้างไหม	people	54
3138393739333937	IN:GET_CONTACT	มีเพื่อนของฉันอาศัยอยู่ในไมอามีบ้างไหม	people	54
3138393739313837	IN:GET_CONTACT	ใครอาศัยอยู่ในโบลเดอร์	people	54
3138393735383735	IN:GET_CONTACT	บอกชื่อเพื่อนของ Mini หน่อย	people	54
3138393735363536	IN:GET_CONTACT	เพื่อนของ Molly	people	54
3138393735363336	IN:GET_CONTACT	ฉันอยากรู้จักเพื่อนของ George	people	54
3138393735323332	IN:GET_CONTACT	เพื่อนของ David	people	54
3138393735313930	IN:GET_CONTACT	Gloria Garcia มีเพื่อนคนไหนที่มีชื่อว่า Emmanuel ในเพจ Facebook ของเธอไหม	people	54
3138393734373831	IN:GET_CONTACT	แสดงเพื่อนของ Juan	people	54
3138393734363434	IN:GET_CONTACT	ใครเป็นเพื่อนของ Jennifer บ้าง	people	54
3138393734343332	IN:GET_CONTACT	เพื่อนของพี่สาวของฉัน	people	54
3138393734313635	IN:GET_CONTACT	ใครคือเพื่อนของ Tina	people	54
