ID	intent	text	domain	label
3231353438343537	IN:UPDATE_CALL	เพิ่มพ่อของฉันกับน้องสาวของฉันเข้าในวิดีโอแชทนี้	calling	79
3138393934343034	IN:GET_AGE	John อายุเท่าไร	people	80
3138393839303336	IN:GET_AGE	พ่อสามีของฉันอายุเท่าไร	people	80
3138393838373733	IN:GET_AGE	Ben อายุเท่าไร	people	80
3138393838363736	IN:GET_AGE	Floyd อายุเท่าไร	people	80
3138393838313130	IN:GET_AGE	Jo Nelle อายุเท่าไร	people	80
3138393837383135	IN:GET_AGE	ซูกำลังจะอายุเท่าไหร่	people	80
3138393837373639	IN:GET_AGE	รู้ไหมว่า Sam อายุเท่าไร	people	80
3138393837353335	IN:GET_AGE	Chris อายุเกิน 45 แล้วหรือยัง	people	80
3132363130313939	IN:PREVIOUS_TRACK_MUSIC	ช่วยเล่นแทร็กสุดท้ายอีกครั้ง	music	81
3132353634363333	IN:PREVIOUS_TRACK_MUSIC	กรุณาเล่นเพลงที่แล้วซ้ำ	music	81
39353331313237	IN:PREVIOUS_TRACK_MUSIC	ฉันต้องการเล่นซ้ำเพลงก่อนหน้า	music	81
3136383737333330	IN:PREVIOUS_TRACK_MUSIC	กลับไปที่เพลงก่อนหน้า	music	81
39353037363839	IN:PREVIOUS_TRACK_MUSIC	ย้อนกลับไปหนึ่งหรือสองเพลง	music	81
39353037323131	IN:PREVIOUS_TRACK_MUSIC	ฉันอยากฟังเพลงสุดท้ายอีกครั้ง	music	81
39353037313834	IN:PREVIOUS_TRACK_MUSIC	เล่นซ้ำเพลงล่าสุดด้วย	music	81
39353036303038	IN:PREVIOUS_TRACK_MUSIC	คุณช่วยเล่นเพลงที่แล้วอีกครั้งได้ไหม	music	81
39343530353830	IN:PREVIOUS_TRACK_MUSIC	เล่นเพลงสุดท้ายอีกครั้งทันที	music	81
39353138383135	IN:SUBTRACT_TIME_TIMER	ช่วยลบ 1 ชั่วโมงออกจากตัวจับเวลาของฉันหน่อย	timer	82
39353134373735	IN:SUBTRACT_TIME_TIMER	ลดเวลา 15 นาทีจากตัวจับเวลา	timer	82
39343832383931	IN:SUBTRACT_TIME_TIMER	ลดเวลา 11 นาทีจากตัวจับเวลา	timer	82
3232333437383234	IN:SUBTRACT_TIME_TIMER	ลดเวลาจากการจับเวลามะกะโรนีลง 20 นาที	timer	82
3232333437373930	IN:SUBTRACT_TIME_TIMER	เอาออกสิบสองนาทีจากตัวจับเวลาการอ่าน	timer	82
3232313136343538	IN:SUBTRACT_TIME_TIMER	ลบการจับเวลาของฉันออกหนึ่งนาที	timer	82
3136343035303134	IN:SUBTRACT_TIME_TIMER	หักเวลาออก 10 นาทีจากการจับเวลา	timer	82
3135333031353838	IN:SUBTRACT_TIME_TIMER	ลดเวลาลง 1 ชั่วโมงจากการจับเวลาของฉัน	timer	82
3135333030313533	IN:SUBTRACT_TIME_TIMER	ลดเวลาลง 10 นาทีจากการจับเวลาของวันนี้	timer	82
39353633333139	IN:SUBTRACT_TIME_TIMER	ลบ 30 นาทีจากตัวจับเวลาของฉัน	timer	82
3132363135383431	IN:QUESTION_MUSIC	ศิลปินคนนี้จะทัวร์คอนเสิร์ตอีกรอบเมื่อไหร่	music	83
3132353634393233	IN:QUESTION_MUSIC	เพลงของใครฮิตติดชาร์ตอยู่ตอนนี้	music	83
39353337323034	IN:QUESTION_MUSIC	เพลย์ลิสต์ Spotify ของฉันมีอะไรบ้าง	music	83
3132353933323232	IN:QUESTION_MUSIC	อัลบั้มอันดับ 1 จาก 40 อัลบั้มของสัปดาห์นี้คืออะไร	music	83
3231363336393438	IN:SILENCE_ALARM	ปิดนาฬิกาปลุก!	alarm	85
3231363032323737	IN:SILENCE_ALARM	ปิดเสียง	alarm	85
3231363032323431	IN:SILENCE_ALARM	ไม่ต้องตั้งนาฬิกาปลุกอีก	alarm	85
3231353535363139	IN:SILENCE_ALARM	ปิดการแจ้งเตือน	alarm	85
3231353535343337	IN:SILENCE_ALARM	ปิดเสียงการแจ้งเตือนของฉัน	alarm	85
39353539303639	IN:SILENCE_ALARM	ปิดการแจ้งเตือนของฉัน	alarm	85
39353336303339	IN:SILENCE_ALARM	ปิดการแจ้งเตือนล่าสุดของฉัน	alarm	85
3231363336383030	IN:SILENCE_ALARM	ไม่ใช่ตอนนี้	alarm	85
3231363032313131	IN:SILENCE_ALARM	ช่วยปิดการแจ้งเตือนของฉันหน่อย	alarm	85
3231353535363834	IN:SILENCE_ALARM	ทำให้นาฬิกาปลุกเงียบ	alarm	85
39343733353232	IN:SILENCE_ALARM	ช่วยปิดเสียงนาฬิกาปลุกให้หน่อย	alarm	85
3232343330343935	IN:CREATE_ALARM	ตั้งนาฬิกาปลุกเวลา 20.45 น.	alarm	87
3232333238363734	IN:CREATE_ALARM	ตั้งการแจ้งเตือนเป็นเวลา 25 นาทีนับจากนี้	alarm	87
3232313432333230	IN:CREATE_ALARM	ช่วยเปิดการแจ้งเตือนสำหรับเวลา 7.30 น. ให้หน่อย	alarm	87
3232313432333135	IN:CREATE_ALARM	สลับเปิดการแจ้งเตือนของฉันในเวลา 10.00 น	alarm	87
3232313432323332	IN:CREATE_ALARM	คุณช่วยตั้งนาฬิกาปลุกในอีก 1 นาทีนับจากตอนนี้ได้มั้ย	alarm	87
3231363337343134	IN:CREATE_ALARM	การแจ้งเตือนใหม่	alarm	87
3231363337343038	IN:CREATE_ALARM	ฉันอยากได้นาฬิกาปลุกใหม่	alarm	87
3231363337333134	IN:CREATE_ALARM	ตั้งการแจ้งเตือนให้ฉันหน่อย	alarm	87
3231363337323631	IN:CREATE_ALARM	ฉันไปประชุมพรุ่งนี้สายไม่ได้	alarm	87
3231363337313830	IN:CREATE_ALARM	กรุณาตั้งนาฬิกาปลุก	alarm	87
3231363336343930	IN:CREATE_ALARM	สร้างการแจ้งเตือนใหม่สำหรับเวลา 14.00 น. วันพุธ	alarm	87
3231363336343736	IN:CREATE_ALARM	ช่วยปลุกฉันตอน 9.00 น.	alarm	87
3231363336343534	IN:CREATE_ALARM	ช่วยปลุกฉันเวลา 7.00 น.	alarm	87
3231363336343533	IN:CREATE_ALARM	แจ้งเตือน 2.00 น.	alarm	87
3231363336333534	IN:CREATE_ALARM	สร้างการแจ้งเตือนสำหรับ 5.00 น.	alarm	87
3231363336323830	IN:CREATE_ALARM	การแจ้งเตือนใหม่เวลา 8.00 น.	alarm	87
3231363336323630	IN:CREATE_ALARM	ตั้งเตือนความจำสำหรับ 12.00 น.	alarm	87
3231363335393633	IN:CREATE_ALARM	ช่วยปลุกฉันตอน 17.00 น. หน่อยนะ	alarm	87
3231363335383834	IN:CREATE_ALARM	ตั้งการแจ้งเตือนสำหรับวันพุธเวลา 16.20 น.	alarm	87
3231363335363331	IN:CREATE_ALARM	ตั้งการแจ้งเตือนวันนี้ให้ฉันหน่อย	alarm	87
3231363335353535	IN:CREATE_ALARM	สร้างการแจ้งเตือนสำหรับวันพฤหัสบดีหน้า เวลา 14.00 น.	alarm	87
3231363335343231	IN:CREATE_ALARM	ช่วยสร้างการแจ้งเตือนวันที่ 18 เวลา 7.00 น. ได้ไหม	alarm	87
3231363335333139	IN:CREATE_ALARM	ช่วยแจ้งเตือนฉันเวลา 01.00 น. ของวันศุกร์ 13 หน่อย	alarm	87
3231363335323139	IN:CREATE_ALARM	แทรกการแจ้งเตือนวันพรุ่งนี้เวลาตี 1 สำหรับรายการที่ 20	alarm	87
3231363335303930	IN:CREATE_ALARM	ตั้งการแจ้งเตือนสำหรับวันที่ 6 กรกฎาคม	alarm	87
3231363335303132	IN:CREATE_ALARM	สร้างการแจ้งเตือนเวลา 15.00 น. สำหรับ 4 สุดสัปดาห์ต่อจากนี้	alarm	87
3231363334393835	IN:CREATE_ALARM	การแจ้งเตือนใหม่ทุกวันศุกร์ 5 โมงเย็น	alarm	87
3231363334383839	IN:CREATE_ALARM	ตั้งการแจ้งเตือนซ้ำสำหรับตอนเที่ยงวันธรรมดา	alarm	87
3231363334383238	IN:CREATE_ALARM	ช่วยตั้งการแจ้งเตือนเวลา 4.30 น. ในวันจันทร์ติดกัน 10 สัปดาห์ให้หน่อย	alarm	87
3231363334373833	IN:CREATE_ALARM	เพิ่มนาฬิกาปลุกทุกคืนตอน 1 ทุ่ม	alarm	87
3231363334353531	IN:CREATE_ALARM	ตั้งการแจ้งเตือนทุกสองสัปดาห์สำหรับวันศุกร์เวลา 10.00 น.	alarm	87
3231363334343834	IN:CREATE_ALARM	ตั้งนาฬิกาปลุกสำหรับทุกวันพุธเวลา 5 โมงเย็น ตั้งชื่อว่า 'สควอช'	alarm	87
3231363334313730	IN:CREATE_ALARM	ตั้งการแจ้งเตือนเพื่อปลุกฉันเวลา 18.00 น. วันพรุ่งนี้	alarm	87
3231363333393739	IN:CREATE_ALARM	ตั้้งการแจ้งเตือน 'ดูผ้าที่ซักไว้' ให้ฉันหน่อย	alarm	87
3231363333393538	IN:CREATE_ALARM	สร้างการแจ้งเตือนเกี่ยวกับการไปทำงาน	alarm	87
3231363333393031	IN:CREATE_ALARM	ตั้งการแจ้งเตือนชื่อ 'ยิม' เวลา 6.00 น.	alarm	87
3231363333383332	IN:CREATE_ALARM	ช่วยทำการแจ้งเตือนเวลาทานข้าวกลางวันเป็น 12.00 น. พรุ่งนี้หน่อย	alarm	87
3231363333373330	IN:CREATE_ALARM	ช่วยสร้างการแจ้งเตือนสำหรับเวลาเข้านอนคืนนี้ได้ไหม	alarm	87
3231363333333136	IN:CREATE_ALARM	ตั้งการแจ้งเตือนให้ฉันสองครั้งสำหรับวันพุธ 9.00 น. และ 10.30 น.	alarm	87
3231363332393736	IN:CREATE_ALARM	สร้างการแจ้งเตือนสำหรับพรุ่งนี้เช้าเวลา 7.00 น. และ 9.00 น.	alarm	87
3231363332383332	IN:CREATE_ALARM	สร้างนาฬิกาปลุกทุกเช้าตอน 8 โมงและ 9 โมง	alarm	87
3231363332353738	IN:CREATE_ALARM	ตื่นตอน 11 โมง และทานยา	alarm	87
3231363038363938	IN:CREATE_ALARM	สร้างการแจ้งเตือนสำหรับ 6 ชั่วโมง 55 นาที	alarm	87
3231363038353033	IN:CREATE_ALARM	ตั้งการแจ้งเตือนสำหรับ 9.50 น.	alarm	87
3231363038333134	IN:CREATE_ALARM	สร้างการแจ้งเตือนสำหรับ 3.10 น.	alarm	87
3231363038333033	IN:CREATE_ALARM	ส่งเสียงการแจ้งเตือนเวลา 850	alarm	87
3231363032303039	IN:CREATE_ALARM	สร้างการแจ้งเตือนสำหรับ 11.00 น.	alarm	87
3231363031393136	IN:CREATE_ALARM	เตือนฉันในวันศุกร์เวลา 13.30 น. ให้จัดการเรื่องภาษีหน่อย	alarm	87
3231363031383937	IN:CREATE_ALARM	คุณช่วยปลุกฉันตอน 7 โมงเช้าได้ไหม	alarm	87
3231363031383532	IN:CREATE_ALARM	สร้างการแจ้งเตือนสำหรับ 15.00 น.	alarm	87
3231363031373636	IN:CREATE_ALARM	กรุณาตั้งนาฬิกาปลุกตอน 7 โมงเช้า	alarm	87
3231363031353536	IN:CREATE_ALARM	ตั้งการแจ้งเตือนสำหรับ 12.00 น. วันอังคารหน้า	alarm	87
3231363030393735	IN:CREATE_ALARM	ทำให้การแจ้งเตือนส่งเสียงทุกวันอังคารเวลา 2.00 น.	alarm	87
3231363030383737	IN:CREATE_ALARM	ช่วยปลุกฉันตอน 7 โมงในอีก 3 วันถัดไปได้ไหม	alarm	87
3231363030333838	IN:CREATE_ALARM	ตั้งนาฬิกาปลุกในเช้าวันศุกร์เพื่อเริ่มทำงานวิจัยของฉัน	alarm	87
3231363030323733	IN:CREATE_ALARM	ตั้งการแจ้งเตือนเวลามื้อเย็นเป็น 19.00 น. ของวันพรุ่งนี้	alarm	87
3231363030323632	IN:CREATE_ALARM	ตั้งการแจ้งเตือนเกี่ยวกับการไปทำงาน	alarm	87
3231363030323332	IN:CREATE_ALARM	ตั้งนาฬิกาปลุกการคุมกำเนิดตอน 3 ทุ่มครึ่ง	alarm	87
3231363030313938	IN:CREATE_ALARM	สร้างนาฬิกาปลุกสำหรับตื่นนอน	alarm	87
3231353939373833	IN:CREATE_ALARM	เปิดการแจ้งเตือนของฉันซ้ำตอน 7.00 น. และ 7.15 น.	alarm	87
3231353939373433	IN:CREATE_ALARM	ตั้งการแจ้งเตือนสำหรับการนัดหมอในวันจันทร์เวลา 8.00 น. และ 8.30 น.	alarm	87
3231353535333732	IN:CREATE_ALARM	ฉันต้องการนาฬิกาปลุกสำหรับวันพรุ่งนี้ตอนเที่ยง	alarm	87
3231353535323130	IN:CREATE_ALARM	กรุณาสร้างนาฬิกาปลุกตอน 3 ทุ่ม	alarm	87
3231353534393835	IN:CREATE_ALARM	ตั้งการแจ้งเตือนเวลา 7.00 น. ตั้งแต่วันจันทร์ถึงวันศุกร์	alarm	87
3231353534393534	IN:CREATE_ALARM	ช่วยตั้งการแจ้งเตือนสำหรับพรุ่งนี้ เวลา 7 โมงให้หน่อย	alarm	87
3231353534373032	IN:CREATE_ALARM	สร้างการแจ้งเตือนใหม่เวลา 21.00 น. วันศุกร์	alarm	87
3231353534363530	IN:CREATE_ALARM	ตั้งการแจ้งเตือนสำหรับวันศุกร์เวลา 5.00 น.	alarm	87
3231353534363030	IN:CREATE_ALARM	ตั้งการแจ้งเตือนใหม่สำหรับวันที่ 15 กรกฎาคม เวลา 6.00 น.	alarm	87
3231353534353838	IN:CREATE_ALARM	ตั้งการแจ้งเตือนสำหรับวันที่ 4 กรกฎาคม	alarm	87
3231353534323736	IN:CREATE_ALARM	สร้างการแจ้งเตือนสำหรับวันที่ 25 พฤษภาคม ตอนเที่ยงวัน	alarm	87
3231353533343937	IN:CREATE_ALARM	เริ่มการแจ้งเตือนรายเดือนสำหรับวันอังคาร เวลา 6.00 น. และ 18.00 น.	alarm	87
3231353533343733	IN:CREATE_ALARM	ตั้งค่าการแจ้งเตือนเป็น 12.00 น. และ 6.00 น.	alarm	87
3231353532333933	IN:CREATE_ALARM	สร้างการแจ้งเตือนสำหรับวันพุธเวลา 6.00 น.	alarm	87
3231353532303636	IN:CREATE_ALARM	เริ่มต้นการแจ้งเตือนสำหรับทุกวันจันทร์เวลา 19.00 น.	alarm	87
3231353531393635	IN:CREATE_ALARM	สร้างนาฬิกาปลุกสำหรับอีก 7 สัปดาห์ข้างหน้าในวันพฤหัสบดี ตอน 6 โมงเย็น	alarm	87
3231353531363537	IN:CREATE_ALARM	ตั้งค่าการแจ้งเตือนทุกวันจันทร์เวลา 10.00 น.	alarm	87
3231353531353732	IN:CREATE_ALARM	ตั้งการแจ้งเตือนเพื่อปลุกฉันเวลา 7.00 น. ตั้งชื่อว่า ทำงาน	alarm	87
3231353531343933	IN:CREATE_ALARM	ตรวจสอบให้แน่ใจว่ามีการแจ้งเตือนสำหรับวันพฤหัสบดีนี้เวลา 6.00 น. แล้ว	alarm	87
3231353438393139	IN:CREATE_ALARM	ตั้งการแจ้งเตือนให้ฉันสำหรับเช้าวันศุกร์	alarm	87
3231353438383835	IN:CREATE_ALARM	ตั้งการแจ้งเตือนสำหรับเย็นนี้	alarm	87
3231353438383831	IN:CREATE_ALARM	ช่วยตั้งการแจ้งเตือนให้ฉันหน่อย	alarm	87
3231353438383138	IN:CREATE_ALARM	สร้างการแจ้งเตือนในตอนเช้า	alarm	87
3231353438363233	IN:CREATE_ALARM	สร้างการแจ้งเตือนให้ฉันสำหรับบ่ายวันนี้	alarm	87
3230303431393037	IN:CREATE_ALARM	ตั้งการแจ้งเตือนเดือนกรกฎาคม	alarm	87
3230303431383730	IN:CREATE_ALARM	ตั้งนาฬิกาปลุกสำหรับ 4 ปี	alarm	87
3136363730333836	IN:CREATE_ALARM	ตั้งการแจ้งเตือนสำหรับ 8.00 น. ในวันอาทิตย์	alarm	87
3136353036333836	IN:CREATE_ALARM	ปลุกเราในอีก 7 ชั่วโมง ไม่เกินนี้	alarm	87
3135333031313132	IN:CREATE_ALARM	ตั้งการแจ้งเตือนสำหรับตอนเช้าวันธรรมดาทุกวันเวลา 6.30 น.	alarm	87
3135323939343330	IN:CREATE_ALARM	ฉันต้องการตั้งการแจ้งเตือนสำหรับ 5 ชั่วโมงต่อจากนี้	alarm	87
3135323938333631	IN:CREATE_ALARM	เปิดเสียงนาฬิกาปลุกในอีก 2 ชั่วโมง	alarm	87
3135323931303031	IN:CREATE_ALARM	ตั้งการแจ้งเตือนเป็น 15 นาที	alarm	87
3135323839343439	IN:CREATE_ALARM	ตั้งนาฬิกาปลุกสำหรับ 9 โมงเช้าวันพรุ่งนี้	alarm	87
39353830353536	IN:CREATE_ALARM	รีเซ็ตนาฬฺาปลุกพรุ่งนี้	alarm	87
39353738393337	IN:CREATE_ALARM	ตั้งการแจ้งเตือนทุก 5 ชั่วโมง	alarm	87
39353738353232	IN:CREATE_ALARM	ตั้งการแจ้งเตือนเวลา 4.30 ของเช้าวันพรุ่งนี้	alarm	87
39353735343030	IN:CREATE_ALARM	ตั้งการแจ้งเตือนสำหรับ 14.30 น. วันพรุ่งนี้	alarm	87
39353735313638	IN:CREATE_ALARM	แจ้งเตือนต่อ	alarm	87
39353730393232	IN:CREATE_ALARM	ตั้งการแจ้งเตือนของฉันเป็นเวลา 30 นาที	alarm	87
39353730323534	IN:CREATE_ALARM	ตั้งนาฬิกาปลุกของฉันตอน 1	alarm	87
39353635313938	IN:CREATE_ALARM	กรุณาตั้งนาฬิกาปลุกตอน 10 โมงเช้า	alarm	87
39353632323039	IN:CREATE_ALARM	แจ้งเตือนฉันที่ 25 วินาที	alarm	87
39353539343433	IN:CREATE_ALARM	ตั้งการแจ้งเตือนสำหรับ 4.00 น.	alarm	87
39353534343832	IN:CREATE_ALARM	ตั้งการแจ้งเตือนให้ปลุกตอน 6 โมง	alarm	87
39353433383238	IN:CREATE_ALARM	ตั้งการแจ้งเตือนเพื่อปลุกฉันในอีกหนึ่งชั่วโมง	alarm	87
39353339353536	IN:CREATE_ALARM	ตั้งการแจ้งเตือนเป็นเวลา 3 นาที	alarm	87
39353331393231	IN:CREATE_ALARM	ตั้งการแจ้งเตือนเวลา 7.00 น. ตอนเช้าวันอังคาร	alarm	87
39353331353439	IN:CREATE_ALARM	คุณช่วยตั้งการแจ้งเตือนสำหรับวันที่ 2 ธันวาคม เวลาตี 4 ได้ไหม	alarm	87
39353238303435	IN:CREATE_ALARM	ตั้งการแจ้งเตือนสำหรับเวลา 7.00 น. ทุกวัน	alarm	87
39353235313639	IN:CREATE_ALARM	ตั้งนาฬิกาปลุกตอน 2 ทุ่มพรุ่งนี้	alarm	87
39353233383234	IN:CREATE_ALARM	ตั้งนาฬิกาปลุกทุก 5 นาทีเป็นระยะเวลา 1 ชั่วโมง	alarm	87
39353233373133	IN:CREATE_ALARM	ตั้งการแจ้งเตือนสำหรับเวลา 8.00 น. ในวันเสาร์	alarm	87
39353233333032	IN:CREATE_ALARM	ตั้งการแจ้งเตือนสำหรับเวลา 16.45 น.	alarm	87
39353233303733	IN:CREATE_ALARM	ตั้งการแจ้งเตือนสำหรับวันจันทร์เป็นเวลา 5.30	alarm	87
39353231343439	IN:CREATE_ALARM	กรุณาตั้งนาฬิกาปลุกสำหรับวันอังคาร 15 สิงหาคนตอน 7 โมงครึ่ง	alarm	87
39353136353133	IN:CREATE_ALARM	กรุณาตั้งนาฬิกาปลุกอีกอัน	alarm	87
39353038323330	IN:CREATE_ALARM	ตั้งการแจ้งเตือนสำหรับวันพุธที่ 15 เวลา 12.00 น.	alarm	87
39353036353335	IN:CREATE_ALARM	นาฬิกาปลุ่มใหม่สำหรับพรุ่งนี้ตอน 10 โมงครึ่งด้วย	alarm	87
39353033353831	IN:CREATE_ALARM	ตั้งนาฬิกาปลุกสำหรับตอน 4 โมงเย็นวันพรุ่งนี้	alarm	87
39353030393436	IN:CREATE_ALARM	ตั้งการออกกำลังกายเป็นเวลา 1 ชั่วโมง พร้อมนาฬิกาปลุกทุกๆ 10 นาที	alarm	87
39343938393731	IN:CREATE_ALARM	ตั้งการแจ้งเตือนสำหรับพรุ่งนี้เช้า 5.00 น.	alarm	87
39343938333939	IN:CREATE_ALARM	ช่วยตั้งการแจ้งเตือนเวลา 6.30 น. ให้ฉันหน่อย	alarm	87
39343935363638	IN:CREATE_ALARM	ตั้งการแจ้งเตือนสำหรับช่วงเที่ยงให้กับฉัน	alarm	87
39343930363838	IN:CREATE_ALARM	แจ้งเตือนเป็นเวลา 5 นาที	alarm	87
39343839303338	IN:CREATE_ALARM	ตั้งนาฬิกาปลุกทุกๆ 5 นาที ในช่วงเวลา 30 นาที	alarm	87
39343836363534	IN:CREATE_ALARM	ตั้งการแจ้งเตือนสำหรับวันพรุ่งนี้เวลา 22.00 น.	alarm	87
39343832363735	IN:CREATE_ALARM	ตั้งการแจ้งเตือนสำหรับทุกๆ วันเสาร์ เวลา 19.00 น.	alarm	87
39343830383635	IN:CREATE_ALARM	ตั้งการแจ้งเตือนหนึ่งชั่วโมงนับจากตอนนี้	alarm	87
39343730333938	IN:CREATE_ALARM	ตั้งการแจ้งเตือนสำหรับ 7.30 น. วันพรุ่งนี้	alarm	87
39343637363934	IN:CREATE_ALARM	ตั้งการแจ้งเตือนทุกวันจันทร์เวลา 7.00 น.	alarm	87
3231363337333339	IN:CREATE_ALARM	ตั้งนาฬิกาปลุกตอนนี้	alarm	87
3231363337303735	IN:CREATE_ALARM	ตั้งการเตือนสำหรับพรุ่งนี้เช้า	alarm	87
3231363335363632	IN:CREATE_ALARM	ตั้งนาฬิกาปลุกใหม่ในวันอังคาร	alarm	87
3231363335353532	IN:CREATE_ALARM	ปิดการปลุกของฉันในวันจันทร์ถึงศุกร์ ตอน 7 โมงเช้า	alarm	87
