ID	intent	text	domain	label
3231343937343834	IN:GET_EVENT	มีการแข่งขันวอลเลย์บอลอะไรบ้างในเดือนกันยายน	event	35
3231343937343034	IN:GET_EVENT	มีแมตช์ซอฟต์บอลสัปดาห์หน้าไหม	event	35
3231343937323737	IN:GET_EVENT	ฮอกกี้น้ำแข็งรายการไหนที่จะแข่งในวันอาทิตย์ที่โอ๊คแลนด์	event	35
3139393930313038	IN:GET_EVENT	เกิดอะไรขึ้นที่เพนซาโคลาในคืนวันเสาร์	event	35
3139393839383937	IN:GET_EVENT	มีอะไรน่าทำในไมอามีบ้าง	event	35
3139393839383639	IN:GET_EVENT	กิจกรรมให้ทำในมอนต์โมเมอรี่ อัลบาม่า	event	35
3139393839353335	IN:GET_EVENT	สิ่งที่ต้องทำในอีทากาสุดสัปดาห์นี้	event	35
3139393839343139	IN:GET_EVENT	กิจกรรมนี้อยู่ในเพนซิลเวเนียใช่ไหม	event	35
3139393839313436	IN:GET_EVENT	มีอะไรใหม่ในซานตาแคลริตา	event	35
3139393839313434	IN:GET_EVENT	คอนเสิร์ตในสัปดาห์วันคริสต์มาสที่บอยซี	event	35
3139393838393934	IN:GET_EVENT	คืนนี้ที่ซานฟรานซิสโกมีอะไรให้ทำบ้าง	event	35
3139393838393739	IN:GET_EVENT	คอนเสิร์ตในบอสตันเดือนนี้	event	35
3139393838393139	IN:GET_EVENT	พรุ่งนี้เราจะทำอะไรที่แอตแลนตาได้บ้าง	event	35
3139393838393138	IN:GET_EVENT	มีงานกิจกรรมอะไรพิเศษในริเวอร์ไซด์ในสุดสัปดาห์นี้ไหม	event	35
3139393838383638	IN:GET_EVENT	เกิดอะไรขึ้นที่เพนซาโคลา	event	35
3139393838353639	IN:GET_EVENT	มีการแสดงดนตรีสดในวิลมิงตันคืนนี้บ้างมั้ย	event	35
3139393838333434	IN:GET_EVENT	เกิดอะไรขึ้นที่ลาสเวกัสเมื่อคืนนี้	event	35
3139393838313638	IN:GET_EVENT	สิ่งที่ต้องทำในเกรแชม	event	35
3139393838303337	IN:GET_EVENT	มีกิจกรรมอะไรบ้างในเพนซาโคลาวันนี้	event	35
3139393838303031	IN:GET_EVENT	คอนเสิร์ตในเซนต์ ออกัสติน สุดสัปดาห์นี้	event	35
3139393837363137	IN:GET_EVENT	รายชื่อกิจกรรมในชิคาโกสัปดาห์หน้า	event	35
3139393837343438	IN:GET_EVENT	มีอะไรเกิดขึ้นในฟิลาเดเฟียช่วงสุดสัปดาห์นี้บ้าง	event	35
3139393837303730	IN:GET_EVENT	มีเทศกาลรื่นเริงที่กำลังจะจัดหรือไม่	event	35
3139393837303136	IN:GET_EVENT	วันนี้มีงานกิจกรรมไหนจัดในลอสแองเจลิสบ้าง	event	35
3139393836383139	IN:GET_EVENT	มีรายการเพลงอะไรบ้างในวันนี้	event	35
3139393836383137	IN:GET_EVENT	เทศกาลอาหารใน DC เดือนมีนาคม	event	35
3139393836343838	IN:GET_EVENT	ขบวนพาเหรดในเดือนนี้	event	35
3139393836323835	IN:GET_EVENT	ฉันเบื่อ คืนนี้มีอะไรทำบ้าง	event	35
3139393835393438	IN:GET_EVENT	งานกิจกรรมของวันพรุ่งนี้	event	35
3139393835393337	IN:GET_EVENT	คืนนี้มีกิจกรรมดนตรีในเมืองแอครอนไหม	event	35
3139393835393034	IN:GET_EVENT	สิ่งที่ควรทำในบิล็อกซีสัปดาห์หน้า	event	35
3139393835383636	IN:GET_EVENT	เทศกาลในราลีสุดสัปดาห์นี้	event	35
3139393835383439	IN:GET_EVENT	ฉันจะทำอะไรได้บ้างในคืนวันศุกร์	event	35
3139393835343634	IN:GET_EVENT	งานกิจกรรมดนตรีใดๆ สำหรับวันพรุ่งนี้	event	35
3139393835333733	IN:GET_EVENT	คอนเสิร์ตสุดสัปดาห์นี้	event	35
3139393835333338	IN:GET_EVENT	สุดสัปดาห์นี้ที่นิวเจอร์ซีย์มีคอนเสิร์ตอะไรบ้าง	event	35
3139393835333031	IN:GET_EVENT	สิ่งที่ควรทำในนิวยอร์กในวันอังคาร	event	35
3139393835323730	IN:GET_EVENT	จะมีอะไรสนุกๆ เกิดขึ้นที่แกรนด์แรพิดส์คืนนี้ไหม	event	35
3139393835313135	IN:GET_EVENT	สิ่งที่ต้องทำในอิลลินอยส์	event	35
3139393834383431	IN:GET_EVENT	คอนเสิร์ตดนตรีในดัลลาส	event	35
3139393834383430	IN:GET_EVENT	มีกิจกรรมดีๆ ที่จัดในเท็กซัสไหม	event	35
3139393834373037	IN:GET_EVENT	ปาร์ตี้ในนิวยอร์ก	event	35
3139393834353136	IN:GET_EVENT	งานกิจกรรมหลักในซอลต์เลกซิตี	event	35
3139393834343738	IN:GET_EVENT	เทศกาลอาหารในเท็กซัสในสุดสัปดาห์นี้	event	35
3139393834343030	IN:GET_EVENT	งานกิจกรรมที่จะเกิดในโคนาคืนนี้	event	35
3139393833383332	IN:GET_EVENT	ฉันจะทำอะไรได้บ้างในคืนวันพฤหัสบดี	event	35
3139393833373735	IN:GET_EVENT	งานกิจกรรมในกรุงนิวยอร์ก	event	35
3139393833323133	IN:GET_EVENT	เกิดอะไรขึ้นที่เวสต์ปาล์ม	event	35
3139393833313232	IN:GET_EVENT	ฉันเบื่อ ช่วยฉันหาอะไรทำวันนี้หน่อย	event	35
3139393832383836	IN:GET_EVENT	พรุ่งนี้ฉันทำอะไรได้บ้าง	event	35
3139393832353839	IN:GET_EVENT	ซีแอตเทิลจะเป็นเจ้าภาพการแสดงดนตรีระดับท็อปปี 2018	event	35
3139393832353335	IN:GET_EVENT	มีงานอะไรที่จะจัดขึ้นในสัปดาห์หน้ามั้ย	event	35
3139393832343238	IN:GET_EVENT	สิ่งที่ต้องทำด้วยตัวเอง	event	35
3139393832323231	IN:GET_EVENT	มีอะไรต้องทำในวันอาทิตย์นี้ไหม	event	35
3139393831333934	IN:GET_EVENT	สิ่งที่ต้องทำในวันศุกร์หน้า	event	35
3139393831333237	IN:GET_EVENT	มีงานกิจกรรมดีๆ ที่จัดคืนนี้บ้างไหม	event	35
3139393831323632	IN:GET_EVENT	คุณแนะนำงานอะไร	event	35
3139393830363831	IN:GET_EVENT	มีอะไรใหม่ๆ ให้ทำพรุ่งนี้ไหม	event	35
3139393830353233	IN:GET_EVENT	เกิดอะไรขึ้นในเกรเชมตอนกลางคืนสุดสัปดาห์นี้	event	35
3139393739393835	IN:GET_EVENT	บอกฉันเกี่ยวกับหนังที่เปิดตัวในสุดสัปดาห์นี้หน่อย	event	35
3139393739383138	IN:GET_EVENT	มีอะไรเกิดขึ้นในเวกัสคืนนี้บ้าง	event	35
3139393739383137	IN:GET_EVENT	คอนเสิร์ตในซีแอทเทิลในเดือนมิถุนายน	event	35
3139393739363934	IN:GET_EVENT	กิจกรรมในเวกัสสุดสัปดาห์นี้	event	35
3139393739363738	IN:GET_EVENT	มีอะไรเกิดขึ้นบ้างคืนนี้	event	35
3139393739363631	IN:GET_EVENT	งานเลี้ยงที่ลอสแองเจลีสในคืนก่อนวันปีใหม่	event	35
3139393739353533	IN:GET_EVENT	มีคอนเสิร์ตอะไรที่กำลังจะมาจัดที่ซาคราเมนโตบ้าง	event	35
3139393738373734	IN:GET_EVENT	มีการแสดงของนักร้องประสานเสียงในเที่ยงคืนวันที่ 24 ที่เซาธ์ไมอามีไหม	event	35
3139393738343232	IN:GET_EVENT	วันศุกร์หน้าจะเกิดอะไรขึ้น	event	35
3139393738313933	IN:GET_EVENT	งานกิจกรรมในนิวยอร์กสุดสัปดาห์นี้	event	35
3139393738303332	IN:GET_EVENT	คืนนี้มีอะไรบ้าง	event	35
3139393737383331	IN:GET_EVENT	มีงานอีเว้นท์อะไรสนุกๆ คืนนี้ไหม	event	35
3139393737343634	IN:GET_EVENT	งานกิจกรรมที่เกิดขึ้นพรุ่งนี้	event	35
3139393737313436	IN:GET_EVENT	เสาร์นี้จะมีอะไรบ้าง	event	35
3139393736393432	IN:GET_EVENT	คืนนี้มีอะไรให้ทำบ้าง	event	35
3139393736393234	IN:GET_EVENT	มีอะไรเกิดขึ้นบ้างในคืนนี้	event	35
3139393736363539	IN:GET_EVENT	งานกิจกรรมดนตรีก่อน 20.00 น. สุดสัปดาห์นี้	event	35
3139393736353730	IN:GET_EVENT	พาเหรดที่กำลังจะเกิดขึ้น	event	35
3139393736333139	IN:GET_EVENT	สิ่งที่น่าทำสุดสัปดาห์นี้	event	35
3139393736313639	IN:GET_EVENT	มีสิ่งที่ต้องทำในวันศุกร์ไหม	event	35
3139393736313138	IN:GET_EVENT	เรื่องสนุกที่น่าทำในสุดสัปดาห์นี้	event	35
3232323232303935	IN:GET_EVENT	คุณสามารถเอางานอีเว้นท์ที่ฉันได้รับเชิญขึ้นมาได้มั้ย	event	35
3231373530333536	IN:GET_EVENT	ช่วยแสดงงานอีเว้นท์อื่นๆ ให้ฉันดูอีกได้มั้ย	event	35
3231373530303331	IN:GET_EVENT	ช่วยแนะนำงานอีเว้นท์สำหรับเดือนนี้	event	35
3139393930303033	IN:GET_EVENT	การแสดงบรอดเวย์ที่นครนิวยอร์กในเดือนมีนาคม	event	35
3139393839363234	IN:GET_EVENT	สิ่งที่ต้องทำที่ซินซินนาติสุดสัปดาห์หน้า	event	35
3139393839343632	IN:GET_EVENT	มีอะไรสนุกๆให้ทำที่ซีราคิวส์บ้าง	event	35
3139393838393930	IN:GET_EVENT	พรุ่งนี้มีงานอีเว้นท์อะไรบ้างในฮอลลีวูด	event	35
3139393838323632	IN:GET_EVENT	เกิดอะไรขึ้นที่ NYC คืนวันเสาร์	event	35
3139393837373737	IN:GET_EVENT	มีงานอีเว้นท์อะไรบ้างที่นิวยอร์กสัปดาห์นี้	event	35
3139393837373233	IN:GET_EVENT	ฉันจะทำอะไรได้บ้างที่แฟร์แฟกซ์วันพรุ่งนี้	event	35
3139393837313032	IN:GET_EVENT	เกิดอะไรขึ้นบ้างในสัปดาห์นี้	event	35
3139393836363637	IN:GET_EVENT	เกิดอะไรขึ้นในวันส่งท้ายปีเก่าที่ลาสเวกัส ตอน 5 ทุ่ม	event	35
3139393835373537	IN:GET_EVENT	รายการงานแสดงรถยนต์ที่จะจัดขึ้นที่แอตแลนตาในสุดสัปดาห์หน้า	event	35
3139393835353134	IN:GET_EVENT	ดูหนังตอน 3 ทุ่มคืนนี้ ที่พิตส์เบิร์ก	event	35
3139393835343338	IN:GET_EVENT	งานอีเว้นท์ที่ในโฮโนลูลู	event	35
3139393834383534	IN:GET_EVENT	เหตุการณ์ปัจจุบันในนิวยอร์ก	event	35
3139393832363237	IN:GET_EVENT	เกิดอะไรขึ้นในวันพฤหัสบดี	event	35
3139393832323831	IN:GET_EVENT	มีเหตุการณ์อะไรเกิดขึ้นในเมืองฮาร์ดี้บ้างมั้ย	event	35
3139393830343632	IN:GET_EVENT	ภาพยนตร์ใหม่ที่กำลังจะฉายนั้นมาเมื่อไหร่	event	35
3139393830313634	IN:GET_EVENT	งานอีเว้นท์ที่ซีแอตเทิลสำหรับวันศุกร์นี้	event	35
3139393737393739	IN:GET_EVENT	เกิดอะไรขึ้นบ้างในสัปดาห์นี้	event	35
3139393736383030	IN:GET_EVENT	กิจกรรมสนุกๆ ที่จะทำสุดสัปดาห์นี้	event	35
3232323232353133	IN:GET_EVENT	ฉันอยากเห็นอีเว้นท์ที่เหมาะกับครอบครัว	event	35
3232323232303933	IN:GET_EVENT	คุณช่วยแสดงรายการงานที่ผ่านมาของฉันด้วย	event	35
3231373530333432	IN:GET_EVENT	แสดงงานแสดงดนตรีสดต่าง ๆ ให้ฉันดู	event	35
3231343937363333	IN:GET_EVENT	หาการแข่งขันฟุตบอลในมิลวอกี้สำหรับวันอังคารให้ฉัน	event	35
3231363735393631	IN:HOLD_CALL	ถือสายนี้	calling	36
3231353438343436	IN:HOLD_CALL	พักสายของฉันกับ Jennifer	calling	36
3231303232343138	IN:HOLD_CALL	พักสายของทอมไว้ก่อน	calling	36
3138393930383739	IN:GET_EDUCATION_TIME	Lena เริ่มเข้าเรียนที่ Miami Dade College เมื่อไร	people	37
3138393930333934	IN:GET_EDUCATION_TIME	Abby เริ่มเรียนคณะแพทย์ตั้งแต่ปีไหน	people	37
3138393930323834	IN:GET_EDUCATION_TIME	Theresa จบมัธยมเมื่อปีไหน	people	37
3138393839323538	IN:GET_EDUCATION_TIME	Anna เรียนจบจากที่ไหน	people	37
3138393930343936	IN:GET_EDUCATION_TIME	David เริ่มเข้าเรียนที่มหาวิทยาลัยบอสตันเมื่อไหร่	people	37
3138393931303530	IN:GET_EDUCATION_TIME	เจสสิกาเคยเข้าเรียนที่วิทยาลัยฟอร์เรกต์มาก่อนหรือเปล่า	people	37
3138393930303438	IN:GET_EDUCATION_TIME	บิล เกตส์ อยู่ในวิทยาลัยนานเท่าไหร่	people	37
3232343330373137	IN:GET_WEATHER	แสดงอากาศของทั้งสัปดาห์ให้ฉันดูหน่อย	weather	38
3232313432383933	IN:GET_WEATHER	สภาพอากาศในบาร์ตัน อัพพอน ฮัมเบอร์เป็นยังไง	weather	38
3232313432383836	IN:GET_WEATHER	ฉันอยากรู้สภาพอากาศที่แบรดฟอร์ดออนเอวอน	weather	38
3232313432383731	IN:GET_WEATHER	แสดงสภาพอากาศสำหรับเวลส์ใกล้ทะเล	weather	38
3232313136333536	IN:GET_WEATHER	อุณหภูมิในตอนเย็นวันนี้จะเป็นอย่างไร	weather	38
3231363431333535	IN:GET_WEATHER	เวลา 16.00 น. อากาศจะอุ่นขึ้นไหม	weather	38
3231363431323938	IN:GET_WEATHER	กรุณาบอกสภาพอากาศตอน 9 โมงครึ่งให้กับฉัน	weather	38
3231363431313537	IN:GET_WEATHER	บอกฉันหน่อยว่าสภาพอากาศเวลา 15.00 น. จะเป็นยังไง	weather	38
3231363431303232	IN:GET_WEATHER	บอกฉันว่าอากาศตอน 1 ทุ่มครึ่งจะเป็นอย่างไร	weather	38
3231363430393933	IN:GET_WEATHER	บ่ายนี้สภาพอากาศเป็นยังไงบ้าง	weather	38
3231363430393337	IN:GET_WEATHER	สภาพอากาศตอน 16.00 น. จะเป็นยังไง	weather	38
3231363430363431	IN:GET_WEATHER	สภาพอากาศของวันที่เหลือในสัปดาห์นี้เป็นยังไง	weather	38
3231363430353131	IN:GET_WEATHER	การพยากรณ์	weather	38
3231363430343535	IN:GET_WEATHER	อุณหภูมิจะอยู่ที่เท่าไหร่	weather	38
3231363430343339	IN:GET_WEATHER	บอกฉันได้ไหมว่าข้างนอกตอนนี้เป็นยังไง	weather	38
3231363430303432	IN:GET_WEATHER	วันนี้ฉันจะใส่รองเท้าแตะได้ใช่ไหม	weather	38
3231363430303039	IN:GET_WEATHER	สภาพอากาศในเช้าวันจันทร์จะเป็นยังไง	weather	38
3231363339363630	IN:GET_WEATHER	สภาพอากาศที่คาวส์ช่วงสุดสัปดาห์นี้จะดีมั้ย	weather	38
3231363339363030	IN:GET_WEATHER	แสดงพยากรณ์อากาศสำหรับพรุ่งนี้เช้าให้ฉันรู้หน่อย	weather	38
3231363339343339	IN:GET_WEATHER	กรุณาบอกพยากรณ์อากาศในโกลด์โคสต์	weather	38
3231363339333333	IN:GET_WEATHER	พยากรณ์อากาศสำหรับโตเกียวเป็นยังไงบ้าง	weather	38
3231363339323430	IN:GET_WEATHER	อธิบายสภาพอากาศปัจจุบันในเอสเซกซ์	weather	38
3231363339313836	IN:GET_WEATHER	พยากรณ์อากาศในควีนส์แลนด์เป็นอย่างไร	weather	38
3231363339303332	IN:GET_WEATHER	แสดงพยากรณ์อากาศสำหรับ 5 วัน	weather	38
3231363338383435	IN:GET_WEATHER	บอกฉันเกี่ยวกับสภาพอากาศในวันจันทร์ของสัปดาห์หน้า	weather	38
3231363337393733	IN:GET_WEATHER	วันนี้อีกสักพักอากาศจะอุ่นขึ้นไหม	weather	38
3231353938323130	IN:GET_WEATHER	ต้องการ; พยากรณ์อากาศ 5 วัน	weather	38
3231353938313630	IN:GET_WEATHER	พยากรณ์อากาศสำหรับวันหยุดยาวเดือนกรกฎาคม	weather	38
3231353937383831	IN:GET_WEATHER	วันนี้ฉันควรใส่รองเท้ากันฝนไปโรงเรียนไหม	weather	38
3231353937333536	IN:GET_WEATHER	สภาพอากาศตอน 5 ทุ่มเป็นยังไงบ้าง	weather	38
3231353937323635	IN:GET_WEATHER	สภาพอากาศสุดสัปดาห์นี้เป็นยังไง	weather	38
3231353937313637	IN:GET_WEATHER	ข้างนอกหนาวไหม	weather	38
3231353937313037	IN:GET_WEATHER	คืนนี้ฉันจำเป็นต้องใช้ร่มมั้ย	weather	38
3231353936393236	IN:GET_WEATHER	อุณหภูมิในโทรอนโต แคนาดาอยู่ที่เท่าไร	weather	38
3231353936383434	IN:GET_WEATHER	พยากรณ์อากาศสำหรับวันจันทร์หน้าเป็นยังไง	weather	38
3231353936383139	IN:GET_WEATHER	พยากรณ์อากาศในโทรอนโตเป็นยังไงบ้าง	weather	38
3231353539383130	IN:GET_WEATHER	บอกฉันหน่อยว่าสภาพอากาศจะเป็นยังไง	weather	38
3231353539373830	IN:GET_WEATHER	สภาพอากาศข้างนอกตอนนี้เป็นยังไง	weather	38
3231353539373739	IN:GET_WEATHER	สภาพอากาศตอนนี้เป็นยังไง	weather	38
3231353539363239	IN:GET_WEATHER	สภาพอากาศวันนี้เป็นยังไงบ้าง	weather	38
3231353539363135	IN:GET_WEATHER	อากาศข้างนอกเป็นยังไงบ้าง	weather	38
3231353539343536	IN:GET_WEATHER	วันนี้ฉันต้องใส่เสื้อโค้ทไหม	weather	38
3231353539323332	IN:GET_WEATHER	บอกฉันหน่อยว่าสภาพอากาศที่กลาสโกว์วันเสาร์หน้าเป็นยังไง	weather	38
3231353539313134	IN:GET_WEATHER	พรุ่งนี้เช้า 8.00 น. สภาพอากาศที่ลองบีชจะเป็นยังไง	weather	38
3231353539313133	IN:GET_WEATHER	ช่วยบอกสภาพอากาศเวลา 14.00 น. ในโคลอมเบียหน่อยได้ไหม	weather	38
3231353539303331	IN:GET_WEATHER	สภาพอากาศในลอนดอนเวลา 15.00 น. วันพุธหน้า	weather	38
3231353538383431	IN:GET_WEATHER	พยากรณ์อากาศวันจันทร์นี้ในบริสตอลเป็นยังไง	weather	38
3231353538333936	IN:GET_WEATHER	ร้อนขนาดไหนในหน่วยเซลเซียส	weather	38
3231353538323331	IN:GET_WEATHER	ตรวจสอบสภาพอากาศตอน 6 โมงเย็น	weather	38
3231353538323135	IN:GET_WEATHER	ข้างนอกตอนสองโมงจะเป็นยังไง	weather	38
3231353538303933	IN:GET_WEATHER	ใครมีข้อมูลเกี่ยวกับสภาพอากาศในเวลา 19.00 น.	weather	38
3231353537393832	IN:GET_WEATHER	บอกฉันเกี่ยวกับสภาพอากาศในตอนบ่ายนี้	weather	38
3231353537373337	IN:GET_WEATHER	ช่วยอธิบายให้ฉันฟังหน่อยได้ไหมว่าสภาพอากาศในโรดไอแลนด์เป็นยังไง	weather	38
3231353537353737	IN:GET_WEATHER	บอกข้อมูลสภาพอากาศในแคลิฟอร์เนียให้ฉันฟังหน่อย	weather	38
3231353537353330	IN:GET_WEATHER	พยากรณ์อากาศสำหรับเชฟฟิลด์เป็นยังไง	weather	38
3231353537343733	IN:GET_WEATHER	พยากรณ์อากาศสำหรับวันหยุดธนาคารช่วงสุดสัปดาห์เป็นยังไงบ้าง	weather	38
3231353537343436	IN:GET_WEATHER	ฉันอยากรู้ว่าสภาพอากาศช่วงสุดสัปดาห์นี้จะเป็นอย่างไร	weather	38
3231353537333439	IN:GET_WEATHER	สภาพอากาศวันธรรมดาเป็นยังไงบ้าง	weather	38
3231353537323732	IN:GET_WEATHER	แสดงสภาพอากาศสำหรับวันจันทร์และวันอังคารหน้า	weather	38
3231353537323230	IN:GET_WEATHER	อากาศในสุดสัปดาห์นี้เป็นยังไงบ้าง	weather	38
3231353537303437	IN:GET_WEATHER	ฉันขอดูพยากรณ์อากาศสำหรับวันที่ 3 พฤษภาคมหน่อยได้ไหม	weather	38
3231353536383431	IN:GET_WEATHER	สภาพอากาศในช่วงสุดสัปดาห์นี้จะเป็นอย่างไร	weather	38
