ID	intent	text	domain	label
3139393738303133	IN:GET_EVENT	พรุ่งนี้ต้องทำอะไรที่นั่น	event	35
3139393737353333	IN:GET_EVENT	กิจกรรมท้องถิ่นสุดสัปดาห์นี้	event	35
3139393737343131	IN:GET_EVENT	มีอะไรเกิดขึ้นในเดือนนี้	event	35
3139393737313037	IN:GET_EVENT	มีกิจกรรมประเภทใดในสุดสัปดาห์นี้บ้าง	event	35
3139393736393439	IN:GET_EVENT	สิ่งที่ต้องทำในสัปดาห์หน้า	event	35
3139393736363939	IN:GET_EVENT	การแสดงรถยนต์กำลังจะแสดงเร็ว ๆ นี้	event	35
3231373530323135	IN:GET_EVENT	ฉันต้องการให้คุณแนะนำการแข่งขันรักบี้สำหรับเดือนถัดไปในเรดดิงให้ฉัน	event	35
3139393839353338	IN:GET_EVENT	คอนเสิร์ตในกรีนวิลล์ เทนเนสซีเดือนนี้	event	35
3139393839323537	IN:GET_EVENT	มีอะไรเกิดขึ้นในมินนิอาโปลิสสัปดาห์หน้า	event	35
3139393837363034	IN:GET_EVENT	กิจกรรมสำหรับฟิลาเดลเฟีย	event	35
3139393837353935	IN:GET_EVENT	สิ่งที่ต้องทำในเดนเวอร์	event	35
3139393837313036	IN:GET_EVENT	จะเกิดอะไรขึ้นในเมมฟิสพรุ่งนี้	event	35
3139393836353234	IN:GET_EVENT	บรอดเวย์โชว์ที่นิวยอร์กในเดือนหน้า	event	35
3139393834393038	IN:GET_EVENT	อะไรก็ได้ในคืนนี้	event	35
3139393834383539	IN:GET_EVENT	กิจกรรมน่าสนใจในบรันสวิกสุดสัปดาห์ถัดไป	event	35
3139393834333937	IN:GET_EVENT	กิจกรรมเดย์โทนาในเดือนธันวาคม	event	35
3139393834313938	IN:GET_EVENT	จะเกิดอะไรขึ้นในดัลลัสในวันเสาร์หน้า	event	35
3139393833323434	IN:GET_EVENT	มีอะไรให้ทำตอนเย็นนี้	event	35
3139393832383233	IN:GET_EVENT	มีอะไรสนุก ๆ ให้ทำในคืนวันพุธ	event	35
3139393831363435	IN:GET_EVENT	กิจกรรมในมิลวอกีสุดสัปดาห์นี้	event	35
3139393831313130	IN:GET_EVENT	สิ่งที่ต้องทำในสุดสัปดาห์นี้	event	35
3139393830363836	IN:GET_EVENT	ฉันจะไปดูคอนเสิร์ตที่แอลเอในช่วงสุดสัปดาห์ได้ไหม	event	35
3139393739313137	IN:GET_EVENT	สิ่งที่ต้องทำในเซาท์เท็กซัสสัปดาห์หน้า	event	35
3232323232353331	IN:GET_EVENT	แนะนำกิจกรรมที่เป็นมิตรกับสุนัข	event	35
3232323232353231	IN:GET_EVENT	ฉันอยากจะเห็นเหตุการณ์ที่เป็นที่นิยมในหมู่เพื่อนของฉัน	event	35
3232323232343930	IN:GET_EVENT	แนะนำกิจกรรมที่เป็นที่นิยม	event	35
3231373530343431	IN:GET_EVENT	ฉันต้องการให้คุณแสดงกิจกรรมการเล่นเกมเพิ่มอีก	event	35
3231373530343335	IN:GET_EVENT	แสดงคอนเสิร์ตดนตรีให้ฉันดูเพิ่ม	event	35
3231373530343134	IN:GET_EVENT	คุณมีกิจกรรมทางศาสนาอีกหรือไม่	event	35
3231373530313732	IN:GET_EVENT	แสดงกิจกรรมเพิ่มเติมให้ฉันดู	event	35
3231373530303738	IN:GET_EVENT	แนะนำกิจกรรมบางอย่างในบัฟฟาโล	event	35
3231343937353834	IN:GET_EVENT	มีการแข่งฮอกกี้น้ำแข็งในเดือนกุมภาพันธ์บ้างหรือไม่	event	35
3231343937353832	IN:GET_EVENT	มีการแข่งขันเบสบอลอะไรในวันศุกร์	event	35
3231343937353633	IN:GET_EVENT	การแข่งขันซอฟต์บอลนัดใด ๆ	event	35
3231343937343938	IN:GET_EVENT	มีการแข่งขันรักบี้ในช่วงสุดสัปดาห์หรือไม่	event	35
3231343937343436	IN:GET_EVENT	ค้นหาการแข่งขันเทนนิสในซีแอตเทิลในเดือนนี้	event	35
3231343937333938	IN:GET_EVENT	มีการแข่งขันฮ็อกกี้น้ำแข็งในวันอังคารไหม	event	35
3231343937333633	IN:GET_EVENT	การแข่งฟุตบอล	event	35
3231343937323436	IN:GET_EVENT	มีการแข่งขันลาครอสในเดือนนี้ไหม?	event	35
3139393930323030	IN:GET_EVENT	กิจกรรมในชาเลสตัน	event	35
3139393930313933	IN:GET_EVENT	เกิดอะไรขึ้นในเฟรนช์ควอเตอร์ในตอนนี้	event	35
3139393930313639	IN:GET_EVENT	มีกิจกรรมอะไรในวันนี้ในแอลเอ	event	35
3139393839393538	IN:GET_EVENT	คอนเสิร์ตที่จัดขึ้นในออสตินในคืนวันเสาร์	event	35
3139393839393137	IN:GET_EVENT	สิ่งที่ต้องทำในแคสโทร วัลเลย์เดือนนี้	event	35
3139393839383938	IN:GET_EVENT	มีอะไรให้ฉันทำบ้างคืนนี้ที่แซนตา มอนิกา	event	35
3139393839373835	IN:GET_EVENT	คืนนี้มีงานแสดงดนตรีที่ฟิลาเดลเฟียไหม	event	35
3139393839373735	IN:GET_EVENT	กิจกรรมสนุก ๆ ในดัลลัส	event	35
3139393839373638	IN:GET_EVENT	กิจกรรมในโรงภาพยนตร์ในเมืองเจอร์ซีย์ในสัปดาห์นี้	event	35
3139393839363333	IN:GET_EVENT	สิ่งที่ต้องทำในมอนทรีออลในวันศุกร์นี้	event	35
3139393839353933	IN:GET_EVENT	เกิดอะไรขึ้นในชิคาโกในสุดสัปดาห์นี้	event	35
3139393839353839	IN:GET_EVENT	พรุ่งนี้จะเกิดอะไรขึ้นในบรุกลิน	event	35
3139393839353834	IN:GET_EVENT	มีอะไรดี ๆ เกิดขึ้นในแฮตติสเบิรก์ ในสุดสัปดาห์นี้บ้าง	event	35
3139393839353330	IN:GET_EVENT	สิ่งที่ต้องทำในแมนเชสเตอร์คืนนี้	event	35
3139393839343635	IN:GET_EVENT	เกิดอะไรขึ้นในคืนนี้ที่บอสตันเวลา 4 ทุ่ม	event	35
3139393839323538	IN:GET_EVENT	สิ่งที่ต้องทำในนิวอาร์กคืนนี้	event	35
3139393839313737	IN:GET_EVENT	สิ่งน่าสนใจในฟอร์ตเวิร์ทในสุดสัปดาห์ที่จะมาถึงนี้	event	35
3139393839303933	IN:GET_EVENT	มีอะไรดี ๆ เกิดขึ้นในสุดสัปดาห์หน้าในชิคาโกบ้าง	event	35
3139393838393537	IN:GET_EVENT	แสดงคอนเสิร์ตทั้งหมดในแกรนด์แพร์รีสุดสัปดาห์หน้าให้ฉันดู	event	35
3139393838373831	IN:GET_EVENT	กิจกรรมดาวน์ทาวน์ ดีแลนด์เริ่มต้นหลัง 4 ทุ่มสุดสัปดาห์นี้	event	35
3139393838363536	IN:GET_EVENT	เกิดอะไรขึ้นในเดือนหน้าในคลีฟแลนด์	event	35
3139393838363134	IN:GET_EVENT	สิ่งที่ต้องทำในนอร์ธมาก็องสุดสัปดาห์หน้า	event	35
3139393838353434	IN:GET_EVENT	จะเกิดอะไรขึ้นในแมนเชสเตอร์ รัฐนิวแฮมป์เชียร์ คืนนี้	event	35
3139393838353133	IN:GET_EVENT	กำลังมีกิจกรรมอะไรในตัวเมือง	event	35
3139393838343531	IN:GET_EVENT	พรุ่งนี้จะมีอะไรเกิดขึ้นในบัลติมอร์	event	35
3139393838343333	IN:GET_EVENT	สิ่งที่ต้องทำในแซนดีเอโก	event	35
3139393838343031	IN:GET_EVENT	สิ่งที่ต้องทำในจูโนสัปดาห์หน้า	event	35
3139393838323634	IN:GET_EVENT	จะมีกิจกรรมอะไรในเร็ว ๆ นี้ที่ฟลินต์	event	35
3139393838323132	IN:GET_EVENT	คืนนี้มีอะไรสนุก ๆ เกิดขึ้นบ้างในฟอร์ตเวิร์ท	event	35
3139393837383837	IN:GET_EVENT	สิ่งที่ต้องทำในออร์แลนโด	event	35
3139393837373535	IN:GET_EVENT	เหตุการณ์ในซิลเวอร์เลกคืนนี้	event	35
3139393837373532	IN:GET_EVENT	กิจกรรมในเบิร์กลีย์ในสุดสัปดาห์นี้	event	35
3231303135303037	IN:HOLD_CALL	พักสายนี้กับเคทลินเป็นเวลา 10 วินาที	calling	36
3138393930393733	IN:GET_EDUCATION_TIME	แพตตี้จบการศึกษาจากมหาวิทยาลัยอีสเทิร์น มิชิแกนเมื่อไร	people	37
3138393930373036	IN:GET_EDUCATION_TIME	จอห์นเรียนที่โรงเรียนกี่ปี	people	37
3138393930343633	IN:GET_EDUCATION_TIME	เพียร์สเริ่มเรียนที่วิทยาลัยเมาต์ซาซินโตตอนไหน?	people	37
3132353837373238	IN:GET_WEATHER	พรุ่งนี้จะเป็นวันไมเกรนที่เกี่ยวข้องกับสภาพอากาศหรือไม่	weather	38
3132353837313437	IN:GET_WEATHER	พายุเคลื่อนตัวเข้ามาใช่ไหม	weather	38
3132353837303133	IN:GET_WEATHER	ฉันควรจะนำแจ็กเก็ตไปที่ซานฮวน เปอร์โตริโกในวันจันทร์หน้าหรือไม่	weather	38
3132353832383434	IN:GET_WEATHER	เมื่อวานมีพายุในฮิวสตันไหม	weather	38
3132353738333333	IN:GET_WEATHER	ควรจะปกคลุมไปด้วยเมฆในวันนี้ใช่หรือไม่	weather	38
3132353731383238	IN:GET_WEATHER	ฉันต้องใช้ร่มวันนี้ไหม	weather	38
39353831353938	IN:GET_WEATHER	อุณหภูมิของวันนี้คืออะไร?	weather	38
39353831343234	IN:GET_WEATHER	ฉันต้องใช้แจ็กเก็ตไหม?	weather	38
39353831313536	IN:GET_WEATHER	ฉันควรนำเสื้อโค้ทไปทำงานวันนี้หรือไม่?	weather	38
39353830373838	IN:GET_WEATHER	ข้างนอกอากาศหนาวใช่ไหม?	weather	38
39353830363532	IN:GET_WEATHER	มีการเฝ้าระวังพายุทอร์นาโดวันนี้ไหม?	weather	38
39353739303830	IN:GET_WEATHER	มีฝนปริมาณกี่นิ้ว	weather	38
39353737363937	IN:GET_WEATHER	พรุ่งนี้ตอนเที่ยงจะมีอุณหภูมิเท่าไร?	weather	38
39353639383634	IN:GET_WEATHER	มีการพยากรณ์ว่าฝนจะตกในฟิลลี่พรุ่งนี้หรือไม่	weather	38
39353639333539	IN:GET_WEATHER	เราจะมีลมแรงวันนี้หรือไม่?	weather	38
39353639313336	IN:GET_WEATHER	คาดว่าจะมีฝนในปานามาซิตี ฟลอริดาในสัปดาห์หน้าหรือไม่?	weather	38
39353637323139	IN:GET_WEATHER	อากาศที่แอละบามาเป็นอย่างไร?	weather	38
39353636383935	IN:GET_WEATHER	อุณหภูมิสำหรับสัปดาห์นี้	weather	38
39353636363530	IN:GET_WEATHER	อุณหภูมิคืนนี้จะเป็นเท่าไร?	weather	38
39353636313837	IN:GET_WEATHER	สภาพอากาศเป็นอย่างไร?	weather	38
39353635303230	IN:GET_WEATHER	การคาดการณ์ของสัปดาห์ถัดไป	weather	38
39353633363536	IN:GET_WEATHER	ฉันต้องใช้เสื้อโค้ทไหม	weather	38
39353535303533	IN:GET_WEATHER	สภาพอากาศในคลีฟแลนด์ปัจจุบันเป็นอย่างไร?	weather	38
39353534343030	IN:GET_WEATHER	ฉันจำเป็นต้องใช้เสื้อกันฝนไหม?	weather	38
39353532323336	IN:GET_WEATHER	หิมะตกที่โทพีกาตอนนี้หรือไม่?	weather	38
39353531373930	IN:GET_WEATHER	ลมแรงแค่ไหนวันนี้?	weather	38
39353531343633	IN:GET_WEATHER	ฉันควรสวมถุงมือไหม?	weather	38
39353530313730	IN:GET_WEATHER	จะมีอุณหภูมิเท่าไรในบ่ายนี้?	weather	38
39353439353136	IN:GET_WEATHER	หนาวจัง อุณหภูมิเท่าไร?	weather	38
39353434343237	IN:GET_WEATHER	ฉันต้องใช้กางเกงขายาวไหม?	weather	38
39353433373938	IN:GET_WEATHER	อากาศในแชเปิลฮิลล์จะเป็นอย่างไรตอนตี 5?	weather	38
39353433363231	IN:GET_WEATHER	อุณหภูมิปัจจุบันตอนนี้	weather	38
39353430373530	IN:GET_WEATHER	เวลาที่ควรจะเริ่มมีหิมะตกคือเวลาใด	weather	38
39353430313030	IN:GET_WEATHER	พายุจะโจมตีฉันหรือไม่	weather	38
39353338353438	IN:GET_WEATHER	ฉันควรใส่เสื้อกันฝนวันนี้ไหม?	weather	38
39353338323939	IN:GET_WEATHER	ฝนจะตกวันนี้หรือไม่	weather	38
39353338323138	IN:GET_WEATHER	อากาศร้อนแค่ไหนในวันจันทร์?	weather	38
39353337393732	IN:GET_WEATHER	ฉันต้องใช้เสื้อโค้ทวันนี้ไหม	weather	38
39353337353531	IN:GET_WEATHER	ในฮ่องกงร้อนแค่ไหน?	weather	38
39353336353632	IN:GET_WEATHER	การพยากรณ์สำหรับแมนฮัตตันในวันนี้เป็นอย่างไร?	weather	38
39353334333038	IN:GET_WEATHER	พรุ่งนี้ฝนจะตกเมื่อไร	weather	38
39353331343937	IN:GET_WEATHER	วันนี้เย็นกว่าเมื่อวานนี้ใช่ไหม?	weather	38
39353330353532	IN:GET_WEATHER	โอเชียนซิตี้อบอุ่นแค่ไหน	weather	38
39353330303139	IN:GET_WEATHER	ฉันจะต้องการเสื้อกันหนาวคืนนี้หรือไม่?	weather	38
39353239363939	IN:GET_WEATHER	สภาพอากาศ	weather	38
39353239333336	IN:GET_WEATHER	พยากรณ์แบบเจ็ดวันให้ฉันหน่อย	weather	38
39353236363533	IN:GET_WEATHER	ข้างนอกร้อนไหมวันนี้	weather	38
39353233343034	IN:GET_WEATHER	หิมะจะตกในชิคาโกมากแค่ไหนในวันพรุ่งนี้?	weather	38
39353233333039	IN:GET_WEATHER	เรามีฝนมากแค่ไหนวันนี้?	weather	38
39353232393332	IN:GET_WEATHER	อากาศในอียิปต์เป็นอย่างไร?	weather	38
39353232373739	IN:GET_WEATHER	ฉันจะต้องตักหิมะพรุ่งนี้ไหม?	weather	38
39353231353137	IN:GET_WEATHER	จะมีพายุทอร์นาโดในแคริบเบียนไหม	weather	38
39353230373733	IN:GET_WEATHER	จะมีหิมะตกในแคนาดาวันนี้หรือไม่	weather	38
39353139313034	IN:GET_WEATHER	สภาพอากาศในฮิวสตัน เท็กซัสปัจจุบันเป็นอย่างไร	weather	38
39353137383530	IN:GET_WEATHER	บอกอุณหภูมิระดับต่ำสำหรับคืนนี้ให้กับฉัน	weather	38
39353137383335	IN:GET_WEATHER	เมื่อไรจะมีหิมะตกในสัปดาห์หน้า	weather	38
39353136333638	IN:GET_WEATHER	จะมีหยาดน้ำฟ้าในอากาศมากแค่ไหนวันนี้	weather	38
39353133373931	IN:GET_WEATHER	ฉันควรนำแจ็กเก็ตไปทานอาหารเย็นหรือไม่?	weather	38
39353133353135	IN:GET_WEATHER	มีการพยากรณ์ว่าจะมีฝนหรือไม่?	weather	38
39353132373830	IN:GET_WEATHER	ฉันจำเป็นต้องสวมเสื้อผ้าที่ให้ความอบอุ่นวันนี้ไหม?	weather	38
39353130373138	IN:GET_WEATHER	อุณหภูมิในดัลลัสเป็นยังไงในวันนี้?	weather	38
39353038353733	IN:GET_WEATHER	สภาพอากาศในดัลลัสในวันจันทร์หน้าเป็นอย่างไร	weather	38
39353035323832	IN:GET_WEATHER	ลมแรงแค่ไหนบนชายหาด	weather	38
39353035313239	IN:GET_WEATHER	อากาศจะดีไหมที่ชายหาด	weather	38
39353034393731	IN:GET_WEATHER	อุณหภูมิจะเปลี่ยนแปลงอย่างไรในวันพรุ่งนี้	weather	38
39353033383334	IN:GET_WEATHER	ฉันควรเปิดเครื่องปรับอากาศในวันนี้หรือไม่?	weather	38
39353030393939	IN:GET_WEATHER	บ่ายนี้จะร้อนแค่ไหน?	weather	38
39353030333135	IN:GET_WEATHER	สภาพอากาศในวันพรุ่งนี้จะเป็นอย่างไร?	weather	38
39353030303636	IN:GET_WEATHER	ฉันควรใส่รองเท้าบูตหิมะหรือไม่?	weather	38
39343937393834	IN:GET_WEATHER	คาดว่าวันนี้น่าจะมีฝนมากแค่ไหน	weather	38
39343935353035	IN:GET_WEATHER	อุณหภูมิเฉลี่ยในสัปดาห์นี้เป็นเท่าไร	weather	38
39343932353033	IN:GET_WEATHER	อุณหภูมิจะต่ำกว่าจุดเยือกแข็งวันนี้?	weather	38
39343930373433	IN:GET_WEATHER	คาดว่าจะมีหิมะตกมากแค่ไหน?	weather	38
39343838383135	IN:GET_WEATHER	โปรดแสดงอุณหภูมิให้ฉันดู	weather	38
39343838313534	IN:GET_WEATHER	แสดงอากาศแบบรายชั่วโมงให้ฉันดู	weather	38
39343837383734	IN:GET_WEATHER	มีการพยากรณ์สภาพอากาศที่เลวร้ายไหม?	weather	38
39343835383836	IN:GET_WEATHER	ฉันต้องใช้ครีมกันแดดวันนี้ไหม?	weather	38
39343835313636	IN:GET_WEATHER	ข้างนอกหนาวไหม?	weather	38
3231393232393032	IN:GET_WEATHER	ฉันควรใส่ พลิมโซลส์พรุ่งนี้หรือไม่	weather	38
3231363431343337	IN:GET_WEATHER	การพยากรณ์อุณหภูมิสำหรับวันนี้คืออะไร?	weather	38
3231363430383935	IN:GET_WEATHER	อากาศจะเป็นอย่างไรในสัปดาห์หน้า?	weather	38
3231363430373237	IN:GET_WEATHER	คุณบอกฉันได้ไหมว่าอากาศจะเป็นอย่างไรในสุดสัปดาห์นี้	weather	38
3231363339393735	IN:GET_WEATHER	คุณช่วยบอกสภาพอากาศสำหรับช่วงคริสต์มาสในฮาวายให้ฉันได้ไหม?	weather	38
3231363339333338	IN:GET_WEATHER	สภาพอากาศในควีนส์แลนด์เป็นอย่างไร?	weather	38
3231363339323033	IN:GET_WEATHER	ฉันขอสภาพอากาศสำหรับเทรนโตได้หรือไม่?	weather	38
3231363339313936	IN:GET_WEATHER	แสดงการคาดการณ์ของฝรั่งเศสตอนเหนือ	weather	38
3231363338343036	IN:GET_WEATHER	กรุณาพยากรณ์อากาศสำหรับบริสเบน	weather	38
3231363338313238	IN:GET_WEATHER	บอกสภาพอากาศในกาฐมาณฑุ เนปาล	weather	38
3231353938343232	IN:GET_WEATHER	บอกการพยากรณ์อากาศสำหรับเท็กซัสให้ฉัน	weather	38
3231353936383236	IN:GET_WEATHER	สภาพอากาศในภูมิภาคยอร์กคืออะไร	weather	38
3231353539373431	IN:GET_WEATHER	ฉันต้องรู้ว่าข้างนอกหนาวแค่ไหน	weather	38
3231353539303035	IN:GET_WEATHER	อากาศจะเป็นอย่างไรในไบรตันบ่ายวันนี้	weather	38
3231353537353734	IN:GET_WEATHER	แสดงสภาพอากาศในออร์แลนโดให้ฉันดูได้ไหม	weather	38
3138383937343937	IN:GET_WEATHER	ฉันควรนำร่มมาหรือไม่	weather	38
3134313539393136	IN:GET_WEATHER	มันจะสูงกว่า 69 ฟาเรนไฮต์ในนิวยอร์กหรือไม่?	weather	38
3134313539353730	IN:GET_WEATHER	มาดริดจะมีอุณหภูมิสูงกว่า 61 องศาฟาเรนไฮต์พรุ่งนี้เช้าหรือไม่	weather	38
3134313539353239	IN:GET_WEATHER	นิวยอร์กหนาวกี่องศาฟาเรนไฮต์ในวันนี้	weather	38
3132363031383931	IN:GET_WEATHER	ฉันต้องใช้ร่มไหม	weather	38
3132353835323138	IN:GET_WEATHER	จะมีหมอกในคืนนี้ไหม	weather	38
39353739343937	IN:GET_WEATHER	อากาศในโรเชสเตอร์	weather	38
39353733333032	IN:GET_WEATHER	นี่เป็นสัปดาห์การเดินทางที่ดีหรือไม่?	weather	38
39353639303937	IN:GET_WEATHER	จะมีลูกเห็บเย็นนี้ไหม?	weather	38
39353634323436	IN:GET_WEATHER	วันนี้ลมแรงไหม?	weather	38
39353632303830	IN:GET_WEATHER	ฝนตกที่ฟลอริด้าตอนนี้หรือไม่?	weather	38
39353535383933	IN:GET_WEATHER	อากาศข้างนอกเป็นอย่างไร	weather	38
39353534383236	IN:GET_WEATHER	มีพายุเข้ามาไหม?	weather	38
39353337343931	IN:GET_WEATHER	จะมีฝนในเร็ว ๆ นี้ไหม	weather	38
39353333343332	IN:GET_WEATHER	จะมีอุณหภูมิเท่าไรในวันพฤหัสบดีเวลา 16.00 น.?	weather	38
39353333303738	IN:GET_WEATHER	ฉันควรคาดหวังฝนคืนนี้ไหม?	weather	38
39353236363937	IN:GET_WEATHER	ข้างนอกหนาวไหม?	weather	38
39353134383735	IN:GET_WEATHER	อากาศในบอยซี ไอดาโฮเป็นอย่างไรในเดือนตุลาคม?	weather	38
39353133383734	IN:GET_WEATHER	ยังมีหมอกในซีแอตเทิลหรือไม่?	weather	38
