ID	intent	text	domain	label
3231313534323339	IN:DELETE_REMINDER	ลบการแจ้งเตือนการประชุม	reminder	48
3231313533323930	IN:DELETE_REMINDER	ลบการแจ้งเตือนเพื่อส่งคืนหนังสือห้องสมุด	reminder	48
3231313531303135	IN:DELETE_REMINDER	ยกเลิกการแจ้งเตือนเกี่ยวกับปาร์ตี้ของเจน	reminder	48
3231313438383837	IN:DELETE_REMINDER	ลบการแจ้งเตือนของฉันเกี่ยวกับเซสชันสไกป์ของฉันกับโจชัว	reminder	48
3231313438363832	IN:DELETE_REMINDER	ลบการแจ้งเตือนทั้งหมดและการแจ้งเตือนเกี่ยวกับแพทริค	reminder	48
3231313436353538	IN:DELETE_REMINDER	ลบการแจ้งเตือนการฉลองการสำเร็จการศึกษา	reminder	48
3231313435353537	IN:DELETE_REMINDER	นำการแจ้งเตือนการเอาออกไปรีไซเคิลของสัปดาห์นี้ออก	reminder	48
3231313434393231	IN:DELETE_REMINDER	ลบการแจ้งเตือนเพื่อให้อาหารแมวของไบรอันพรุ่งนี้	reminder	48
3231313434373236	IN:DELETE_REMINDER	นำการแจ้งเตือนในการรับการซักแห้งออกไป	reminder	48
3231313434333337	IN:DELETE_REMINDER	ลบการแจ้งเตือนในอนาคตทั้งหมดเกี่ยวกับการเรียนว่ายน้ำ	reminder	48
3231313433383239	IN:DELETE_REMINDER	โปรดลบการแจ้งเตือนเกี่ยวกับไข่	reminder	48
3231323335393537	IN:DELETE_REMINDER	ยกเลิกการแจ้งเตือนเพื่อไปหาคุณยาย	reminder	48
3231323335333632	IN:DELETE_REMINDER	ยกเลิกการแจ้งเตือนการนัดหมายแพทย์พรุ่งนี้	reminder	48
3231323237313931	IN:DELETE_REMINDER	ลบการแจ้งเตือนสำหรับการนัดหมายแพทย์ของฉัน	reminder	48
3231313536323338	IN:DELETE_REMINDER	ยกเลิกการแจ้งเตือนสำหรับมื้อกลางวันวันอาทิตย์นี้	reminder	48
3231313532373136	IN:DELETE_REMINDER	ลบการแจ้งเตือนทั้งหมดของฉันเกี่ยวกับงานที่ทำงานเดิมของฉัน	reminder	48
3231313436363936	IN:DELETE_REMINDER	ลบการแจ้งเตือนเพื่อตั้งเวลาปลุกสำหรับ 8:00 น.	reminder	48
3231313433393837	IN:DELETE_REMINDER	ลบตัวแจ้งเตือนเกี่ยวกับการไปรับเจมส์	reminder	48
3231343030383834	IN:DELETE_REMINDER	ช่วยลบการเตือนความจำเพื่อซ่อมเครื่องเป่าผม	reminder	48
3231333938353235	IN:DELETE_REMINDER	ยกเลิกการเตือนความจำของฉันเกี่ยวกับการประชุม	reminder	48
3231333932383035	IN:DELETE_REMINDER	ช่วยลบการแจ้งเตือนสำหรับสัปดาห์นี้ตั้งแต่วันศุกร์ถึงวันอาทิตย์	reminder	48
3231323431323531	IN:DELETE_REMINDER	ยกเลิกการเตือนความจำการโทรหาเพื่อน	reminder	48
3231323430383234	IN:DELETE_REMINDER	ยกเลิกการเตือนความจำสำหรับทันตแพทย์	reminder	48
3231323338393533	IN:DELETE_REMINDER	ยกเลิกการเตือนสำหรับวันนี้	reminder	48
3231323337393931	IN:DELETE_REMINDER	ยกเลิกการเตือนของฉันให้จ่ายเงินให้ลอร์รีน	reminder	48
3231323337303939	IN:DELETE_REMINDER	ช่วยยกเลิกการแจ้งเตือนของฉันเพื่อซื้อเบคอน	reminder	48
3231323336363932	IN:DELETE_REMINDER	ลบการเตือนความจำให้ซื้อซีเรียล	reminder	48
3231323336343832	IN:DELETE_REMINDER	ยกเลิกนาฬิกาปลุกให้ซื้อไข่	reminder	48
3231323336343334	IN:DELETE_REMINDER	ฉันต้องการลบการเตือนความจำสำหรับนม	reminder	48
39353533333631	IN:CREATE_TIMER	ตั้งตัวจับเวลาเพื่อบันทึกการโชว์ของฉันตอน 20:00 น.	timer	49
39353532363839	IN:CREATE_TIMER	เริ่มการจับเวลาเพื่อนับ	timer	49
39353531393333	IN:CREATE_TIMER	กำหนดตัวจับเวลาเป็นเวลา 50 นาที	timer	49
39353435393034	IN:CREATE_TIMER	กรุณาตั้งเวลาสำหรับ 10:30 น.	timer	49
39353433343730	IN:CREATE_TIMER	ตั้งเวลาไว้ครึ่งชั่วโมง	timer	49
39353234373237	IN:CREATE_TIMER	ตั้งเวลาเป็น 3 ชั่วโมง	timer	49
39353234343633	IN:CREATE_TIMER	ตั้งเวลา 1 ชั่วโมงครึ่งจากนี้	timer	49
39353233363737	IN:CREATE_TIMER	ตั้งตัวจับเวลาเป็น 19 นาที	timer	49
39353231353938	IN:CREATE_TIMER	ฉันต้องการให้จับเวลาเป็น 25 นาที	timer	49
39353038343735	IN:CREATE_TIMER	ตั้งการจับเวลาเป็นเวลา 3 นาที	timer	49
39343938343031	IN:CREATE_TIMER	ช่วยจับเวลาให้ฉันเป็นเวลา 15 นาที	timer	49
39343937343731	IN:CREATE_TIMER	คุณตั้งเวลาเป็น 30 นาทีได้ไหม	timer	49
39343935393138	IN:CREATE_TIMER	เพิ่มตัวจับเวลาวินาทีเป็น 35 นาที	timer	49
39343933323738	IN:CREATE_TIMER	เริ่มจับเวลาเป็นเวลา 5 นาที	timer	49
39343835343032	IN:CREATE_TIMER	ตั้งเวลาการนับถอยหลังเป็นเวลา 30 นาที เริ่มนับถอยหลังตอนนี้	timer	49
39343736383638	IN:CREATE_TIMER	ตั้งการจับเวลาเป็น 5 ชั่วโมง	timer	49
39343732333633	IN:CREATE_TIMER	เริ่มจับเวลาอีกครั้ง	timer	49
3136343732383837	IN:CREATE_TIMER	ตั้งตัวจับเวลาการนอนหลับ 10 นาที	timer	49
3135323935363935	IN:CREATE_TIMER	ตั้งตัวจับเวลา 30 วินาที	timer	49
3135323930323136	IN:CREATE_TIMER	ตั้งเวลาของฉันเป็นเวลา 6 นาที	timer	49
39353634393530	IN:CREATE_TIMER	เริ่มการจับเวลาใหม่	timer	49
39353633353338	IN:CREATE_TIMER	ตั้งเวลา 20 นาที เริ่ม	timer	49
39353533323933	IN:CREATE_TIMER	ตั้งการจับเวลาเป็น 2 นาที	timer	49
39353435353032	IN:CREATE_TIMER	ตั้งตัวจับเวลาสี่นาที	timer	49
39353133303830	IN:CREATE_TIMER	ฉันต้องการตัวจับเวลา 6 นาที	timer	49
39343730363531	IN:CREATE_TIMER	ตั้งเวลาใหม่เป็นเวลา 45 วินาที	timer	49
3232343333313937	IN:CREATE_TIMER	เริ่มใช้เครื่องจับเวลาที่จะเหลือ 1 นาทีสุดท้าย	timer	49
3232343330393137	IN:CREATE_TIMER	ตั้งเครื่องจับเวลาเป็น 18 นาทีและอีกหนึ่งอันเป็นเวลา 20 นาที	timer	49
3232343330363735	IN:CREATE_TIMER	ตั้งนาฬิกาจับเวลาตัวหนึ่ง 23 นาที และตัวที่สอง 30 นาที	timer	49
3232333730383638	IN:CREATE_TIMER	ช่วยสร้างเครื่องจับเวลา 45 นาทีและตั้งชื่อว่าเชิญแขกกลับได้	timer	49
3232333730383538	IN:CREATE_TIMER	ตั้งนาฬิกาจับเวลาสำหรับออกกำลังกายที่จะสิ้นสุดใน 30 นาที	timer	49
3232333537373134	IN:CREATE_TIMER	เพิ่มเครื่องจับเวลาสิบนาที	timer	49
3232323930323636	IN:CREATE_TIMER	ช่วยตั้งเครื่องจับเวลาชื่อว่าเฝอ	timer	49
3232323730323232	IN:CREATE_TIMER	ตั้งเครื่องจับเวลาสี่ชั่วโมงสี่สิบห้านาทีและตั้งเครื่องจับเวลาสี่นาทีและตั้งเครื่องจับเวลาสี่นาที	timer	49
3232323730323039	IN:CREATE_TIMER	สร้างเครื่องจับเวลา 80 วินาทีและเครื่องจับเวลาสองชั่วโมงและเครื่องจับเวลาสิบวินาที	timer	49
3232323730323037	IN:CREATE_TIMER	สร้างตัวจับเวลาแปดนาทีและตัวจับเวลาสี่ชั่วโมง และตัวจับเวลาสี่นาที	timer	49
3232323530323630	IN:CREATE_TIMER	ตั้งเครื่องจับเวลาไข่	timer	49
3232323530323535	IN:CREATE_TIMER	ตั้งเครื่องจับเวลาละลายไก่งวง	timer	49
3232313432313835	IN:CREATE_TIMER	แก้ไขนาฬิกาจับเวลาตอนนี้	timer	49
3232313432313830	IN:CREATE_TIMER	แก้ไขตัวจับเวลาอีก 2 นาที	timer	49
3232313432313731	IN:CREATE_TIMER	แก้ไขเครื่องจับเวลาให้ฉัน	timer	49
3232313136343139	IN:CREATE_TIMER	เริ่มนาฬิกาจับเวลาของฉันครึ่งชั่วโมง	timer	49
3136343035363839	IN:CREATE_TIMER	เพิ่มเวลาห้านาทีไปที่เครื่องจับเวลา	timer	49
3136343034393438	IN:CREATE_TIMER	ตั้งตัวจับเวลาใหม่สำหรับรีส	timer	49
3136333731353939	IN:CREATE_TIMER	เพิ่มตัวจับเวลาอีกครั้ง ครั้งนี้เพิ่มเป็น 45 นาที	timer	49
3135333031393735	IN:CREATE_TIMER	ตั้งเครื่องจับเวลา 30 วินาที	timer	49
3135333031323133	IN:CREATE_TIMER	15 นาทีบนเครื่องจับเวลา	timer	49
3135333031313039	IN:CREATE_TIMER	ตั้งตัวตั้งเวลาเป็น 6 นาที	timer	49
3135333030353836	IN:CREATE_TIMER	สร้างการจับเวลาใหม่เป็นเวลา 10 วินาที	timer	49
3135323937343739	IN:CREATE_TIMER	ตั้งตัวจับเวลา 20 นาที	timer	49
3135323935333131	IN:CREATE_TIMER	เริ่มเครื่องจับเวลาเป็นเวลา 21 นาทีจากนี้	timer	49
3135323935313037	IN:CREATE_TIMER	คุณช่วยตั้งนาฬิกาจับเวลาหนึ่งชั่วโมงนับจากนี้	timer	49
3135323839363735	IN:CREATE_TIMER	คุณช่วยตั้งตัวจับเวลาเป็นหนึ่งชั่วโมงได้ไหม	timer	49
3231353336363932	IN:UPDATE_METHOD_CALL	เข้าโหมดการโทรด้วยวิดีโอเดี๋ยวนี้	calling	51
3231363736303738	IN:UPDATE_METHOD_CALL	เพิ่มวิดีโอในการโทรนี้	calling	51
3231353336373338	IN:UPDATE_METHOD_CALL	เปลี่ยนให้เป็นการโทรผ่านวิดีโอ	calling	51
3231353336383032	IN:UPDATE_METHOD_CALL	เปลี่ยนเป็นวิดีโอคอล	calling	51
3232343333313133	IN:UPDATE_METHOD_CALL	สลับการโทรเป็นแบบเต็มหน้าจอเท่านั้น	calling	51
3232343333313131	IN:UPDATE_METHOD_CALL	สลับการโทรเป็นเต็มจอ	calling	51
3231363736313639	IN:UPDATE_METHOD_CALL	สลับการโทรปัจจุบันเป็นวิดีโอคอล	calling	51
39353635373439	IN:REMOVE_FROM_PLAYLIST_MUSIC	ลบเพลงนี้จากเพลย์ลิสต์ของฉัน	music	53
39353533323136	IN:REMOVE_FROM_PLAYLIST_MUSIC	อย่าเล่นเพลงที่ร้องโดยจัสติน บีเบอร์	music	53
3138393739313430	IN:GET_CONTACT	เพื่อนของฉันคนใดอาศัยอยู่ในแองเคอเรจหรือไม่?	people	54
3138393738393533	IN:GET_CONTACT	เพื่อนของฉันคนไหนอาศัยอยู่ในโบฟอร์ต	people	54
3138393738363835	IN:GET_CONTACT	ใครอยู่ในฟอร์ตเวิร์ธ?	people	54
3138393738323637	IN:GET_CONTACT	ใครอยู่ในมอนทรีออล	people	54
3138393738323133	IN:GET_CONTACT	คุณบอกฉันได้ไหมว่าใครอยู่ในชิคาโก?	people	54
3138393738313438	IN:GET_CONTACT	ฉันรู้จักใครในฮาวายบ้างไหม?	people	54
3138393738303931	IN:GET_CONTACT	ใครบ้างที่อยู่ในสาธารณรัฐโดมินิกันในตอนนี้?	people	54
3138393736303333	IN:GET_CONTACT	ขอเพื่อนของแมรี่	people	54
3138393735393935	IN:GET_CONTACT	แสดงเพื่อนของเซลมา	people	54
3138393735373934	IN:GET_CONTACT	บอกฉันว่าใครเป็นเพื่อนกับโคล	people	54
3138393735363531	IN:GET_CONTACT	เพื่อนของแครอล	people	54
3138393735343938	IN:GET_CONTACT	ฉันต้องการรายชื่อเพื่อนของฉันทั้งหมด	people	54
3138393735323733	IN:GET_CONTACT	คุณสามารถหาคนที่เป็นเพื่อนกับทอมได้ไหม?	people	54
3138393735303739	IN:GET_CONTACT	แสดงให้ฉันเห็นทุกคนที่เป็นเพื่อนกับจีจีบี	people	54
3138393735303634	IN:GET_CONTACT	ใครคือเพื่อนของเอริค	people	54
3138393734373939	IN:GET_CONTACT	แสดงเพื่อนของพี่สาวของฉัน	people	54
39353838343139	IN:GET_CONTACT	จะมีวันเกิดของใครหรือเปล่า?	people	54
3232353330333436	IN:GET_CONTACT	ฉันต้องการให้คุณหามาธีโอให้ฉันด้วย	people	54
3231393232363936	IN:GET_CONTACT	ฉันโชว์เพื่อนบนหน้าจอได้ไหม	people	54
3231343631333630	IN:GET_CONTACT	แสดงวันเกิดของเพื่อนรักดร. เดนิสันให้ฉันดู	people	54
3231343630393334	IN:GET_CONTACT	มีวันเกิดของคนที่เกิดวันที่ 29 กี่คน	people	54
3231313731373135	IN:GET_CONTACT	เพื่อนคนไหนที่มีวันเกิดในเดือนมิถุนายน?	people	54
3139343333313038	IN:GET_CONTACT	โดนัลด์ ทรัมป์มีอดีตภรรยากี่คน?	people	54
3138393833353039	IN:GET_CONTACT	คุณรู้หรือไม่ว่าใครเป็นผู้รับผิดชอบโรงแรมนี้?	people	54
3138393833343037	IN:GET_CONTACT	ใส่รายชื่อผู้ติดต่อที่ทำงานที่แมคโดนัลด์	people	54
3138393831323833	IN:GET_CONTACT	ฉันมีเพื่อนในมหาวิทยาลัยแห่งรัฐบอสตันหรือไม่	people	54
3138393830303334	IN:GET_CONTACT	มีคนในรายชื่อเพื่อนของฉันกี่คนที่เข้ามหาวิทยาลัยบราวน์?	people	54
3138393738393334	IN:GET_CONTACT	เพื่อนของฉันคนใดอาศัยอยู่ในไมอามีในตอนนี้หรือไม่?	people	54
3138393737363733	IN:GET_CONTACT	บอกให้ฉันรู้ว่าใครที่เล่นเฟซบุ๊กในตอนนี้	people	54
3232353330343430	IN:GET_CONTACT	ช่วยฉันหาแคโรลีน คลาร์ก โบลตัน ได้ไหม	people	54
3231393232373431	IN:GET_CONTACT	แสดงรายชื่อเพื่อนหน่อย	people	54
3231393232373037	IN:GET_CONTACT	คุณช่วยแสดงเพื่อนของฉันบนหน้าจอได้หรือไม่	people	54
3231393232363330	IN:GET_CONTACT	ช่วยแสดงหน้าเพื่อนของฉันหน่อย	people	54
3231343631353031	IN:GET_CONTACT	ป้าคนไหนของสตีเฟ่น ฮาวาส ที่เกิดวันอังคาร?	people	54
3231343631333133	IN:GET_CONTACT	แสดงวันเกิดของลูกสะใภ้	people	54
3231343631333130	IN:GET_CONTACT	บอกวันเกิดของลินน์ โอมีส์กับฉัน	people	54
3231343631333035	IN:GET_CONTACT	มีวันเกิดของใครในวันที่ 17 เมษายน?	people	54
3231343631323534	IN:GET_CONTACT	มีใครที่ยูลันดารู้จักที่เกิดในวันที่ 11 พฤษภาคม	people	54
3231343631323433	IN:GET_CONTACT	วันที่ 7 ตุลาคมเป็นวันเกิดของใคร?	people	54
3231343631303536	IN:GET_CONTACT	บอกวันเกิดแม่ของคาริสให้ฉันที	people	54
3231343630373735	IN:GET_CONTACT	มีพี่น้องสะใภ้ตระกูลแคลลี่เกิดในวันที่ 9 มกราคม 2008 ไหม?	people	54
3231343533323831	IN:GET_CONTACT	เพื่อนคนไหนของฉันมีวันเกิดที่ใกล้จะถึง?	people	54
3231313733303538	IN:GET_CONTACT	เพื่อนคนไหนของฉันมีวันเกิดในเดือนมิถุนายนบ้าง	people	54
3231313732303333	IN:GET_CONTACT	แสดงสมาชิกในครอบครัวที่มีวันเกิดในเดือนนี้	people	54
3231313638373339	IN:GET_CONTACT	เพื่อนของฉันคนไหนที่มีวันเกิดในเดือนมีนาคม	people	54
3139393231333834	IN:GET_CONTACT	ค้นหาปู่ของชาเด บรูกส์	people	54
3139393231333638	IN:GET_CONTACT	ซาแมนธา วัตต์มีแม่เลี้ยงหรือไม่?	people	54
3139393231333333	IN:GET_CONTACT	แจ็กสัน รีดมีลูกชายหรือไม่?	people	54
3139393231323736	IN:GET_CONTACT	หาพี่เขยของมาริน่า	people	54
3139343333363131	IN:GET_CONTACT	อดีตสามีของเกล คิงส์คือใคร?	people	54
3138393935313033	IN:GET_CONTACT	แม่ของเชอร์ลีย์คือใคร?	people	54
3138393935303236	IN:GET_CONTACT	ใครคือเพื่อนรักของทอม	people	54
3138393934303033	IN:GET_CONTACT	เพื่อนรักของปีเตอร์ แกเบรียลคือใคร?	people	54
3138393930363531	IN:GET_CONTACT	ฉันรู้จักใครที่มีเอ็มบีเอไหม?	people	54
3138393837383535	IN:GET_CONTACT	วันเกิดในเดือนนี้	people	54
3138393835303233	IN:GET_CONTACT	ช่วยบอกฉันว่าใครทำงานอยู่ที่เรด โรบิน	people	54
3138393835303232	IN:GET_CONTACT	ใครทำงานกับซีเอสเอส?	people	54
3138393835303133	IN:GET_CONTACT	คุณช่วยบอกให้ทราบหน่อยได้ไหมว่าใครทำงานที่ออเรนจ์ โคสต์ คอลเลจ?	people	54
3138393834383839	IN:GET_CONTACT	บอกฉันทีว่าใครทำงานที่ชีสเค้กแฟคทอรี่?	people	54
3138393834343832	IN:GET_CONTACT	บอกฉันทีว่าใครทำงานที่ IHOP	people	54
3138393834343133	IN:GET_CONTACT	คุณช่วยบอกได้ไหมว่าใครทำงานที่แมคโดนัลด์?	people	54
3138393834343132	IN:GET_CONTACT	ใครทำงานที่อาร์แอลพีเอส?	people	54
3138393834323339	IN:GET_CONTACT	ฉันต้องการเห็นคนที่ทำงานให้กับลิงค์อิน	people	54
3138393834313738	IN:GET_CONTACT	ดูว่าใครที่ทำงานในร้านอาหารสำหรับครอบครัว	people	54
3138393834313639	IN:GET_CONTACT	มองหาคนที่ทำงานที่ไฟเซอร์	people	54
3138393834313632	IN:GET_CONTACT	ค้นหาเพื่อนที่ทำงานที่ดิสนีย์	people	54
3138393834303337	IN:GET_CONTACT	ใครทำงานที่โรงยิม	people	54
3138393833393634	IN:GET_CONTACT	บอกฉันว่าใครทำงานที่สตาร์บัคส์	people	54
3138393833393431	IN:GET_CONTACT	แสดงรายชื่อเพื่อนของฉันที่สอนที่มหาวิทยาลัยรัฐโคโลราโด	people	54
3138393833383832	IN:GET_CONTACT	ใครคือแพทย์ที่ทำงานในคลินิกสัตว์ REACH?	people	54
3138393833383136	IN:GET_CONTACT	ใครทำงานที่ทรานสกอร์?	people	54
3138393833373837	IN:GET_CONTACT	มีคนที่ฉันรู้จักทำงานที่โฮลฟู้ดไหม	people	54
3138393833373533	IN:GET_CONTACT	บอกฉันว่าใครเคยทำงานที่ไฮนซ์ฟิลด์	people	54
3138393833373437	IN:GET_CONTACT	คุณช่วยบอกฉันได้ไหมว่าใครทำงานที่แมคโดนัลด์บ้าง	people	54
3138393833373431	IN:GET_CONTACT	ฉันรู้จักใครที่ทำงานที่กูเกิลหรือไม่	people	54
3138393833343832	IN:GET_CONTACT	มีเพื่อนคนใดทำงานที่ทาร์เก็ตไหม	people	54
3138393833343730	IN:GET_CONTACT	บอกฉันหน่อยว่าใครทำงานที่อินเทล	people	54
3138393833343338	IN:GET_CONTACT	ใครทำงานในนครนิวยอร์ก	people	54
3138393833333331	IN:GET_CONTACT	ฉันรู้จักใครที่ทำงานที่ชิลลีไหม	people	54
3138393833333133	IN:GET_CONTACT	บอกฉันว่าใครทำงานที่เมซี่	people	54
3138393833313938	IN:GET_CONTACT	ชื่อของเพื่อนของฉันที่ทำงานที่สตาร์บัคส์	people	54
3138393833313630	IN:GET_CONTACT	ฉันต้องการชื่อคนที่ทำงานที่ทาโก้ เบลล์	people	54
3138393833303638	IN:GET_CONTACT	บอกฉันทีว่าใครทำงานที่ DMV	people	54
3138393832393134	IN:GET_CONTACT	ใครทำงานในเวนิส	people	54
3138393832383437	IN:GET_CONTACT	ใครทำงานให้กับห้องสมุดสาธารณะ	people	54
3138393832383031	IN:GET_CONTACT	ใครทำงานที่ดิสนีย์แลนด์	people	54
3138393832363536	IN:GET_CONTACT	ใครทำงานที่ออฟฟิศดีพอต	people	54
