ID	intent	text	domain	label
3232343533373236	IN:SET_RSVP_INTERESTED	ตอบว่ามีความสนใจที่จะเข้าร่วมงานที่สาม	event	0
3232343533373139	IN:SET_RSVP_INTERESTED	ตอบไปว่าอาจเข้าร่วมงานที่ห้า	event	0
3232343533363937	IN:SET_RSVP_INTERESTED	ตอบว่าสนใจการชมพระจันทร์	event	0
3232343533363531	IN:SET_RSVP_INTERESTED	ตอบสนองว่าสนใจในกิจกรรมที่ห้า	event	0
3232343533343533	IN:SET_RSVP_INTERESTED	ตั้งสถานะของฉันเป็นสนใจที่จะเข้าร่วมงานนั้น	event	0
3232343533323330	IN:SET_RSVP_INTERESTED	กำหนดสถานะของฉันว่าสนใจ Brickpalooza	event	0
3232343533323137	IN:SET_RSVP_INTERESTED	กำหนดสถานะของฉันเป็นอาจเข้าร่วมกิจกรรมนี้	event	0
3231323239393833	IN:GET_REMINDER_AMOUNT	จะมีการแจ้งเตือนกี่ครั้งสำหรับพรุ่งนี้?	reminder	2
3232323230333436	IN:PLAY_MEDIA	ค้นหาเพลงคัฟเวอร์ของกุชชี่ เมน	music	3
3231323235363132	IN:GET_REMINDER_DATE_TIME	ตัวแจ้งเตือนการทำความสะอาดพรมคือเมื่อไร	reminder	4
3231323337373035	IN:GET_REMINDER_DATE_TIME	เตือนฉันเมื่อเลขห้าปรากฏขึ้น	reminder	4
3231323333373832	IN:GET_REMINDER_DATE_TIME	มีการเตือนความจำของฉันสำหรับวันพรุ่งนี้ตอนเช้าใช่หรือไม่?	reminder	4
3138393932383138	IN:GET_EMPLOYMENT_TIME	เบนเริ่มทำงานกับซับเวย์เมื่อใด?	people	5
3138393932343035	IN:GET_EMPLOYMENT_TIME	มาร์ธาเลิกทำงานให้กับวอลกรีนส์เมื่อไร	people	5
3138393932333739	IN:GET_EMPLOYMENT_TIME	เอมิลี่เริ่มทำงานให้ St. Luke's เมื่อใด?	people	5
3138393932333531	IN:GET_EMPLOYMENT_TIME	แอนโทนีทำงานที่แอปเปิลมานานเท่าไรแล้ว	people	5
3138393931373636	IN:GET_EMPLOYMENT_TIME	แชนนอนทำงานปัจจุบันมานานแค่ไหนแล้ว?	people	5
3138393931373435	IN:GET_EMPLOYMENT_TIME	ฟิลเริ่มทำงานที่แมคโดนัลด์เมื่อไร	people	5
3132353935303436	IN:LOOP_MUSIC	เล่นเพลงนี้ 3 ครั้งติด	music	6
39353534353434	IN:LOOP_MUSIC	ใส่เพลงนี้ไปยังรายการเล่นซ้ำ	music	6
3132353833323831	IN:SKIP_TRACK_MUSIC	เริ่มเพลงถัดไป	music	8
3132363231333730	IN:SKIP_TRACK_MUSIC	โปรดข้าม	music	8
3132353835323430	IN:SKIP_TRACK_MUSIC	เล่นเพลงถัดไป	music	8
3132353834323132	IN:SKIP_TRACK_MUSIC	ช่วยไปที่เพลงที่ 3	music	8
3132353732383038	IN:SKIP_TRACK_MUSIC	กรุณาข้าม	music	8
3132353635323538	IN:SKIP_TRACK_MUSIC	ข้ามไปข้างหน้า 5 เพลง	music	8
39353736323834	IN:SKIP_TRACK_MUSIC	ข้ามเพลงตอนนี้	music	8
39353732343334	IN:SKIP_TRACK_MUSIC	ไปยังอีกเพลง	music	8
39353439323739	IN:LIKE_MUSIC	ทำเพลงนี้เป็นรายการโปรด	music	9
3139393237353130	IN:GET_TRACK_INFO_MUSIC	เพลงนี้ที่สปอทิฟายเล่นอยู่คือเพลงอะไร?	music	10
3132363135303732	IN:GET_TRACK_INFO_MUSIC	เพลงสุดท้ายชื่อว่าอะไร	music	10
39353630383939	IN:GET_TRACK_INFO_MUSIC	บียอนเซ่กำลังร้องเพลงอยู่ใช่ไหม?	music	10
39353538343639	IN:GET_TRACK_INFO_MUSIC	เพลงนี้คือเพลงอะไร?	music	10
39353531363734	IN:GET_TRACK_INFO_MUSIC	ใครร้องเพลง Hey Pretty	music	10
39353136383634	IN:GET_TRACK_INFO_MUSIC	ใครเป็นจุดเด่นในเพลงนี้	music	10
39353031393337	IN:GET_TRACK_INFO_MUSIC	เพลงออกมาเมื่อไร	music	10
39343832353838	IN:GET_TRACK_INFO_MUSIC	นี่เป็นปกเหรอ?	music	10
39353536323235	IN:GET_TRACK_INFO_MUSIC	เพลงนี้ของศิลปินคนไหน?	music	10
39343738323636	IN:GET_TRACK_INFO_MUSIC	ใครคือนักร้องนำของวงนี้	music	10
3230303431383436	IN:GET_TRACK_INFO_MUSIC	ตอนนี้กำลังเล่นเพลงอะไร	music	10
3132363133393932	IN:GET_TRACK_INFO_MUSIC	ใครกำลังร้องเพลงนี้	music	10
3132353938383330	IN:GET_TRACK_INFO_MUSIC	ใครกำลังร้องเพลง	music	10
3231313435313730	IN:CREATE_REMINDER	ฉันมีการสัมมนาผ่านเว็บตอน 6 โมงวันนี้ คุณช่วยตั้งค่าการแจ้งเตือนล่วงหน้าเป็นเวลา 15 นาทีได้หรือไม่	reminder	11
3231313435303535	IN:CREATE_REMINDER	เตือนให้ฉันโทรหาบริตคืนนี้เวลา 19:00 น.	reminder	11
3231313434393239	IN:CREATE_REMINDER	ช่วยตั้งค่าการแจ้งเตือนสำหรับวันเสาร์เวลา 15:00 น. เพื่อรับจอช	reminder	11
3231313434333735	IN:CREATE_REMINDER	เตือนให้ฉันอบเค้ก	reminder	11
3231313434323033	IN:CREATE_REMINDER	ฉันต้องโทรหาหมอฟันอีกครั้งเพื่อทำการนัดหมายการทดสอบใหม่ของซินดี้ คุณสามารถเตือนฉันตอนเที่ยงพรุ่งนี้ได้ไหม?	reminder	11
3231313433383335	IN:CREATE_REMINDER	แจ้งเตือนให้ฉันโทรหาครูของลูกชายของฉันให้กำหนดการประชุมในสัปดาห์ถัดไป	reminder	11
3231313433383231	IN:CREATE_REMINDER	เตือนให้ฉันโทรหาพี่สาวของฉันพรุ่งนี้เวลา 5:00 น.	reminder	11
3231313433343039	IN:CREATE_REMINDER	สร้างกิจกรรมบนเฟซบุ๊กสำหรับการจัดปาร์ตี้ที่บ้านในวันอาทิตย์ เพิ่มสมาชิกในครอบครัวด้วย	reminder	11
3231313433303336	IN:CREATE_REMINDER	เตือนฉันให้ถามพี่สาวว่าวันเกิดของดอมคือเมื่อไรในคืนนี้	reminder	11
3231313432353635	IN:CREATE_REMINDER	เตือนฉันเวลา 15:00 น. เพื่อส่งอีเมลถึงทอมเกี่ยวกับรายละเอียดของการประชุมในวันอังคารหน้า	reminder	11
3231323431333435	IN:CREATE_REMINDER	เตือนฉันให้เอาน้ำมันใส่รถ 8:00 น. พรุ่งนี้	reminder	11
3231323430343534	IN:CREATE_REMINDER	เตือนฉันถึงการสัมภาษณ์ของฉันในเช้าวันจันทร์	reminder	11
3231323430343434	IN:CREATE_REMINDER	ตั้งการแจ้งเตือนเพื่อชมสเกนเดลคืนนี้	reminder	11
3231323339343738	IN:CREATE_REMINDER	เตือนฉันให้จ่ายค่าโทรศัพท์ก่อนสัปดาห์หน้า	reminder	11
3231323338323532	IN:CREATE_REMINDER	เตือนฉันว่ามีการนัดหมายกับแพทย์ในวันพุธหน้า	reminder	11
3231323337313639	IN:CREATE_REMINDER	คุณช่วยเตือนฉันให้ทำความสะอาดรถได้ไหม?	reminder	11
3231323337313036	IN:CREATE_REMINDER	เพิ่มการแจ้งเตือนสำหรับงานหนักตั้งแต่วันพุธเวลา 9:00 น.	reminder	11
3231323336383031	IN:CREATE_REMINDER	เตือนฉันว่าฉันมีการประชุมในตอนเช้า	reminder	11
3231323336333535	IN:CREATE_REMINDER	เตือนให้ฉันทำการนัดหมาย	reminder	11
3231323336323837	IN:CREATE_REMINDER	คำเตือน: ภาพยนตร์เริ่มเวลา 16:30 น.	reminder	11
3231323335373437	IN:CREATE_REMINDER	เตือนฉันให้อัปเดตข้อมูลการติดต่อสำหรับโรงเรียน	reminder	11
3231323335303534	IN:CREATE_REMINDER	สร้างการแจ้งเตือนให้พาแมวไปเดินเล่น	reminder	11
3231323333383933	IN:CREATE_REMINDER	เตือนให้ฉันโทรหาราเชล เธอได้ออกจากชั้นเรียนตอน 19:00 น. ดังนั้น 19:15 น. จะเป็นเวลาที่ดีสำหรับฉันที่จะโทร	reminder	11
3231323332323235	IN:CREATE_REMINDER	ใส่การแจ้งเตือนให้พบแม่ของฉันที่ทางในสวนสาธารณะทางตะวันออกวันพฤหัสบดีนี้	reminder	11
3231323332313037	IN:CREATE_REMINDER	คุณจะเตือนฉันให้ไปรับหนังสือพิมพ์ของเจนนี่ในวันจันทร์ได้ไหม	reminder	11
3231323235363830	IN:CREATE_REMINDER	การแจ้งเตือนสำหรับการนัดหมายแพทย์ของฉัน	reminder	11
3231323235353737	IN:CREATE_REMINDER	สร้างการแจ้งเตือนให้เปลี่ยนการนัดหมายแพทย์เป็นเดือนหน้า	reminder	11
3231323235313130	IN:CREATE_REMINDER	แจ้งเตือนฉันว่าฉันสมควรได้รับความรัก	reminder	11
3231323234333734	IN:CREATE_REMINDER	เตือนฉันใน 15 นาทีว่าซาร่าห์กำลังจะมาถึงตอน 5 โมง	reminder	11
3231323234303839	IN:CREATE_REMINDER	คุณช่วยตั้งการแจ้งเตือนเพื่อล็อกประตูโรงรถก่อนฉันออกจากเมืองได้ไหม	reminder	11
3231323231363232	IN:CREATE_REMINDER	เตือนฉันเกี่ยวกับวันเกิดหนึ่งสัปดาห์ก่อนถึงวัน	reminder	11
3231313536313837	IN:CREATE_REMINDER	เตือนฉันให้เริ่มแต่งตัวไปทำงานเวลา 16:00 น.	reminder	11
3231313534323135	IN:CREATE_REMINDER	คุณช่วยเตือนฉันให้สั่งซื้อตั๋วหนังก่อนเที่ยงวันพรุ่งนี้ได้ไหม	reminder	11
3231313533333633	IN:CREATE_REMINDER	เตือนให้ฉันไปซื้อนมคืนนี้เวลา 21:00 น.	reminder	11
3231313532393230	IN:CREATE_REMINDER	เตือนฉันให้ส่งคืนหนังสือห้องสมุดในบ่ายวันอังคาร	reminder	11
3231313531383530	IN:CREATE_REMINDER	เตือนฉันให้ไปซื้อของสำหรับปาร์ตี้ในวันศุกร์	reminder	11
3231313531373035	IN:CREATE_REMINDER	เตือนจูลี่ถึงการประชุมในสัปดาห์หน้า	reminder	11
3231313530323139	IN:CREATE_REMINDER	เตือนให้ฉันฟังพอดแคสต์ Come and Reason เวลา 10:00 น. ในวันเสาร์	reminder	11
3231313439363639	IN:CREATE_REMINDER	เตือนฉันให้ทำอะไรให้กับสมาคมหนังสือของเราภายในวันเสาร์หน้าเวลา 18.00 น.	reminder	11
3231313437343431	IN:CREATE_REMINDER	ตั้งการแจ้งเตือนสำหรับการประชุมชมรมหนังสือของฉัน	reminder	11
3231313436383639	IN:CREATE_REMINDER	เตือนพี่ชายของฉันให้โทรไปที่ออฟฟิศตอน 10 โมงเช้าพรุ่งนี้	reminder	11
3231313436363734	IN:CREATE_REMINDER	แจ้งเตือนให้ฉันส่งอีเมลรายการชอปปิงไปให้แม่ของฉัน	reminder	11
3231313435333332	IN:CREATE_REMINDER	แจ้งเตือนให้ฉันยื่นฟ้องรายงานทั้งหมดวันอาทิตย์นี้	reminder	11
3231313434353437	IN:CREATE_REMINDER	เตือนฉันให้โทรหาเทอร์รี่และขอให้เขาให้อาหารม้า	reminder	11
3231343030363432	IN:CREATE_REMINDER	เตือนให้ฉันโทรหาพี่ชายของฉันหลังเลิกงาน	reminder	11
3231343030363334	IN:CREATE_REMINDER	เตือนให้ฉันล้างจานคืนนี้	reminder	11
3231333933313531	IN:CREATE_REMINDER	ช่วยเตือนให้ฉันพาสุนัขออกไปเดิน	reminder	11
3231333933303836	IN:CREATE_REMINDER	เตือนให้ฉันโทรหาพ่อ	reminder	11
3231323432333032	IN:CREATE_REMINDER	เตือนฉันว่ามีประชุมทางโทรศัพท์ในวันพรุ่งนี้เวลา 10.00 น.	reminder	11
3231323432323332	IN:CREATE_REMINDER	เตือนฉันให้โทรหาหมอพรุ่งนี้	reminder	11
3231323432313835	IN:CREATE_REMINDER	เตือนให้ฉันโทรหาพ่อของฉันในอีก 1 ชั่วโมง	reminder	11
3231323432303833	IN:CREATE_REMINDER	เตือนให้ฉันโทรหาแม่เวลา 20:00 น. คืนนี้	reminder	11
3231323431393935	IN:CREATE_REMINDER	เตือนให้ฉันไปรับลูกสาวจากสนามฟุตบอลตอน 7 โมง	reminder	11
3231323431363136	IN:CREATE_REMINDER	เตือนฉันให้ไปรับตั๋วเข้าชมคอนเสิร์ตคืนนี้เวลา 17:00 น.	reminder	11
3231323431343734	IN:CREATE_REMINDER	เตือนให้ฉันซื้อผักแช่แข็งระหว่างทางกลับบ้านจากที่ทำงาน	reminder	11
3231323431313934	IN:CREATE_REMINDER	เตือนให้ฉันเพิ่มรายการน้ำบรรจุขวดลงในรายการซื้อของ	reminder	11
3231323431313639	IN:CREATE_REMINDER	เตือนให้ฉันพาสุนัขไปเดินเล่นเย็นนี้	reminder	11
3231323430393431	IN:CREATE_REMINDER	เตือนให้ฉันส่งดอกไม้ให้แม่ของฉันในวันแม่ครั้งถัดไป	reminder	11
3231323430383733	IN:CREATE_REMINDER	เตือนให้ฉันส่งเอกสารให้ทนายความ	reminder	11
3231323430383437	IN:CREATE_REMINDER	เตือนความจำให้ฉันเรียนคืนนี้	reminder	11
3231323430373336	IN:CREATE_REMINDER	เตือนให้ฉันไปรับผ้าที่ส่งซักแห้ง	reminder	11
3231323430363139	IN:CREATE_REMINDER	เตือนให้ฉันทิ้งขยะในคืนวันอังคาร	reminder	11
3231323430353131	IN:CREATE_REMINDER	เตือนฉันให้ซื้อขนมปังวันนี้	reminder	11
3231323430343538	IN:CREATE_REMINDER	เตือนให้ฉันเซ็นชื่อในเอกสารอนุญาตออกนอกสถานที่	reminder	11
3231323430333831	IN:CREATE_REMINDER	เตือนให้ฉันตื่นขึ้นมาทำงานตอนเช้าเวลา 9:30 น.	reminder	11
3231323430333037	IN:CREATE_REMINDER	เตือนฉันให้ไปซื้อแก๊สวันนี้	reminder	11
3231323430323031	IN:CREATE_REMINDER	เตือนให้ฉันกินยาตอน 13.00 น.	reminder	11
3231323430313331	IN:CREATE_REMINDER	เพิ่มนาฬิกาปลุกเพื่อไปรับลูก	reminder	11
3231323430313038	IN:CREATE_REMINDER	ฉันต้องการการแจ้งเตือนการนัดหมายตอน 16:00 น. สำหรับการนัดหมายของฉันวันพรุ่งนี้	reminder	11
3231323339393337	IN:CREATE_REMINDER	เตือนฉันว่าฉันมีนัดกับหมอในวันที่ 5	reminder	11
3231323339393332	IN:CREATE_REMINDER	เตือนให้ฉันซื้ออาหารสุนัขในวันพรุ่งนี้	reminder	11
3231323339383638	IN:CREATE_REMINDER	เตือนฉันให้โทรหาแม่ของฉัน	reminder	11
3231323339383532	IN:CREATE_REMINDER	เตือนฉันถึงการนัดกับหมอฟัน	reminder	11
3231323339363332	IN:CREATE_REMINDER	เตือนให้ฉันปิดไฟ	reminder	11
3231323339353836	IN:CREATE_REMINDER	เตือนให้ฉันไปรับพัสดุในวันอังคาร	reminder	11
3231323339343634	IN:CREATE_REMINDER	เตือนให้ฉันกินยา	reminder	11
3231323339343533	IN:CREATE_REMINDER	เตือนให้ฉันกินยาคุมกำเนิดของฉัน	reminder	11
3231323339333031	IN:CREATE_REMINDER	เตือนให้ซื้อไข่ในวันพรุ่งนี้	reminder	11
3231323339303539	IN:CREATE_REMINDER	เตือนให้นัดหมายที่ปรึกษา	reminder	11
3231323339303536	IN:CREATE_REMINDER	เตือนฉันว่าโรงเรียนเริ่มวันพุธ เวลา 9 โมงเช้า	reminder	11
3231323338393132	IN:CREATE_REMINDER	เตือนให้ฉันซื้อของขวัญให้จาน่า	reminder	11
3231323338363935	IN:CREATE_REMINDER	ช่วยเตือนฉันเกี่ยวกับการประชุมทางธุรกิจครั้งถัดไป	reminder	11
3231323338353931	IN:CREATE_REMINDER	เตือนให้ฉันทำความสะอาดกล่องขยะ	reminder	11
3231323338343334	IN:CREATE_REMINDER	เพิ่มการซักผ้าเข้าไปในการเตือนความจำ	reminder	11
3231323338343230	IN:CREATE_REMINDER	เตือนฉันเรื่องการนัดกับทันตแพทย์ในวันเสาร์	reminder	11
3231323338343031	IN:CREATE_REMINDER	เตือนให้ฉันไปรับผ้าซักแห้งก่อนที่ร้านจะปิดด้วย	reminder	11
3231323338323334	IN:CREATE_REMINDER	เตือนให้ฉันอัปเดตแอปฯ ของฉันคืนนี้	reminder	11
3231323338303933	IN:CREATE_REMINDER	เตือนให้ฉันเปลี่ยนนาฬิกาปลุกของฉันจาก 7 โมงเช้าเป็น 6 โมงเช้าสำหรับวันจันทร์หน้า	reminder	11
3231323338303132	IN:CREATE_REMINDER	เตือนให้ฉันปรับอุณหภูมิใน 15 นาที	reminder	11
3231323337393534	IN:CREATE_REMINDER	เตือนให้ฉันซื้อดอกไม้ระหว่างทางกลับบ้าน	reminder	11
3231323337383932	IN:CREATE_REMINDER	ตั้งการแจ้งเตือนสำหรับวันพรุ่งนี้เวลา 6 โมงเช้า	reminder	11
3231323337383833	IN:CREATE_REMINDER	เตือนให้ฉันนำขยะออกไปทิ้งคืนนี้เวลา 22:00 น.	reminder	11
3231323337383632	IN:CREATE_REMINDER	ฉันต้องการตั้งการเตือนความจำหรือวันอังคาร	reminder	11
3231323337373733	IN:CREATE_REMINDER	เตือนให้ฉันจ่ายค่าเช่าในวันที่ 31 ในตอนเย็น	reminder	11
3231323337373437	IN:CREATE_REMINDER	เตือนให้ฉันซื้อกระดาษชำระวันนี้	reminder	11
3231323337363532	IN:CREATE_REMINDER	เตือนให้ฉันไปซื้อนม	reminder	11
3231323337353537	IN:CREATE_REMINDER	เตือนฉันให้ไปซื้อไข่หลังเลิกงานคืนนี้	reminder	11
3231323337353437	IN:CREATE_REMINDER	เตือนให้ขับรถพาสามีกลับบ้าน	reminder	11
3231323337353238	IN:CREATE_REMINDER	เตือนฉันให้ยื่นภาษีในวันที่ 1 เมษายน	reminder	11
3231323337343336	IN:CREATE_REMINDER	เตือนความจำเกี่ยวกับโบสถ์ในวันพุธ	reminder	11
3231323337333734	IN:CREATE_REMINDER	ตั้งการแจ้งเตือนเป็นเวลา 30 วัน	reminder	11
3231323337313437	IN:CREATE_REMINDER	เตือนฉันให้ซื้อเครื่องดื่มเมื่อไปเติมน้ำมัน	reminder	11
3231323337313138	IN:CREATE_REMINDER	เตือนฉันว่าเดอะวอล์กกิงเดดจะมาวันอาทิตย์ตอน 19:00 น.	reminder	11
3231323337303635	IN:CREATE_REMINDER	เตือนฉันให้จ่ายบิลค่าโทรศัพท์ของฉันสัปดาห์หน้า	reminder	11
3231323337303331	IN:CREATE_REMINDER	เตือนให้ฉันคืนหนังสือห้องสมุดในวันศุกร์ของฉัน	reminder	11
3231323336383835	IN:CREATE_REMINDER	เตือนให้ฉันจ่ายค่าเช่าในวันพุธ	reminder	11
3231323336373332	IN:CREATE_REMINDER	แจ้งเตือนฉันเกี่ยวกับทัวร์รถเข็นในวันที่ 24 สิงหาคม	reminder	11
3231323336353635	IN:CREATE_REMINDER	ตั้งค่าการเตือนสำหรับวันครบกำหนดส่งภาคนิพนธ์	reminder	11
3231323336353631	IN:CREATE_REMINDER	เตือนให้ฉันจัดกำหนดการไปรับของที่ร้านขายของชำ	reminder	11
3231323336323732	IN:CREATE_REMINDER	ตั้งค่าการเตือนเพื่อดูรายการทีวีในวันที่ 13 มิถุนายน	reminder	11
3231323336323438	IN:CREATE_REMINDER	เตือนฉันให้ทำการบ้านวันนี้ตอน 16:00 น.	reminder	11
3231323336323430	IN:CREATE_REMINDER	เตือนให้ฉันทำความสะอาดไมโครเวฟคืนนี้	reminder	11
3231323336313632	IN:CREATE_REMINDER	แจ้งเตือนบัลเลต์วันศุกร์เวลา 15:30 น.	reminder	11
3231323336313432	IN:CREATE_REMINDER	สร้างการแจ้งเตือนสำหรับการนัดทำผมของฉันในเวลาบ่าย 3 วันศุกร์	reminder	11
3231323336303631	IN:CREATE_REMINDER	เตือนฉันเกี่ยวกับวันครอบครัวในวันพรุ่งนี้	reminder	11
3231323335383335	IN:CREATE_REMINDER	ฉันไม่อยากลืมชาร์จโทรศัพท์	reminder	11
3231323335373633	IN:CREATE_REMINDER	เตือนให้ฉันกินยาเวลา 22:00 น.	reminder	11
3231323335373134	IN:CREATE_REMINDER	เตือนให้ฉันหยุดพัก	reminder	11
