ID	intent	text	domain	label
39353034323233	IN:GET_STORIES_NEWS	มีอัปเดตข่าวใด ๆ สำหรับวันนี้หรือไม่?	news	78
39353032323736	IN:GET_STORIES_NEWS	ขอพาดหัวข่าวลอนดอนด้วย	news	78
39353031343134	IN:GET_STORIES_NEWS	มีอะไรน่าสนใจในส่วนข่าวบันเทิงบ้างไหม?	news	78
39353030353632	IN:GET_STORIES_NEWS	แสดงให้ฉันดูหัวข้อทั้งหมดเกี่ยวกับกีฬานิวอิงแลนด์	news	78
39343937383231	IN:GET_STORIES_NEWS	เรื่องเด่นของวันนี้คือเรื่องอะไร?	news	78
39343839383836	IN:GET_STORIES_NEWS	ข่าวสุขภาพล่าสุดคือข่าวอะไร	news	78
39343837343330	IN:GET_STORIES_NEWS	การอัปเดตข่าวล่าสุดมีอะไรบ้าง	news	78
39343836363032	IN:GET_STORIES_NEWS	เกิดอะไรกับข่าวของตระกูล คาร์ดาเชียน	news	78
39343739353335	IN:GET_STORIES_NEWS	ข่าวพาดหัวทางเอ็มเอสเอ็นบีซีคืออะไร?	news	78
39343736333331	IN:GET_STORIES_NEWS	อ่านหัวข้อสำหรับวันนี้ให้ฉันฟัง	news	78
39343736323438	IN:GET_STORIES_NEWS	ข่าวคราวของทัลซา โอคลาโฮมาคืออะไร	news	78
39343736303638	IN:GET_STORIES_NEWS	คุณช่วยบอกข่าวเกี่ยวกับกวมและเกาหลีเหนือให้ฉันได้ไหม	news	78
39343732353732	IN:GET_STORIES_NEWS	บอกฉันทีว่ามีข่าวอะไรในวันนี้	news	78
39343730303536	IN:GET_STORIES_NEWS	อัปเดตข่าวให้ฉันบ้าง	news	78
39343639363034	IN:GET_STORIES_NEWS	การพิจารณาคดีของศาลใดที่อยู่ในข่าว	news	78
39343638323030	IN:GET_STORIES_NEWS	ให้ข้อมูลเพิ่มเติมเกี่ยวกับข่าวงูที่หนีไป	news	78
39343637333135	IN:GET_STORIES_NEWS	มีหัวข้อใด ๆ เกี่ยวกับเรื่องอื้อฉาวเอ็นเอฟแอลไหม?	news	78
39343636373435	IN:GET_STORIES_NEWS	ข่าวเกี่ยวกับฌอน สไปเซอร์	news	78
3135333032363036	IN:GET_STORIES_NEWS	ขอข่าวท้องถิ่นของฉันด้วย	news	78
3135323938353939	IN:GET_STORIES_NEWS	อุบัติเหตุทางรถยนต์กลายเป็นพาดหัวในข่าว	news	78
3135323933373336	IN:GET_STORIES_NEWS	หัวข้อข่าววันนี้	news	78
39353831343039	IN:GET_STORIES_NEWS	ช่วยบอกฉันเกี่ยวกับพาดหัวข่าวระดับโลก	news	78
39353731363231	IN:GET_STORIES_NEWS	หัวข้อหลักในยูเอสเอวันนี้คืออะไร?	news	78
39353639313934	IN:GET_STORIES_NEWS	ช่วยบอกรายละเอียดเกี่ยวกับเกาหลีเหนือให้กับฉัน	news	78
39353635343730	IN:GET_STORIES_NEWS	คุณช่วยแสดงให้ฉันเห็นข่าวเพิ่มเติมเกี่ยวกับเอเชียได้ไหม?	news	78
39353632393236	IN:GET_STORIES_NEWS	ข่าวจากฮาวายมีอะไรบ้าง?	news	78
39353438323834	IN:GET_STORIES_NEWS	แจ้งการอัปเดตข่าวล่าสุดให้ฉัน	news	78
39353237323632	IN:GET_STORIES_NEWS	ข่าวการอพยพเข้าสหรัฐอเมริกา	news	78
39353038353133	IN:GET_STORIES_NEWS	หัวข้อข่าวสำหรับวันนี้	news	78
39353030353939	IN:GET_STORIES_NEWS	เอาข่าวท้องถิ่นให้ฉัน	news	78
39343836313930	IN:GET_STORIES_NEWS	ข่าวเด่นจากเดอะนิวยอร์กไทม์คืออะไร?	news	78
39343833303537	IN:GET_STORIES_NEWS	มีอะไรไม่ดีในข่าวแห่งชาติไหม?	news	78
39343730303839	IN:GET_STORIES_NEWS	พาดหัวข่าวในสเปนคืออะไร?	news	78
39343637343237	IN:GET_STORIES_NEWS	แสดงให้ฉันเห็นหัวข้อล่าสุด	news	78
39343636343039	IN:GET_STORIES_NEWS	อัปเดตข่าวท้องถิ่น	news	78
39343636303732	IN:GET_STORIES_NEWS	แจ้งข่าวอันดับต้นให้ฉัน	news	78
3231323433333334	IN:GET_STORIES_NEWS	แสดงข่าวจากนิวยอร์กไทมส์ให้ฉันดูหน่อย	news	78
3139383539343134	IN:GET_STORIES_NEWS	ฉันต้องการทราบข่าวจาก Newsy	news	78
3136343035373238	IN:GET_STORIES_NEWS	อ่านพาดหัวข่าวบางส่วนจากปี 1999	news	78
3136343035323833	IN:GET_STORIES_NEWS	อ่านพาดหัวข่าวบันเทิงให้ฉัน	news	78
3136343034373533	IN:GET_STORIES_NEWS	มีข่าวบิล คลินตันเมื่อเร็ว ๆ นี้ไหม	news	78
3136343034363938	IN:GET_STORIES_NEWS	โปรดอ่านรายละเอียดเกี่ยวกับการประท้วงที่กำลังเกิดขึ้นในเวอร์จิเนียตอนนี้	news	78
3136343034343730	IN:GET_STORIES_NEWS	วันนี้มีเรื่องใหญ่ไหม	news	78
3136333731363631	IN:GET_STORIES_NEWS	พาดหัวข่าวของเมื่อวานซืนมีอะไรบ้าง	news	78
3136333731343936	IN:GET_STORIES_NEWS	มีพัฒนาการใด ๆ ในคดี CASEY ANYTHING ไหม	news	78
3136333337353634	IN:GET_STORIES_NEWS	ข่าวบอกว่าเกิดอะไรขึ้นเมื่อคืนนี้	news	78
3136303030343035	IN:GET_STORIES_NEWS	มีข่าวท้องถิ่นอะไรบ้าง	news	78
3136303030333530	IN:GET_STORIES_NEWS	บอกฉันเกี่ยวกับรายละเอียดเพิ่มเติมเกี่ยวกับวันครบรอบการเสียชีวิตของเจ้าหญิงไดอาน่าได้ไหม	news	78
3136303030323934	IN:GET_STORIES_NEWS	ช่วยอ่านรายละเอียดเกี่ยวกับการขึ้นศาลของเทย์เลอร์ สวิฟต์หน่อย	news	78
3136303030323932	IN:GET_STORIES_NEWS	อ่านรายละเอียดเกี่ยวกับความขัดแย้งกับเกาหลีเหนือให้ฉันฟัง	news	78
3136303030303438	IN:GET_STORIES_NEWS	มีข่าวอะไรเกี่ยวกับนินเท็นโด สวิตช์บ้าง	news	78
3135333032343338	IN:GET_STORIES_NEWS	อ่านพาดหัวข่าวให้ฉันฟัง	news	78
3135333031353534	IN:GET_STORIES_NEWS	ช่วยบอกข่าวการเลือกตั้งในเมืองลูซเดลที่จัดขึ้นในวันอังคารเพิ่มเติมให้ฉันหน่อย	news	78
3135333030313638	IN:GET_STORIES_NEWS	เรื่องเด่นของช่องฟ็อกซ์นิวส์มีอะไรบ้าง>	news	78
3135333030313131	IN:GET_STORIES_NEWS	มีอะไรในข่าวช่อง 2	news	78
3135323939313239	IN:GET_STORIES_NEWS	พาดหัวข่าวหลักช่วงเย็นนี้คืออะไร	news	78
3135323937333639	IN:GET_STORIES_NEWS	ข่าวล่าสุดจากเกาหลีเหนือ	news	78
3135323937303138	IN:GET_STORIES_NEWS	ขอดูข่าวจากฟอกซ์หน่อย	news	78
3135323936353235	IN:GET_STORIES_NEWS	ค้นหาข่าวปลอม	news	78
3135323935323631	IN:GET_STORIES_NEWS	ข่าวพาดหัวระดับประเทศ	news	78
3135323934383734	IN:GET_STORIES_NEWS	แจ้งหัวข้อข่าวทั้งหมดที่เกี่ยวกับการตายของเชสเตอร์ เบนนิงตัน	news	78
3135323932363434	IN:GET_STORIES_NEWS	มีเรื่องราวไหนที่กล่าวถึงแฟรงคลิน วิลเลจไหม	news	78
3135323932353835	IN:GET_STORIES_NEWS	มีข่าวใหญ่ด้านการเงินไหม	news	78
3135323932343539	IN:GET_STORIES_NEWS	พาดหัวข่าวในตอนนี้พูดถึงโดนัลด์ ทรัมป์อย่างไร	news	78
3135323930333933	IN:GET_STORIES_NEWS	ข่าวล่าสุดคือข่าวอะไร	news	78
3135323930323135	IN:GET_STORIES_NEWS	บอกข้อมูลใหม่เกี่ยวกับเรื่องอื้อฉาวทางการเมือง	news	78
3135323839343530	IN:GET_STORIES_NEWS	บอกข่าวเยอรมนีรายสัปดาห์ให้ฉันหน่อย	news	78
3135323839323236	IN:GET_STORIES_NEWS	พาดหัวเด่น ๆ ของข่าวในประเทศมีอะไรบ้าง	news	78
39353831373933	IN:GET_STORIES_NEWS	มีพาดหัวข่าวใหญ่ไหมวันนี้?	news	78
39353831303136	IN:GET_STORIES_NEWS	บอกพาดหัวข่าวของช่องฟ็อกซ์นิวส์ให้ฉันหน่อย	news	78
39353830383037	IN:GET_STORIES_NEWS	พาดหัวข่าวใหญ่ของช่องฟ็อกซ์นิวส์คืออะไร	news	78
39353830353831	IN:GET_STORIES_NEWS	อ่านข่าวล่าสุดของฉัน	news	78
39353739363832	IN:GET_STORIES_NEWS	มีข่าวเกี่ยวกับคลินตันอีกหรือไม่?	news	78
39353739343330	IN:GET_STORIES_NEWS	โปรดเสนอข่าวสำหรับวันนี้	news	78
39353738333532	IN:GET_STORIES_NEWS	เสนอข่าวพาดหัวล่าสุดจากเอ็มเอสเอ็นบีซีให้ฉัน	news	78
39353737383138	IN:GET_STORIES_NEWS	พาดหัวข่าวของวันนี้	news	78
39353736383835	IN:GET_STORIES_NEWS	ข่าวท้องฟ้ามีอะไรอัปเดตบ้าง	news	78
39353736323735	IN:GET_STORIES_NEWS	ขอฉันฟังข่าวเกี่ยวกับข่าวบันเทิงในพื้นที่	news	78
39353732383734	IN:GET_STORIES_NEWS	ข่าวเกี่ยวกับประธานาธิบดีจากเช้านี้	news	78
39353732333339	IN:GET_STORIES_NEWS	มีข่าวอะไรในส่วนข่าวท้องถิ่น	news	78
39353731393531	IN:GET_STORIES_NEWS	เรื่องเด่นในซีเอ็นเอ็น	news	78
39353639383535	IN:GET_STORIES_NEWS	ช่วยให้รายละเอียดเกี่ยวกับการเยี่ยมเยียนของทรัมป์ที่เม็กซิโกได้ไหม	news	78
39353638393838	IN:GET_STORIES_NEWS	มีข่าวล่าสุดอะไรบ้างเกี่ยวกับการเหยียดสีผิว	news	78
39353638343634	IN:GET_STORIES_NEWS	บอกอัปเดตข่าวให้หน่อย	news	78
39353635343239	IN:GET_STORIES_NEWS	มีเทรนด์ใดในข่าวตอนนี้?	news	78
39353633353839	IN:GET_STORIES_NEWS	แสดงรายการพาดหัวข่าว	news	78
39353632393432	IN:GET_STORIES_NEWS	พาดหัวข่าวระดับชาติ	news	78
39353632393330	IN:GET_STORIES_NEWS	บอกข่าววันนี้หน่อย	news	78
39353632373539	IN:GET_STORIES_NEWS	พาดหัวข่าวกีฬาในวันนี้มีอะไรบ้าง?	news	78
39353632353030	IN:GET_STORIES_NEWS	แสดงพาดหัวข่าวสำหรับวันนี้	news	78
39353539333930	IN:GET_STORIES_NEWS	มีข่าวเกี่ยวกับการทำให้กัญชาถูกกฎหมายในเขตโซโนมาไหม	news	78
3231333533353634	IN:UPDATE_CALL	เชิญให้อัลลิสันทำการโทร	calling	79
3231333431393031	IN:UPDATE_CALL	เชิญแม่มาเพิ่มเพื่อทำการโทร	calling	79
3231333431373638	IN:UPDATE_CALL	เชิญแบรดไปยังการโทร	calling	79
3231333431373438	IN:UPDATE_CALL	เพิ่มแม่ไปยังสายปัจจุบัน	calling	79
3231333431323733	IN:UPDATE_CALL	เชิญพ่อไปยังสายของฉัน	calling	79
3231333430363538	IN:UPDATE_CALL	เพิ่มเมลิสสาลงในการโทร	calling	79
3231333430343039	IN:UPDATE_CALL	เพิ่มมาร์จีนน้าของฉันไปยังการโทรนี้	calling	79
3231333339363034	IN:UPDATE_CALL	แพตช์ อเล็กซ์ใช้สายนี้	calling	79
3231333039383339	IN:UPDATE_CALL	เราสามารถเพิ่มญาติของฉันในวิดีโอแชทได้หรือไม่?	calling	79
3231303137373238	IN:UPDATE_CALL	เราสามารถใส่ซูซีในการโทรนี้ด้วยได้ไหม	calling	79
3231363735383137	IN:UPDATE_CALL	เพิ่มอลิสันไปยังการโทรของฉันกับแซก	calling	79
3231353438323731	IN:UPDATE_CALL	เพิ่มแม่เข้าไปในการโทร	calling	79
3231343839343330	IN:UPDATE_CALL	เพิ่มเจรัลดีน สติกลิตซ์	calling	79
3231333131373538	IN:UPDATE_CALL	คุณสามารถเพิ่มคุณปู่ไปยังการโทรของฉันได้ไหม	calling	79
3232313330363234	IN:UPDATE_CALL	นำลูคัส มีโดวส์ออกจากสายนี้	calling	79
3232313330353734	IN:UPDATE_CALL	ให้วาเนสซา ซัมเมอร์ออกจากการประชุมสาย	calling	79
3231373234323636	IN:UPDATE_CALL	เพิ่มเดวิดไปในการโทรของฉัน	calling	79
3231363736323935	IN:UPDATE_CALL	นำแซมออกไปจากการโทรปัจจุบันของฉัน	calling	79
3231363039383533	IN:UPDATE_CALL	คุณช่วยเพิ่มชานิคัว คิมเมอร์เข้ามาได้ไหม?	calling	79
3231363039383339	IN:UPDATE_CALL	คุณจะเพิ่มไปใน Pasty Inks ไหม?	calling	79
3231363039383239	IN:UPDATE_CALL	คุณช่วยเพิ่มมาซี แอคช์เตอร์เข้ามาหน่อยได้ไหม?	calling	79
3231363039383231	IN:UPDATE_CALL	ช่วยเพิ่ม Nickole Vasquiz เข้ามา	calling	79
3231363039383230	IN:UPDATE_CALL	ช่วยเพิ่มพอลลี่ บิงเจลีเข้ามาหน่อย	calling	79
3231363039373635	IN:UPDATE_CALL	คุณต้องการเพิ่มเมแกนหรือไม่?	calling	79
3231353438303434	IN:UPDATE_CALL	ฉันต้องการให้ลบภรรยาออกจากสายนี้	calling	79
3231353437393530	IN:UPDATE_CALL	เพิ่มเฮเลนไปยังสายนี้	calling	79
3231353437383739	IN:UPDATE_CALL	กรุณาเพิ่มเซบาสเตียโนในการโทรครั้งนี้	calling	79
3231353336343832	IN:UPDATE_CALL	ลบป้าของฉันออกจากสาย	calling	79
3231353336343733	IN:UPDATE_CALL	ลบคุณย่าของฉันออกจากการโทรผ่านวิดีโอคอล	calling	79
3231353336343239	IN:UPDATE_CALL	วางสายเคทจากการวิดีโอคอล	calling	79
3231343839343534	IN:UPDATE_CALL	เพิ่มเพย์ตัน	calling	79
3231343839343434	IN:UPDATE_CALL	เพิ่มอะบิเกล	calling	79
3231343839343331	IN:UPDATE_CALL	เพิ่มองค์กรการกุศลสตาร์ชแมน	calling	79
3231343030393034	IN:UPDATE_CALL	กรุณาเพิ่มฉันกลับเข้าสู่การประชุมสาย	calling	79
3231333534333939	IN:UPDATE_CALL	เพิ่มคู่สมรสในสายนี้	calling	79
3138393837383834	IN:GET_AGE	แม็กกี้จะอายุ 47 ปีในปีนี้ใช่ไหม	people	80
3138393837363435	IN:GET_AGE	พ่ออายุเท่าไร	people	80
3138393838333632	IN:GET_AGE	บอกฉันว่าเคดอายุเท่าไร	people	80
3138393838333032	IN:GET_AGE	จีน่ามีอายุมากกว่าฉันใช่ไหม	people	80
3138393837383933	IN:GET_AGE	มัลคอล์มมีอายุกี่ปี	people	80
3138393837373630	IN:GET_AGE	Jahmir อายุเท่าไร?	people	80
3138393837333737	IN:GET_AGE	เคทจะมีอายุเท่าไรในวันเกิดของเธอ?	people	80
3132353634353837	IN:PREVIOUS_TRACK_MUSIC	ฉันอยากฟังเพลงสุดท้ายนั้นอีกครั้ง	music	81
3132353731343731	IN:PREVIOUS_TRACK_MUSIC	ฉันต้องการฟังเพลงสุดท้ายอีกครั้ง	music	81
3132353639383430	IN:PREVIOUS_TRACK_MUSIC	เล่นเพลงก่อนหน้านี้อีกครั้ง	music	81
3132353637373138	IN:PREVIOUS_TRACK_MUSIC	เล่นเพลงก่อนหน้า	music	81
3132353635313439	IN:PREVIOUS_TRACK_MUSIC	ช่วยเล่นเพลงสุดท้ายซ้ำ	music	81
39353637353239	IN:PREVIOUS_TRACK_MUSIC	เล่นเพลงสุดท้าย	music	81
39343635333639	IN:SUBTRACT_TIME_TIMER	ลบสองนาทีจากตัวจับเวลา	timer	82
39353732343835	IN:SUBTRACT_TIME_TIMER	ลบอกจากตัวจับเวลา 20 นาที	timer	82
39343737393638	IN:SUBTRACT_TIME_TIMER	ลดการจับเวลาของฉันลง 5 นาที	timer	82
3232333731313232	IN:SUBTRACT_TIME_TIMER	แยมโรลเหล่านี้มีสีน้ำตาลเข้มเกินไป ลดเวลาอบขนมปังลง 5 นาที	timer	82
3232333437373935	IN:SUBTRACT_TIME_TIMER	ลบ 15 นาทีออกจากตัวจับเวลาการอ่าน	timer	82
3232313136343034	IN:SUBTRACT_TIME_TIMER	ใช้เวลาจากตัวจับเวลาของฉัน	timer	82
3135323938373437	IN:SUBTRACT_TIME_TIMER	ลบ 5 นาทีออกจากเครื่องจับเวลา	timer	82
3135323936303339	IN:SUBTRACT_TIME_TIMER	ลดเวลาในนาฬิกาจับเวลา 6 นาที	timer	82
39353730383932	IN:QUESTION_MUSIC	อัลบั้มใดที่ทำรายได้รวมสูงสุดในอเมริกาปีนี้	music	83
39353830353932	IN:QUESTION_MUSIC	อัลบั้มใหม่ของเซลีนา โกเมซคืออะไร	music	83
39353036343738	IN:QUESTION_MUSIC	มิก แจ็กเกอร์เล่นเครื่องดนตรีใด ๆ ได้ไหม	music	83
3132363036313030	IN:QUESTION_MUSIC	ใครเป็นมือกลองที่ยอดเยี่ยมที่สุดตลอดกาล	music	83
3231363032323331	IN:SILENCE_ALARM	ปิดใช้งานการปลุก	alarm	85
39353637383138	IN:SILENCE_ALARM	ปิดการแจ้งเตือน	alarm	85
39353538313535	IN:SILENCE_ALARM	ข้ามการแจ้งเตือน	alarm	85
39353338323938	IN:SILENCE_ALARM	หยุดการเตือนทั้งหมดสำหรับวัน	alarm	85
39343938363231	IN:SILENCE_ALARM	ปิดการแจ้งเตือนตอนนี้	alarm	85
39343732373339	IN:SILENCE_ALARM	รีเซ็ตการแจ้งเตือนทั้งหมด	alarm	85
3231363032303735	IN:SILENCE_ALARM	ปิดการตั้งการปลุก	alarm	85
3231353535363432	IN:SILENCE_ALARM	ช่วยหยุดการตั้งปลุกด้วย	alarm	85
39353439383531	IN:SILENCE_ALARM	ปิดการแจ้งเตือนทั้งหมด	alarm	85
39353435373339	IN:SILENCE_ALARM	รีเซ็ตการปลุกทั้งหมด	alarm	85
3231363336393333	IN:SILENCE_ALARM	ช่วยปิดการเตือนของฉันที่กำลังทำงานอยู่ด้วย	alarm	85
3231353534363632	IN:CREATE_ALARM	สร้างการแจ้งเตือนใหม่สำหรับฉันในวันพฤหัสบดีเวลา 8:00 น.	alarm	87
3231353534343833	IN:CREATE_ALARM	สร้างการแจ้งเตือนสำหรับวันที่ 4 พฤษภาคมเวลา 17:00 น.	alarm	87
3231353533373438	IN:CREATE_ALARM	สร้างการปลุกซ้ำสำหรับวันอังคารและวันพุธ	alarm	87
3231353533353530	IN:CREATE_ALARM	สร้างการแจ้งเตือนสำหรับเวลา 5.55 น. และ 6.00 น. วันพฤหัสบดีนี้	alarm	87
3231353533343631	IN:CREATE_ALARM	ทำการแจ้งสำหรับวันนี้ในภายหลังเวลา 11:00 น. และ 23:05 น.	alarm	87
3231353533333535	IN:CREATE_ALARM	ช่วยปลุกเวลา 21:00 น. และ 22:00 น.	alarm	87
3231353532333237	IN:CREATE_ALARM	ทำเสียงปลุกซ้ำทุกวันเวลา 11:00 น.	alarm	87
3231353532323233	IN:CREATE_ALARM	สร้างการแจ้งเตือนให้ออกเดินทางเวลา 10:00 น. ทุกเช้าวันอาทิตย์	alarm	87
3231353531373636	IN:CREATE_ALARM	ตั้งปลุกตอน 8 โมงทุกวันจันทร์เป็นเวลา 4 สัปดาห์	alarm	87
3231353531333631	IN:CREATE_ALARM	ตั้งการแจ้งเตือนเวลานอนสำหรับวันนี้	alarm	87
3231353531333138	IN:CREATE_ALARM	ตั้งปลุกแบบเบา ๆ ตอนนี้	alarm	87
3231353531313730	IN:CREATE_ALARM	สร้างการแจ้งเตือนสำหรับโอลิเวอร์ เวลา 19:00 น.	alarm	87
3231353531303438	IN:CREATE_ALARM	ตั้งเวลาปลุกสำหรับการงีบวันนี้ตอน 18:00 น.	alarm	87
3231353438363636	IN:CREATE_ALARM	เตรียมการแจ้งเตือนใหม่สำหรับพรุ่งนี้เช้า	alarm	87
3231353438363333	IN:CREATE_ALARM	ทำการแจ้งเตือนสำหรับพรุ่งนี้ตอนเย็นด้วย	alarm	87
3231353438363234	IN:CREATE_ALARM	ตั้งนาฬิกาปลุกให้ฉันสำหรับตอนเช้า	alarm	87
3230393939353537	IN:CREATE_ALARM	ตั้งเวลาปลุกตอน 5:40 น.	alarm	87
3136353036343534	IN:CREATE_ALARM	ปิดการแจ้งเตือนทุกสองชั่วโมงในช่วงที่เหลือของวัน	alarm	87
3136353036333039	IN:CREATE_ALARM	เปิดการแจ้งเตือนของฉันทั้งหมด	alarm	87
3135323936343231	IN:CREATE_ALARM	ตั้งเวลาสำหรับเวลา 10:00 น. วันศุกร์	alarm	87
3135323935393830	IN:CREATE_ALARM	ตั้งปลุกสำหรับ 7 โมงเช้าวันเว้นวันโดยเริ่มในวันนี้	alarm	87
3135323934363234	IN:CREATE_ALARM	ตั้งเวลาปลุก 3 นาทีจากนี้	alarm	87
3135323933323034	IN:CREATE_ALARM	ตั้งเวลาปลุกทุก ๆ 20 วินาที	alarm	87
3135323930383839	IN:CREATE_ALARM	ตั้งนาฬิกาปลุกตอน 7 โมงเช้าทุกวันเดือนนี้	alarm	87
