ID	intent	text	domain	label
3231333130313236	IN:UPDATE_CALL	Rajoute papy à cet appel	calling	79
3231333130303337	IN:UPDATE_CALL	invite mon beau-frère à rejoindre l'appel	calling	79
3138393838363637	IN:GET_AGE	Quel âge a Melinda ?	people	80
3138393838333132	IN:GET_AGE	Quel âge a Kus ?	people	80
3138393838323032	IN:GET_AGE	Donne-moi l'âge de Nancy	people	80
3138393838313632	IN:GET_AGE	Quel âge a Liz ?	people	80
3138393838303936	IN:GET_AGE	Est-ce que Marius a 82 ans	people	80
3138393837383438	IN:GET_AGE	Quel âge aura Liam en février	people	80
3138393837383135	IN:GET_AGE	Quel âge va avoir Sue	people	80
3138393837303935	IN:GET_AGE	Jean a 21 ans ou plus ?	people	80
39343932383439	IN:PREVIOUS_TRACK_MUSIC	puis-je réécouter la dernière chanson	music	81
3230303431393336	IN:PREVIOUS_TRACK_MUSIC	s'il te plaît, mets le morceau joué avant celui-ci	music	81
3132363230393338	IN:PREVIOUS_TRACK_MUSIC	Peux-tu rejouer la dernière chanson	music	81
3132363133363936	IN:PREVIOUS_TRACK_MUSIC	Rejouer la dernière chanson	music	81
3132353935363538	IN:PREVIOUS_TRACK_MUSIC	Puis-je réécouter la dernière chanson ?	music	81
39353134373735	IN:SUBTRACT_TIME_TIMER	Retire 15 min du chronomètre	timer	82
39343832383931	IN:SUBTRACT_TIME_TIMER	retire 11 minutes de la minuterie	timer	82
3232313938333839	IN:SUBTRACT_TIME_TIMER	diminue de 11 minutes ma minuterie Tu n’as pas fini de courir tant que ça n'a pas explosé	timer	82
3135333031353838	IN:SUBTRACT_TIME_TIMER	retire une heure de ma minuterie	timer	82
39353830373136	IN:SUBTRACT_TIME_TIMER	Efface quelques minutes de mon temps de course.	timer	82
39353638363333	IN:SUBTRACT_TIME_TIMER	enlève 5 minutes à la minuterie	timer	82
39353134353835	IN:SUBTRACT_TIME_TIMER	Réduis le temps sur mon chronomètre de 15 secondes.	timer	82
39343736313736	IN:SUBTRACT_TIME_TIMER	Ajuste la minuterie pour qu'elle se déclenche dans 10 minutes.	timer	82
39353831373135	IN:QUESTION_MUSIC	Combien d'albums les Judds ont-ils sortis ?	music	83
39353737323631	IN:QUESTION_MUSIC	Quel est le nom du dernier album de Pink ?	music	83
39343636373631	IN:QUESTION_MUSIC	Quelle est la dernière chanson de Selena Gomez	music	83
3132363339343138	IN:QUESTION_MUSIC	Qui est-ce qui chante sur la chanson du générique de Frasier?	music	83
3231363336363535	IN:SILENCE_ALARM	éteindre	alarm	85
3231363032323737	IN:SILENCE_ALARM	arrête la sonnerie	alarm	85
3231363032323431	IN:SILENCE_ALARM	plus d’alarme	alarm	85
3231363032323337	IN:SILENCE_ALARM	coupe le son, s'il te plaît	alarm	85
3231363032313635	IN:SILENCE_ALARM	arrête l'alarme	alarm	85
3231363032313131	IN:SILENCE_ALARM	Éteins mon réveil s'il te plaît.	alarm	85
3231353535363930	IN:SILENCE_ALARM	J'ai besoin que tu éteignes l'alarme	alarm	85
3231353535363834	IN:SILENCE_ALARM	coupe le son de l’alarme	alarm	85
3231353535353736	IN:SILENCE_ALARM	Chut, s'il te plaît	alarm	85
39343733353232	IN:SILENCE_ALARM	Arrête l'alarme, s'il te plaît.	alarm	85
3231363337383037	IN:SILENCE_ALARM	Alarme silence	alarm	85
3231353534323736	IN:CREATE_ALARM	Programme une alarme pour le 25 mai à midi	alarm	87
3231353533353331	IN:CREATE_ALARM	Programme des alarmes pour demain 7 h 30 et 17 h 30.	alarm	87
3231353533343930	IN:CREATE_ALARM	Programme les alarmes pour 9 h et 22 h.	alarm	87
3231353533343733	IN:CREATE_ALARM	Programme des alarmes à minuit et 6 h	alarm	87
3231353532343035	IN:CREATE_ALARM	Programme une alarme récurrente pour qu'elle se déclenche à 15 h tous les jeudis pendant 6 semaines	alarm	87
3231353532333935	IN:CREATE_ALARM	Programme une alarme qui retentira tous les jeudis matin à 6 h	alarm	87
3231353532333933	IN:CREATE_ALARM	Programme des alarmes pour mercredi à 6 h	alarm	87
3231353532323934	IN:CREATE_ALARM	Réveille-moi à 7 heures tous les matins	alarm	87
3231353532303636	IN:CREATE_ALARM	Programmons un réveil régulier le lundi à 19 h.	alarm	87
3231353531393235	IN:CREATE_ALARM	Programme un réveil pour 10h chaque dimanche s'il te plaît	alarm	87
3231353531363537	IN:CREATE_ALARM	Programme une alarme tous les lundis à 10h00 du matin	alarm	87
3231353531353732	IN:CREATE_ALARM	Programme une alarme pour me réveiller à 7 h nommée Travail	alarm	87
3231353531353635	IN:CREATE_ALARM	Programme une alarme qui s'appelle « Réveille-toi maintenant !» à six heures	alarm	87
3231353531343933	IN:CREATE_ALARM	Veille à ce qu'il y ait une alarme ce jeudi à 6 heures	alarm	87
3231353438393139	IN:CREATE_ALARM	Règle-moi une alarme pour vendredi matin	alarm	87
3231353438383835	IN:CREATE_ALARM	Programme une alarme pour ce soir	alarm	87
3231353438383831	IN:CREATE_ALARM	Peux-tu m'aider à régler une alarme ?	alarm	87
3231353438383138	IN:CREATE_ALARM	Programme une alarme pour dans la matinée.	alarm	87
3231353438363639	IN:CREATE_ALARM	peux-tu programmer une alarme pour ce soir s'il te plaît	alarm	87
3231353438363233	IN:CREATE_ALARM	Programme-moi une alarme pour ce soir	alarm	87
3136363730333836	IN:CREATE_ALARM	programme une alarme pour dimanche à 8 h	alarm	87
3136353036333836	IN:CREATE_ALARM	réveille-nous dans 7 heures	alarm	87
3136353036303437	IN:CREATE_ALARM	Fixe l'alarme toutes les 10 minutes pendant une heure	alarm	87
3135333032353433	IN:CREATE_ALARM	s'il te plaît, règle l'alarme pour 1 heure	alarm	87
3135323939343330	IN:CREATE_ALARM	J'ai besoin d'une alarme pour cinq heures à partir de maintenant	alarm	87
3135323934303739	IN:CREATE_ALARM	Règle une alarme répétitive à partir de 13 h chaque jour	alarm	87
3135323932323436	IN:CREATE_ALARM	Vas-y définis l'alarme pour 5 h du matin	alarm	87
3135323931303031	IN:CREATE_ALARM	FIXE L'ALARME POUR 15 MINUTES	alarm	87
3135323930313130	IN:CREATE_ALARM	Prévois une alarme pour demain matin à 10 h	alarm	87
39353738393337	IN:CREATE_ALARM	programme une alarme toutes les 5 heures	alarm	87
39353738353232	IN:CREATE_ALARM	règle mon réveil pour 4h30 demain matin	alarm	87
39353737383131	IN:CREATE_ALARM	active l'alarme	alarm	87
39353735343030	IN:CREATE_ALARM	Programme une alarme à 14 h 30 demain	alarm	87
39353735313638	IN:CREATE_ALARM	Réinitialise l’alarme	alarm	87
39353734323832	IN:CREATE_ALARM	règle mon réveil pour sonner tous les dimanches à 8 heures	alarm	87
39353731363835	IN:CREATE_ALARM	Règle une alarme pour mardi à trois heures	alarm	87
39353731323333	IN:CREATE_ALARM	fixe une alarme pour 30 minutes	alarm	87
39353730393232	IN:CREATE_ALARM	Règle mon alarme pendant 30 minutes.	alarm	87
39353639363231	IN:CREATE_ALARM	alarme fixée pour 7 h du matin	alarm	87
39353632323039	IN:CREATE_ALARM	Programme-moi une alarme à 25 secondes	alarm	87
39353539343433	IN:CREATE_ALARM	Règle l'alarme sur 4 heures du matin	alarm	87
39353536393035	IN:CREATE_ALARM	règle une alarme à six heures	alarm	87
39353534343832	IN:CREATE_ALARM	mets l'alarme pour un réveil à 6 h	alarm	87
39353533313637	IN:CREATE_ALARM	règle une alarme récurrente	alarm	87
39353439303437	IN:CREATE_ALARM	réinitialise l'alarme à six heures quarante-cinq	alarm	87
39353433383238	IN:CREATE_ALARM	Mets une alarme pour me réveiller dans une heure.	alarm	87
39353339353536	IN:CREATE_ALARM	règle une alarme pour 3 minutes	alarm	87
39353336393239	IN:CREATE_ALARM	Mets une alerte pour 19 h aujourd'hui	alarm	87
39353331393231	IN:CREATE_ALARM	Fixe l'alarme à 7 h du matin mardi	alarm	87
39353331353439	IN:CREATE_ALARM	Peux-tu programmer un réveil pour le 2 décembre à 4 heures ?	alarm	87
39353330363234	IN:CREATE_ALARM	mets une alarme toutes les 3 minutes	alarm	87
39353330313632	IN:CREATE_ALARM	Mets une alarme dans 30 minutes.	alarm	87
39353238303435	IN:CREATE_ALARM	mets une alarme à 7 heures du matin tous les jours	alarm	87
39353233373133	IN:CREATE_ALARM	programme une alarme pour samedi à 8h00	alarm	87
39353233333032	IN:CREATE_ALARM	mettre l'alarme à 16 h 45	alarm	87
39353233323739	IN:CREATE_ALARM	règle l'alarme de 6 h	alarm	87
39353233303733	IN:CREATE_ALARM	Programme une alarme pour lundi à 5h30.	alarm	87
39353038323330	IN:CREATE_ALARM	Règle une alarme pour le mercredi 15 à 12h	alarm	87
39343939313839	IN:CREATE_ALARM	Règle un réveil pour 8 heures jeudi	alarm	87
39343938393731	IN:CREATE_ALARM	Mets une alarme demain matin à 5 h.	alarm	87
39343938333939	IN:CREATE_ALARM	s'il te plaît, règle mon alarme à 6:30 du matin	alarm	87
39343935363638	IN:CREATE_ALARM	Règle une alarme pour moi à midi	alarm	87
39343934383737	IN:CREATE_ALARM	règle l'alarme sur 12h20	alarm	87
39343930383732	IN:CREATE_ALARM	s'il te plaît, mets une alarme à trois heures du matin	alarm	87
39343930363838	IN:CREATE_ALARM	Alarme dans cinq minutes.	alarm	87
39343836363534	IN:CREATE_ALARM	Règle l’alarme pour demain à 22 h	alarm	87
39343832363735	IN:CREATE_ALARM	Mets une alarme tous les samedis à 19 h	alarm	87
39343832333631	IN:CREATE_ALARM	programme une alarme pour 9h	alarm	87
39343830383635	IN:CREATE_ALARM	Mets une alarme pour dans une heure	alarm	87
39343830313337	IN:CREATE_ALARM	Règle une alarme toutes les minutes pendant 24 minutes	alarm	87
39343736383337	IN:CREATE_ALARM	Crée une alarme pour toutes les dix minutes pendant 90 minutes.	alarm	87
39343735353130	IN:CREATE_ALARM	Active les alarmes comme d'habitude.	alarm	87
39343735313635	IN:CREATE_ALARM	Programme une alarme pour 5h.	alarm	87
39343730333938	IN:CREATE_ALARM	Mets une alarme à 7h30 du matin demain.	alarm	87
39343637363934	IN:CREATE_ALARM	crée une alarme pour tous les lundis à 7 h	alarm	87
39343635383633	IN:CREATE_ALARM	règle une alarme pour 7 h 15	alarm	87
3232323639363339	IN:CREATE_ALARM	peux-tu programmer un réveil dans une heure et demie	alarm	87
3232323630383432	IN:CREATE_ALARM	crée une alarme pour les jours de la semaine	alarm	87
3232313432323332	IN:CREATE_ALARM	peux-tu faire sonner une alarme dans une minute à partir de maintenant	alarm	87
3231393233313135	IN:CREATE_ALARM	active mes alarmes pour demain matin	alarm	87
3231393233303936	IN:CREATE_ALARM	merci de faire sonner mon alarme	alarm	87
3231363337343038	IN:CREATE_ALARM	Je veux une nouvelle alarme	alarm	87
3231363337333339	IN:CREATE_ALARM	Programme une alarme maintenant	alarm	87
3231363337323631	IN:CREATE_ALARM	Je ne dois pas être en retard à ma réunion demain	alarm	87
3231363337313830	IN:CREATE_ALARM	S'il te plaît règle une alarme	alarm	87
3231363337313234	IN:CREATE_ALARM	Crée une nouvelle entrée d'alarme	alarm	87
3231363337303939	IN:CREATE_ALARM	Ajoute une nouvelle alarme	alarm	87
3231363337303735	IN:CREATE_ALARM	Crée une alarme pour demain matin	alarm	87
3231363336333638	IN:CREATE_ALARM	Réveille-moi à 13 h	alarm	87
3231363336333035	IN:CREATE_ALARM	Je veux aller me coucher à 22 h.	alarm	87
3231363335393939	IN:CREATE_ALARM	Nouveau réveil à 11 h	alarm	87
3231363335393537	IN:CREATE_ALARM	mets l'alarme à 23 h 30	alarm	87
3231363335383134	IN:CREATE_ALARM	Crée une alarme pour demain matin	alarm	87
3231363335373135	IN:CREATE_ALARM	J'ai besoin d'une alarme pour lundi à 15 h	alarm	87
3231363335363033	IN:CREATE_ALARM	Mets l'alarme vendredi à 8 h	alarm	87
3231363335353532	IN:CREATE_ALARM	fais sonner mon réveil du lundi au vendredi à 7 h	alarm	87
3231363335353530	IN:CREATE_ALARM	Programme une alerte pour demain soir	alarm	87
3231363335353339	IN:CREATE_ALARM	Programme une alarme pour le vendredi à 16 h	alarm	87
3231363335333236	IN:CREATE_ALARM	Je veux une alarme sonore pour le 4 juin à 20h	alarm	87
3231363335313834	IN:CREATE_ALARM	Alarme pour le 14 février à 10 h	alarm	87
3231363335313730	IN:CREATE_ALARM	Mets une alarme à 5 h 10 le 23	alarm	87
3231363335313039	IN:CREATE_ALARM	Active mon alarme du vendredi 5 mai	alarm	87
3231363334393630	IN:CREATE_ALARM	prévois une alarme toute la semaine à 16 h	alarm	87
3231363334393231	IN:CREATE_ALARM	J'ai besoin d'une alarme à 14 h tous les dimanches appelée promener le chien	alarm	87
3231363334383132	IN:CREATE_ALARM	Peux-tu t'éteindre tous les jeudis à 9 h pendant deux mois ?	alarm	87
3231363334373833	IN:CREATE_ALARM	Ajoute une alarme tous les soirs à 19 h	alarm	87
3231363334353434	IN:CREATE_ALARM	Règle le réveil pour 7 h du matin en semaine.	alarm	87
3231363334353035	IN:CREATE_ALARM	Commence l'alarme à 9 heures chaque dimanche par quinzaine	alarm	87
3231363334343939	IN:CREATE_ALARM	Nouveau réveil à 16h45 les mardis	alarm	87
3231363334343834	IN:CREATE_ALARM	Programme-moi une alarme pour mercredi à 17 h appelée « squash »	alarm	87
3231363334343535	IN:CREATE_ALARM	Programme une alarme pour le verre après le travail tous les vendredis à 17 h	alarm	87
3231363334333030	IN:CREATE_ALARM	Mets une alarme pour le 1er jour du mois pendant 6 mois	alarm	87
3231363334313937	IN:CREATE_ALARM	Crée une alarme courses à 18 h aujourd'hui	alarm	87
3231363334313538	IN:CREATE_ALARM	Fais sonner mon réveil à 17h	alarm	87
3231363333343035	IN:CREATE_ALARM	Crée des alarmes pour 6h, 7h et 8h	alarm	87
3231363333333537	IN:CREATE_ALARM	Programme une alarme lundi à 14 h, samedi à 9 h et dimanche à midi.	alarm	87
3231363333313235	IN:CREATE_ALARM	Active des alarmes pour mardi et samedi à minuit	alarm	87
3231363332393434	IN:CREATE_ALARM	programme des alarmes à 15 heures et 23 heures tous les jeudis pendant les 8 prochaines semaines	alarm	87
3231363332383437	IN:CREATE_ALARM	Crée une alarme pour 16 h et 18 h	alarm	87
3231363332353738	IN:CREATE_ALARM	Se lever à 11 heures et prendre le médicament	alarm	87
3231363039303637	IN:CREATE_ALARM	crée une alarme pour 430 h	alarm	87
3231363038383132	IN:CREATE_ALARM	programme une nouvelle alarme pour 06h40	alarm	87
3231363038373639	IN:CREATE_ALARM	programme une alarme pour 8 h 30	alarm	87
3231363038343338	IN:CREATE_ALARM	mets une alarme pour 06 h 50	alarm	87
3231363038313933	IN:CREATE_ALARM	crée une alarme pour 6 h 35	alarm	87
3231363038313136	IN:CREATE_ALARM	fais sonner l'alarme à 6 h 10	alarm	87
3231363038303230	IN:CREATE_ALARM	crée une alarme pour 24 h 15	alarm	87
3231363037373731	IN:CREATE_ALARM	crée une alarme pour 03 h 50	alarm	87
3231363031383937	IN:CREATE_ALARM	Peux-tu me réveiller à 7h du matin	alarm	87
3231363031373636	IN:CREATE_ALARM	S'il te plaît, règle l'alarme pour 7 heures du matin	alarm	87
3231363031373531	IN:CREATE_ALARM	Programme une alarme pour lundi 8 h	alarm	87
3231363031373434	IN:CREATE_ALARM	Mets une alarme aujourd'hui à 18h.	alarm	87
3231363031373037	IN:CREATE_ALARM	Crée une alarme pour jeudi à minuit.	alarm	87
3231363031353632	IN:CREATE_ALARM	Crée une alarme pour vendredi	alarm	87
3231363031353631	IN:CREATE_ALARM	Crée une alarme pour jeudi prochain	alarm	87
3231363031333438	IN:CREATE_ALARM	S'il te plaît crée une alarme pour aller à la patinoire le 2 juin à 10 h du matin.	alarm	87
3231363030393336	IN:CREATE_ALARM	Réveille-moi à 10 h le samedi	alarm	87
3231363030383831	IN:CREATE_ALARM	Règle une alarme qui doit se déclencher tous les lundis à huit heures	alarm	87
3231363030373534	IN:CREATE_ALARM	Ajoute une alarme à 9h le mardi	alarm	87
3231363030353436	IN:CREATE_ALARM	Crée une alarme « partir travailler »	alarm	87
3231363030353338	IN:CREATE_ALARM	Crée l'alarme « Funérailles » pour le 2 juin à 15 h	alarm	87
3231363030343739	IN:CREATE_ALARM	Lance un réveil pour étudier dans 30 minutes.	alarm	87
3231363030333838	IN:CREATE_ALARM	Mets une alarme pour vendredi matin afin que je commence mes recherches.	alarm	87
3231363030333637	IN:CREATE_ALARM	Programme un réveil pour me réveiller	alarm	87
3231363030333635	IN:CREATE_ALARM	Règle une alarme pour 8 heures, appelle-la « appelle lucy ».	alarm	87
3231363030323332	IN:CREATE_ALARM	Mets une alarme pour la contraception à 21 h 30.	alarm	87
3231363030313938	IN:CREATE_ALARM	Crée une alarme de réveil.	alarm	87
3231353535343134	IN:CREATE_ALARM	Réveille-moi le matin	alarm	87
3231353535333833	IN:CREATE_ALARM	Crée une nouvelle alarme à 8 h	alarm	87
3231353535333732	IN:CREATE_ALARM	Il me faut une alarme pour demain à midi	alarm	87
3231353535333032	IN:CREATE_ALARM	J'ai besoin d'une alarme pour 14 h	alarm	87
3231353535323837	IN:CREATE_ALARM	Je veux me réveiller à 8 h	alarm	87
3231353535323130	IN:CREATE_ALARM	Mets une alarme pour 21 h s'il te plaît.	alarm	87
3231353535323032	IN:CREATE_ALARM	J'ai besoin d'une alarme pour 8 h 30 du matin	alarm	87
3231353535313231	IN:CREATE_ALARM	J'ai besoin d'une nouvelle alarme à sept heures	alarm	87
3231353535303632	IN:CREATE_ALARM	Crée une alarme pour 6 h du matin.	alarm	87
3231353534373734	IN:CREATE_ALARM	Règle une nouvelle alarme pour 7 heures mardi matin	alarm	87
3231353534363437	IN:CREATE_ALARM	Merci de mettre une alarme à 10 heures du matin	alarm	87
3231353534343033	IN:CREATE_ALARM	Programme un réveil le 20 mai s'il te plaît	alarm	87
3231353534323831	IN:CREATE_ALARM	Réveille-moi à 9 h le jeudi 16 mai.	alarm	87
3231353533373837	IN:CREATE_ALARM	Débrouille-toi pour que mon alarme sonne tous les jours	alarm	87
3231353533373036	IN:CREATE_ALARM	Crée deux alarmes pour demain matin à 5 h et 8 h	alarm	87
3231353533363139	IN:CREATE_ALARM	crée des alarmes pour cet après-midi à 18 h et 20 h	alarm	87
3231353533333039	IN:CREATE_ALARM	Programme une alarme se répétant à 7 h du matin chaque lundi.	alarm	87
3138393832333632	IN:GET_EDUCATION_DEGREE	As-tu terminé ton cursus à l'UNCW ?	people	88
3138393930333035	IN:GET_EDUCATION_DEGREE	Quel diplôme a obtenu Megan à l'université ?	people	88
3231303134303738	IN:GET_CALL_CONTACT	Qui a appelé plus tôt ?	calling	90
3231363735303737	IN:GET_CALL_CONTACT	Qui m'a appelé hier soir ?	calling	90
39343738393234	IN:RESTART_TIMER	Réinitialise le chronomètre de jogging maintenant	timer	91
39343637333238	IN:RESTART_TIMER	redémarre la minuterie pour le dîner	timer	91
39343637323539	IN:RESTART_TIMER	Fais redémarrer ma minuterie	timer	91
3135323934313936	IN:RESTART_TIMER	Relance ma minuterie précédent	timer	91
39353734383631	IN:RESTART_TIMER	redémarre la minuterie s'il te plaît	timer	91
39353433343438	IN:RESTART_TIMER	Redémarre la minuterie que j'ai fixé	timer	91
39343937333739	IN:RESTART_TIMER	Redémarre la dernière minuterie.	timer	91
3138393933353838	IN:GET_EMPLOYER	Qui est l'employeur de Denise ?	people	92
3138393932383736	IN:GET_EMPLOYER	Pour qui Jessica travaille-t-elle ?	people	92
3138393932383730	IN:GET_EMPLOYER	est-ce que Noah travaille encore à lax	people	92
3138393932373739	IN:GET_EMPLOYER	est-ce que Valorie a un employeur	people	92
3138393932373536	IN:GET_EMPLOYER	est-ce vrai que Gail travaille chez Microsoft ?	people	92
3138393932373037	IN:GET_EMPLOYER	Sais-tu où travaille mon ami Jerry ?	people	92
3138393932373031	IN:GET_EMPLOYER	Dis-moi où travaille Jerry, s'il te plaît	people	92
3138393932343337	IN:GET_EMPLOYER	Où travaille Lisa ?	people	92
3138393932323933	IN:GET_EMPLOYER	Où travaille Chris ?	people	92
3138393932323239	IN:GET_EMPLOYER	Andrews travaille-t-il toujours pour UPS	people	92
3138393931393038	IN:GET_EMPLOYER	Pour qui Pam travaille-t-elle à présent ?	people	92
3138393931383236	IN:GET_EMPLOYER	Est-ce que Judy travaille chez Google	people	92
3138393931383232	IN:GET_EMPLOYER	Comment s'appelle l'entreprise pour laquelle Rachel travaille	people	92
3138393931373739	IN:GET_EMPLOYER	Walter est-il maintenant à son compte ?	people	92
3138393931373530	IN:GET_EMPLOYER	Est-ce que Phil travaille actuellement pour l'État de Washington	people	92
3138393931373439	IN:GET_EMPLOYER	Où Phil travaille-t-il en ce moment	people	92
3138393931373433	IN:GET_EMPLOYER	Où James travaille-t-il	people	92
3231323235373831	IN:GET_REMINDER	Dis-moi quels sont mes rappels pour récupérer les enfants pour les activités périscolaires.	reminder	93
3231323235333837	IN:GET_REMINDER	Y a-t-il un rappel prévu pour repeindre notre maison ?	reminder	93
3231323234393139	IN:GET_REMINDER	Qu'est-ce que j'ai programmé comme rappels pour le boulot cette semaine ?	reminder	93
3231323234353630	IN:GET_REMINDER	Montre-moi les rappels de maman pour samedi prochain	reminder	93
3231323234303536	IN:GET_REMINDER	Lis mon rappel de baseball d'aujourd'hui.	reminder	93
3231323233373236	IN:GET_REMINDER	Montre-moi tous les rappels pour travaille cette semaine.	reminder	93
3231323233363932	IN:GET_REMINDER	Dresse une liste de mes rappels de recharge de prescriptions pour le mois.	reminder	93
3231323233313735	IN:GET_REMINDER	affiche les rappels de la commission scolaire dans les 6 mois à venir	reminder	93
3231313534383435	IN:GET_REMINDER	Quels sont mes rappels pour jeudi après-midi ?	reminder	93
3231313534313032	IN:GET_REMINDER	Montre-moi tous les rappels de réunions des AA.	reminder	93
3231313531353738	IN:GET_REMINDER	quels rappels ai-je pour Thanksgiving	reminder	93
3231313530393537	IN:GET_REMINDER	y a-t-il des rappels cette semaine pour des réunions avec les responsables de l'école	reminder	93
3231313530363435	IN:GET_REMINDER	Est-ce que j'ai des rappels ce matin ?	reminder	93
3231313438343831	IN:GET_REMINDER	quels sont mes rappels pour samedi	reminder	93
3231313436383530	IN:GET_REMINDER	Quels rappels ai-je pour la première semaine de septembre ?	reminder	93
3231313435393131	IN:GET_REMINDER	Y-a-t-il des rappels pour lundi prochain à 15 h ?	reminder	93
3231323430363631	IN:GET_REMINDER	Affiche-moi mes rappels.	reminder	93
3231323430353331	IN:GET_REMINDER	ai-je des rappels aujourd'hui ?	reminder	93
3231323430333737	IN:GET_REMINDER	quels sont les rappels d'aujourd'hui	reminder	93
3231323339383936	IN:GET_REMINDER	montre mes rappels de cette semaine	reminder	93
3231323339363632	IN:GET_REMINDER	Affiche tous mes rappels pour les deux prochains jours	reminder	93
3231323339353532	IN:GET_REMINDER	Montre-moi la liste des rappels que j'ai	reminder	93
3231323338383034	IN:GET_REMINDER	quelque chose sur ma liste de rappels	reminder	93
3231323338373236	IN:GET_REMINDER	Quels sont mes rappels pour ce matin ?	reminder	93
3231323338343033	IN:GET_REMINDER	ai-je des rappels ?	reminder	93
3231323338323734	IN:GET_REMINDER	Quels rappels j'ai pour vendredi	reminder	93
3231323337363836	IN:GET_REMINDER	Montre-moi tous les rappels pour aujourd'hui	reminder	93
3231323337313538	IN:GET_REMINDER	Liste mes rappels de la journée	reminder	93
3231323336323633	IN:GET_REMINDER	Est-ce que j'ai des rappels prévus pour le vendredi	reminder	93
3231323335393932	IN:GET_REMINDER	Montre mes rappels pour demain	reminder	93
3231323335313136	IN:GET_REMINDER	peux-tu me rappeler mes rendez-vous chez le médecin. semaine prochaine	reminder	93
3231323334343036	IN:GET_REMINDER	Montre-moi les rappels que j'avais créés pour la semaine dernière.	reminder	93
3231323334323933	IN:GET_REMINDER	ai-je créé un mémo pour mardi ?	reminder	93
3231323334323637	IN:GET_REMINDER	lis-moi mes rappels d'aujourd'hui, s'il te plaît	reminder	93
3231323334323437	IN:GET_REMINDER	Donne-moi mes rappels pour Nick	reminder	93
3231323334313430	IN:GET_REMINDER	Quels rappels y a-t-il pour le week-end entre filles ?	reminder	93
3231323334303536	IN:GET_REMINDER	Montre-moi les rappels pour 17 h jeudi	reminder	93
3231323333363232	IN:GET_REMINDER	Quels sont les rappels de mon mari Mark de ce mois	reminder	93
3231323333353630	IN:GET_REMINDER	Dis-moi quels sont les rappels que j'ai prévus pour les deux dernières semaines de décembre ?	reminder	93
3231323332393132	IN:GET_REMINDER	trouve-moi tous les rappels concernant l'assureur	reminder	93
3231323332373331	IN:GET_REMINDER	Quels sont mes rappels pour la fête d'anniversaire de Peter la semaine prochaine ?	reminder	93
3231323332333035	IN:GET_REMINDER	Affiche les mémos avec John aujourd'hui à 5 h	reminder	93
3231323332313838	IN:GET_REMINDER	Lis-moi les rappels programmés la semaine dernière.	reminder	93
3231323332303833	IN:GET_REMINDER	Montre-moi mes rappels pour le samedi 25.	reminder	93
3231323331393034	IN:GET_REMINDER	Affiche-moi les rappels des dîners avec mes enfants cette semaine	reminder	93
3231323331383535	IN:GET_REMINDER	Lance des rappels pour les rendez-vous chez le médecin de la semaine prochaine	reminder	93
3231323331353334	IN:GET_REMINDER	Affiche les rappels de ce que j'ai besoin de rapporter à l'avocat la semaine prochaine.	reminder	93
3231323331353039	IN:GET_REMINDER	ai-je un rappel de prévu demain matin pour la réunion de l'après-midi	reminder	93
3231323331313035	IN:GET_REMINDER	Je pensais avoir déjà créé un rappel pour l'appel téléphonique de 15h, mais peux-tu vérifier ?	reminder	93
3231323331303831	IN:GET_REMINDER	Est-ce que j’ai des rappels d’anniversaires pour ce week-end ?	reminder	93
3231323330393937	IN:GET_REMINDER	dis-moi mes rappels de covoiturage de cette semaine	reminder	93
3231323330343437	IN:GET_REMINDER	Est-ce que Taylor et Ava ont des rappels pour le cheerleading la semaine prochaine ?	reminder	93
3231323330323338	IN:GET_REMINDER	Ai-je des rappels pour la semaine prochaine pour le chiropracteur ?	reminder	93
39343932323838	IN:REWIND_MUSIC	Peux-tu rembobiner la chanson ?	music	97
3135323839313330	IN:QUESTION_NEWS	En quelle année a eu lieu Pearl Harbor	news	98
3132353930383631	IN:QUESTION_NEWS	Qui est en tête des élections	news	98
39353831333335	IN:QUESTION_NEWS	Est-ce qu'ils ont trouvé la fille portée disparue à Jacksonville ?	news	98
39353338313536	IN:QUESTION_NEWS	Est-ce que Trump a renvoyé le directeur du FBI ?	news	98
39343639393838	IN:QUESTION_NEWS	Quelles zones ont eu les pires inondations hier ?	news	98
39343639353036	IN:QUESTION_NEWS	qui est le nouveau maire	news	98
39343636383734	IN:QUESTION_NEWS	Quelles lois sont révisées aujourd'hui ?	news	98
3136343034393935	IN:QUESTION_NEWS	les protestations se poursuivent t-elles à charlottesville	news	98
3136343034373938	IN:QUESTION_NEWS	Est-ce que l'ouragan est télévisé	news	98
3136343034353136	IN:QUESTION_NEWS	y a t-il un risque de guerre nucléaire	news	98
3136333337373536	IN:QUESTION_NEWS	Combien de pays sont touchés par l'interdiction de voyage ?	news	98
3136333337363434	IN:QUESTION_NEWS	Quelle est notre situation économique	news	98
