ID	intent	text	domain	label
3138383932303536	IN:GET_INFO_RECIPES	किन चीज़ों से कुकीज़ नरम हो जाती हैं	recipes	28
3138383931353531	IN:GET_INFO_RECIPES	मैं किस तापमान पर टर्की पका सकता हूँ	recipes	28
3138383931313632	IN:GET_INFO_RECIPES	मुझे बीफ स्टू के लिए किन मसालों की जरूरत पड़ेगी	recipes	28
3137353932393634	IN:GET_INFO_RECIPES	योगर्ट में कितना कार्बोहायड्रेट होता है	recipes	28
3137353932393333	IN:GET_INFO_RECIPES	ऑलिव ऑयल में कितना फैट होता है	recipes	28
3137353437353034	IN:GET_INFO_RECIPES	बच्चों के लिए एक सेहतमंद साप्ताहिक मेनू क्या है	recipes	28
3135333032333230	IN:GET_INFO_RECIPES	3 लेयर का केक कितने लोगों को खिलाया जा सकता है	recipes	28
3133343635323433	IN:GET_INFO_RECIPES	लैट्टे में कौन-कौन सी सामग्री डलती है।	recipes	28
3133343635313838	IN:GET_INFO_RECIPES	मुझे नो-बेक ओटमील कुकीज़ में कितने कोकोआ का उपयोग करना चाहिए	recipes	28
3133343635303139	IN:GET_INFO_RECIPES	मोज़ारेला चीज़ की एक स्लाइस में कितनी कैलोरीज़ होती हैं	recipes	28
3133343635303033	IN:GET_INFO_RECIPES	आप गाजर को बारीक कतरन में कैसे काटते हैं	recipes	28
3133343634393935	IN:GET_INFO_RECIPES	डिब्बाबंद सामानों में कितना सोडियम होता है	recipes	28
3133343634353138	IN:GET_INFO_RECIPES	मछली तलने के लिए तेल कितना गर्म होना चाहिए	recipes	28
3133343634343932	IN:GET_INFO_RECIPES	रेयर हैमबर्गर पकाने के लिए कितना तापमान चाहिए	recipes	28
3133343634343530	IN:GET_INFO_RECIPES	आइस क्रीम के एक स्कूप में कितनी कैलोरीज़ होती हैं	recipes	28
3133343439363038	IN:GET_INFO_RECIPES	एक बीफ रोस्ट को कितने तापमान में पकाना चाहिए	recipes	28
3133343139313537	IN:GET_INFO_RECIPES	पिज़्ज़ा बनाने के लिए कितना तापमान होना जरूरी है	recipes	28
3133343139313339	IN:GET_INFO_RECIPES	स्टू में कौन सी सब्ज़ियाँ डालूं	recipes	28
3133343139303130	IN:GET_INFO_RECIPES	बादाम के दूध में कितनी कैलोरी होती हैं	recipes	28
3133343138373939	IN:GET_INFO_RECIPES	क्रॉक पॉट में रखे रोस्ट के लिए मुझे कितना पानी डालना चाहिए	recipes	28
3133343130373636	IN:GET_INFO_RECIPES	पूरी तरह से पकने के बाद टर्की का तापमान कितना होता है	recipes	28
3133343130363839	IN:GET_INFO_RECIPES	बीफ को कितनी देर तक पकाना चाहिए	recipes	28
3133343130363538	IN:GET_INFO_RECIPES	चिकन स्टर-फ्राइ में कितनी कैलरी होती हैं	recipes	28
3133343130353336	IN:GET_INFO_RECIPES	बेकन की एक स्लाइस में कितना सोडियम होता है	recipes	28
3133343130343937	IN:GET_INFO_RECIPES	पिको डि गैलो की सामग्री	recipes	28
3133343130343137	IN:GET_INFO_RECIPES	इससे कितनी कुकीज़ बनती हैं	recipes	28
3133343130333635	IN:GET_INFO_RECIPES	एक गिलास पानी में कॉफ़ी के कितने स्कूप्स डालने हैं	recipes	28
3133343130313239	IN:GET_INFO_RECIPES	चावल कैसे बनाते हैं	recipes	28
3133323738333735	IN:GET_INFO_RECIPES	एक बड़े चम्मच पीनट बटर में कितनी कैलोरी होती है	recipes	28
3133323737383731	IN:GET_INFO_RECIPES	आप चिकन ब्रेस्ट को कैसे पेन सीअर करते हैं	recipes	28
3133323737323036	IN:GET_INFO_RECIPES	मशरूम रिसोट्टो बनाने के लिए सामग्री	recipes	28
3133323735343533	IN:GET_INFO_RECIPES	मैं माइक्रोवेव में चावल कैसे बनाऊ	recipes	28
3133323735333735	IN:GET_INFO_RECIPES	गर्म खाने को किस तापमान पर रखना चाहिए	recipes	28
3133323735333635	IN:GET_INFO_RECIPES	सॉफ्ट बॉयल अंडे के लिए कितनी देर तक उबालना होगा	recipes	28
3133303534343230	IN:GET_INFO_RECIPES	पेपरौनी पिज़्ज़ा या सॉसेज पिज़्ज़ा में कम कैलोरी होती है	recipes	28
3133303534333931	IN:GET_INFO_RECIPES	वैनीला आइसक्रीम में कितनी कैलोरीज़ होती है	recipes	28
3132383135333135	IN:GET_INFO_RECIPES	एवोकैडो को कैसे काटते हैं	recipes	28
3132383135323231	IN:GET_INFO_RECIPES	टारटर सॉस में क्या-क्या सामग्री होती है	recipes	28
3132363338393936	IN:GET_INFO_RECIPES	लज़ान्या के साथ क्या अच्छा लगता है	recipes	28
3132363334383831	IN:GET_INFO_RECIPES	चावल के सर्विंग मात्रा कितनी है	recipes	28
3132363333373738	IN:GET_INFO_RECIPES	मर्साला सॉस में कितनी कैलोरी होती हैं?	recipes	28
3132363238303939	IN:GET_INFO_RECIPES	स्टेक के लिए अलग-अलग तापमान क्या है?	recipes	28
3139343332383434	IN:GET_LIFE_EVENT	माइकल जैक्सन की मौत कहाँ हुई थी?	people	29
39353633343732	IN:DISLIKE_MUSIC	वो गाना मुझे अच्छा नहीं लगता और मुझे वो नहीं सुनना है	music	30
3231373237393139	IN:DISLIKE_MUSIC	इस म्यूजिक को अन लाइक करो	music	30
3231363331323336	IN:DELETE_ALARM	सारे अलार्म रद्द कर दो	alarm	31
3231363331323937	IN:DELETE_ALARM	इस सप्ताह के लिए सेट सभी अलार्म को डिलीट करें	alarm	31
3231363331323439	IN:DELETE_ALARM	अलार्म को रद्द कर दो	alarm	31
3231363330393339	IN:DELETE_ALARM	आज रात के अलार्म्स को कैंसल कर दो।	alarm	31
3231363330383337	IN:DELETE_ALARM	मेरे अलार्म को रद्द कर दो।	alarm	31
3231363330373832	IN:DELETE_ALARM	सभी अलार्म से छुटकारा पाओ	alarm	31
3231363032303830	IN:DELETE_ALARM	इस अलार्म को रद्द करो।	alarm	31
3231353938383431	IN:DELETE_ALARM	अगले दो महीनों के लिए अलार्म हटाएँ	alarm	31
3231353439313536	IN:DELETE_ALARM	कोई भी अलार्म डिलीट कर दो	alarm	31
3231353439313030	IN:DELETE_ALARM	मेरे सारे अलार्म निकाल दो	alarm	31
3232343533333236	IN:SET_RSVP_YES	मैं चौथे कार्यक्रम में जाना चाहता हु	event	32
3232343533323231	IN:SET_RSVP_YES	मेरे स्टेटस पर ये डाल दो कि में सोल्स्टिस परेड में जा रहा हूँ	event	32
3232343532353338	IN:SET_RSVP_YES	दी ऑलिव फेस्टिवल पर जा रहा हु	event	32
3232343532333937	IN:SET_RSVP_YES	मुझे TEDxSeattle में जाना है	event	32
3232343533373235	IN:SET_RSVP_YES	Who Gets to Make History? The Story of Monuments and Statues के लिए हाँ में जवाब दें	event	32
3232343533363830	IN:SET_RSVP_YES	चौथे इवेंट के लिए हाँ में जवाब दें	event	32
3232343533323230	IN:SET_RSVP_YES	तीसरे इवेंट के लिए RSVP को हां कहे	event	32
3132363138373538	IN:ADD_TO_PLAYLIST_MUSIC	इस गाने को मेरे मनपसंद वालों में जोड़ना	music	33
39353030343036	IN:ADD_TO_PLAYLIST_MUSIC	मेरे ऑफ़िस की प्लेलिस्ट में सेव करें	music	33
39353531343731	IN:ADD_TO_PLAYLIST_MUSIC	अभी-अभी चली गानों की लिस्ट को सेव कर लो	music	33
39353034303631	IN:ADD_TO_PLAYLIST_MUSIC	पैंडोरा में जोड़ो	music	33
39343830313034	IN:ADD_TO_PLAYLIST_MUSIC	कृपया इस गाने को मेरी कार प्लेलिस्ट में जोड़ें।	music	33
3232353834303234	IN:GET_MESSAGE	मंगलवार से क्या कोवर्कर ग्रुप से मुझे कोई मैसेज आया है	messaging	34
3232353833323935	IN:GET_MESSAGE	स्टीव और बिल से हुई मेरे संदेश ले आओ	messaging	34
3232353832393336	IN:GET_MESSAGE	जूलिया वॉल्टर्स और स्पार्क्स से मेरे वीडियो मैसेज ले लेना	messaging	34
3232353832393132	IN:GET_MESSAGE	क्या पिछले हफ्ते अपने ऑफिस ग्रुप से मुझे कोई मैसेज आया	messaging	34
3232353832353037	IN:GET_MESSAGE	मेरी भतीजी के टेक्स्ट दिखाएँ	messaging	34
3232353832313739	IN:GET_MESSAGE	मेरी माँ केसन के मेसेज दिखाओ	messaging	34
3232353735323034	IN:GET_MESSAGE	क्या ऐन ने मुझे WhatsApp पर कुछ भी भेजा है	messaging	34
3232343436353030	IN:GET_MESSAGE	बैरियर कमीलया ने आज मुझे संदेश भेजा क्या?	messaging	34
3232343436343739	IN:GET_MESSAGE	क्या डेहलिया ने आज मुझे मेसेज किया है?	messaging	34
3232343436343634	IN:GET_MESSAGE	क्या लोरेंजो ने मुझे मैसेज किया है?	messaging	34
3232313734353837	IN:GET_MESSAGE	क्या मुझे इस हफ़्ते मेरी पत्नी के कोई मैसेज मिलें?	messaging	34
3231323832313632	IN:GET_MESSAGE	मेरे पापा ने कल जो मैसेज भेजा था, वो खो गया है, क्या आप उसे ढूँढ सकते हैं?	messaging	34
3231323830323732	IN:GET_MESSAGE	मुझे पिछले हफ्ते के मैसेज पढ़के सुनाओ	messaging	34
3232353833383933	IN:GET_MESSAGE	मेरे सिब्लिंग्स से आए टेक्स्ट्स दिखाएं	messaging	34
3232353833383631	IN:GET_MESSAGE	क्या मेरे परिवार ने मेरे लिए कुछ भेजा है	messaging	34
3232353833363539	IN:GET_MESSAGE	क्या मेरी फैमिली ने मुझे टेक्स्ट किया	messaging	34
3232353833343635	IN:GET_MESSAGE	एना और सामंथा के भेजे हुए वीडियो मेस्सगेस मुझे दिखाओ	messaging	34
3232353832393537	IN:GET_MESSAGE	डेवलपमेंट थ्रेड ने मुझे कुछ भेजा क्या	messaging	34
3232353832363831	IN:GET_MESSAGE	क्या कॉलेज के दोस्त थ्रेड ने मुझे कुछ भेजा है	messaging	34
3232353832343835	IN:GET_MESSAGE	ब्रैडी द्वारा भेजा गया वीडियो मैसेज को मुझे दिखाओ	messaging	34
3232353832343832	IN:GET_MESSAGE	मैं अपनी बेटी के वीडियो मैसेज देखना चाहता हूँ	messaging	34
3232353832343634	IN:GET_MESSAGE	मेरी भतीजी मैकायला के वीडियो मैसेज दिखाओ	messaging	34
3232353832343530	IN:GET_MESSAGE	मुझे आर्चर के वीडियो संदेश दिखाएं	messaging	34
3232353832343331	IN:GET_MESSAGE	आइए मेरे लाइफ पार्टनर के वीडियो मैसेज देखते हैं	messaging	34
3232353832343235	IN:GET_MESSAGE	मेरे भाई से मेरे वीडियो मेसेज को दिखाओ	messaging	34
3232353832343138	IN:GET_MESSAGE	मुझे एडेलिना के द्वारा भेजे गए टेक्स्ट देखने दो	messaging	34
3232353832333434	IN:GET_MESSAGE	कैल्विन की टेक्स्ट दिखाओ	messaging	34
3232353832323535	IN:GET_MESSAGE	हेनरी से प्राप्त हुए मैसेजों को दिखाओ	messaging	34
3232353832323432	IN:GET_MESSAGE	गर्लफ्रेंड एड्रिएल के मेस्सगेस निकालो	messaging	34
3232353832323334	IN:GET_MESSAGE	बेला के मेरे मैसेजेस को डिस्प्ले करें	messaging	34
3232353832313837	IN:GET_MESSAGE	मुझे ईडन के वीडियो मैसेज दिखाएँ	messaging	34
3232353832313631	IN:GET_MESSAGE	चलो मेरी पत्नी के वीडियो  मेसेज देखें	messaging	34
3232353832313532	IN:GET_MESSAGE	मुझे मेरे पोते एडलिन के वीडियो मैसेज देखने दें	messaging	34
3232353832313436	IN:GET_MESSAGE	मेरे दादाजी गनर के वीडियो मैसेज दिखाओ	messaging	34
3232353832313237	IN:GET_MESSAGE	विविएना दादाजी ने क्या मैसेजिस भेजे हैं	messaging	34
3231373530333230	IN:GET_EVENT	एबरडीन में शुक्रवार के लिए मुझे कुछ त्यौहार सुझाएँ	event	35
3231343937353636	IN:GET_EVENT	क्या जल्द ही कोई आइस हॉकी गेम होने वाले हैं	event	35
3231343937353238	IN:GET_EVENT	क्या आने वाले दिनों में कोई वॉलीबॉल मैच हैं	event	35
3231343937343034	IN:GET_EVENT	अगले हफ़्ते कोई सॉफ़्टबॉल के मैच	event	35
3231343937323734	IN:GET_EVENT	क्या आज कोई लैक्रोस मैच हैं	event	35
3139393839393130	IN:GET_EVENT	अलाचुआ में शुक्रवार रात को कौन-से म्यूज़िक ईवेंट होने वाले हैं	event	35
3139393839363736	IN:GET_EVENT	अगले महीने फ़ीनिक्स में होने वाला संगीत कार्यक्रम	event	35
3139393839363238	IN:GET_EVENT	शनिवार को फोर्ट वर्थ में होने वाले ओपेराज़	event	35
3139393839363133	IN:GET_EVENT	न्यू रोशेल में अगले हफ्ते क्या होगा	event	35
3139393838393934	IN:GET_EVENT	आज रात सैन फ्रांसिस्को में क्या-क्या किया जाए	event	35
3139393838393739	IN:GET_EVENT	इस महीने बॉस्टन में होने वाले कॉन्सर्ट्स	event	35
3139393838393139	IN:GET_EVENT	कल हम एटलांटा में क्या-क्या कर सकते हैं	event	35
3139393838363938	IN:GET_EVENT	अगले हफ्ते कॉर्पस क्रिस्टी में दिखाई जाने वाली फ़िल्में	event	35
3139393837363233	IN:GET_EVENT	शनिवार को ऑस्टिन में कौन-कौनसे कॉन्सर्ट्स हैं	event	35
3139393837313830	IN:GET_EVENT	इस वीकेंड लाइव कॉन्सर्ट्स	event	35
3139393836383336	IN:GET_EVENT	सैन होज़े में आज होने वाले स्पोर्ट्स ईवेंट	event	35
3139393836353738	IN:GET_EVENT	अगले वीकेंड पर क्या हो रहा है	event	35
3139393835393630	IN:GET_EVENT	इस सप्ताहांत सू फॉल्स में होने वाले म्यूज़िक इवेंट्स	event	35
3139393835393438	IN:GET_EVENT	कल के ईवेंट	event	35
3139393835393034	IN:GET_EVENT	बिलोक्सी में अगले हफ़्ते करने के लिए चीज़ें	event	35
3139393835373036	IN:GET_EVENT	क्या इस हफ्ते में करने के लिए कोई मनोरंजक चीज़ है	event	35
3139393835343634	IN:GET_EVENT	कल के लिए कोई म्यूज़िक ईवेंट	event	35
3139393835333534	IN:GET_EVENT	सैन फ्रांसिस्को में इस वीकेंड क्या करना चाहिए?	event	35
3139393835333031	IN:GET_EVENT	मंगलवार को न्यूयॉर्क में करने के लिए चीज़ें	event	35
3139393835323730	IN:GET_EVENT	क्या आज रात ग्रैंड रैपिड्स में कोई फ़न होने वाला है	event	35
3139393834353136	IN:GET_EVENT	सॉल्ट लेक सिटी में मुख्य कार्यक्रम	event	35
3139393834343738	IN:GET_EVENT	टेक्सास में इस वीकेंड फ़ूड फेस्टिवल	event	35
3139393834343030	IN:GET_EVENT	आज रात कोना में होने वाले ईवेंट	event	35
3139393833313933	IN:GET_EVENT	शनिवार के कार्यक्रम	event	35
3139393833313232	IN:GET_EVENT	मुझे बोरियत लग रही है, आज कुछ करने के लिए ढूँढने में मेरी मदद करें	event	35
3139393833303939	IN:GET_EVENT	इस हफ्ते लॉस एंजिल्स में करने लायक काम	event	35
3139393832383938	IN:GET_EVENT	अगले हफ्ते ऑर्लैंडो में करने लायक काम	event	35
3139393832373935	IN:GET_EVENT	इस शुक्रवार को सीएटल में होने वाले संगीत कार्यक्रम	event	35
3139393831313734	IN:GET_EVENT	कल रात कुछ रोमांचक करने के लिए है क्या	event	35
3139393830353233	IN:GET_EVENT	ग्रेशम में इस हफ़्ते के अंत में रात को क्या होने वाला है	event	35
3139393739393537	IN:GET_EVENT	रविवार को खेल-कूद के इवेंट्स	event	35
3139393739383938	IN:GET_EVENT	मैं आज रात को कुछ करना चाहता हूं	event	35
3139393739363639	IN:GET_EVENT	इस हफ्ते एटलांटा में किसका कॉन्सर्ट है	event	35
3139393739363132	IN:GET_EVENT	क्या इस हफ्ते और कोई लाइव परफॉरमेंसिस हैं, जिनकी टिकटें भी उपलब्ध हों	event	35
3139393739303237	IN:GET_EVENT	इस वीकेंड मेरी आसपास क्या चल रहा है	event	35
3139393738363839	IN:GET_EVENT	सॉउथिंगटन में आज रात कौन कौन सी फिल्में लगी हैं	event	35
3139393738323839	IN:GET_EVENT	आज रात बॉस्टन में करने लायक काम	event	35
3139393738323331	IN:GET_EVENT	ओमाहा में कौन-कौनसे कॉन्सर्ट्स होने वाले हैं	event	35
3139393737373736	IN:GET_EVENT	इस हफ्ते कौन-कौन से कॉमेडी शो हो रहे हैं	event	35
3139393737333939	IN:GET_EVENT	आज रात कोई ढंग का लाइव संगीत है क्या	event	35
3139393737323439	IN:GET_EVENT	अगले वीकेंड के कार्यक्रम ढूंढने में मेरी मदद करो	event	35
3139393736373235	IN:GET_EVENT	आज रात को होने वाले ओपेरा कार्यक्रम	event	35
3232323232353732	IN:GET_EVENT	मुझे लोकप्रिय ईवेंट दिखाएँ	event	35
3232323232353139	IN:GET_EVENT	मुझे और कुछ इवेंट्स देखना है जो फैमिली फ्रेंडली हो	event	35
3232323232353133	IN:GET_EVENT	मुझे फैमिली फ्रेंडली इवेंट्स देखने हैं	event	35
3232323232333631	IN:GET_EVENT	क्या तुम कृपया मुझे और ईवेंट्स दिखा सकते हो?	event	35
3232323232323838	IN:GET_EVENT	क्या तुम घोस्ट हाउस ओपनिंग डे से मिलते-जुलते और भी इवेंट्स दिखा सकते हो प्लीज़?	event	35
3232323232303935	IN:GET_EVENT	क्या तुम मुझे बता सकते हो कि मुझे किन-किन इवेंट्स में इन्वाईट किया गया है?	event	35
3231373530373335	IN:GET_EVENT	मुझे अन्य स्वास्थ्य संबंधी ईवेंट दिखाएँ	event	35
3231373530333933	IN:GET_EVENT	तुम्हारे पास क्या और कार शोज हैं	event	35
3231373530333536	IN:GET_EVENT	क्या तुम मुझे कोई और इवेंट्स दिखा सकते हो	event	35
3231373530333432	IN:GET_EVENT	मुझे कोई दूसरे लाइव म्यूज़िक इवेंट्स दिखाएँ	event	35
3231373530303535	IN:GET_EVENT	इस्लिप में अगले वीकेंड होने वाले कुछ खेल कार्यक्रमों के बारे में सुझाव दो	event	35
3231373530303331	IN:GET_EVENT	इस महीने के लिए मुझे कुछ कार्यक्रमों का सुझाव दो	event	35
3231343937353939	IN:GET_EVENT	मुझे बताना कि गुरुवार को कौन-कौनसे वॉलीबॉल मैच होने वाले हैं	event	35
3231343937353937	IN:GET_EVENT	क्या कल रात कोई टेनिस का मैच है	event	35
3231343937353734	IN:GET_EVENT	क्या शनिवार को कोई टेनिस गेम है	event	35
3231343937353635	IN:GET_EVENT	मई में कोई स्पोर्ट्स मैच है क्या	event	35
3231343937333431	IN:GET_EVENT	अभी कौन से बास्केटबॉल मैच हो रहे हैं	event	35
3231343937333235	IN:GET_EVENT	नवंबर में कोई स्पोर्ट्स मैच है	event	35
3231343937333032	IN:GET_EVENT	क्या कोई रग्बी का खेल आने वाला है	event	35
3231343937323737	IN:GET_EVENT	ओकलैंड में क्या रविवार को आइस हॉकी गेम होने वाले हैं	event	35
3139393930313834	IN:GET_EVENT	विल्कस बार्रे शुक्रवार की रात को होने वाले संगीत समारोह	event	35
3139393930313038	IN:GET_EVENT	पेंसाकोला में शनिवार रात को क्या होने वाला है	event	35
3139393930303033	IN:GET_EVENT	मार्च के न्यू यॉर्क सिटी ब्रॉडवे शोज़	event	35
