ID	intent	text	domain	label
3231333130363530	IN:CREATE_CALL	मेरे पोते-पोतियों को कॉलबैक करो।	calling	42
3231333130303139	IN:CREATE_CALL	मेरे भाइयों को फ़ोन करो।	calling	42
3231333039393632	IN:CREATE_CALL	सिस्टर्स को फ़ोन करें	calling	42
3231333039393336	IN:CREATE_CALL	कृप्या मेरी जेठानियों को फ़ोन कर दो	calling	42
3231333039383032	IN:CREATE_CALL	मेरे सौतेले माता-पिता को कॉल करो	calling	42
3231333039323533	IN:CREATE_CALL	टक्सन वाले मेरे भतीजों को फ़ोन करो	calling	42
3231303232343638	IN:CREATE_CALL	मेरी माँ को कॉल करें.	calling	42
3231303231393331	IN:CREATE_CALL	फैमिली ग्रुप पर वीडियो कॉल करें	calling	42
3231303138313336	IN:CREATE_CALL	मेरे पिताजी को कॉल करो	calling	42
3231303136383939	IN:CREATE_CALL	मेरी दोस्त जूली को अभी वीडियो कॉल करो	calling	42
3231303134313033	IN:CREATE_CALL	मेरे पति से वीडियो चैट करो।	calling	42
3232353332373533	IN:CREATE_CALL	क्रिस्टीना हार्वी को कॉल करें	calling	42
3232353332373335	IN:CREATE_CALL	टेरी मुर्रे को कॉल करो	calling	42
3232353332363835	IN:CREATE_CALL	ग्रेग्री एड्किन्स को कॉल लगाओ	calling	42
3232353332343532	IN:CREATE_CALL	मॉरीस शेवालिएर को कॉल करो	calling	42
3232353332343432	IN:CREATE_CALL	रेगिना जॉर्ज को कॉल करो	calling	42
3232353332333832	IN:CREATE_CALL	जूडी कॉलिंस को कॉल करों	calling	42
3232353331343334	IN:CREATE_CALL	555-7533 डायल करें	calling	42
3232353331343332	IN:CREATE_CALL	मुझे मेरे सेलफोन से 555-5419 पर कॉल करना है	calling	42
3232353331343237	IN:CREATE_CALL	मुझे Skype  पर 4085556205 पर फोन कॉल करना है	calling	42
3232353331343230	IN:CREATE_CALL	555-1918 पर Messenger से कॉल करो	calling	42
3232353331343139	IN:CREATE_CALL	क्या तुम को 555-5248 कॉल कर सकते हो	calling	42
3232353331333934	IN:CREATE_CALL	WhatsApp  पर 555-7775 में कॉल करें	calling	42
3232353331333539	IN:CREATE_CALL	676-555-5608 पर कॉल करो	calling	42
3232353331333137	IN:CREATE_CALL	Skype पर 5558546 पर फ़ोन कॉल करो	calling	42
3232353331333130	IN:CREATE_CALL	7105553393 पर कॉल करें	calling	42
3232353139323539	IN:CREATE_CALL	पॉल वुड को कॉल करें	calling	42
3232353139323132	IN:CREATE_CALL	अहमद को कॉल करें	calling	42
3232353139323032	IN:CREATE_CALL	मेरे भाई को एक कॉल करो	calling	42
3232353139313339	IN:CREATE_CALL	क्लारा लैम्बर्ट से संपर्क करो	calling	42
3232353139313335	IN:CREATE_CALL	मैल्कम रॉबर्टसन को फ़ोन मिलाओ	calling	42
3232353139313238	IN:CREATE_CALL	मैक्स को रिंग करो	calling	42
3232353138383430	IN:CREATE_CALL	मुझे केटलिन पैटन से एक बात करनी है	calling	42
3232353138373636	IN:CREATE_CALL	मैं टिमथी से दुबारा कॉन्टैक्ट करना चाहता हूँ	calling	42
3232353138363833	IN:CREATE_CALL	मेरे दोस्त एमिली, बेनेट, मैलेरी, और एजेकिएल को स्लैक पर वीडियो कॉल करो	calling	42
3232353138353932	IN:CREATE_CALL	मेरी आंटी ज़ैकरी कोनली और मेरी माँ एंजेलो को कॉल करें	calling	42
3232353138353835	IN:CREATE_CALL	क्या तुम कृपया किरा, एडवर्ड, और रेमन बार्बर के साथ एक कॉल शुरू कर सकते हो	calling	42
3232353138353738	IN:CREATE_CALL	मेरे लिए कैरोलिना मैक्सवेल और केटी मैकलॉड को कॉल कर दो	calling	42
3232353138353333	IN:CREATE_CALL	कृपया क्या आप ह्यूगो गुज़मान, डोमिनिक दिल्लार्ड, और शेल्बी वाल को एक वीडियो  कॉल कर सकते हो?	calling	42
3232353138343937	IN:CREATE_CALL	शॉन होगन, चेल्सि मॅकजी, नेथनेल जेनिंग्स, और केड सौलिस के साथ एक कॉल मिलाओ	calling	42
3232353138343334	IN:CREATE_CALL	केलेब क्रेन और ऑर्लैंडो हेनी के सथ वीडियो कॉल शुरू करो	calling	42
3232353138333637	IN:CREATE_CALL	कृपया ब्रेडली और जिआना को कॉल करें	calling	42
3232353138333536	IN:CREATE_CALL	प्लीज़ लोगन और ब्रैंडी को कॉल लगा दो	calling	42
3232353138333232	IN:CREATE_CALL	ट्रिनिटी, म्या, कैंडल और उरिएल को वीडियो  कॉल करो	calling	42
3232353138323834	IN:CREATE_CALL	जार्ड, जैमे, फेरनान्दो और ब्रूकलिन को वीचैट पर कॉल करो	calling	42
3232353138313034	IN:CREATE_CALL	WhatsApp  में म्यूजिकल ग्रुप को कॉल करो	calling	42
3232353138313030	IN:CREATE_CALL	हैंगआउट्स पर मेरे कम्युनिटी ग्रुप को कॉल करो	calling	42
3232353138303631	IN:CREATE_CALL	कृपया मेरे पापा को कॉल करें	calling	42
3232353138303532	IN:CREATE_CALL	स्पोकन वर्ड शुरू करो	calling	42
3232353138303531	IN:CREATE_CALL	क्या हम Whatsapp पर मिलिट्री हिस्ट्री ग्रुप को कॉल कर सकते हैं	calling	42
3232353137393230	IN:CREATE_CALL	क्या तुम लॉस एंजेलिस के ग्रुप को कॉल कर सकते हो	calling	42
3232353137383935	IN:CREATE_CALL	Personal Finance को कॉल करें	calling	42
3232353137383035	IN:CREATE_CALL	क्या आप मुझे कारपूल ग्रुप में कनेक्ट कर सकते हैं	calling	42
3232353137373237	IN:CREATE_CALL	क्या वाइन लवर्स ग्रुप के साथ Wechat  पर कॉल हो सक्ती है	calling	42
3232353038313236	IN:CREATE_CALL	क्या तुम ज़ेवियर, केविन और रयान को कॉल कर सकती हो	calling	42
3232343430303334	IN:CREATE_CALL	कॉनर को पिंग करो	calling	42
3232343339393935	IN:CREATE_CALL	कार्लोस को पिंग करो	calling	42
3232343339393731	IN:CREATE_CALL	कॉल्टन किम को फ़ोन लगाओ	calling	42
3232333730383232	IN:CREATE_CALL	नोएल के पापा डेरेक को कॉल करो	calling	42
3232333730373839	IN:CREATE_CALL	वेस्टन अब्बोट की माँ को कॉल करो	calling	42
3232333730373739	IN:CREATE_CALL	क्रिस्टोफर थॉमस की माँ को कॉल करें	calling	42
3232333730373137	IN:CREATE_CALL	क्या आप ग्रेसन के पार्टनर को कॉल कर सकते हैं	calling	42
3232333730373031	IN:CREATE_CALL	ऐशटन की बहन केडैन को फ़ोन करो	calling	42
3232333730363934	IN:CREATE_CALL	एरन की दादी को कॉल करो	calling	42
3232333730363837	IN:CREATE_CALL	जीसस लियोनार्ड की दादी जेरेमिया को कॉल लगाओ	calling	42
3232333730363530	IN:CREATE_CALL	मिलो जेन्किन्स के नाना को फ़ोन करें	calling	42
3232333730363231	IN:CREATE_CALL	क्या तुम कैथरीन के दोस्त को कॉल कर सकते हो	calling	42
3232333730353339	IN:CREATE_CALL	रोजाली जोसेफ के दादा/नाना को कॉल करना शुरू करें	calling	42
3232333730353233	IN:CREATE_CALL	जेम्स के पति को फ़ोन करें	calling	42
3232333730353137	IN:CREATE_CALL	कृपया मेलिसा माल्डोनाडो की भतीजी को कॉल करो	calling	42
3232333730353031	IN:CREATE_CALL	ऑब्रे वैगनर के अंकल को फ़ोन करें	calling	42
3232333730343430	IN:CREATE_CALL	एमिलियानो के पार्टनर को कॉल करना शुरू करें	calling	42
3232333730343131	IN:CREATE_CALL	रोमन म्यूएलर के पिता को कॉल करें	calling	42
3232333636313330	IN:CREATE_CALL	एजेकिएल मैक्डोनाल्ड को Whatsapp पर कॉल करो	calling	42
3232333636303632	IN:CREATE_CALL	निकोलाई को WhatsApp  के द्वारा कॉल करें	calling	42
3232333636303134	IN:CREATE_CALL	ऑस्कर गिलमोर को whatsapp कॉल करें	calling	42
3232333635393938	IN:CREATE_CALL	मिशेल एडवर्ड्स को whatsapp कॉल करें	calling	42
3232333635393830	IN:CREATE_CALL	रीगन को whatsapp पर कॉल करो	calling	42
3232333635383730	IN:CREATE_CALL	WhatsApp  पर मैकेंज़ी को कॉल करो	calling	42
3232333635383430	IN:CREATE_CALL	लिंकन हीनेस के मोबाइल पर whatsapp कॉल करो	calling	42
3232333635373234	IN:CREATE_CALL	डेक्कन पेक को WhatsApp  पर एक वीडियो चैट कॉल करो	calling	42
3232333635363839	IN:CREATE_CALL	पाइपर शावेज़ को WhatsApp  पर कॉल करो	calling	42
3232333635363634	IN:CREATE_CALL	WhatsApp  वीडियो चैट का उपयोग करके इमर्सन को कॉल करें	calling	42
3232333635363439	IN:CREATE_CALL	WhatsApp  वीडियो चैट का उपयोग करके पेड्रो को कॉल करें	calling	42
3232333635353830	IN:CREATE_CALL	WhatsApp  में रायलन मकगी को कॉल करो और रेगन सॉयर को कॉल करो	calling	42
3232333635353633	IN:CREATE_CALL	क्लोए को कॉल करें एडुआर्डो को Whatsapp पर कॉल करें	calling	42
3232333635353138	IN:CREATE_CALL	मेरे WhatsApp  कांटेक्ट आएडेन पैडिला को कॉल करो	calling	42
3232333635333933	IN:CREATE_CALL	मेरे Whatsapp संपर्कों में से जोसलिन मिल्स को कॉल करें	calling	42
3232333635333837	IN:CREATE_CALL	मेरे WhatsApp  संपर्कों से केविन पॉटर को कॉल करें	calling	42
3232333635333835	IN:CREATE_CALL	Whatsapp संपर्कों से लिलियन क्रिश्चियन को कॉल करें	calling	42
3232333635333130	IN:CREATE_CALL	आइज़क बार्नेट को WhatsApp  में कॉल करो	calling	42
3232333635323239	IN:CREATE_CALL	सेलाह को whatsapp पर कॉल करो	calling	42
3232333635323236	IN:CREATE_CALL	करीना को WhatsApp  कॉल करें	calling	42
3232333635313239	IN:CREATE_CALL	अमाया को WhatsApp  पर वीडियो करो	calling	42
3232333239333239	IN:CREATE_CALL	हम ग्लोरिया बर्गेस को कॉल करने वाले हैं	calling	42
3232333239323831	IN:CREATE_CALL	हम अमांडा को कॉल करने जा रहे हैं	calling	42
3232323935333534	IN:CREATE_CALL	मेरे सुंदर साथी को कॉल करें	calling	42
3232313933383737	IN:CREATE_CALL	क्या आप ब्रिअना को Messenger का प्रयोग करके कॉल कर सकते हैं	calling	42
3232313933383031	IN:CREATE_CALL	Messenger का उपयोग करके रिवर रोबर्स्टन को कॉल करें	calling	42
3232313933373931	IN:CREATE_CALL	Messenger में रेबेका रान्डेल से संपर्क करो	calling	42
3232313933373234	IN:CREATE_CALL	कृपया करके क्या आप एलिसे बर्नार्ड को WhatsApp  पर कॉल कर सकते हैं	calling	42
3232313933373131	IN:CREATE_CALL	जस्टिन एकोस्टा को फोन करने के लिए क्या तुम Messenger का उपयोग कर सकते हो	calling	42
3232313933363532	IN:CREATE_CALL	जेड नेल्सन को Messenger कॉल करें	calling	42
3232313933363431	IN:CREATE_CALL	मैं कलि फॉक्स को WhatsApp  पर कॉल करना चाहूँगा	calling	42
3232313933363038	IN:CREATE_CALL	ज़ेंडर रेयेस को Messenger से कॉल करें प्लीज़	calling	42
3232313933353733	IN:CREATE_CALL	रीगन वेबस्टर को मेसेंजर से संपर्क करो	calling	42
3232313536373938	IN:CREATE_CALL	मेलिसा को Hangouts पर कॉल करें	calling	42
3232313536373630	IN:CREATE_CALL	सुसैन को Whatsapp पर कॉल करो	calling	42
3232313332343839	IN:CREATE_CALL	कार्सन और हान्सेन को कॉल करो	calling	42
3232313332343532	IN:CREATE_CALL	सुआरेज़ और डेविस को कॉल करें	calling	42
3232313332333737	IN:CREATE_CALL	ईजेकील और डायलन को कॉल करो	calling	42
3232313332333035	IN:CREATE_CALL	यंग और रिवेरा को कॉल करो	calling	42
3232313332323434	IN:CREATE_CALL	स्टीवेन और मैथ्यू को कॉल करो	calling	42
3231373538373431	IN:CREATE_CALL	तुरंत किम को कॉल करो	calling	42
3232343330373738	IN:GET_SUNSET	बाहर अँधेरा होना कब शुरू होता है	weather	43
3231373034313431	IN:GET_SUNSET	सूरज कब डूबेगा	weather	43
3231353134363533	IN:GET_SUNSET	नौवां सूर्यास्त कब है	weather	43
3132363035323530	IN:GET_SUNSET	न्यू ऑर्लीन्स में किस समय सूर्यास्त होता है	weather	43
3132353936373034	IN:GET_SUNSET	आज एशेविल में सूर्यास्त कब होगा	weather	43
3132353934313432	IN:GET_SUNSET	आज रात सूर्यास्त कितने बजे होगा	weather	43
3231373530343131	IN:GET_LOCATION	अंतिम ईवेंट कहाँ पर है, के बारे में आप मुझे बताएँ	event	44
3231373530333738	IN:GET_LOCATION	Planet Home किस जगह पर है?	event	44
3231373530333636	IN:GET_LOCATION	फ्री इंट्रो टू रेइकी का पता बताओ	event	44
3139343333363731	IN:GET_LOCATION	अल पचीनो कहाँ पले-बड़े?	people	44
3139343333353434	IN:GET_LOCATION	टॉम ब्रैडी का जन्म कहाँ हुआ?	people	44
3139343333303637	IN:GET_LOCATION	मेगन मार्कल कहाँ से हैं?	people	44
3139343332373630	IN:GET_LOCATION	मेलानिया ट्रम्प कहाँ पैदा हुई थीं?	people	44
3138393836393438	IN:GET_LOCATION	क्या कैरोल का एड्रेस 32118 ज़िप कोड क्षेत्र में है?	people	44
3138393836383039	IN:GET_LOCATION	मुझे जुलिअस के ऑफिस का पता बताओ	people	44
3138393836373333	IN:GET_LOCATION	पैट्रीशिया कहाँ रहती है?	people	44
3138393836343734	IN:GET_LOCATION	इस्टियाना कहाँ रहती है?	people	44
3138393836333434	IN:GET_LOCATION	क्या जेसिका न्यूयॉर्क में रहती है?	people	44
3138393836333431	IN:GET_LOCATION	जैसिका कहाँ रहती है?	people	44
3138393836333032	IN:GET_LOCATION	लिंडा के कार्यालय का पता क्या है?	people	44
3138393836313932	IN:GET_LOCATION	ऐन कहाँ रहती है	people	44
3138393836303836	IN:GET_LOCATION	जैफ के घर का पता क्या है?	people	44
3138393836303233	IN:GET_LOCATION	ल्यूक वॉशिंगटन में किस जगह रहता है	people	44
3138393835393631	IN:GET_LOCATION	क्रिस का पता क्या है?	people	44
3138393835393335	IN:GET_LOCATION	एलिज़ाबेथ क्वीन्स में काम करती है या मैनहट्टन में?	people	44
3138393835383338	IN:GET_LOCATION	क्या तुम मुझे बर्ट्स का पता दे सकते हो	people	44
3138393835353738	IN:GET_LOCATION	पैम कहाँ रहती है	people	44
3138393835313635	IN:GET_LOCATION	मैबल का घर कहाँ है?	people	44
3138393835313430	IN:GET_LOCATION	क्या लिअम ब्रैंडन पार्क में रहता है	people	44
3138393834383237	IN:GET_LOCATION	ली का वर्कप्लेस किस जगह पर है?	people	44
3138393834373134	IN:GET_LOCATION	ली के घर का पता	people	44
3231373530343935	IN:GET_LOCATION	कॉमिक कॉन कहाँ पर है?	event	44
3231373530343339	IN:GET_LOCATION	तुम मुझे इस इवेंट के लोकेशन को बताओ	event	44
3231373530323630	IN:GET_LOCATION	मुझे बताओ आखिरी इवेंट कहां पर है	event	44
3139343333303736	IN:GET_LOCATION	मौजूदा समय में ओजे सिम्पसन कहाँ रहता है?	people	44
3139343332353232	IN:GET_LOCATION	मारिया कैरी का जन्म कहाँ हुआ था?	people	44
3138393935333738	IN:GET_LOCATION	हन्नाह का गृहनगर क्या है?	people	44
3138393935333138	IN:GET_LOCATION	ट्रॉय कहाँ का रहने वाला है?	people	44
3138393931373831	IN:GET_LOCATION	तारा का कार्यस्थल किस शहर में है?	people	44
3138393837353738	IN:GET_LOCATION	रॉबर्ट का जन्म कहाँ हुआ?	people	44
3138393837303034	IN:GET_LOCATION	लेस्ली नेब्रास्का में कहां रहता है?	people	44
3232343533313934	IN:SET_RSVP_NO	ब्लेक आइलैंड वाले डे ट्रिप क्रूज़ के लिए नहीं RSVP कर देना	event	45
3232343533313630	IN:SET_RSVP_NO	मुझे NW Indigenous Peoples: Sharing Powwow Ways में नहीं जा रहा/रही हूँ के रूप में मार्क करें	event	45
3232343533313336	IN:SET_RSVP_NO	पाँचवे समारोह के लिए मेरा स्टेटस नहीं जा रहा पर बदल दो	event	45
3232343532393533	IN:SET_RSVP_NO	स्टेटस लगाओ कि मैं C-ID नाइट मार्केट में नहीं जा रहा हूँ	event	45
3232323232313631	IN:SET_RSVP_NO	मुझे अब प्लेट बाय प्लेट में रूचि नहीं है	event	45
3232323232313134	IN:SET_RSVP_NO	Planet Home को RSVP नहीं	event	45
3232343533373237	IN:SET_RSVP_NO	तीसरे ईवेंट के लिए ना बोल दो	event	45
3232343533333036	IN:SET_RSVP_NO	मैं दूसरे ईवेंट पर नहीं जाना चाहता	event	45
3231333932373837	IN:DELETE_REMINDER	कृपया हमारे सॉकर मैच का रिमाइंडर डिलीट करें	reminder	48
3231323336363136	IN:DELETE_REMINDER	ऑरेंज जूस खरीदने वाले मेरे रिमाइंडर को हटा दो	reminder	48
3231323335313039	IN:DELETE_REMINDER	मंगलवार सुबह वाले रिमाइंडर को हटा दो	reminder	48
3231323334383634	IN:DELETE_REMINDER	मुझे कल की मीटिंग को फिर से शेड्यूल करना होगा, इसलिए कृपया उस रिमाइंडर को डिलीट करें.	reminder	48
3231323332363330	IN:DELETE_REMINDER	कृपया इस हफ़्ते के घरेलू कामकाज से जुड़े रिमाइंडर निकाल दें.	reminder	48
3231323332323431	IN:DELETE_REMINDER	इस वीकेंड एटिक की सफाई करने वाले मेरे रिमाइंडर को क्या तुम डिलीट कर सकते हो?	reminder	48
3231323332313536	IN:DELETE_REMINDER	23 अगस्त के प्ले वाले मेरे रिमाइंडर को कैंसल कर दो	reminder	48
3231323331393937	IN:DELETE_REMINDER	अब मुझे उन बैक टू स्कूल इवेंट्स के रिमाइंडर्स नहीं चाहिए	reminder	48
3231323331393237	IN:DELETE_REMINDER	जेसन के टीकाकरण से संबंधित रिमाइंडर डिलीट करें	reminder	48
3231323239343835	IN:DELETE_REMINDER	सफाई से जुड़े रिमाइंडर हटा दें.	reminder	48
3231323237393033	IN:DELETE_REMINDER	साशा वाले सभी रिमाइंडर्स को कैंसल कर दो	reminder	48
3231323236383135	IN:DELETE_REMINDER	संडे को कुत्ते को बाहर लेकर जाने वाले रिमाइंडर को डिलीट कर दो	reminder	48
3231323236373938	IN:DELETE_REMINDER	आंटी लीसा के बर्थडे वाले मेरे रिमाइंडर को हटा दो	reminder	48
3231323236373532	IN:DELETE_REMINDER	फ्रिज में रखी हुमस को ख़त्म करने वाले रिमाइंडर को डिलीट कर दो	reminder	48
3231323236373139	IN:DELETE_REMINDER	काम वाले सभी रिमाइंडर्स को हटा दो।	reminder	48
3231323235323130	IN:DELETE_REMINDER	अगले तीन हफ्ते के लिए चर्च के सारे रिमाइंडर हटा दो	reminder	48
3231323233373433	IN:DELETE_REMINDER	जेसिका की अपॉइंटमेंट का रिमाइंडर हटा देना क्योंकि उसे अब जाने की ज़रुरत नहीं	reminder	48
3231313536343632	IN:DELETE_REMINDER	कल शाम 5 बजे वाली वीडियो टेनिस टीम मीटिंग के रिमाइंडर को प्लीज़ डिलीट करो दो।	reminder	48
3231313439393833	IN:DELETE_REMINDER	अगले हफ्ते फूल ले कर आने वाले रिमाइंडर को हटा दो।	reminder	48
3231313437373731	IN:DELETE_REMINDER	मुझसे अब कॉन्सर्ट में जाना नहीं हो सकता, अलर्ट को कैंसल करें.	reminder	48
3231313437303839	IN:DELETE_REMINDER	रॉब के साथ शनिवार के डिनर का रिमाइंडर डिलीट करें	reminder	48
3231343132373439	IN:DELETE_REMINDER	इसे डिलीट करें.	reminder	48
3231323432303831	IN:DELETE_REMINDER	मेरा वेट को कॉल करने का रिमाइंडर कैंसल करें	reminder	48
