ID	intent	text	domain	label
3232343533373130	IN:SET_RSVP_INTERESTED	चौथे इवेंट के लिए जवाब दे दो	event	0
3232343532393836	IN:SET_RSVP_INTERESTED	दूसरे इवेंट के लिए मेरे स्टेटस को बदल कर इंटरेस्टिड कर दो	event	0
3232343532373730	IN:SET_RSVP_INTERESTED	पहले ईवेंट में जाने के लिए रुचिकर	event	0
3232343533313339	IN:SET_RSVP_INTERESTED	दूसरे इवेंट के लिए इंटरेस्टेड RSVP कर दो	event	0
3232343533313031	IN:SET_RSVP_INTERESTED	इनसरजेंट एंपायर बुक लॉन्च के बारे में मेरा स्टेटस इंटरेस्टेड रखो	event	0
3231323338333833	IN:GET_REMINDER_AMOUNT	मेरे कितने रिमाइंडर हैं?	reminder	2
3231323235313631	IN:GET_REMINDER_AMOUNT	AJ के साथ मेरे कितने रिमाइंडर हैं ?	reminder	2
3231323234343632	IN:GET_REMINDER_AMOUNT	इस हफ़्ते के लिए मेरे कितने रिमाइंडर हैं?	reminder	2
3231323233313237	IN:GET_REMINDER_AMOUNT	मेरे इस महीने के लिए कितने ग्रोसरी रमिंदरस है?	reminder	2
3232323230333134	IN:PLAY_MEDIA	क्या तुम अशर के इम्प्रेसका, वॉल्यूम 19 को ढूँढ कर बजा सकते हो?	music	3
3232323230333234	IN:PLAY_MEDIA	रिहाना को ढूंढो।	music	3
3232323230323133	IN:PLAY_MEDIA	मेरे लिए एड शीरन ढूँढो	music	3
3232323230303538	IN:PLAY_MEDIA	स्नूप डॉग को ढूँढों	music	3
3232323230333036	IN:PLAY_MEDIA	हैप्पीनेस बिगिन्स को खोजें	music	3
3231323331383338	IN:GET_REMINDER_DATE_TIME	मुझे अपने भाइयों की साइंस क्लब मीटिंग का रिमाइंडर कब देखने को मिल सकता है?	reminder	4
3231323332333437	IN:GET_REMINDER_DATE_TIME	मेरा अगला रिमाइंडर किस समय पर है?	reminder	4
3231323331393837	IN:GET_REMINDER_DATE_TIME	ट्रक को रिपेयर करने का मेरा रिमाइंडर कब है?	reminder	4
3231323239363637	IN:GET_REMINDER_DATE_TIME	कॉन्सर्ट का रिमाइंडर कब का है?	reminder	4
3231323239313831	IN:GET_REMINDER_DATE_TIME	तेशा के साथ लंच करने का मेरा रिमाइंडर किस समय का है?	reminder	4
3231323235313732	IN:GET_REMINDER_DATE_TIME	पिछली बार मैंने कब पौधों को पानी देने के लिए एक रिमाइंडर सेट किया था?	reminder	4
3231323332393835	IN:GET_REMINDER_DATE_TIME	जिम की रिटायरमेंट पार्टी के लिए रिमाइंडर कब सेट किया गया है	reminder	4
3231323237353738	IN:GET_REMINDER_DATE_TIME	मुझे देखने दो कि ऑफिस की मीटिंग का रिमाइंडर कब का सेट है	reminder	4
3138393932333333	IN:GET_EMPLOYMENT_TIME	बॉब वहां किस तारीख से काम कर रहा है	people	5
3138393931333738	IN:GET_EMPLOYMENT_TIME	क्या गूगल से पहले टोन्या चिपोटल में काम करती थी?	people	5
3138393933373038	IN:GET_EMPLOYMENT_TIME	मरानी ने Toys R Us में कितने समय तक काम किया?	people	5
3138393933333534	IN:GET_EMPLOYMENT_TIME	बॉब ने फॉक्स में कितने समय तक काम किया?	people	5
3138393933303438	IN:GET_EMPLOYMENT_TIME	मार्क ने Home Depot में काम करना कब शुरू किया?	people	5
3138393933303037	IN:GET_EMPLOYMENT_TIME	जो ने एप्पन के लिए कितने टाइम तक काम किया है?	people	5
3138393932373930	IN:GET_EMPLOYMENT_TIME	सिंडी अपनी मौजूदा नौकरी कब से कर रही है?	people	5
3138393932343136	IN:GET_EMPLOYMENT_TIME	सराह कितने समय से Allstate के लिए काम कर रही है?	people	5
3138393932303633	IN:GET_EMPLOYMENT_TIME	केविन ने amazon के लिए कितने समय पहले काम करना शुरू किया?	people	5
3138393931393937	IN:GET_EMPLOYMENT_TIME	वेस्टसाइड अप्लायंस में मार्क कितने दिनों से काम कर रहा है	people	5
3132363031353339	IN:LOOP_MUSIC	पिछले गाने को छः बार बजाओ	music	6
39353639343433	IN:LOOP_MUSIC	क्या मैं उस गाने को बार-बार सुन सकता हूँ?	music	6
3139383539323832	IN:GET_CONTACT_METHOD	टॉम का नंबर क्या है	people	7
3139383039323035	IN:GET_CONTACT_METHOD	हैली शरमर्स का इंस्टाग्राम यूजरनेम	people	7
3139383039313938	IN:GET_CONTACT_METHOD	एलेक्जेंड्रा ज़ेन के लिए ईमेल चाहिए	people	7
3132363036343134	IN:SKIP_TRACK_MUSIC	इसे छोड़ दो	music	8
3132353834333036	IN:SKIP_TRACK_MUSIC	क्या तुम अगला गाना चला दोगे कृप्या	music	8
39353831313535	IN:SKIP_TRACK_MUSIC	इस गाने को छोड़ो	music	8
39343638393830	IN:SKIP_TRACK_MUSIC	मैं अगला गाना सुनना चाहता हूँ	music	8
3132353732393233	IN:SKIP_TRACK_MUSIC	कोई और गाना चला दो	music	8
3132353634353931	IN:SKIP_TRACK_MUSIC	अगला गाना  चलाओ	music	8
39353735313235	IN:SKIP_TRACK_MUSIC	ट्रैक स्किप करें	music	8
39353639383438	IN:SKIP_TRACK_MUSIC	सभी देशी गाने रोक दो	music	8
39353639353034	IN:SKIP_TRACK_MUSIC	अगला गाना बजाओ	music	8
3132363139313739	IN:LIKE_MUSIC	मेरे लिए यह पसंदीदा गाना	music	9
3132353837373438	IN:LIKE_MUSIC	इस गाने को मेरे फेवरेट में मार्क करो	music	9
39353830303236	IN:GET_TRACK_INFO_MUSIC	इस गाने का क्या नाम है?	music	10
39353536323532	IN:GET_TRACK_INFO_MUSIC	इस गाने का कलाकार कौन है?	music	10
39353432383533	IN:GET_TRACK_INFO_MUSIC	पिछला वाला गाना किसने गाया था?	music	10
39353339343731	IN:GET_TRACK_INFO_MUSIC	ये कौन सा कलाकार है	music	10
39353333353232	IN:GET_TRACK_INFO_MUSIC	क्या ये गाना नए एल्बम में है?	music	10
39353330373833	IN:GET_TRACK_INFO_MUSIC	इस धुन को पहचानो	music	10
39353033373134	IN:GET_TRACK_INFO_MUSIC	इस गाने के परफॉर्मर का क्या नाम है?	music	10
39343839393133	IN:GET_TRACK_INFO_MUSIC	अभी कौन खेल रहा है	music	10
39343837313035	IN:GET_TRACK_INFO_MUSIC	इस गाने की कीमत क्या है?	music	10
3139393237343833	IN:GET_TRACK_INFO_MUSIC	इस समय iHeartRadio पर कौन सा गाना चल रहा है?	music	10
3132363231303136	IN:GET_TRACK_INFO_MUSIC	इस ट्रैक का नाम क्या है	music	10
3132363139373635	IN:GET_TRACK_INFO_MUSIC	आखरी गाने का नाम क्या था	music	10
3132363138393634	IN:GET_TRACK_INFO_MUSIC	इस आर्टिस्ट का नाम क्या है	music	10
3132363036323038	IN:GET_TRACK_INFO_MUSIC	कलाकार कौन है	music	10
3132353932383338	IN:GET_TRACK_INFO_MUSIC	क्या यह नया गाना है	music	10
3132353839343738	IN:GET_TRACK_INFO_MUSIC	इस एल्बम में कौन-से कलाकार हैं	music	10
3231333932363032	IN:CREATE_REMINDER	मैंने कहा अफेस्ट के लिए पैक करने के लिए रिमाइंडर लगाओ	reminder	11
3231323432333132	IN:CREATE_REMINDER	मुझे याद दिलाना कि आज दोपहर को प्लम्बर को कॉल करनी है	reminder	11
3231323339393336	IN:CREATE_REMINDER	मुझे याद दिलाना कि शाम 5 बजे मुझे खाना बनाना है	reminder	11
3231323339373534	IN:CREATE_REMINDER	अगले हफ्ते टोनी के बर्थडे का मुझे रिमाइंडर देना	reminder	11
3231323339353232	IN:CREATE_REMINDER	मुझे याद कराना कि आज दोपहर 3 बजे मेरी अपॉइंटमेंट है	reminder	11
3231323339333438	IN:CREATE_REMINDER	मुझे दोपहर को कसरत करने का याद दिलाना	reminder	11
3231323339323230	IN:CREATE_REMINDER	मेरी अपॉइंटमेंट के एक घंटे पहले मुझे याद दिलाना	reminder	11
3231323339313036	IN:CREATE_REMINDER	सुबह 10 बजे का रिमाइंडर लगाओ	reminder	11
3231323338383734	IN:CREATE_REMINDER	मुझे गुरुवार को डाइट शुरू करने के बारे में रिमाइंड करवाएँ	reminder	11
3231323338383337	IN:CREATE_REMINDER	मुझे और कॉपी पेपर खरीदने के बारे में रिमाइंड करवाएँ.	reminder	11
3231323338353536	IN:CREATE_REMINDER	मुझे कल तोहफ़ा खरीदने के बारे में रिमाइंड करवाएँ	reminder	11
3231323338333039	IN:CREATE_REMINDER	मुझे दिन में मेरे डॉक्टर के अपॉइंटमेंट के बारे में रिमाइंड करवाएँ	reminder	11
3231323337393831	IN:CREATE_REMINDER	मुझे दोपहर में टूथपेस्ट खरीदने के बारे में रिमाइंड करवाएँ	reminder	11
3231323337373539	IN:CREATE_REMINDER	मुझे याद दिलाना कि गुरुवार को मुझे कसरत करना है।	reminder	11
3231323337373435	IN:CREATE_REMINDER	मुझे याद दिलाना कि शुक्रवार शाम 4 बजे मुझे अपने वकील को कॉल करनी है	reminder	11
3231323337343936	IN:CREATE_REMINDER	रविवार शाम 5 बजे का रिमाइंडर लगा दो	reminder	11
3231323336363034	IN:CREATE_REMINDER	मुझे याद कराना कि बिजली का बिल चेक करना है	reminder	11
3231323336343834	IN:CREATE_REMINDER	इस वीकेंड में होने वाली पार्टी के बारे में मुझे याद दिलाना	reminder	11
3231323336303634	IN:CREATE_REMINDER	मुझे मैगज़ीन की सदस्यता कैंसल करने के बारे में रिमाइंड करवाएँ.	reminder	11
3231323336303336	IN:CREATE_REMINDER	मुझे लाइसेंस प्लेट को रिन्यू करने का याद दिलाना	reminder	11
3231323335393939	IN:CREATE_REMINDER	खाना बनाने के लिए दो घंटे बाद का रिमाइंडर लगाओ	reminder	11
3231323335383831	IN:CREATE_REMINDER	दोपहर के 12 बजे मुझे किराने का सामान लाने के लिए याद दिलाना	reminder	11
3231323335333235	IN:CREATE_REMINDER	मुझे याद दिलाना की मेरी बेटी का बुधवार को शाम के 7 बजे कार्यक्रम है	reminder	11
3231323333383637	IN:CREATE_REMINDER	क्या तुम हमें याद दिला सकते हो कि इस शनिवार की रात को कॉन्सर्ट है?	reminder	11
3231323333363030	IN:CREATE_REMINDER	डैड और टॉम को 15 मिनट पहले ही शाम 6 बजे निकलने के लिए याद करा देना	reminder	11
3231323332373735	IN:CREATE_REMINDER	इस वीकेंड को शेली के जन्मदिन की पार्टी के लिए रिमाइंडर लगाओ।	reminder	11
3231323330393237	IN:CREATE_REMINDER	एक रिमाइंडर शुरू करना	reminder	11
3231323330323530	IN:CREATE_REMINDER	सोमवार को सुबह 8 बजे थैंक यू कार्ड भेजने के बारे में मुझे रिमाइंड करवाएँ.	reminder	11
3231323237363333	IN:CREATE_REMINDER	हाईकिंग ग्रुप को याद दिलाना कि शनिवार सुबह उन्हें अपना गियर लेकर आना है।	reminder	11
3231323237333039	IN:CREATE_REMINDER	मुझे याद दिलाना कि नए टेक इक्विपमेंट की खरीदारी के बारे में मुझे एकाउंटिंग डिपार्टमेंट को 5 ईमेल भेजने हैं	reminder	11
3231323235343933	IN:CREATE_REMINDER	मुझे याद दिलाना कि दोपहर 3 बजे बच्चों के लिए पानी लाना है	reminder	11
3231323233323237	IN:CREATE_REMINDER	मार्टिन फैमिली रीयूनियन के लिए 17 अक्टूबर से तीन महीने पहले रिमाइंडर लगाओ	reminder	11
3231323232363437	IN:CREATE_REMINDER	पीटर के जन्मदिन की पार्टी के लिए साइड डिश लाने का रिमाइंडर सेट करें	reminder	11
3231313536343037	IN:CREATE_REMINDER	1 सितंबर को लुआउ पार्टी की सभी चीज़ों का आर्डर करने के लिए एक रिमाइंडर सेट कर देना	reminder	11
3231313536333436	IN:CREATE_REMINDER	मुझे याद कराना कि कल दोपहर असाइनमेंट्स के मार्क्स देने हैं।	reminder	11
3231313535373332	IN:CREATE_REMINDER	मुझे डेब्बी और एरिक की सालगिरह के एक हफ्ते पहले याद दिलाना	reminder	11
3231313535343438	IN:CREATE_REMINDER	मुझे मेरी आँख का अपॉइंटमेंट कैंसल करके फिर से शेड्यूल करने के बारे में रिमाइंड करवाएँ	reminder	11
3231313535313633	IN:CREATE_REMINDER	मुझे डेंटिस्ट को कॉल करने के बारे में रिमाइंड करवाएँ	reminder	11
3231313534333434	IN:CREATE_REMINDER	मुझे कॉन्सर्ट के शेड्यूल के बारे में रिमाइंड करवाएँ.	reminder	11
3231313534313533	IN:CREATE_REMINDER	मुझे आज शाम को 5 बजे लहसुन खरीदने के बारे में रिमाइंड करवाएँ.	reminder	11
3231313534303234	IN:CREATE_REMINDER	रविवार को 10:30 बजे ड्रेस फिटिंग के लिए रिमाइंडर लगा दो	reminder	11
3231313532373632	IN:CREATE_REMINDER	मुझे आज बैटरी लेने के बारे में रिमाइंड करवाएँ	reminder	11
3231313532333331	IN:CREATE_REMINDER	मेरे कल दिन में 1 बजे के डेंटिस्ट के अपॉइंटमेंट का रिमाइंडर बनाएँ	reminder	11
3231313531393134	IN:CREATE_REMINDER	हमारी बीच ट्रिप की पैकिंग करने के लिए फ्राइडे का रिमाइंडर लगाओ	reminder	11
3231313531363733	IN:CREATE_REMINDER	4 अगस्त को सुबह 8 बजे Edible Arrangements से सैमी और विफ़ के लिए तोहफ़ा भेजने का रिमाइंडर सेट करें.	reminder	11
3231313530363433	IN:CREATE_REMINDER	शनिवार, अगस्त 4 को सुबह 10 बजे होने वाली बैक टू स्कूल सेलिब्रेशन के लिए मुझे 2 घंटे पहले याद दिला देना	reminder	11
3231313530303735	IN:CREATE_REMINDER	सुबह मुझे नाश्ता करने के लिए याद दिलाना	reminder	11
3231313439353439	IN:CREATE_REMINDER	मुझे मंगलवार को रेमन के लिए केयर पैकेज भेजना याद दिलाना	reminder	11
3231313439323431	IN:CREATE_REMINDER	मेरे पति को कॉल करने के लिए रिमाइंडर सेट करें और उन्हें हमारे रिज़र्वेशन के बारे में याद दिलाएँ	reminder	11
3231313438373732	IN:CREATE_REMINDER	मुझे याद दिलाना कि मुझे आज शाम 6 बजे अपना कमरा साफ़ करना है।	reminder	11
3231313438313730	IN:CREATE_REMINDER	मुझे याद दिलाना कि आज रात 12 बजे मुझे अपनी दवाई लेनी है	reminder	11
3231313437393738	IN:CREATE_REMINDER	मुझे याद दिलाना कि आज दोपहर 3 बजे मुझे अमेज़न पर अपना नया वीजा कार्ड डालना है।	reminder	11
3231313437393431	IN:CREATE_REMINDER	मुझे स्टेन से गुरुवार, 7:15 पर कार लेने के बारे में रिमाइंड करवाएँ.	reminder	11
3231313437383431	IN:CREATE_REMINDER	इस बुधवार मुझे एलेक्स का तोहफ़ा भेजना याद करा देना।	reminder	11
3231313437343330	IN:CREATE_REMINDER	मेरे नए स्कूटर को असेंबल करने के लिए डुएन से उनके औजार मांगने के लिए मुझे याद दिला देना।	reminder	11
3231313436383430	IN:CREATE_REMINDER	अभी से 2 घंटे और 50 मिनट बाद का एक रिमाइंडर सेट कर दो	reminder	11
3231313436373039	IN:CREATE_REMINDER	मुझे ट्रेक्टर को आज रात बैटरी चार्जर से हटाने के बारे में याद रखना है.	reminder	11
3231313436373033	IN:CREATE_REMINDER	मुझे इस हफ्ते कुत्ते को नहलाने का याद दिलाओ	reminder	11
3231313435353133	IN:CREATE_REMINDER	मुझे अपनी प्रेजेंटेशन के लिए पढ़ना है; क्या तुम बुधवार का एक रिमाइंडर सेट कर सकते हो?	reminder	11
3231313434373234	IN:CREATE_REMINDER	मुझे दिसंबर 12 को क्रिसमस कार्ड्स भेजने का याद दिलाना।	reminder	11
3231343030383632	IN:CREATE_REMINDER	प्लीज़ मुझे याद दिलाना कि मुझे शलजम को उबालना है।	reminder	11
3231333932373133	IN:CREATE_REMINDER	मुझे कल शाम 5:00 बजे याद दिलाना	reminder	11
3231323432333233	IN:CREATE_REMINDER	अपॉइंटमेंट के लिए डेंटिस्ट को कॉल करने का रिमाइंडर जोड़ो	reminder	11
3231323431393737	IN:CREATE_REMINDER	शाम 7 बजे माँ को कॉल करने की याद दिलाएँ	reminder	11
3231323431363636	IN:CREATE_REMINDER	मुझे आज रात 5 बजे माँ को कॉल करने के बारे में रिमाइंड करवाएँ	reminder	11
3231323431353237	IN:CREATE_REMINDER	मुझे आज रात माँ को कॉल करने के लिए याद दिलाएं	reminder	11
3231323431353230	IN:CREATE_REMINDER	कल काम से आने के बाद शाम 6 बजे टिम को कॉल करने के लिए मुझे रिमाइंड करवाएँ	reminder	11
3231323431343638	IN:CREATE_REMINDER	मुझे याद दिलाना कि आज सुबह 9:00 बजे स्टेटस कॉल में शामिल होना है	reminder	11
3231323431343337	IN:CREATE_REMINDER	मुझे घर पहुँचने पर कूड़ा बाहर निकालने के बारे में रिमाइंड करवाएँ	reminder	11
3231323431343134	IN:CREATE_REMINDER	मुझे माँ को कॉल करने के लिए रिमाइंड करवाएँ	reminder	11
3231323431313032	IN:CREATE_REMINDER	मुझे एक घंटे में दफ़्तर कॉल करना याद दिलाएँ	reminder	11
3231323431303933	IN:CREATE_REMINDER	काम पर पहुंचने के बाद मुझे डॉक्टर को कॉल करने की याद दिलाएं	reminder	11
3231323430393234	IN:CREATE_REMINDER	नया रिमाइंडर: आज दोपहर डॉक्टर को कॉल करना है।	reminder	11
3231323430393233	IN:CREATE_REMINDER	9 सितंबर को कास्टिंग कॉल के लिए याद दिलाना	reminder	11
3231323430383238	IN:CREATE_REMINDER	मुझे आज रात चादर धोने के लिए याद दिलाना	reminder	11
3231323430383035	IN:CREATE_REMINDER	मुझे कल साइकिल क्लास के बारे में रिमाइंड करवाएँ	reminder	11
3231323430373538	IN:CREATE_REMINDER	आज रात को दूध लाने के लिए याद दिलाएं	reminder	11
3231323430363430	IN:CREATE_REMINDER	जॉन के जन्मदिन से पहले मुझे गिफ्ट खरीदना याद करा देना	reminder	11
3231323430333038	IN:CREATE_REMINDER	मुझे 21 मिनट में केक बाहर निकालने के लिये याद कराना।	reminder	11
3231323430323732	IN:CREATE_REMINDER	शाम को 4 बजे बर्तन धोने के लिए रिमाइंडर सेट करें	reminder	11
3231323430323335	IN:CREATE_REMINDER	ऐना के ऑडीशन के लिए रिमाइंडर सेट करें	reminder	11
3231323430313036	IN:CREATE_REMINDER	मुझे अपॉइंटमेंट कैंसल करना याद दिलाना	reminder	11
3231323430303930	IN:CREATE_REMINDER	मुझे कल सुबह 10 बजे के ब्रंच के बारे में याद दिलाएं	reminder	11
3231323339383232	IN:CREATE_REMINDER	4 जुलाई की पार्टी का रिमाइंडर लगा दो	reminder	11
3231323339383138	IN:CREATE_REMINDER	कल शाम मुझे सॉकर गेम रिकार्ड करने के लिए याद दिलाओ	reminder	11
3231323339363932	IN:CREATE_REMINDER	कल रात 8 बजे वाले डिनर के बारे में मुझे याद दिलाना	reminder	11
3231323339363535	IN:CREATE_REMINDER	क्या तुम मुझे 21 सितंबर को मेरे भाई के जन्मदिन की बधाई देने की याद दिलाओगे?	reminder	11
3231323339353339	IN:CREATE_REMINDER	मुझे रिमाइंड करवाएँ कि मुझे कल काम है.	reminder	11
