ID	intent	text	domain	label
3232353138333633	IN:CREATE_CALL	कोनर और ऑस्कर के साथ वॉट्सऐप पर कॉल शुरू करें	calling	42
3232353138333438	IN:CREATE_CALL	हैंगआउट्स पर मिया, कायरा, एलन और नो को कॉल करो	calling	42
3232353138333431	IN:CREATE_CALL	एवरी, ह्यूगो और ब्रायन को डायल करें	calling	42
3232353138323631	IN:CREATE_CALL	जेरेमायाह, डॉल्टन, डकोटा और पॉलीना को कॉल लगाएं	calling	42
3232353138323337	IN:CREATE_CALL	मैसेंजर पर केटलिन और मैक्सवेल के साथ कॉल शुरू करें	calling	42
3232353138323239	IN:CREATE_CALL	क्या आप एडम और कैली को डायल करेंगे	calling	42
3232353138323131	IN:CREATE_CALL	मेरे लिए रीगन, चार्ल्स, और एलीना के लिए वीडियो कॉल बनाएँ	calling	42
3232353138313835	IN:CREATE_CALL	कृपया सिंडी, जैमी, और डेस्टिनी डायल करें	calling	42
3232353138313633	IN:CREATE_CALL	drama nerds को कॉल लगाएँ	calling	42
3232353138303137	IN:CREATE_CALL	लाइन पर एलन के साथ वीडियो चैट करें	calling	42
3232353137393837	IN:CREATE_CALL	होम एंड गार्डन को कॉल करें	calling	42
3232353137383131	IN:CREATE_CALL	गार्डन क्लब ग्रुप के साथ एक कॉल शुरू करें	calling	42
3232353137373830	IN:CREATE_CALL	knitting को वीडियो कॉल लगाएँ	calling	42
3232353137373038	IN:CREATE_CALL	मैं अपने एशियाई प्रोफेशनल्स ग्रुप को वीडियो कॉल करना चाहता हूँ	calling	42
3232353038323932	IN:CREATE_CALL	पिंग पोंग क्लब के साथ एक वीडियो कॉल शुरू करें	calling	42
3232353038323035	IN:CREATE_CALL	मैं अपने फोटोग्राफी ग्रुप को कॉल करना चाहता हूँ	calling	42
3232353038313839	IN:CREATE_CALL	मैसेंजर पर लूसी, बेंजी, जोस और बेन के साथ वीडियो कॉल शुरू करें	calling	42
3232343534323136	IN:CREATE_CALL	क्या आप वीडियो कॉल शुरू कर सकते हैं	calling	42
3232343534323132	IN:CREATE_CALL	क्या आप वॉट्सऐप संपर्कों को कॉल कर सकते है	calling	42
3232343430303337	IN:CREATE_CALL	पिंग ग्राहम	calling	42
3232343339393730	IN:CREATE_CALL	ब्रेक्सटन शाह को पिंग करें	calling	42
3232343339393530	IN:CREATE_CALL	मैथ्यू मेककी को पिंग करें	calling	42
3232333730383338	IN:CREATE_CALL	ईथान टकर की पोती को कॉल करें	calling	42
3232333730383139	IN:CREATE_CALL	वेलन के पापा नेटली श्मीट को कॉल करें	calling	42
3232333730383138	IN:CREATE_CALL	लायला के भाई को कॉल करना शुरू करें	calling	42
3232333730383137	IN:CREATE_CALL	रोज़ के नाना को डायल करें	calling	42
3232333730383135	IN:CREATE_CALL	मैक्स ब्लैक के दादाजी को फ़ोन करें	calling	42
3232333730373037	IN:CREATE_CALL	ब्रायन टायलर की पत्नी को कॉल करें	calling	42
3232333730363634	IN:CREATE_CALL	मैसन के दादाजी को कॉल करें	calling	42
3232333730363234	IN:CREATE_CALL	मेवरिक ओस्लन की पत्नी का नंबर लगाएँ	calling	42
3232333730353933	IN:CREATE_CALL	मार्क मेयर्स के पापा के साथ एक कॉल शुरू करें	calling	42
3232333730353434	IN:CREATE_CALL	कृपया कैमिला के बच्चे को कॉल करें	calling	42
3232333730353433	IN:CREATE_CALL	मैकेंजी के दादाजी को कॉल करें	calling	42
3232333730353231	IN:CREATE_CALL	जेनिफर करी के पिताजी को कॉल करें	calling	42
3232333730353139	IN:CREATE_CALL	क्या आप थॉमस की आंटी हेनरी सिम्पसन को कॉल कर सकते हैं	calling	42
3232333730343334	IN:CREATE_CALL	एलेक्सा डेलगाडो के दोस्त को फोन करें	calling	42
3232333730333931	IN:CREATE_CALL	क्या आप मारियाना की माँ हैडली पीटरसन को कॉल कर सकते हैं	calling	42
3232333636343237	IN:CREATE_CALL	वॉट्सऐप से मेरे पापा को कॉल करें	calling	42
3232333636333339	IN:CREATE_CALL	दादा के फ़ोन पर वॉट्सऐप कॉल करें	calling	42
3231313235343131	IN:GET_SUNSET	सनडाउन किस समय है?	weather	43
3132363034373135	IN:GET_SUNSET	5 अगस्त 1922 को सूरज कब ढला था	weather	43
3132363033393031	IN:GET_SUNSET	सूर्यास्त किस समय होता है	weather	43
3138393835353639	IN:GET_LOCATION	केरेन का पुराना पता क्या था	people	44
3138393835323632	IN:GET_LOCATION	अहमद किस शहर में रहता है ?	people	44
3138393835323130	IN:GET_LOCATION	मुझे साराह के कार्य-स्थल का पता चाहिए।	people	44
3138393834363237	IN:GET_LOCATION	क्या एलेक्स बेमोंट पर रहता है	people	44
3231373530353331	IN:GET_LOCATION	मैं चाहता हूँ कि आप मुझे दूसरे इवेंट का स्थान बताएं	event	44
3231373530323536	IN:GET_LOCATION	दूसरा इवेंट कहां है?	event	44
3139343333343936	IN:GET_LOCATION	अकीरा कुरोसावा कहाँ से है?	people	44
3139343332353531	IN:GET_LOCATION	स्टीव जॉब्स कहाँ बड़े हुए?	people	44
3138393935343034	IN:GET_LOCATION	मिगुएल कहाँ रहता है?	people	44
3138393837303232	IN:GET_LOCATION	मेरे ऑफिस का पता क्या है?	people	44
3138393836383433	IN:GET_LOCATION	क्या यह सच है कि पॉल गार्डन ग्रोव में रहता है?	people	44
3138393836373438	IN:GET_LOCATION	क्या कैथी अभी भी रिवरव्यू स्ट्रीट पर रहती है?	people	44
3138393836363436	IN:GET_LOCATION	मेरा एक्स-बॉयफ्रेंड सैम इस वक्त शहर के किस तरफ़ रहता है?	people	44
3138393836353936	IN:GET_LOCATION	अमेंडा के घर का पता क्या है?	people	44
3138393836343430	IN:GET_LOCATION	मार्गरेट का पता क्या है	people	44
3138393836333131	IN:GET_LOCATION	जेम्स अब कहां रह रहा है?	people	44
3138393836323238	IN:GET_LOCATION	स्कॉट के कार्य-स्थल का पता क्या है?	people	44
3138393835393739	IN:GET_LOCATION	क्या जॉर्ज मिनोट में रह रहा है?	people	44
3138393835393435	IN:GET_LOCATION	क्या सैम का घर का पता अब भी वही है	people	44
3138393835363239	IN:GET_LOCATION	एंडी कहाँ रहता है?	people	44
3138393835363236	IN:GET_LOCATION	क्या पेड्रो अभी भी ग्रीन ब्रूक में रहता है?	people	44
3138393835353832	IN:GET_LOCATION	बचपन में डेस्ट्रीवा कहाँ रहती थी?	people	44
3138393835333333	IN:GET_LOCATION	क्या स्मिथ परिवार बटलर में रहता है?	people	44
3138393835313231	IN:GET_LOCATION	जॉर्ज के घर का पता क्या है?	people	44
3138393834383637	IN:GET_LOCATION	क्या सैम पेरेज़ फोर्ट वर्थ में रहता है?	people	44
3138393739383038	IN:GET_LOCATION	सीएटल में जेन कहाँ रहती है?	people	44
3138393739313437	IN:GET_LOCATION	क्या टॉम अभी भी ओशन सिटी में रहता है	people	44
3231373530353139	IN:GET_LOCATION	मुझे घोस्ट हाउस ओपनिंग डे का स्थान बताएं	event	44
3231373530333837	IN:GET_LOCATION	क्या आप मुझे इस इवेंट का स्थान बता सकते हैं	event	44
3231373530323634	IN:GET_LOCATION	मुझे पहले इवेंट के स्थान के बारे में बताएं	event	44
3139343333373034	IN:GET_LOCATION	जॉर्ज लुकास का जन्म कहाँ हुआ था?	people	44
3139343333363134	IN:GET_LOCATION	क्रिस रॉक का जन्म कहाँ हुआ था?	people	44
3232343532363737	IN:SET_RSVP_NO	मेरी स्थिति को दिया डे लॉस मुर्टोस नहीं जाने के लिए बदलें	event	45
3232343532323236	IN:SET_RSVP_NO	कॉमिक कॉन के लिए नहीं में जवाब दें	event	45
3232343533323133	IN:SET_RSVP_NO	टेस्ट ऑफ़ सिएटल के लिए नहीं जा रहा हूँ	event	45
3232343533323037	IN:SET_RSVP_NO	मेरा स्टेटस बदलकर मैं इस ईवेंट के लिए नहीं जा रहा हूँ करें	event	45
3232343533313335	IN:SET_RSVP_NO	मेरी स्थिति को स्लीपिंग ब्यूटी ड्रीम्स के लिए नहीं जाना बदलें	event	45
3231323337303939	IN:DELETE_REMINDER	कृपया बेकन खरीदने के लिए मेरा अनुस्मारक रद्द करें	reminder	48
3231323334383334	IN:DELETE_REMINDER	इस महीने हमारे घर के रंग-रोगन का रिमाइंडर हटाएँ	reminder	48
3231323332303137	IN:DELETE_REMINDER	मेरा कुकिंग रिमाइंडर डिलीट करें।	reminder	48
3231323331393032	IN:DELETE_REMINDER	अगले 4 घंटे के सारे रिमाइंडर अलर्ट डिलीट करें।	reminder	48
3231323331373939	IN:DELETE_REMINDER	इस हफ़्ते परिवार के साथ डिनर का रिमाइंडर हटाएँ	reminder	48
3231323331323632	IN:DELETE_REMINDER	मैं मई के महीने में कैलिफोर्निया जाने वाला रिमाइंडर हटाना चाहता हूँ।	reminder	48
3231323331303936	IN:DELETE_REMINDER	आज की शादी की पार्टी के लिए मेरे रिमाइंडर का अलर्ट हटाएं।	reminder	48
3231323239383333	IN:DELETE_REMINDER	मेरे द्वारा फरवरी-जुलाई के लिए सेट किए गए सभी अनुस्मारक हटा दें	reminder	48
3231323239333038	IN:DELETE_REMINDER	कृपया जनवरी के सभी गेम नाइट रिमाइंडर हटाएं	reminder	48
3231323237393037	IN:DELETE_REMINDER	मंगलवार को ड्राई क्लीनिंग लेने जाने के मेरे रिमाइंडर को डिलीट करें	reminder	48
3231323237363032	IN:DELETE_REMINDER	अगले 2 घंटे के सारे रिमाइंडर हटा दें	reminder	48
3231323237313033	IN:DELETE_REMINDER	मेरे दोपहर 2 बजे के रैकेट बॉल गेम का रिमाइंडर कैंसल करें।	reminder	48
3231323236383832	IN:DELETE_REMINDER	क्या आप मेरी कॉफी डेट के बारे में बनाए गए आखिरी रिमाइंडर को हटा सकते हैं?	reminder	48
3231323234353433	IN:DELETE_REMINDER	शुक्रवार को जेरेमी के जन्मदिन के लिए फूल खरीदने का रिमाइंडर डिलीट करें।	reminder	48
3231323234333334	IN:DELETE_REMINDER	कल रात के खाने के लिए अनुस्मारक हटाएं।	reminder	48
3231323233383036	IN:DELETE_REMINDER	शादी से संबंधित सभी रिमाइंडर रद्द करें	reminder	48
3231323232333035	IN:DELETE_REMINDER	इस वीकेंड और अगले वीकेंड के साइकिलिंग ग्रुप के रिमाइंडर डिलीट करें।	reminder	48
3231313535323634	IN:DELETE_REMINDER	कल सुबह 10 बजे कार्लोस से मिलने का रिमाइंडर डिलीट करें।	reminder	48
3231313534373832	IN:DELETE_REMINDER	मुझे कल सुबह 8 बजे मेल चेक करना याद ना दिलाएं	reminder	48
3231313532363735	IN:DELETE_REMINDER	सोमवार रात का फुटबॉल रिमाइंडर डिलीट करें।	reminder	48
3231313530333435	IN:DELETE_REMINDER	पेन खरीदने के लिए अनुस्मारक को हटाएं	reminder	48
3231313530323536	IN:DELETE_REMINDER	मेरा डिनर का रिमाइंडर डिलीट करें	reminder	48
3231313530313030	IN:DELETE_REMINDER	कल बच्चों को लेने जाने का रिमाइंडर डिलीट करें।	reminder	48
3231313436373337	IN:DELETE_REMINDER	क्या आप कल की मेरी डेंटिस्ट अपॉइंटमेंट का अलर्ट हटा सकते हैं	reminder	48
3231313436313336	IN:DELETE_REMINDER	नाश्ते का रिमाइंडर कैंसल करें	reminder	48
3231313433393837	IN:DELETE_REMINDER	जेम्स को पिक करने के रिमाइंडर को डिलीट करें	reminder	48
3231313433393830	IN:DELETE_REMINDER	4 अगस्त को ब्रॉडवे शो के रिमाइंडर को डिलीट कर दें।	reminder	48
3231333938353235	IN:DELETE_REMINDER	कांफ्रेंस के बारे में मेरा रिमाइंडर रद्द करें	reminder	48
3231323431323531	IN:DELETE_REMINDER	मित्र को कॉल करने के रिमाइंडर को रद्द कर दें	reminder	48
3231323430383234	IN:DELETE_REMINDER	डेंटिस्ट के रिमाइंडर को रद्द करें	reminder	48
3231323430383036	IN:DELETE_REMINDER	काम के मेरे रिमाइंडर को रद्द करें	reminder	48
3231323430373539	IN:DELETE_REMINDER	टॉयलेट पेपर खरीदने का मेरा रिमाइंडर कैंसल करें।	reminder	48
3231323339313038	IN:DELETE_REMINDER	बुधवार की अपॉइंटमेंट का रिमाइंडर कैंसल करें	reminder	48
3231323338393434	IN:DELETE_REMINDER	कल के लिए मेरे सभी रिमाइंडर रद्द करें।	reminder	48
3231323338303235	IN:DELETE_REMINDER	मेरे सारे रिमाइंडर कैंसल करें	reminder	48
3231323336383138	IN:DELETE_REMINDER	बिल्ली का खाना खरीदने के मेरे रिमाइंडर को रद्द कर दें।	reminder	48
3231323336343635	IN:DELETE_REMINDER	मेरे सभी अनुस्मारक हटाएं	reminder	48
3231323335393834	IN:DELETE_REMINDER	बुधवार दोपहर 1 बजे डॉक्टर से मिलने का रिमाइंडर रद्द करें	reminder	48
3231323334373536	IN:DELETE_REMINDER	मेरे सभी रिमाइंडर हटाएं।	reminder	48
3231323334323136	IN:DELETE_REMINDER	क्या आप रिमाइंडर हटा सकते हैं	reminder	48
3231323333383639	IN:DELETE_REMINDER	मेलिसा की सगाई की पार्टी का रिमाइंडर हटाएं।	reminder	48
3231323333373935	IN:DELETE_REMINDER	डॉक्टर से मिलने के अलर्ट को रद्द कर दें।	reminder	48
3231323333323837	IN:DELETE_REMINDER	कल लसग्ना बनाने वाला रिमाइंडर रद्द करें।	reminder	48
3231323333323431	IN:DELETE_REMINDER	पिछले महीने के सभी रिमाइंडर हटा दें	reminder	48
3231323332373139	IN:DELETE_REMINDER	म्यूज़िक क्लासों के रिमाइंडर हटाएँ।	reminder	48
3135333031323133	IN:CREATE_TIMER	टाइमर पर 15 मिनट	timer	49
3135323935333131	IN:CREATE_TIMER	अब से 21 मिनट बाद का टाइमर लगाएँ	timer	49
3135323930323136	IN:CREATE_TIMER	मेरे टाइमर को 6 मिनट के लिए सेट करें	timer	49
3132363033313132	IN:CREATE_TIMER	मुझे एक मिनट और सेट करना है	timer	49
39353831323731	IN:CREATE_TIMER	4 मिनट में टाइमर बजाएँ	timer	49
39353739373436	IN:CREATE_TIMER	नया टाइमर सेट करने में मेरी मदद करें	timer	49
39353737313135	IN:CREATE_TIMER	केक बेक करने के लिए टाइमर लगाएँ	timer	49
39353736303439	IN:CREATE_TIMER	1 मिनट का टाइमर लगाएँ	timer	49
39353732333538	IN:CREATE_TIMER	10 मिनट के लिए टाइमर सेट करें	timer	49
39353638393334	IN:CREATE_TIMER	टाइमर 10 मिनट के लिए ऑन करें	timer	49
39353634393530	IN:CREATE_TIMER	एक नया टाइमर शुरू करें	timer	49
39353634383135	IN:CREATE_TIMER	मेरी कसरत की टाइमिंग शुरू करें	timer	49
39353534303833	IN:CREATE_TIMER	23 मिनट के लिए टाइमर सेट करें।	timer	49
39353533323933	IN:CREATE_TIMER	कृपया 2 मिनट के लिए एक टाइमर सेट करें	timer	49
39353532363839	IN:CREATE_TIMER	गिनने के लिए टाइमर शुरू करें।	timer	49
39353532363530	IN:CREATE_TIMER	मुझे 8 घंटों के लिए टाइमर दें	timer	49
39353532333434	IN:CREATE_TIMER	क्या आप 5 मिनट का टाइमर लगा सकते हैं?	timer	49
39353530393835	IN:CREATE_TIMER	दस मिनट का एक टाइमर लगाएँ	timer	49
39353439333239	IN:CREATE_TIMER	5वें नंबर के टाइमर को 30 मिनट के लिए सेट करें	timer	49
39353432363731	IN:CREATE_TIMER	दोपहर 2 बजे 50 मिनट का टाइमर शेड्यूल करें	timer	49
39353234373237	IN:CREATE_TIMER	3 घंटे के लिए टाइमर सेट करें	timer	49
39353133303830	IN:CREATE_TIMER	मुझे एक 6 मिनट का टाइमर चाहिए	timer	49
39353038343735	IN:CREATE_TIMER	3 मिनट के लिए टाइमर सेट करें	timer	49
39353034363136	IN:CREATE_TIMER	बीस मिनट का टाइमर लगाएँ	timer	49
39353030393337	IN:CREATE_TIMER	140 सेकंड के लिए टाइमर सेट करें	timer	49
39343938393136	IN:CREATE_TIMER	3 घंटे का एक दूसरा टाइमर लगाएँ	timer	49
39343937393330	IN:CREATE_TIMER	30 मिनट के लिए एक टाइमर बनाएं।	timer	49
39343937363633	IN:CREATE_TIMER	ओवन शुरू करने के लिए टाइमर लगाएं	timer	49
39343831303834	IN:CREATE_TIMER	2 मिनट के लिए एक टाइमर बनाएँ	timer	49
39343732333633	IN:CREATE_TIMER	टाइमर फिर से शुरू करें।	timer	49
39343732323033	IN:CREATE_TIMER	प्लीज़ मेरा टाइमर शुरू करें	timer	49
3232343333313937	IN:CREATE_TIMER	1 मिनट तक चलने वाला टाइमर शुरू करें	timer	49
3232343330363735	IN:CREATE_TIMER	एक टाइमर 23 मिनट के लिए और दूसरा टाइमर 30 मिनट के लिए सेट करें	timer	49
3232333730383538	IN:CREATE_TIMER	30 मिनट में समाप्त होने वाला वर्कआउट टाइमर लगाएं	timer	49
3232333537373134	IN:CREATE_TIMER	दस मिनट का टाइमर जोड़ें	timer	49
3232323930323636	IN:CREATE_TIMER	कृपया फो नामक एक टाइमर सेट करें	timer	49
3232323530323138	IN:CREATE_TIMER	थॉ टर्की टाइमर सेट करें	timer	49
3232313432313835	IN:CREATE_TIMER	अभी टाइमर सेट करें	timer	49
3232313432313830	IN:CREATE_TIMER	एक टाइमर को 2 मिनट के लिए फिक्स करें	timer	49
3232313136343139	IN:CREATE_TIMER	आधे घंटे का टाइमर शुरू करें	timer	49
3232313136343135	IN:CREATE_TIMER	एक घंटे का टाइमर शुरू करें	timer	49
3232313136343131	IN:CREATE_TIMER	एक घंटे का टाइमर लगाएँ	timer	49
3230303431383934	IN:CREATE_TIMER	2029 बजे के लिए एक टाइमर सेट करें	timer	49
3136343732353931	IN:CREATE_TIMER	एक 1 मिनट का टाइमर शुरू करें और इसे लगातार 10 मिनट तक दोहराएं	timer	49
3136343035363537	IN:CREATE_TIMER	45 मिनट का वर्कआउट का टाइमर सेट करें	timer	49
3136343034393438	IN:CREATE_TIMER	रीस के लिए एक नया टाइमर सेट करें	timer	49
3136333731353939	IN:CREATE_TIMER	दूसरा टाइमर जोड़ें, इस बार इसे 45 मिनट के लिए सेट करें	timer	49
3135333031383035	IN:CREATE_TIMER	एक घंटे के लिए टाइमर सेट करें	timer	49
3135333031313039	IN:CREATE_TIMER	6 मिनट के लिए टाइमर सेट करें	timer	49
3135333030353836	IN:CREATE_TIMER	10 सेकंड के लिए नया टाइमर सेट करें	timer	49
3135333030323633	IN:CREATE_TIMER	15 मिनट के लिए टाइमर सेट करें	timer	49
3135323937343739	IN:CREATE_TIMER	20 मिनट के लिए टाइमर सेट करें	timer	49
3135323936343331	IN:CREATE_TIMER	पूल पंप 30 मिनट में बंद हो जाना चाहिए। कृपया टाइमर सेट करें ताकि मैं सुनिश्चित कर सकूं	timer	49
3135323935313037	IN:CREATE_TIMER	क्या आप अब से एक घंटे के लिए टाइमर लगा सकते हैं	timer	49
3135323932363636	IN:CREATE_TIMER	55 मिनट के लिए टाइमर सेट करें	timer	49
3135323930373437	IN:CREATE_TIMER	शाम 6:30 के लिए रात के खाने का टाइमर सेट करें	timer	49
3135323839363735	IN:CREATE_TIMER	क्या आप एक घंटे के लिए टाइमर सेट कर सकते हैं	timer	49
3135323839313830	IN:CREATE_TIMER	क्या आप टाइमर सेटर को 10 मिनट पर रखेंगे	timer	49
3231353336383032	IN:UPDATE_METHOD_CALL	वीडियो कॉल लगाओ	calling	51
