ID	intent	text	domain	label
3135323933393938	IN:GET_STORIES_NEWS	अभी यूरोप की ताजा खबर	news	78
3135323933373830	IN:GET_STORIES_NEWS	वर्जीनिया के राष्ट्रवादी मार्च के विवरण क्या हैं	news	78
3135323932353835	IN:GET_STORIES_NEWS	वित्त से संबंधित कोई बड़ी ख़बर है	news	78
3135323932343539	IN:GET_STORIES_NEWS	इस समय मुख्य समाचार डोनाल्ड ट्रम्प के बारे में क्या कह रहे हैं	news	78
3135323932333835	IN:GET_STORIES_NEWS	मुख्य स्थानीय खबरें क्या हैं	news	78
3135323930333933	IN:GET_STORIES_NEWS	सबसे ताजा खबर कौन सी है	news	78
3135323930323135	IN:GET_STORIES_NEWS	राजनीतिक स्कैंडल के बारे में नई जानकारियाँ दें	news	78
3135323839343830	IN:GET_STORIES_NEWS	मुझे कुछ नई सुर्खियां बताएं	news	78
3135323839343034	IN:GET_STORIES_NEWS	मुझे हाउसिंग मार्केट की खास खबरें दिखाएँ	news	78
39353831393935	IN:GET_STORIES_NEWS	क्या आज कोई मज़ेदार खबर है	news	78
39353831303136	IN:GET_STORIES_NEWS	मुझे Fox न्यूज़ की मुख्य ख़बरें बताएं	news	78
39353830383037	IN:GET_STORIES_NEWS	फॉक्स न्यूज़ की बड़ी मुख्य ख़बर क्या है	news	78
39353830373638	IN:GET_STORIES_NEWS	सेलेब्रिटी न्यूज़ क्या है	news	78
39353830313931	IN:GET_STORIES_NEWS	दुनिया भर की खबरें	news	78
39353830303530	IN:GET_STORIES_NEWS	आज रात के समाचारों में क्या चल रहा है?	news	78
39353739393234	IN:GET_STORIES_NEWS	मुझे इस वीकेंड की वे सारी खास खबरें पढ़कर सुनाएँ जो मैंने नहीं पढ़ीं	news	78
39353739363832	IN:GET_STORIES_NEWS	क्लिंटन के बारे में कोई और खबर?	news	78
39353739343330	IN:GET_STORIES_NEWS	आज की ख़बरें बताएं	news	78
39353738373531	IN:GET_STORIES_NEWS	कृपया ग्लोबल न्यूज़ चलाएं ।	news	78
39353736383835	IN:GET_STORIES_NEWS	स्काई न्यूज़ के अपडेट क्या थे	news	78
39353736333034	IN:GET_STORIES_NEWS	ताजा ब्रेकिंग न्यूज़ क्या है?	news	78
39353735313134	IN:GET_STORIES_NEWS	उत्तर कोरिया पर कोई भी ताजा खबर	news	78
39353734393634	IN:GET_STORIES_NEWS	मुझे न्यूज़ अपडेट चाहिए	news	78
39353732383734	IN:GET_STORIES_NEWS	राष्ट्रपति के बारे में आज सुबह का समाचार।	news	78
39353732333339	IN:GET_STORIES_NEWS	स्थानीय समाचार में क्या चल रहा है	news	78
39353731393531	IN:GET_STORIES_NEWS	CNN के मुख्य समाचार	news	78
39353731323536	IN:GET_STORIES_NEWS	गेम ऑफ़ थ्रोन्स पर मुझे एक समाचार अपडेट दें।	news	78
39353730343732	IN:GET_STORIES_NEWS	आयरलैंड की आज क्या खबर है?	news	78
39353730323130	IN:GET_STORIES_NEWS	राष्ट्रीय मुख्य समाचार	news	78
39353638373933	IN:GET_STORIES_NEWS	क्या उत्तर कोरिया संकट पर कोई खबर आई है	news	78
3231333039333838	IN:UPDATE_CALL	वर्तमान कॉल में दादाजी को आमंत्रित करें	calling	79
3231373234323636	IN:UPDATE_CALL	डेविड को मेरी कॉल में शामिल करें	calling	79
3231363735383138	IN:UPDATE_CALL	इस कॉल में स्टीवन को शामिल करें	calling	79
3231363039383339	IN:UPDATE_CALL	क्या आप पैस्टी इंक्स को ऐड करेंगे?	calling	79
3231363039383335	IN:UPDATE_CALL	क्या तुम डोरा फिलीपोविच को शामिल कर सकते हैं?	calling	79
3231363039383235	IN:UPDATE_CALL	प्लीज़ Gino Hinkley को ऐड करें	calling	79
3231363039383231	IN:UPDATE_CALL	प्लीज़ निकोल वैसकेज़ को ऐड करें	calling	79
3231363039383230	IN:UPDATE_CALL	कृपया पोली बिंगेली को शामिल करें	calling	79
3231353437393530	IN:UPDATE_CALL	हेलेन को इस कॉल में शामिल करें।	calling	79
3231353336343239	IN:UPDATE_CALL	केट को वीडियो कॉल से हटाएं	calling	79
3231353336343037	IN:UPDATE_CALL	इस बातचीत से फ्रेडी को हटाएं	calling	79
3231343839343534	IN:UPDATE_CALL	पेटन को ऐड करें	calling	79
3231343839343331	IN:UPDATE_CALL	चैरिटी स्टार्चमैन को ऐड करें	calling	79
3231333533373038	IN:UPDATE_CALL	कीगन को कॉल में शामिल करें	calling	79
3231333533363730	IN:UPDATE_CALL	शेल्बी को कॉल में शामिल करें	calling	79
3231333533363632	IN:UPDATE_CALL	अलेक्जेंडर को कॉल में ऐड करें	calling	79
3231333530343431	IN:UPDATE_CALL	ग्लेंडा को हमारी कॉल में शामिल करें	calling	79
3231333439313333	IN:UPDATE_CALL	कॉल में दोस्त को ऐड करें	calling	79
3231333435333634	IN:UPDATE_CALL	मुझे किसी को इस कॉल में ऐड करना है	calling	79
3231333431323634	IN:UPDATE_CALL	कॉल में जेसन को भी ऐड करें	calling	79
3231333339363833	IN:UPDATE_CALL	जेसन को भी फ़ोन पर लाएँ	calling	79
3231333131373538	IN:UPDATE_CALL	क्या आप दादाजी को मेरी कॉल में जोड़ सकते हैं	calling	79
3231333039383339	IN:UPDATE_CALL	क्या हम वीडियो चैट में मेरे कज़न्स को जोड़ सकते हैं?	calling	79
3231333039353432	IN:UPDATE_CALL	इस कॉल में सौतेली बहनों को जोड़ें	calling	79
3231333039343338	IN:UPDATE_CALL	सौतेले बच्चे पैटी को वीडियो कॉल में शामिल करें	calling	79
3231303230353932	IN:UPDATE_CALL	कर्टिस को इस चालू कॉल में ऐड करें।	calling	79
3231303138333739	IN:UPDATE_CALL	कृपया मौजूदा कॉल में जिम को जोड़ें।	calling	79
3231303135353431	IN:UPDATE_CALL	इस कॉल में रोक्सी और सेरा को ऐड करें	calling	79
3232313330363234	IN:UPDATE_CALL	इस कॉल से लूकस मेडोज़ को हटा दें	calling	79
3232313330353734	IN:UPDATE_CALL	क्या वैनेसा समर्स ने ग्रुप कॉल बंद कर दी है	calling	79
3231373234353134	IN:UPDATE_CALL	इस कॉल में बैक्सटर को ऐड करें	calling	79
3231363736323935	IN:UPDATE_CALL	मेरी मौजूदा कॉल से सेम को हटा दें।	calling	79
3231363736313937	IN:UPDATE_CALL	पिताजी को कॉल में शामिल करें	calling	79
3231363736313232	IN:UPDATE_CALL	अरे स्टीव जॉनसन को इस वीडियो कॉल में जोड़ें	calling	79
3231363039383533	IN:UPDATE_CALL	क्या कृपया आप शनिक्वा किमर को जोड़ सकते हैं?	calling	79
3231363039373635	IN:UPDATE_CALL	क्या आप मेगन को जोड़ेंगे?	calling	79
3231353438323436	IN:UPDATE_CALL	इस कॉल से जॉन को हटाएं	calling	79
3231353438313438	IN:UPDATE_CALL	फ़ोन कॉल में डेविड को ऐड करें।	calling	79
3231353438303434	IN:UPDATE_CALL	मैं चाहता हूँ कि पत्नी को इस कॉल से हटा दिया जाए	calling	79
3138393838353330	IN:GET_AGE	जॉन इस साल कितने साल का हो जाएगा?	people	80
3138393837373630	IN:GET_AGE	जाहमीर की उम्र क्या है?	people	80
3138393837363435	IN:GET_AGE	पिताजी की उम्र कितनी है	people	80
3138393837353238	IN:GET_AGE	क्या पॉल जुलाई में 67 का हो जाएगा?	people	80
3138393837343638	IN:GET_AGE	काइल की उम्र क्या है	people	80
3138393838393530	IN:GET_AGE	अगले साल अपने जन्मदिन पर बिल कितने साल का होगा?	people	80
3138393838363435	IN:GET_AGE	मुझे बताएँ मैरी कितने साल की है।	people	80
3138393838333632	IN:GET_AGE	मुझे बताएं की कैड की उम्र क्या है।	people	80
3138393838333032	IN:GET_AGE	क्या गिना मुझसे बड़ी है	people	80
39353036363531	IN:PREVIOUS_TRACK_MUSIC	कृपया आखिरी गाना फिर से बजाएं	music	81
3132353639383430	IN:PREVIOUS_TRACK_MUSIC	क्या आप पिछला गाना दोबारा प्ले करेंगे	music	81
3132353637373138	IN:PREVIOUS_TRACK_MUSIC	पिछला गाना प्ले करें	music	81
39353236373130	IN:PREVIOUS_TRACK_MUSIC	पिछला गाना दोबारा प्लीज़	music	81
39343933313732	IN:PREVIOUS_TRACK_MUSIC	क्या आप अंतिम गीत फिर से चला सकते हैं	music	81
3132353731343731	IN:PREVIOUS_TRACK_MUSIC	मैं फिर से पिछला गाना सुनना चाहता हूँ	music	81
39353632353332	IN:SUBTRACT_TIME_TIMER	टाइमर से 23 सेकंड घटाएं	timer	82
39353337363536	IN:SUBTRACT_TIME_TIMER	टाइमर को 30 मिनट कम करें	timer	82
39343839393834	IN:SUBTRACT_TIME_TIMER	15 मिनट घटाएँ	timer	82
39343738373138	IN:SUBTRACT_TIME_TIMER	मेरे टाइमर में से 15 मिनट घटाएँ	timer	82
39343734393139	IN:SUBTRACT_TIME_TIMER	मेरे टाइमर से 10 मिनट घटाएं।	timer	82
3232333731313232	IN:SUBTRACT_TIME_TIMER	ये रोल बहुत अधिक भूरे हो रहे हैं; ब्रेड टाइमर में से 5 मिनट कम कर दें	timer	82
3232333437383138	IN:SUBTRACT_TIME_TIMER	क्या आप मेरे फेस मास्क टाइमर में 11 मिनट कम कर सकते हैं	timer	82
3232333437373935	IN:SUBTRACT_TIME_TIMER	पढ़ने के टाइमर में से 15 मिनट कम कर दें	timer	82
3132363036313030	IN:QUESTION_MUSIC	आजतक का सबसे महान ड्रमर कौन है	music	83
39353730383932	IN:QUESTION_MUSIC	इस साल US में किस एल्बम ने सबसे ज़्यादा कमाई की है	music	83
3132363339323338	IN:QUESTION_MUSIC	सबसे अधिक बिकने वाला संगीत का रिकॉर्ड कौनसा है	music	83
3132363035313734	IN:QUESTION_MUSIC	दक्षिण में कौन से संगीत कार्यक्रम हो रहे हैं	music	83
3231363336373338	IN:SILENCE_ALARM	अलार्म को म्यूट करें	alarm	85
3231363032303735	IN:SILENCE_ALARM	सेट अलार्म को बंद कर दें।	alarm	85
39353538313535	IN:SILENCE_ALARM	अलार्म स्किप करें	alarm	85
39353439383531	IN:SILENCE_ALARM	सभी अलार्म बंद करें	alarm	85
39353338383930	IN:SILENCE_ALARM	अलार्म को अभी हटाएं	alarm	85
39353135313235	IN:SILENCE_ALARM	कृपया अलार्म बंद करें।	alarm	85
39343935343030	IN:SILENCE_ALARM	मेरा अगला अलार्म हटाएँ।	alarm	85
3231363336393530	IN:SILENCE_ALARM	मैं उठ गया	alarm	85
3231363336393333	IN:SILENCE_ALARM	कृपया मेरा सक्रिय अलार्म बंद करें।	alarm	85
3231363336383032	IN:SILENCE_ALARM	अलार्म को बंद कर दें	alarm	85
3231363336373936	IN:SILENCE_ALARM	इस अलार्म को छोड़ें	alarm	85
3231363337313337	IN:CREATE_ALARM	एक अलार्म लगाएँ	alarm	87
3231363336343937	IN:CREATE_ALARM	कृपया सुबह 12 बजे का अलार्म सेट करें	alarm	87
3231363336343332	IN:CREATE_ALARM	मैं सुबह 6 बजे उठना चाहता हूँ	alarm	87
3231363336333533	IN:CREATE_ALARM	मैं दोपहर 3.30 बजे जागना चाहता हूं, कृपया इस समय का अलार्म सेट करें	alarm	87
3231363336333237	IN:CREATE_ALARM	क्या आप कृपया कल ढाई बजे के लिए अलार्म लगा सकते हैं	alarm	87
3231363336333231	IN:CREATE_ALARM	सुबह 5:00 बजे का अलार्म लगाएँ	alarm	87
3231363336303333	IN:CREATE_ALARM	कृपया शाम 4 बजे के लिए अलार्म सेट करें	alarm	87
3231363336303330	IN:CREATE_ALARM	अलार्म को दस मिनट में बजने के लिए सेट करें	alarm	87
3231363335393235	IN:CREATE_ALARM	इस मंगलवार के लिए अलार्म लगाएं	alarm	87
3231363335393130	IN:CREATE_ALARM	कल रात 8 बजे का एक नया अलार्म लगाएँ।	alarm	87
3231363335383231	IN:CREATE_ALARM	मुझे सोमवार सुबह 5 बजे जगाएं	alarm	87
3231363335343538	IN:CREATE_ALARM	कृपया 12 मई रात 11:59 का अलार्म लगाएं	alarm	87
3231363335333130	IN:CREATE_ALARM	प्लीज़ 12 जून का अलार्म लगाएँ	alarm	87
3231363335313634	IN:CREATE_ALARM	अगले साल की पहली जनवरी के दोपहर 3 बजे के लिए एक नया अलार्म क्रिएट करें।	alarm	87
3231363335303737	IN:CREATE_ALARM	4 मई का अलार्म लगाएँ	alarm	87
3231363335303238	IN:CREATE_ALARM	सोमवार सुबह 7 20 बजे मेरे लिए एक और अलार्म सेट करें	alarm	87
3231363334363730	IN:CREATE_ALARM	हर सोमवार शाम 4 बजे अलार्म रिपीट करें	alarm	87
3231363334363436	IN:CREATE_ALARM	प्लीज़ रिपीटिंग अलार्म लगाएँ, गुरुवार सुबह 9 बजे।	alarm	87
3231363334323337	IN:CREATE_ALARM	मेरे लिए हर हफ्ते मंगलवार को सुबह 8.15 पर बजने वाला अलार्म सेट करें।	alarm	87
3231363333363730	IN:CREATE_ALARM	मुझे जगाने के लिए नया अलार्म	alarm	87
3231363333353632	IN:CREATE_ALARM	कल सुबह बजने वाला एक अलार्म लगाएं	alarm	87
3231363332393335	IN:CREATE_ALARM	मंगलवार सुबह 6 बजे और शाम 6 बजे के लिए नया अलार्म क्रिएट करें	alarm	87
3231363038313338	IN:CREATE_ALARM	2110 पर अलार्म बजाएं	alarm	87
3231363032303530	IN:CREATE_ALARM	शाम 5 बजे रिंग करें	alarm	87
3231363031383832	IN:CREATE_ALARM	प्लीज़ शाम 4 बजे का अलार्म लगाएँ।	alarm	87
3231363031383435	IN:CREATE_ALARM	अलार्म को ठीक दोपहर 2:01 पर बजने के लिए सेट करें	alarm	87
3231363031353436	IN:CREATE_ALARM	बुधवार के लिए एक अलार्म लगाएं	alarm	87
3231363031353139	IN:CREATE_ALARM	शुक्रवार का अलार्म लगाएँ, प्लीज़	alarm	87
3231363031343839	IN:CREATE_ALARM	क्या आप अगले मंगलवार का अलार्म लगा सकते हैं, प्लीज़?	alarm	87
3231363031343633	IN:CREATE_ALARM	मेरे अलार्म को 19 तारीख को सुबह 5 बजे बजा दें	alarm	87
3231363031333232	IN:CREATE_ALARM	2 जुलाई के लिए एक अलार्म ऐड करें	alarm	87
3231363031333038	IN:CREATE_ALARM	कृपया 30 जनवरी को शाम 3 बजे के लिए अलार्म सेट करें।	alarm	87
3231363030353737	IN:CREATE_ALARM	कल सुबह 5 बजे के लिए कचरा दिवस का अलार्म बनाएं	alarm	87
3231363030353034	IN:CREATE_ALARM	शुक्रवार दोपहर 4 बजे का अलार्म लागू करें	alarm	87
3231363030343038	IN:CREATE_ALARM	शाम 7 बजे का 'खेल का वक्त' अलर्ट लगाएँ	alarm	87
3231363030333538	IN:CREATE_ALARM	चलिए पोते-पोतियों के कॉन्सर्ट के लिए शनिवार दोपहर 3 बजे का अलार्म लगाते हैं	alarm	87
3231353939353832	IN:CREATE_ALARM	क्या आप शुक्रवार सुबह 7 और 8 बजे का अलार्म क्रिएट कर सकते हैं, प्लीज़?	alarm	87
3231353535333838	IN:CREATE_ALARM	मुझे सुबह 5 बजे का अलार्म चाहिए	alarm	87
3231353535323037	IN:CREATE_ALARM	सुबह 6 बजे का अलार्म सेट करें, धन्यवाद।	alarm	87
3231353534393633	IN:CREATE_ALARM	शनिवार रात 11 बजे का अलार्म लगाएँ	alarm	87
3231353534363632	IN:CREATE_ALARM	मेरे लिए गुरुवार सुबह 8 बजे का एक नया अलार्म लगाएं	alarm	87
3231353533343338	IN:CREATE_ALARM	हर रोज़ सुबह 7 बजे और 7:30 बजे का अलार्म क्रिएट करें	alarm	87
3231353533333634	IN:CREATE_ALARM	आज रात 8 बजे और 11 बजे का अलार्म लगाएं	alarm	87
3231353533323933	IN:CREATE_ALARM	शनिवार को 8 और 9 बजे के लिए अलार्म सेट करें	alarm	87
3231353532333338	IN:CREATE_ALARM	अगले 5 दिनों के लिए सुबह 8 बजे का अलार्म लगाएँ	alarm	87
3231353532333037	IN:CREATE_ALARM	हर सोमवार सुबह 6 बजे अलार्म रिपीट करें	alarm	87
3231353532323634	IN:CREATE_ALARM	मेरा रोज़ शाम 6 बजे का अलार्म लगाएँ प्लीज़।	alarm	87
3231353532323430	IN:CREATE_ALARM	प्लीज़ हर मंगलवार रात 6 बजे का अलार्म लगाएँ	alarm	87
3231353531393934	IN:CREATE_ALARM	एक अलार्म लगाएँ जो हमेशा मंगलवार को सुबह 9 बजे बज जाए	alarm	87
3231353531373835	IN:CREATE_ALARM	हर मंगलवार सुबह 4 बजे बजने वाला अलार्म लगाएँ।	alarm	87
3231353531373731	IN:CREATE_ALARM	20 मई से वीकडेज़ पर शाम 7 बजे का अलार्म रिपीट करें	alarm	87
3231353531373135	IN:CREATE_ALARM	हर शनिवार सुबह 9 बजे के लिए अलार्म सेट करें	alarm	87
3231353531343732	IN:CREATE_ALARM	झपकी के लिए दोपहर 3 बजे का अलार्म लगाएँ	alarm	87
3231353531333638	IN:CREATE_ALARM	दोपहर 3.15 बजे बच्चों को स्कूल से लाने का अलार्म लगाएँ	alarm	87
3231353531333631	IN:CREATE_ALARM	आज के लिए सोने के समय का अलार्म सेट करें	alarm	87
3231353531333332	IN:CREATE_ALARM	आज शाम 8 बजे का 'सोने का समय' अलार्म सेट करें	alarm	87
3231353531323137	IN:CREATE_ALARM	कल सुबह 7 बजे मेरे लिए 'काम के लिए उठो' नामक अलार्म सेट करें	alarm	87
3231353438363333	IN:CREATE_ALARM	कृपया कल शाम के लिए अलार्म लगाएं	alarm	87
3136363730363433	IN:CREATE_ALARM	शाम 5:30 बजे का अलार्म शुरू करें	alarm	87
3135323936383835	IN:CREATE_ALARM	दूसरा अलार्म 20 मिनट बाद	alarm	87
3135323935383733	IN:CREATE_ALARM	झपकी के लिए शाम 4 बजे का अलार्म लगाएँ	alarm	87
3135323933323034	IN:CREATE_ALARM	हर 20 सेकंड के लिए अलार्म सेट करें	alarm	87
39353831383434	IN:CREATE_ALARM	सुबह 9 बजे का अलार्म, इस हफ़्ते हर रोज़	alarm	87
39353734393638	IN:CREATE_ALARM	कल सुबह 7:00 बजे के लिए एक अलार्म सेट करें	alarm	87
39353734373837	IN:CREATE_ALARM	मेरा आज रात 11 बजे का अलार्म लगाएँ	alarm	87
39353730393435	IN:CREATE_ALARM	आज छह बजे के लिए अलार्म सेट करें।	alarm	87
39353633393233	IN:CREATE_ALARM	7:30 बजे का एक एक्स्ट्रा अलार्म लगाएँ	alarm	87
39353632363136	IN:CREATE_ALARM	3 घंटों के लिए हर 30 मिनट पर एक अलार्म सेट करें।	alarm	87
39353632333232	IN:CREATE_ALARM	मुझे सुबह 2 बजे के लिए दो अलार्म सेट करने हैं	alarm	87
39353539353739	IN:CREATE_ALARM	अलार्म को मेरा वर्क अलार्म बनाएं।	alarm	87
39353339373930	IN:CREATE_ALARM	सभी अलार्म चालू करें	alarm	87
39353339303536	IN:CREATE_ALARM	पार्टी से एक घंटे पहले अलार्म सेट करें	alarm	87
39353236383539	IN:CREATE_ALARM	टर्की को 4 घंटे तक बेक करने के लिए अलार्म सेट करें।	alarm	87
39353134323337	IN:CREATE_ALARM	स्नैक टाइम के लिए एक अलार्म लगाएँ	alarm	87
39353133333237	IN:CREATE_ALARM	मैं कल सुबह 9 बजे के लिए अलार्म सेट करना चाहता हूँ।	alarm	87
39353039313432	IN:CREATE_ALARM	सभी अलार्म चालू करें	alarm	87
39353033373432	IN:CREATE_ALARM	कल शाम 5 बजे का अलार्म लगाएँ	alarm	87
39343938333131	IN:CREATE_ALARM	कल सुबह 9 बजे का अलार्म सेट करें	alarm	87
39343935313037	IN:CREATE_ALARM	शाम 4:15 बजे के लिए अलार्म सेट करें	alarm	87
39343930393531	IN:CREATE_ALARM	सुबह 4:45 का अलार्म सेट करें	alarm	87
39343838343335	IN:CREATE_ALARM	शाम 6 बजे के लिए अलार्म सेट करें	alarm	87
39343835363633	IN:CREATE_ALARM	शाम 4 बजे ओवन शुरू करने के लिए अलार्म सेट करें	alarm	87
39343834383331	IN:CREATE_ALARM	शनिवार और रविवार सुबह 10 बजे का अलार्म लगाएँ	alarm	87
39343831363430	IN:CREATE_ALARM	प्लीज़ सुबह 8:30 बजे का अलार्म लगाएँ	alarm	87
