ID	intent	text	domain	label
3232343533373234	IN:SET_RSVP_INTERESTED	ए बिविचिंग फेट के प्रति रूचि दिखाएँ	event	0
3232343533363937	IN:SET_RSVP_INTERESTED	जवाब दें मून व्यूइंग में रुचि रखते हैं	event	0
3232343533363231	IN:SET_RSVP_INTERESTED	वॉल्वरिन रिकवरी इन द नॉर्थ कैस्केड्स को शायद का जवाब दें	event	0
3232343533343533	IN:SET_RSVP_INTERESTED	उस ईवेंट के लिए मेरे स्टेटस को इंटरेस्टेड के रूप में सेट करें	event	0
3232343533323137	IN:SET_RSVP_INTERESTED	इस इवेंट के लिए मेरे स्टेटस को शायद सेट करें	event	0
3231323339383031	IN:GET_REMINDER_AMOUNT	मैंने कितने रिमाइंडर लगाए हैं?	reminder	2
3232323230313632	IN:PLAY_MEDIA	जोश गुडविन का आइ लाइक इट ढूँढ़ें	music	3
3231323334343539	IN:GET_REMINDER_DATE_TIME	डेंटिस्ट के लिए मेरा अनुस्मारक कब है	reminder	4
3231323333373832	IN:GET_REMINDER_DATE_TIME	क्या मेरा रिमाइंडर कल सुबह के लिए है?	reminder	4
3231323330363337	IN:GET_REMINDER_DATE_TIME	मेरा अगला अनुस्मारक किस समय है?	reminder	4
3231323239383132	IN:GET_REMINDER_DATE_TIME	मेरा अगला डेंटिस्ट रिमाइंडर कब है	reminder	4
3138393933323930	IN:GET_EMPLOYMENT_TIME	डेव ने ह्यूस्टन शहर के लिए काम करना कब शुरू किया था?	people	5
3138393932353236	IN:GET_EMPLOYMENT_TIME	जैकी ने कितने वक्त तक Viaero के लिए काम किया है?	people	5
3138393931343631	IN:GET_EMPLOYMENT_TIME	सू ने wctc में कितने वक्त तक काम किया है	people	5
3138393932383138	IN:GET_EMPLOYMENT_TIME	बेन ने सबवे के लिए काम करना कब शुरू किया?	people	5
3138393932353637	IN:GET_EMPLOYMENT_TIME	बिल ने लोफ एन जग के लिए कितने साल काम किया है?	people	5
3138393932353438	IN:GET_EMPLOYMENT_TIME	जूली ने सैम्स क्लब के लिए काम करना कब शुरू किया था?	people	5
3138393932343834	IN:GET_EMPLOYMENT_TIME	एलिसिया ने अपना पिछला काम कब छोड़ा था?	people	5
3138393932343536	IN:GET_EMPLOYMENT_TIME	जिम ने गूगल के लिए कितने साल काम किया?	people	5
3138393932343035	IN:GET_EMPLOYMENT_TIME	मार्था ने Walgreens के लिए काम करना कब बंद किया था	people	5
39353534353434	IN:LOOP_MUSIC	इस गाने को बार-बार चलाएं।	music	6
39353238333036	IN:LOOP_MUSIC	आखिरी गीत तब तक बजाते रहिए जब तक मैं आपको रुकने के लिए नहीं कहता।	music	6
3139383039323139	IN:GET_CONTACT_METHOD	मुझे ट्रॉय का tumblr नाम पता करके बताओ	people	7
3139383039313931	IN:GET_CONTACT_METHOD	कृपया मुझे केन का ईमेल एड्रेस दो	people	7
3132363231333730	IN:SKIP_TRACK_MUSIC	कृपया इसे छोड़ दें	music	8
3132363230383431	IN:SKIP_TRACK_MUSIC	लिस्ट का अगला गाना प्ले करें	music	8
3132353835323430	IN:SKIP_TRACK_MUSIC	अगला गाना चलाएं	music	8
3132353732383038	IN:SKIP_TRACK_MUSIC	कृपया, स्किप करें	music	8
3132353635323538	IN:SKIP_TRACK_MUSIC	5 गाने छोड़कर आगे जाएं	music	8
39353732343334	IN:SKIP_TRACK_MUSIC	दूसरे गाने पर जाएं।	music	8
39353439323739	IN:LIKE_MUSIC	इस ट्रैक को पसंदीदा में जोड़ें।	music	9
39353536323235	IN:GET_TRACK_INFO_MUSIC	यह गाना किस आर्टिस्ट का है?	music	10
39353531363734	IN:GET_TRACK_INFO_MUSIC	हे प्रिटी गाना किसने गाया है?	music	10
39353336343237	IN:GET_TRACK_INFO_MUSIC	यह कलाकार कौन है?	music	10
39353136383634	IN:GET_TRACK_INFO_MUSIC	इस गाने में किसे दिखाया गया है	music	10
39343832353838	IN:GET_TRACK_INFO_MUSIC	क्या यह एक कवर है?	music	10
3139393237353130	IN:GET_TRACK_INFO_MUSIC	स्पॉटिफाई पर कौन सा गाना चल रहा है?	music	10
3132353932313634	IN:GET_TRACK_INFO_MUSIC	इस गीत का नाम क्या है	music	10
3132353734373433	IN:GET_TRACK_INFO_MUSIC	अभी जो बैंड प्ले हो रहा है उसका नाम क्या है	music	10
3230303431383436	IN:GET_TRACK_INFO_MUSIC	इस समय क्या चल रहा है	music	10
3230303431383431	IN:GET_TRACK_INFO_MUSIC	तुम मेरे लिए क्या चला रहे हो?	music	10
3132363135303732	IN:GET_TRACK_INFO_MUSIC	वो आखिरी गाना क्या था	music	10
3132363133393932	IN:GET_TRACK_INFO_MUSIC	इसे कौन गा रहा है	music	10
3132353938383330	IN:GET_TRACK_INFO_MUSIC	कोन गा रहा है	music	10
3231313532383130	IN:CREATE_REMINDER	10 मिनट में सब्जियों को पलटने का रिमाइंडर ऐड करें।	reminder	11
3231313532343932	IN:CREATE_REMINDER	मुझे 15 मिनट में स्नान करने की याद दिलाएं	reminder	11
3231313531393739	IN:CREATE_REMINDER	मुझे जैज़ कक्षाओं के लिए साइन अप करने के लिए याद दिलाएं।	reminder	11
3231313531393434	IN:CREATE_REMINDER	इस हफ़्ते शनिवार को मेरे भाई के ग्रेजुएशन गेट टूगेदर इवेंट के लिए एक रिमाइंडर लगाएँ।	reminder	11
3231313531383530	IN:CREATE_REMINDER	मुझे शुक्रवार को पार्टी के लिए सामान खरीदने के बारे में याद दिलाएं	reminder	11
3231313531303733	IN:CREATE_REMINDER	मुझे एक अलग बैग में सारी टॉयलेटरीज़ पैक करना याद दिलाएँ	reminder	11
3231313530373337	IN:CREATE_REMINDER	कृपया माँ को आज शाम 6 बजे तारा को लाने की याद दिलाएँ	reminder	11
3231313530333836	IN:CREATE_REMINDER	इस रविवार को तेल बदलने की याद दिलाएं।	reminder	11
3231313530333433	IN:CREATE_REMINDER	10 मिनट में मुझे जाने के लिए अलर्ट करें	reminder	11
3231313530323139	IN:CREATE_REMINDER	मुझे शनिवार सुबह 10 बजे कम एंड रीज़न पॉडकास्ट को सुनने के बारे में याद दिलाएं।	reminder	11
3231313530313032	IN:CREATE_REMINDER	बुधवार को वर्क पार्टी के लिए केक लेने के लिए मुझे एक रात पहले याद दिलाएं।	reminder	11
3231313439393534	IN:CREATE_REMINDER	जन्मदिन पार्टी के लिए शुक्रवार को मुझे एलिज़ा का जन्मदिन केक लाना याद दिलाएँ	reminder	11
3231313439393531	IN:CREATE_REMINDER	प्लीज़ आज रात मुझे मेरे ईमेलों का जवाब देना याद दिलाएँ।	reminder	11
3231313439393237	IN:CREATE_REMINDER	आज रात 8 बजे स्पेशल नीड मॉम ग्रुप को जंगल पॉपिन्स का रिकॉर्ड प्रीमियर याद दिलाएँ।	reminder	11
3231313439343538	IN:CREATE_REMINDER	आज मुझे नहाना याद दिलाएँ	reminder	11
3231313439343335	IN:CREATE_REMINDER	जेड को ट्रेन में चढ़ने के लिए सुबह 5 बजे पहुँचने की याद दिलाएं	reminder	11
3231313439313731	IN:CREATE_REMINDER	मुझे याद दिलाएं कि कैरोल 30 अगस्त को पोर्टलैंड पहुंचेगी	reminder	11
3231313438393734	IN:CREATE_REMINDER	कोल्बी की डिनर पार्टी 2 दिन में शाम 6 बजे हैं; क्या आप मुझे 15 मिनट पहले याद दिला सकते हैं	reminder	11
3231313438363834	IN:CREATE_REMINDER	मुझे 30 मिनट में ओवन चेक करना याद दिलाएँ	reminder	11
3231313438363334	IN:CREATE_REMINDER	आज रात मुझे फैमिली चैट करना याद दिलाएं।	reminder	11
3231313438333330	IN:CREATE_REMINDER	मैट को रविवार सुबह के लिए बोलीनास में मेरे फिन्स लाना याद दिलाएँ।	reminder	11
3231313438313433	IN:CREATE_REMINDER	मुझे कल सुबह 9 बजे दफ़्तर के लिए निकलना याद दिलाएँ।	reminder	11
3231313437363635	IN:CREATE_REMINDER	आज मुझे मेरे पापा को कॉल करना याद दिलाएँ।	reminder	11
3231313437353639	IN:CREATE_REMINDER	मुझे शाम 7 बजे दादी को कॉल करने की याद दिलाएं।	reminder	11
3231313437343937	IN:CREATE_REMINDER	मेरे पिताजी को उनके डॉक्टर की अपॉइंटमेंट के बारे में पूछने के लिए 5:00 बजे कॉल करने का रिमाइंडर सेट करें।	reminder	11
3231313437323635	IN:CREATE_REMINDER	शुक्रवार दोपहर को मेरे कज़न की शादी में शामिल होने के लिए रिमाइंडर सेट करें।	reminder	11
3231313437313735	IN:CREATE_REMINDER	मुझे आज शाम 5 बजे टीना को कॉल करना याद दिलाएँ।	reminder	11
3231313436393635	IN:CREATE_REMINDER	मुझे 6 अगस्त सुबह 9 बजे को डॉक्टर से अपॉइंटमेंट की याद दिलाएं	reminder	11
3231313436393537	IN:CREATE_REMINDER	30 अगस्त को एक रिमाइंडर लगाएँ कि 31 अगस्त को ओज़ार्क का नया सीज़न शुरू हो रहा है	reminder	11
3231313436363734	IN:CREATE_REMINDER	मुझे अपनी माँ को खरीददारी की सूची ईमेल करने के बारे में याद दिलाएं	reminder	11
3231313436353931	IN:CREATE_REMINDER	प्लीज़ शुक्रवार सुबह 10 बजे मार्केटिंग टीम के साथ मीटिंग का रिमाइंडर लगाएँ	reminder	11
3231313436353536	IN:CREATE_REMINDER	मुझे मेरी अपॉइंटमेंट से 15 मिनट पहले निकलना याद दिलाएँ	reminder	11
3231313435393033	IN:CREATE_REMINDER	मुझे आज शाम 5 बजे से पहले मेरे कज़न का ऑर्डर मेल करना याद दिलाएँ।	reminder	11
3231313435363635	IN:CREATE_REMINDER	क्या आप कल रात मुझे दादी को एक बर्थडे कार्ड भेजना याद दिला सकते हैं?	reminder	11
3231313435363531	IN:CREATE_REMINDER	मेरी बहन को आज से दो रात बाद केक बनाने के लिए याद दिलाएं	reminder	11
3231313434393239	IN:CREATE_REMINDER	कृपया शनिवार को दोपहर 3 बजे जोश को लाने के लिए एक रिमाइंडर सेट करें	reminder	11
3231313434343934	IN:CREATE_REMINDER	5:00 बजे तक मांस को ओवन में रखने के लिए याद दिलाएं।	reminder	11
3231313433393539	IN:CREATE_REMINDER	जेनिस की गोद भराई के लिए अगले शनिवार का इवेंट रिमाइंडर ऐड करें	reminder	11
3231313433383033	IN:CREATE_REMINDER	शाम 4:30 बजे मुझे ओवन को प्री-हीट करना याद दिलाएँ।	reminder	11
3231313433373936	IN:CREATE_REMINDER	मुझे कल अकाउंटेंट को ईमेल करना है; क्या आप मुझे आज रात याद दिला सकते हैं?	reminder	11
3231313433363934	IN:CREATE_REMINDER	मुझे आज शाम 7:00 बजे मेरे कपड़े धोना याद दिलाएँ।	reminder	11
3231313433313036	IN:CREATE_REMINDER	मुझे 01 अगस्त को अख़बार बंद करना याद दिलाएँ।	reminder	11
3231313433303336	IN:CREATE_REMINDER	आज रात मुझे बहन से यह पूछना याद दिलाएं कि डोम का जन्मदिन कब है।	reminder	11
3231343030363334	IN:CREATE_REMINDER	आज रात मुझे बर्तन साफ़ करना याद दिलाएं।	reminder	11
3231343030363236	IN:CREATE_REMINDER	मुझे मेरे कुत्ते के लिए नया पट्टा लाना याद दिलाएँ।	reminder	11
3231343030353638	IN:CREATE_REMINDER	मुझे स्टोव बंद करने की याद दिलाएं	reminder	11
3231333933303836	IN:CREATE_REMINDER	मुझे पिताजी को कॉल करना याद दिलाएं	reminder	11
3231323432343139	IN:CREATE_REMINDER	महीने की पहली तारीख को चालू खाते में पैसे डालने का रिमाइंडर जोड़ें।	reminder	11
3231323432333236	IN:CREATE_REMINDER	मुझे अपनी कार का ऑयल बदलवाने के लिए याद दिलाएं	reminder	11
3231323432323332	IN:CREATE_REMINDER	मुझे कल डॉक्टर को कॉल करना याद दिलाएं	reminder	11
3231323432313835	IN:CREATE_REMINDER	मुझे 1 घंटे में अपने पिताजी को कॉल करना याद दिलाएं।	reminder	11
3231323432303833	IN:CREATE_REMINDER	मुझे आज रात 8 बजे माँ को कॉल करना याद दिलाएं।	reminder	11
3231323431343734	IN:CREATE_REMINDER	मुझे काम से वापस घर आते समय फ्रोजन वेजिज लाना याद दिलाएं	reminder	11
3231323431343039	IN:CREATE_REMINDER	आज रात मुझे मेरे पिताजी को कॉल करने की याद दिलाएं	reminder	11
3231323431313934	IN:CREATE_REMINDER	मुझे किराने की सूची में बोतलबंद पानी जोड़ना याद दिलाएं।	reminder	11
3231323431303232	IN:CREATE_REMINDER	बुधवार को दोपहर 1 बजे मुझे कुत्ते को पशु चिकित्सक के पास ले जाना याद करवाएं।	reminder	11
3231323430393532	IN:CREATE_REMINDER	शुक्रवार को रात 9 बजे शीला को कॉल करने के लिए एक रिमाइंडर सेट करें।	reminder	11
3231323430393431	IN:CREATE_REMINDER	मुझे अगले मातृ दिवस पर अपनी माँ को फूल भेजना याद दिलाएं	reminder	11
3231323430383733	IN:CREATE_REMINDER	मुझे वकील को कागजी कार्रवाई भेजना याद दिलाएं	reminder	11
3231323430383437	IN:CREATE_REMINDER	मुझे आज रात पढ़ाई करना याद दिलाएं	reminder	11
3231323430373336	IN:CREATE_REMINDER	मुझे ड्राई क्लीनिंग पिक करना याद दिलाएं	reminder	11
3231323430363831	IN:CREATE_REMINDER	कल मुझे जल्दी निकलना याद दिलाएँ	reminder	11
3231323430353937	IN:CREATE_REMINDER	मुझे तुलसी खरीदना याद दिलाएँ	reminder	11
3231323430353131	IN:CREATE_REMINDER	मुझे आज ब्रेड खरीदना याद दिलाएं	reminder	11
3231323430343538	IN:CREATE_REMINDER	मुझे अनुमति पर्ची पर हस्ताक्षर करना याद दिलाएं	reminder	11
3231323430343534	IN:CREATE_REMINDER	सोमवार सुबह मेरे इंटरव्यू के बारे में मुझे याद दिलाएं	reminder	11
3231323430333831	IN:CREATE_REMINDER	मुझे सुबह 9:30 पर काम के लिए उठना याद दिलाएं	reminder	11
3231323430333037	IN:CREATE_REMINDER	आज गैस लेने के लिए याद दिलाएं	reminder	11
3231323430323430	IN:CREATE_REMINDER	45 सेकंड के लिए रिमाइंडर शुरू करें	reminder	11
3231323430323031	IN:CREATE_REMINDER	मुझे दोपहर 1 बजे अपनी गोली लेना याद दिलाएं	reminder	11
3231323430313038	IN:CREATE_REMINDER	मुझे कल के मेरे अपॉइंटमेंट के लिए 4 बजे का एक रिमाइंडर चाहिए	reminder	11
3231323430303539	IN:CREATE_REMINDER	कल मुझे वस्तुएं खरीदने के बारे में याद दिलाएं	reminder	11
3231323339393035	IN:CREATE_REMINDER	मुझे डेंटिस्ट की अपॉइंटमेंट के लिए याद दिलाएं	reminder	11
3231323339383638	IN:CREATE_REMINDER	मुझे मेरी माँ को कॉल करना याद दिलाएं	reminder	11
3231323339383532	IN:CREATE_REMINDER	मुझे मेरे डेंटिस्ट के अपॉइंटमेंट के बारे में याद दिलाएं	reminder	11
3231323339383237	IN:CREATE_REMINDER	मुझे फेस वॉश लेने के लिए याद दिलाएं	reminder	11
3231323339373834	IN:CREATE_REMINDER	खरीदारी के लिए 6 बजे का अनुस्मारक सेट करें।	reminder	11
3231323339353836	IN:CREATE_REMINDER	मुझे मंगलवार को अपने पैकेज पिक करना याद दिलाएं	reminder	11
3231323339353230	IN:CREATE_REMINDER	मुझे कैमडन की दवा की पर्ची देकर आना याद दिलाएँ	reminder	11
3231323339343533	IN:CREATE_REMINDER	मुझे मेरा बर्थ कंट्रोल लेना याद दिलाएं।	reminder	11
3231323339333539	IN:CREATE_REMINDER	मैं चाहता हूँ कि आप शाम 6 बजे के लिए एक रिमाइंडर लगाएं।	reminder	11
3231323339333031	IN:CREATE_REMINDER	मुझे कल अंडे खरीदना याद दिलाएं	reminder	11
3231323339303536	IN:CREATE_REMINDER	मुझे याद दिलाएं कि स्कूल बुधवार सुबह 9 बजे शुरू होगा	reminder	11
3231323338373933	IN:CREATE_REMINDER	मंगलवार दोपहर के लिए डॉक्टर अपॉइंटमेंट रिमाइंडर	reminder	11
3231323338373032	IN:CREATE_REMINDER	मुझे अपॉइंटमेंट सेट करना याद दिलाएं?	reminder	11
3231323338363734	IN:CREATE_REMINDER	मेरे लिए कल सुबह 11 बजे सूट लेने के लिए एक रिमाइंडर सेट करें	reminder	11
3231323338343734	IN:CREATE_REMINDER	रात 9 बजे मुझे मेरी दवा लेना याद दिलाएँ	reminder	11
3231323338343334	IN:CREATE_REMINDER	कपड़े धोने का रिमाइंडर जोड़ें	reminder	11
3231323338343230	IN:CREATE_REMINDER	शनिवार को मुझे मेरी डेंटिस्ट अपॉइंटमेंट की याद दिलाएं	reminder	11
3231323338343031	IN:CREATE_REMINDER	मुझे बंद होने से पहले ड्राई क्लीनिंग लेना याद दिलाएं।	reminder	11
3231323338323334	IN:CREATE_REMINDER	मुझे आज रात अपने ऐप अपडेट करना याद दिलाएं	reminder	11
3231323338313633	IN:CREATE_REMINDER	मुझे 3 बजे जेक को लाना याद दिलाएं	reminder	11
3231323338313138	IN:CREATE_REMINDER	मैं अपने बालों को रंगना भूलना नहीं चाहता हूँ	reminder	11
3231323337393534	IN:CREATE_REMINDER	मुझे घर जाते समय फूल खरीदना याद दिलाएं	reminder	11
3231323337383833	IN:CREATE_REMINDER	मुझे आज रात 10 बजे कचरा बाहर निकालने के बारे में याद दिलाएं	reminder	11
3231323337383632	IN:CREATE_REMINDER	मेरे लिए मंगलवार के लिए एक रिमाइंडर लगाएं	reminder	11
3231323337373831	IN:CREATE_REMINDER	आज लांड्री को सुखाने के लिए मुझे दो बार याद दिलाएं	reminder	11
3231323337373733	IN:CREATE_REMINDER	मुझे 31 की शाम को किराया देना याद दिलाएं	reminder	11
3231323337363532	IN:CREATE_REMINDER	मुझे दूध लेना याद दिलाएं	reminder	11
3231323337353537	IN:CREATE_REMINDER	मुझे आज रात काम के बाद अंडे लेने के लिए याद दिलाएं।	reminder	11
3231323337353437	IN:CREATE_REMINDER	मुझे पति को गाड़ी से घर ले जाना याद दिलाएं	reminder	11
3231323337343336	IN:CREATE_REMINDER	बुधवार चर्च का रिमाइंडर सेट करें।	reminder	11
3231323337333530	IN:CREATE_REMINDER	एलेक्स को शुभकामनाएं देने के लिए रिमाइंडर सेट करें	reminder	11
3231323337313437	IN:CREATE_REMINDER	जब मैं गैस लूं तब मुझे ड्रिंक्स खरीदना याद दिलाएं	reminder	11
3231323337313138	IN:CREATE_REMINDER	मुझे याद दिलाएं कि वॉकिंग डेड रविवार शाम 7 बजे आता है	reminder	11
3231323337303635	IN:CREATE_REMINDER	मुझे अगले सप्ताह अपने सेल का बिल भरने के बारे में याद दिलाएं	reminder	11
3231323337303633	IN:CREATE_REMINDER	मुझे कल दोपहर 3 बजे मेरे नौकरी के इंटरव्यू के बारे में याद दिलाएं	reminder	11
3231323336393131	IN:CREATE_REMINDER	मुझे अगले रविवार सुबह सैंडी के साथ कॉफी पीने की याद दिलाएं	reminder	11
3231323336383835	IN:CREATE_REMINDER	मुझे बुधवार को किराया देने के बारे में याद दिलाएं	reminder	11
