ID	intent	text	domain	label
3232343533313232	IN:SET_RSVP_INTERESTED	दूसरे इवेंट के जवाब में 'शायद' भेजें	event	0
3232343533303630	IN:SET_RSVP_INTERESTED	मैं दूसरी ईवेंट में जाना चाहता हूँ	event	0
3232343532363235	IN:SET_RSVP_INTERESTED	मेरे स्टेटस को बदलकर लोस एंजलेस इंटरैक्टिव कोन्फेरेंस 2019 में रुचि रखता हूँ कर दें	event	0
3232343532343837	IN:SET_RSVP_INTERESTED	हो सकता है कि मैं सोल समिट में जाना चाहूँ	event	0
3232323232313037	IN:SET_RSVP_INTERESTED	इनसर्जेंट एम्पायर बुक लॉन्च में जाने का जवाब शायद में दें	event	0
3231323331323434	IN:GET_REMINDER_AMOUNT	7 अक्टूबर के लिए कितने अनुस्मारक सेट हैं?	reminder	2
3232323230303939	IN:PLAY_MEDIA	टाइगर वुड्स कवर खोजें।	music	3
3231323238303239	IN:GET_REMINDER_DATE_TIME	मेरी अगली दवा की खुराक के लिए रिमाइंडर किस समय का है?	reminder	4
3231323235303837	IN:GET_REMINDER_DATE_TIME	मेरा पिछला एक्सटर्मिनेटर रिमाइंडर कब का था	reminder	4
3231323234343330	IN:GET_REMINDER_DATE_TIME	अगले सप्ताह फ्लाइट का रिमाइंडर कब है?	reminder	4
3231313436313030	IN:GET_REMINDER_DATE_TIME	मुझे मेरे बालों के अपॉइंटमेंट के बारे में याद दिलाएं	reminder	4
3138393932333739	IN:GET_EMPLOYMENT_TIME	एमिली ने सेंट ल्यूक के लिए कब काम करना शुरू किया?	people	5
3138393932333531	IN:GET_EMPLOYMENT_TIME	एंथनी ने एप्पल में कब तक काम किया	people	5
3138393932333437	IN:GET_EMPLOYMENT_TIME	स्टीव ने स्कूल में कब काम करना शुरू किया	people	5
3138393932303433	IN:GET_EMPLOYMENT_TIME	फाये ने कोहल्स के लिए कब तक काम किया	people	5
3138393931373830	IN:GET_EMPLOYMENT_TIME	क्या सारा पूरा पिछला साल मैकडॉनल्ड्स में काम कर रही थी?	people	5
3138393931373636	IN:GET_EMPLOYMENT_TIME	अपने मौजूदा काम को शेनन कितने समय से कर रही है?	people	5
3138393931373435	IN:GET_EMPLOYMENT_TIME	फिल ने McDonalds में काम करना कब शुरू किया था	people	5
3138393931333535	IN:GET_EMPLOYMENT_TIME	हाइडी ने टारगेट पर काम करना कब शुरू किया था?	people	5
3138393931333032	IN:GET_EMPLOYMENT_TIME	काइल को काम पर कब रखा गया?	people	5
3132353935393032	IN:LOOP_MUSIC	इस गाने को एक घंटे तक चलाएं	music	6
39353232323831	IN:LOOP_MUSIC	जेन्सेन एक्ल्स के गाने सिंपल मैन को ढूँढ़ें और बार-बार चलाएं	music	6
3139383539333236	IN:GET_CONTACT_METHOD	मुझे लिसा का ईमेल चाहिए	people	7
3139383035363132	IN:GET_CONTACT_METHOD	कृपया मुझे फ्रेडी का नंबर बताएं!	people	7
39353732303639	IN:SKIP_TRACK_MUSIC	कृपया दो ट्रैक छोड़ें।	music	8
39353633343939	IN:SKIP_TRACK_MUSIC	उस गाने को छोड़ो, मुझे यह पसंद नहीं है	music	8
39353436383632	IN:SKIP_TRACK_MUSIC	इस ट्रैक को छोड़कर अगले गाने पर जाएं।	music	8
39353039323934	IN:SKIP_TRACK_MUSIC	क्या आप वर्तमान ट्रैक को छोड़ सकते हैं?	music	8
39343935363533	IN:SKIP_TRACK_MUSIC	इस समय चल रहे गाने को हटाकर कोई और गाना चलाएं	music	8
39343733303039	IN:SKIP_TRACK_MUSIC	कृपया अगले ट्रैक पर जाएं।	music	8
39353736353233	IN:LIKE_MUSIC	मुझे यह गाना पसंद है।	music	9
3132353836383332	IN:GET_TRACK_INFO_MUSIC	इस एल्बम का नाम क्या है	music	10
39353832303737	IN:GET_TRACK_INFO_MUSIC	इस गाने का मूल कलाकार कौन था?	music	10
39353733323637	IN:GET_TRACK_INFO_MUSIC	यह गीत कौन सी एल्बम से है?	music	10
39353630383939	IN:GET_TRACK_INFO_MUSIC	क्या जो गा रही है वह बियोंसे है?	music	10
39353538343639	IN:GET_TRACK_INFO_MUSIC	यह कौन सा गाना है?	music	10
39353434363739	IN:GET_TRACK_INFO_MUSIC	यह मौजूदा ट्रैक किस साल आया था?	music	10
39353330303335	IN:GET_TRACK_INFO_MUSIC	इस गाने का नाम क्या है?	music	10
39353139353738	IN:GET_TRACK_INFO_MUSIC	फिलहाल यह बैंड क्या बजा रहा है?	music	10
39353031393337	IN:GET_TRACK_INFO_MUSIC	गाना कब निकला	music	10
39343738323636	IN:GET_TRACK_INFO_MUSIC	इस बैंड के प्रमुख गायक कौन हैं।	music	10
39343736313434	IN:GET_TRACK_INFO_MUSIC	अंतिम गाना किसने गाया?	music	10
39343730303338	IN:GET_TRACK_INFO_MUSIC	इस ट्रैक में ड्रम कौन बजा रहा है?	music	10
39343637343238	IN:GET_TRACK_INFO_MUSIC	यह गाना कौन गा रहा है?	music	10
3231323239353139	IN:CREATE_REMINDER	daylight savings time के लिए रविवार को घड़ियों को एक घंटा आगे करने का एक नया रिमाइंडर बनाएँ।	reminder	11
3231323239343837	IN:CREATE_REMINDER	मुझे याद दिलाएं कि करीने की पार्टी कल है	reminder	11
3231323239343537	IN:CREATE_REMINDER	मुझे पहले ही डोरिस को मेरे क्रिसमस का उपहार मेल करना चाहिए, क्या आप मुझे अक्टूबर में याद दिला सकते हैं?	reminder	11
3231323239343139	IN:CREATE_REMINDER	केमरिन को 5 बजे जाना याद दिलाएं; उसे 20 मिनट पहले सूचित करें।	reminder	11
3231323239303633	IN:CREATE_REMINDER	मुझे तूफ़ान के कारण ब्लॉक हुए नाले के बारे में कॉल करने के लिए याद दिलाएं	reminder	11
3231323239303533	IN:CREATE_REMINDER	डांस रिहर्सल में जाने से पहले चार्ली को पिक करने के लिए लिज़ के लिए एक रिमाइंडर सेट करें	reminder	11
3231323238393036	IN:CREATE_REMINDER	अपना होमवर्क करने के लिए ऐशकिन के लिए एक अनुस्मारक सेट करें।	reminder	11
3231323238373737	IN:CREATE_REMINDER	मुझे शुक्रवार को अपनी पत्नी के कॉफिन का भुगतान करने और मेमोरियल सेवा समय की पुष्टि करना याद दिलाएं	reminder	11
3231323237393533	IN:CREATE_REMINDER	मुझे आज शाम 7 बजे कुत्ते को घुमाने ले जाना याद दिलाएं।	reminder	11
3231323237383230	IN:CREATE_REMINDER	कपड़े धोने के लिए रिमाइंडर सेट करें।	reminder	11
3231323237313032	IN:CREATE_REMINDER	मुझे आज से दो महीने बाद ऑस्टिन, टेक्सास में मेरी छुट्टी के बारे में याद दिलाएं।	reminder	11
3231323236373234	IN:CREATE_REMINDER	मुझे कल थाई कोकोनट राइस, को फूला हुआ बनाने के लिए, में नींबू छिड़कना याद दिलाएं।	reminder	11
3231323236323939	IN:CREATE_REMINDER	मुझे 5 जुलाई को डेव के जन्मदिन के बारे में याद दिलाएं।	reminder	11
3231323235393839	IN:CREATE_REMINDER	जेरी को अगले हफ्ते अपनी दादी के जन्मदिन के बारे में याद दिलाएं	reminder	11
3231323235383935	IN:CREATE_REMINDER	कल शाम 5 बजे एडम से मिलने जाने के लिए मेरी बहन के लिए रिमाइंडर सेट करें।	reminder	11
3231323235363532	IN:CREATE_REMINDER	मुझे सभी प्रिस्क्रिप्शन फिल करने के बारे में याद दिलाएं	reminder	11
3231323234373333	IN:CREATE_REMINDER	क्या आप मुझे उसे लेने जाने के लिए याद दिला सकते हैं?	reminder	11
3231323234363836	IN:CREATE_REMINDER	मेरे सभी सहायकों के लिए कॉन्फ्रेंस कॉल रिमाइंडर बनाएं।	reminder	11
3231323234363338	IN:CREATE_REMINDER	वर्क इंगेजमेंट के लिए गुरुवार शाम 7 बजे का रिमाइंडर सेट करें	reminder	11
3231323234303839	IN:CREATE_REMINDER	क्या आप मुझे शहर से बाहर जाने से पहले अपने गराज के दरवाजे को ताला लगाने के लिए एक रिमाइंडर सेट कर सकते हैं।	reminder	11
3231323233393134	IN:CREATE_REMINDER	मुझे दिसंबर में शावर की व्यवस्था करने के बारे में एलन से संपर्क करना याद दिलाएं	reminder	11
3231323233383631	IN:CREATE_REMINDER	यह याद रखने में मेरी सहायता करें कि जो भी रात के खाने के लिए आने की योजना बना रहा उस हर एक के साथ मुझे संपर्क करना है ताकि यह सुनिश्चित किया जा सके कि उन्हें पता हो कि क्या लाना है।	reminder	11
3231323233373231	IN:CREATE_REMINDER	मुझे आयकर के ऑडिट को मेल करने के बारे में याद दिलाएं।	reminder	11
3231323233363436	IN:CREATE_REMINDER	अगले हफ़्ते की चर्च पिकनिक और ऑफिस डिनर की तारीखों की तुलना करने, चर्च पिकनिक ईमेल्स में नए सदस्य जोड़ने का रिमाइंडर	reminder	11
3231323232373835	IN:CREATE_REMINDER	मेरी सभी मौजूदा अपॉइंटमेंट्स के लिए एक दिन पहले ही रिमाइंडर सेट करें	reminder	11
3231323232343230	IN:CREATE_REMINDER	कल सुबह डॉक्टर को कॉल करने और देखने के लिए रिमाइंडर जोड़ें  कि उनके पास कब उपलब्ध अपॉइंटमेंट है।	reminder	11
3231313535393538	IN:CREATE_REMINDER	मुझे जन्मदिन की बधाई देने के लिए टॉम को कल कॉल करने के लिए याद दिलाएं।	reminder	11
3231313535393330	IN:CREATE_REMINDER	मेरा टीवी शो शुरू होने पर मुझे याद दिलाएं	reminder	11
3231313535353238	IN:CREATE_REMINDER	मुझे आज अपने पोते को एक मनी आर्डर भेजना याद दिलाएं	reminder	11
3231313535353230	IN:CREATE_REMINDER	एक तारीख को लोव का बिल भरने के लिए पैसे ट्रांसफर करने के बारे में मुझे याद दिलाएं	reminder	11
3231313535333434	IN:CREATE_REMINDER	मुझे योगा के बाद आज रात किराने का सामान लेने के बारे में याद दिलाएं।	reminder	11
3231313535323834	IN:CREATE_REMINDER	ब्रिजेट को अपना ऑर्डर मंगलवार दोपहर 3 बजे तक प्लेस करने के बारे में याद दिलाएं।	reminder	11
3231313535323736	IN:CREATE_REMINDER	सोमवार 6 अगस्त शाम 6 बजे स्कूल के ओपन हाउस के लिए रिमाइंडर सेट करें	reminder	11
3231313535323731	IN:CREATE_REMINDER	मेरे स्टडी ग्रुप को शनिवार सुबह 11 बजे वहां पहुंचना याद दिलाएं।	reminder	11
3231313535323533	IN:CREATE_REMINDER	मुझे डॉन को उसके ड्रायवॉल के काम को पूरा करने में मदद करने के लिए कॉल करने के बारे में कल याद दिलाएं।	reminder	11
3231313535323430	IN:CREATE_REMINDER	मैं कल सुबह 5 बजे की बस नहीं छोड़ना चाहता हूँ, क्या आप मुझे 15 मिनट पहले याद दिला सकते हैं	reminder	11
3231313535303831	IN:CREATE_REMINDER	क्या आप मुझे शाम 6 बजे याद दिला सकते हैं? आज अपना EPPI कार्ड का बैलेंस चेक करना।	reminder	11
3231313534373536	IN:CREATE_REMINDER	मुझे सुबह 9 बजे मेरी फ्लाइट के लिए चेक इन करना याद दिलाएँ।	reminder	11
3231313534353434	IN:CREATE_REMINDER	मुझे आज दोपहर एलेक्स को कॉल करना है; क्या आप मुझे दोपहर 12 बजे याद दिला सकते हैं?	reminder	11
3231313534353338	IN:CREATE_REMINDER	मुझे वीकेंड के दौरान मेरी 100 की सूची पर काम करना याद दिलाएं	reminder	11
3231313534353333	IN:CREATE_REMINDER	मुझे शनिवार सुबह 9 बजे मौसम जाँचना याद दिलाएं।	reminder	11
3231313534343537	IN:CREATE_REMINDER	मैंडी को 11 बजे जाने के लिए याद दिलाएं; उसे 30 मिनट पहले अलर्ट करें	reminder	11
3231313534323838	IN:CREATE_REMINDER	यह बहुत अच्छा होगा अगर आप मेरी 2 बजे की अपॉइंटमेंट से 30 मिनट पहले मुझे याद दिला सकते हैं।	reminder	11
3231313534323739	IN:CREATE_REMINDER	मुझे दोपहर के समय अंकल जॉन को कॉल करना याद दिलाएं	reminder	11
3231313534303530	IN:CREATE_REMINDER	महाविद्यालय के डोर्म के बिस्तर के लिए अतिरिक्त लम्बी चादरें ऑर्डर करने का रिमाइंडर	reminder	11
3231313533383639	IN:CREATE_REMINDER	मुझे कल स्कूल के बाद की बैठक के बारे में याद दिलाएं	reminder	11
3231313533373930	IN:CREATE_REMINDER	मुझे दोपहर 2 बजे बैठक में जाने के लिए याद दिलाएं	reminder	11
3231313533373835	IN:CREATE_REMINDER	20 सितंबर को जोआन और पेटे की सालगिरह का रिमाइंडर लगाएं	reminder	11
3231313533363639	IN:CREATE_REMINDER	मेरा पसंदीदा शो कल 8 बजे आएगा, क्या आप मुझे याद दिला सकते हैं?	reminder	11
3231313533343536	IN:CREATE_REMINDER	मुझे कल मैट की स्टैम्प भेजना याद दिलाएं।	reminder	11
3231313533313835	IN:CREATE_REMINDER	यह बहुत महत्वपूर्ण है कि कृपया मुझे अपनी माँ को नेबुलाइज़र उपचार देने के लिए रात 10 बजे से कुछ मिनट पहले याद दिलाएँ	reminder	11
3231313533313538	IN:CREATE_REMINDER	एक घंटे में ड्रायर से लांड्री निकालने के लिए मुझे याद दिलाएं।	reminder	11
3231313533303439	IN:CREATE_REMINDER	रात 11 बजे जगाने के लिए एक रिमाइंडर सेट करें।	reminder	11
3231313532393733	IN:CREATE_REMINDER	मुझे अगस्त से पहले स्कूल की आपूर्ति खरीदना याद दिलाएं	reminder	11
3231313532373831	IN:CREATE_REMINDER	मुझे कचरे को बाहर निकालने के लिए एक रिमाइंडर सेट करना याद दिलाएं।	reminder	11
3231313532373635	IN:CREATE_REMINDER	मुझे कल सुबह चिकन निकालना याद दिलाएं	reminder	11
3231313532343833	IN:CREATE_REMINDER	मुझे आज दोपहर 3:00 बजे ड्राई क्लीनिंग लेने के लिए याद दिलाएं।	reminder	11
3231313532343831	IN:CREATE_REMINDER	मुझे शनिवार को कार धोना याद दिलाएं	reminder	11
3231313532343334	IN:CREATE_REMINDER	मुझे वर्कआउट करने के लिए याद दिलाएं	reminder	11
3231313532343035	IN:CREATE_REMINDER	कल दोपहर 3 बजे मुझे कॉफ़ी लाना याद दिलाएँ	reminder	11
3231313532323233	IN:CREATE_REMINDER	मुझे पैप स्मीयर शेड्यूल करने के लिए तीन सालों में याद दिलाएं	reminder	11
3231313532303930	IN:CREATE_REMINDER	क्या आप मुझे अमेजन से अधिक प्रिंटर पेपर ऑर्डर करने की याद दिला सकते हैं?	reminder	11
3231313532303335	IN:CREATE_REMINDER	श्रीमती थॉमस के लिए एक रिमाइंडर सेट करें कि ओरिएंटेशन 7 तारीख 9 बजे है और उन्हें इससे 10 मिनट पहले सचेत करें	reminder	11
3231313531383439	IN:CREATE_REMINDER	मुझे कल दोपहर 3 बजे मैरी को कॉल करने की याद दिलाएं।	reminder	11
3231313531383433	IN:CREATE_REMINDER	मुझे कैलेब को कुछ पैसे ले जाकर देने होंगे, कृपया मुझे कल सुबह 9 बजे याद दिलाएं।	reminder	11
3231313531373730	IN:CREATE_REMINDER	मैं सुबह 10 बजे की ट्रेन नहीं छोड़ना चाहता; क्या आप मुझे 30 मिनट पहले याद दिला सकते हैं?	reminder	11
3231313531373231	IN:CREATE_REMINDER	कृपया मुझे शाम 4 बजे ईस्टर्न टाइम पर अपना gmail का खाता देखना याद दिलाएं	reminder	11
3231313531363832	IN:CREATE_REMINDER	अगस्त में फुटबॉल खेल के बारे में रविवार को मुझे याद दिलाएं।	reminder	11
3231313531363737	IN:CREATE_REMINDER	क्या आप मुझे गुरुवार शाम 6 बजे एनाटॉमी का सबक 3 पूरा करना याद दिला सकते हैं?	reminder	11
3231313531353631	IN:CREATE_REMINDER	मुझे शुक्रवार को मीकल की दवाईयाँ लेने के लिए याद दिलाएं।	reminder	11
3231313531343530	IN:CREATE_REMINDER	आज शाम 6:00 बजे मुझे नेटफ्लिक्स से हुलु में स्विच करने की याद दिलाएं।	reminder	11
3231313531333937	IN:CREATE_REMINDER	पानी का बिल 15 तारीख तक बकाया है मुझे उसे भरने के लिए एक सप्ताह पहले याद दिलाएं	reminder	11
3231313531333933	IN:CREATE_REMINDER	मुझे आज रात जेसिका को टेक्स्ट करना याद दिलाएं	reminder	11
3231313531333431	IN:CREATE_REMINDER	मुझे अगले बुधवार दोपहर 2:00 बजे पॉल को कॉल करना याद दिलाएं।	reminder	11
3231313531323736	IN:CREATE_REMINDER	रोज को अगले सोमवार को कॉल करने के लिए अनुस्मारक सेट करें।	reminder	11
3231313531323031	IN:CREATE_REMINDER	मुझे याद दिलाएं कि शनिवार को दोपहर 3 बजे मेरी हेयर अपॉइंटमेंट है और पहला अलर्ट तीन घंटे पहले भेजें।	reminder	11
3231313531313638	IN:CREATE_REMINDER	मुझे मंगलवार को मेरी डेंटल अपॉइंटमेंट से एक घंटे पहले याद दिलाएं	reminder	11
3231313530393837	IN:CREATE_REMINDER	शनिवार शाम 8 बजे कर्मचारी पार्टी का रिमाइंडर सेट करें	reminder	11
3231313530383036	IN:CREATE_REMINDER	मुझे दोपहर के बाद बैंक को कॉल करना याद दिलाएं।	reminder	11
3231313530373937	IN:CREATE_REMINDER	बुधवार सुबह 9 बजे, स्कूल पंजीकरण का रिमाइंडर सेट करें	reminder	11
3231313530363839	IN:CREATE_REMINDER	मुझे कल दोपहर 1 बजे मेगन को टेक्स्ट करना याद दिलाएं।	reminder	11
3231313530363732	IN:CREATE_REMINDER	मुझे 20 मिनट में ड्रायर से कपड़े बाहर निकालने की याद दिलाएं	reminder	11
3231313530333634	IN:CREATE_REMINDER	मुझे आज सुबह 11 बजे कॉन्फ्रेंस कॉल में भाग लेना याद दिलाएं।	reminder	11
3231313530313137	IN:CREATE_REMINDER	शुक्रवार को सुबह 8:00 बजे मेरा नया काम शुरू करने के लिए एक रिमाइंडर सेट करें	reminder	11
3231313530313037	IN:CREATE_REMINDER	मुझे शुक्रवार दोपहर को न्यूज़लेटर के बारे में सूजी के साथ आगे की कार्यवाई करना याद दिलाएं।	reminder	11
3231313439393430	IN:CREATE_REMINDER	मुझे कल सुबह 10 बजे जॉन को कॉल करना याद दिलाएं।	reminder	11
3231313439373239	IN:CREATE_REMINDER	कल शाम 6 बजे जिम को कॉल करने के लिए मुझे याद दिलाएं।	reminder	11
3231313439333237	IN:CREATE_REMINDER	पिताजी के लिए रविवार को दोपहर 12 बजे टेनिस के लिए मुझसे मिलने का रिमाइंडर सेट करें।	reminder	11
