ID	intent	text	domain	label
39343534323137	IN:GET_INFO_RECIPES	आप बनाना ब्रेड को कितनी देर पकाते हैं	recipes	28
39343534313231	IN:GET_INFO_RECIPES	कृपया वेनिला फ्रॉस्टिंग के लिए सामग्री प्रदान करें	recipes	28
39343534303735	IN:GET_INFO_RECIPES	पास्ता सलाद में कौन सी सामग्री होती है	recipes	28
39343534303731	IN:GET_INFO_RECIPES	ज़बरदस्त स्वाद वाले पोर्क स्टू में क्या-क्या सामग्री होती है	recipes	28
39343534303231	IN:GET_INFO_RECIPES	क्या मुझे कुकीज़ में आटा चाहिए	recipes	28
39343533383433	IN:GET_INFO_RECIPES	आप पास्ता को कितनी देर तक पकाते हैं	recipes	28
39343533343332	IN:GET_INFO_RECIPES	मुझे चिकन को क्रॉकपॉट में कितनी देर तक पकाना चाहिए	recipes	28
39343533323733	IN:GET_INFO_RECIPES	बीफ को पकाने का न्यूनतम तापमान क्या है	recipes	28
39343532393732	IN:GET_INFO_RECIPES	स्ट्रिंग बीन कैसरोल में कौनसी सामग्रियाँ डाली जाती हैं	recipes	28
39343532383936	IN:GET_INFO_RECIPES	तैयारी से लेकर खाना पकाने तक की रेसिपी को कितना समय लगेगा	recipes	28
39343532383630	IN:GET_INFO_RECIPES	मक्खन की एक आम स्टिक में कितने बड़े चम्मच होते हैं	recipes	28
39343532373036	IN:GET_INFO_RECIPES	ओवन में ब्राउनीज़ पकाने में कितना समय लगता है	recipes	28
39343532363735	IN:GET_INFO_RECIPES	सिके हुए आलू बनाने के लिए कौन सा तापमान सबसे अच्छा है	recipes	28
39343532343438	IN:GET_INFO_RECIPES	आप मछली को कितनी देर तक पकाते हैं	recipes	28
39343532333438	IN:GET_INFO_RECIPES	कैसे पता चलता है कि चिकन पक गया है	recipes	28
39343532323638	IN:GET_INFO_RECIPES	कृपया मुझे बताएं कि फेटूचीनी चिकन अल्फ्रेडो की एक सर्विंग में सोडियम की कितनी मात्रा होती है	recipes	28
39343532303737	IN:GET_INFO_RECIPES	KFC फ्राइड चिकन के लिए सामग्रियां बताएं	recipes	28
39343532303732	IN:GET_INFO_RECIPES	लज़ान्या में क्या डलता है	recipes	28
39343531383239	IN:GET_INFO_RECIPES	एक बर्गर में कितनी मात्रा में प्रोटीन होता है	recipes	28
39343531373339	IN:GET_INFO_RECIPES	रेमन नूडल्स में कितने मिलीग्राम सोडियम होता है	recipes	28
39343531373337	IN:GET_INFO_RECIPES	आप गाजर को कैसे छीलते हैं	recipes	28
39343531353134	IN:GET_INFO_RECIPES	मुझे नूडल्स कब तक पकाने चाहिए	recipes	28
39343531343533	IN:GET_INFO_RECIPES	मैं चिकन को कितनी देर तक पका सकता हूँ	recipes	28
39343531313234	IN:GET_INFO_RECIPES	चावल और पानी का अनुपात कितना होता है	recipes	28
39343531313131	IN:GET_INFO_RECIPES	आलू के चिप्स में कितनी मात्रा में कार्बोहाइड्रेट होते हैं	recipes	28
39343530383337	IN:GET_INFO_RECIPES	मैं कैसे बता सकता हूं कि अंडा खराब हो गया है	recipes	28
39343530363237	IN:GET_INFO_RECIPES	मुझे चिकन ब्रेस्ट कितनी देर तक पकाना चाहिए	recipes	28
39343530343035	IN:GET_INFO_RECIPES	मीटलोफ के लिए किन सामग्रियों की आवश्यकता होती है	recipes	28
39343530313337	IN:GET_INFO_RECIPES	चिकन को ओवन में कितनी देर बेक करना चाहिए	recipes	28
3139343332393636	IN:GET_LIFE_EVENT	क्या निक फोल्स शादीशुदा है?	people	29
39353639323736	IN:DISLIKE_MUSIC	मुझे यह गाना पसंद नहीं है। इसे बंद करें।	music	30
3231353439333639	IN:DELETE_ALARM	कृपया मेरी अलार्म रद्द करें।	alarm	31
3231353439303735	IN:DELETE_ALARM	मेरे मौजूदा अलार्म डिलीट कर दें	alarm	31
3231353439303439	IN:DELETE_ALARM	मेरे सभी सेट अलार्म रद्द करें ।	alarm	31
3231353439303137	IN:DELETE_ALARM	सेट किया गया हर एक अलार्म रद्द करें	alarm	31
3231353439303130	IN:DELETE_ALARM	कल के सभी अलार्म हटा दें	alarm	31
3135323931303732	IN:DELETE_ALARM	अगले 2 अलार्म रद्द करें	alarm	31
39353536383737	IN:DELETE_ALARM	लंच वाला मेरा अलार्म हटा दें	alarm	31
39353332353832	IN:DELETE_ALARM	कृपया अलार्म रद्द करें।	alarm	31
39343931323936	IN:DELETE_ALARM	मेरे सभी निर्धारित अलार्म रद्द करें	alarm	31
3232343532333430	IN:SET_RSVP_YES	TEDxSeattle के आमंत्रण को हाँ कहें	event	32
3232343532323937	IN:SET_RSVP_YES	दीया डे लॉस मुर्टोस के लिए हाँ में rsvp करें	event	32
3232343532313536	IN:SET_RSVP_YES	ओलिंपिक पेनिन्सुला एप्पल एंड साइडर फेस्टिवल के जवाब में हाँ भेजें	event	32
3232343532313533	IN:SET_RSVP_YES	मेरे स्टेटस को बदलकर 'Naomi Klein on the Green New Deal में जा रहा हूँ' करें	event	32
3232343532303735	IN:SET_RSVP_YES	ग्रिल्ड चीज़ ग्रैंड प्री में जा रही हूँ	event	32
39353530383134	IN:ADD_TO_PLAYLIST_MUSIC	उस एल्बम को मेरी प्लेलिस्ट में जोड़ें	music	33
3232353832333139	IN:GET_MESSAGE	मैं पोते चेयेन द्वारा भेजे गए मैसेज देखना चाहता हूँ	messaging	34
3232353832323733	IN:GET_MESSAGE	आइए मेरे नाना के संदेश देखते हैं	messaging	34
3232353832323630	IN:GET_MESSAGE	ऐडरीएल द्वारा मुझे भेजे गए टेक्स्ट दिखाएं	messaging	34
3232353832313839	IN:GET_MESSAGE	मुझे मेरी दादीजी के वीडियो संदेश दिखाएं	messaging	34
3232353832313838	IN:GET_MESSAGE	गर्लफ्रेंड जेसमिन के संदेश दिखाएं	messaging	34
3232353832313833	IN:GET_MESSAGE	आइए जिडियन के पाठ्य-अंश देखें	messaging	34
3232353832313031	IN:GET_MESSAGE	मुझे मेरी बहन मेव के वीडियो संदेश दिखाएं	messaging	34
3232353832303836	IN:GET_MESSAGE	भतीजी एस्टेबन द्वारा कौन से वीडियो मैसेज भेजे गए हैं	messaging	34
3232353831393732	IN:GET_MESSAGE	मेरे पिताजी लायला से मुझे मिले टेक्स्ट दिखाएं	messaging	34
3232353831393139	IN:GET_MESSAGE	मुझे मेरे पति हेडन के संदेश दिखाएं	messaging	34
3232353831393131	IN:GET_MESSAGE	मैगी की ओर से मेरे संदेश क्या हैं	messaging	34
3232353735303836	IN:GET_MESSAGE	मुझे वॉट्सऐप के माध्यम से पॉल द्वारा भेजे गए टेक्स्ट दिखाएं	messaging	34
3232353734393032	IN:GET_MESSAGE	मुझे फेसबुक के माध्यम से जेनिस के टेक्स्ट दिखाएं	messaging	34
3232353734383336	IN:GET_MESSAGE	मुझे वॉट्सऐप के माध्यम से एम के संदेश दिखाएं	messaging	34
3232353734363831	IN:GET_MESSAGE	फेसबुक पर मेरे टेक्स्ट को डिस्प्ले करें	messaging	34
3232353734353533	IN:GET_MESSAGE	क्या मिकी ने मुझे फेसबुक पर कुछ भी भेजा है	messaging	34
3232343436353231	IN:GET_MESSAGE	क्या लीला किरिट्सी ने मुझे कोई मैसेज भेजा है?	messaging	34
3232343436353132	IN:GET_MESSAGE	क्या फिडेला मेनियार ने मेरे लिए कुछ भेजा है?	messaging	34
3232343436343534	IN:GET_MESSAGE	क्या गेब्रियल ने मुझे कोई संदेश भेजा है?	messaging	34
3232343436343232	IN:GET_MESSAGE	क्या एमिली एम. बेंडर ने मेरे लिए कुछ भेजा है?	messaging	34
3231333638313332	IN:GET_MESSAGE	मुझे कोई मैसेज दिखाएं	messaging	34
3231333637393835	IN:GET_MESSAGE	कोई नया मैसेज	messaging	34
3231323832383331	IN:GET_MESSAGE	टिअना आज सुबह क्या कह रही थी	messaging	34
3231323831363238	IN:GET_MESSAGE	क्या आप मेरे लिए नए संदेश पढ़ सकते हैं?	messaging	34
3231323831353839	IN:GET_MESSAGE	क्या लिन ने इस सप्ताह मुझे टेक्स्ट किया था?	messaging	34
3231323739393234	IN:GET_MESSAGE	क्या जैक ने मुझे कल रात मैसेज किया था?	messaging	34
3231323739363330	IN:GET_MESSAGE	क्या कल रात माँ ने मुझे संदेश भेजा था?	messaging	34
3231323738393132	IN:GET_MESSAGE	कल प्राप्त हुए मैसेज पढ़ें।	messaging	34
3231323737383539	IN:GET_MESSAGE	क्या जॉन ने मुझे शुक्रवार को मैसेज किया था?	messaging	34
3231323735343631	IN:GET_MESSAGE	क्या आप मेरे सभी नए संदेश पढ़ सकते हैं?	messaging	34
3231323735343539	IN:GET_MESSAGE	मेरे सारे बिना पढ़े हुए मैसेज पढ़ें।	messaging	34
3139393837353037	IN:GET_EVENT	ऑरलैंडो में करने के लिए चीजें	event	35
3139393837323437	IN:GET_EVENT	आज रात बिलोक्सी में क्या हो रहा है	event	35
3139393836393538	IN:GET_EVENT	इस सोमवार न्यू यॉर्क में होने वाले थिएटर शो	event	35
3139393836393434	IN:GET_EVENT	मियामी में इवेंट्स	event	35
3139393836363937	IN:GET_EVENT	आज रात डाउनटाउन OKC में क्या चल रहा है	event	35
3139393836363039	IN:GET_EVENT	एटलांटा में क्या चल रहा है	event	35
3139393836353833	IN:GET_EVENT	इस वीकेंड मॉन्ट्रियल में संगीत कार्यक्रम खोजें	event	35
3139393836353430	IN:GET_EVENT	शुक्रवार को क्या हो रहा है	event	35
3139393836333539	IN:GET_EVENT	क्या इस वीकेंड में डाउनटाउन सिल्वर स्प्रिंग में कोई रोचक इवेंट है	event	35
3139393836333332	IN:GET_EVENT	कल के लिए सैन फ्रांसिस्को में आर्ट शो	event	35
3139393836313635	IN:GET_EVENT	इस वीकेंड क्या चल रहा है	event	35
3139393836313239	IN:GET_EVENT	क्या आज रात कुछ मजेदार होने वाला है	event	35
3139393835393631	IN:GET_EVENT	कोई विशेष इवेंट आने वाला है	event	35
3139393835393235	IN:GET_EVENT	सैक्रामेंटो में कल होने वाली कोई रोमांचक घटना	event	35
3139393835383230	IN:GET_EVENT	आज की ईवेंट्स	event	35
3139393835373638	IN:GET_EVENT	इस शनिवार मेसक्विट में होने वाली स्पोर्टिंग ईवेंट्स	event	35
3139393835373438	IN:GET_EVENT	क्या आज रात कुछ हो रहा है	event	35
3139393835373035	IN:GET_EVENT	इस वीकेंड लाइव संगीत के सबसे अच्छे इवेंट कहाँ हैं	event	35
3139393835353836	IN:GET_EVENT	अगले वीकेंड में लाइव संगीत कार्यक्रम	event	35
3139393835343831	IN:GET_EVENT	आज एल पसो में कहाँ जाना है	event	35
3139393835343536	IN:GET_EVENT	रोलेट में ईवेंट्स	event	35
3139393835333432	IN:GET_EVENT	क्या डैलस में कोई इवेंट हो रहा है	event	35
3139393835333133	IN:GET_EVENT	अगले सप्ताह कौनसी फिल्में आएंगी	event	35
3139393835313938	IN:GET_EVENT	अगले शुक्रवार की शाम अटलांटा में करने के लिए चीजें	event	35
3139393835313731	IN:GET_EVENT	इस वीकेंड लेनियर झील पर क्या होने वाला है	event	35
3139393835303537	IN:GET_EVENT	आज रात सिएटल में होने वाली कुछ ईवेंट्स के बारे में बताएं	event	35
3139393834393332	IN:GET_EVENT	मियामी में शुक्रवार की रात को क्या हो रहा है	event	35
3139393834383539	IN:GET_EVENT	अगले वीकेंड ब्रन्ज़्विक में करने लायक चीज़ें	event	35
3139393834383339	IN:GET_EVENT	जनवरी में कौन सी ईवेंट्स होंगी	event	35
3139393834373631	IN:GET_EVENT	इस वीकेंड बाल्टिमोर में क्या हो रहा है	event	35
3139393834363935	IN:GET_EVENT	आज रात बर्लिंगटन में क्या होने वाला है	event	35
3139393834343934	IN:GET_EVENT	क्या इस वीकेंड टुसान में कोई मजेदार इवेंट होने वाला है	event	35
3139393834323438	IN:GET_EVENT	परसों क्या होने जा रहा है	event	35
3139393834303837	IN:GET_EVENT	रविवार के इवेंट का क्या हुआ	event	35
3139393834303435	IN:GET_EVENT	क्या मेरे पास अगले शुक्रवार के लिए कोई कार्यक्रम है	event	35
3139393833383435	IN:GET_EVENT	अगले हफ्ते हिलो की इवेंट्स	event	35
3139393833353731	IN:GET_EVENT	आज रात करने के लिए रोचक कार्य	event	35
3139393833353431	IN:GET_EVENT	सैक्रामेंटो में ईवेंट्स	event	35
3139393833353039	IN:GET_EVENT	क्या 8 दिसंबर को टांपा में कोई संगीत कार्यक्रम होगा	event	35
3139393833353033	IN:GET_EVENT	आज रात करने के लिए क्या है	event	35
3139393833343736	IN:GET_EVENT	मुझे नए साल की पूर्वसंध्या पर एटलांटा में करने लायक चीज़ों के बारे में बताएं	event	35
3139393833343732	IN:GET_EVENT	जैक्सनविल में आने वाले इवेंट	event	35
3139393833343533	IN:GET_EVENT	क्या सोमवार को कोई कॉमेडी शो आने वाले है	event	35
3139393833343138	IN:GET_EVENT	इस वीकेंड एनवाईसी में पर्यटन से संबंधित बातें क्या हैं	event	35
3139393833323035	IN:GET_EVENT	इस वीकेंड पर जाने लायक मस्त पार्टियाँ	event	35
3139393833313236	IN:GET_EVENT	क्या आप मुझे इस वीकेंड में होने वाली सबसे लोकप्रिय घटनाओं के बारे में बता सकते हैं	event	35
3139393832393732	IN:GET_EVENT	अगले सप्ताह क्या हो रहा है	event	35
3139393832393136	IN:GET_EVENT	इस सप्ताह डलास में कौन सी कॉन्सर्ट हैं	event	35
3139393832393130	IN:GET_EVENT	मैं कल क्या कर रहा हूँ	event	35
3139393832383835	IN:GET_EVENT	क्या मेरे क्षेत्र में अगले सप्ताह कुछ दिलचस्प होने जा रहा है	event	35
3139393832373032	IN:GET_EVENT	अगले महीने ट्रेंटन में खेलों के कौनसे इवेंट हो रहे हैं	event	35
3139393832313931	IN:GET_EVENT	इस हफ्ते कौन सी एक्शन फिल्में लग रही हैं	event	35
3139393832313231	IN:GET_EVENT	ऑस्टेल, जॉर्जिया में करने लायक चीज़ें	event	35
3139393832313131	IN:GET_EVENT	क्या आप मुझे आज रात का सबसे आखिरी शो खोजने में मदद कर सकते हैं	event	35
3139393831383138	IN:GET_EVENT	क्या इस वीकेंड में कोई कॉन्सर्ट हैं	event	35
3139393831373532	IN:GET_EVENT	क्या इस वीकेंड कोई कॉमेडी शो है	event	35
3139393831363039	IN:GET_EVENT	आज रात मियामी में क्या चल रहा है	event	35
3139393831353535	IN:GET_EVENT	लोस एंजलेस में होने वाले संगीत के इवेंट खोजें	event	35
3139393831343431	IN:GET_EVENT	कल न्यू यॉर्क में होने वाला कोई कॉन्सर्ट	event	35
3139393831343031	IN:GET_EVENT	क्या 25 दिसंबर को क्लरमोंट में कुछ मजेदार हो रहा है	event	35
3139393831323233	IN:GET_EVENT	अगले सप्ताह कोई संगीत कार्यक्रम	event	35
3139393831313936	IN:GET_EVENT	इस महीने रैले के त्यौहार	event	35
3139393830363930	IN:GET_EVENT	न्यू यॉर्क में क्या हो रहा है	event	35
3139393830353234	IN:GET_EVENT	क्या इस वीकेंड में कुछ मजेदार हो रहा है	event	35
3139393830343833	IN:GET_EVENT	मुझे कल मेलबोर्न में करने लायक चीज़ें दिखाएं	event	35
3139393830333433	IN:GET_EVENT	आज रात एंटीआक में क्या किया जा सकता है	event	35
3139393830303836	IN:GET_EVENT	कल रात 10 बजे, न्यू ओर्लींज़ में कौन-से इवेंट होने वाले हैं	event	35
3139393830303637	IN:GET_EVENT	मुझे आज रात करने के लिए कुछ मजेदार चाहिए	event	35
3139393739363030	IN:GET_EVENT	इस हफ़्ते होने वाले इवेंट	event	35
3139393739353630	IN:GET_EVENT	डाउनटाउन किसीमी में क्या हो रहा है	event	35
3139393739353336	IN:GET_EVENT	हैमेट में म्यूज़िक इवेंट	event	35
3139393739343932	IN:GET_EVENT	ग्रीनविल, साउथ कैरोलाइना में करने लायक चीज़ें	event	35
3139393739343632	IN:GET_EVENT	ह्यूस्टन में क्या हो रहा है	event	35
3139393739343339	IN:GET_EVENT	आज लोस एंजलेस में क्या चल रहा है	event	35
3139393739333034	IN:GET_EVENT	इस वीकेंड पर फ्रेज़्नो में कॉन्सर्ट	event	35
3139393739323637	IN:GET_EVENT	शिकागो में होने वाले कुछ इवेंट क्या हैं	event	35
3139393739323633	IN:GET_EVENT	इस सप्ताह सैंट ऑगस्टीन में होने वाले खेल के इवेंट	event	35
3139393739323132	IN:GET_EVENT	रैले में होने वाले कार्यक्रम	event	35
3139393739303530	IN:GET_EVENT	अगले महीने के लिए ह्यूस्टन की आगामी कॉन्सर्ट्स	event	35
3139393739303132	IN:GET_EVENT	आज रात क्या हो रहा है	event	35
3139393738393731	IN:GET_EVENT	आज रात के मिनियापोलिस के इवेंट	event	35
3139393738393330	IN:GET_EVENT	आज रात सैन डिएगो में करने लायक चीज़ें	event	35
3139393738373538	IN:GET_EVENT	अगले वीकेंड एंडोवर में करने वाली चीजें	event	35
3139393738363439	IN:GET_EVENT	इस सप्ताह का कॉमेडी शो	event	35
3139393738363436	IN:GET_EVENT	क्या अगले वीकेंड पर कोई दिलचस्प इवेंट हो रहा है	event	35
3139393738363332	IN:GET_EVENT	अगले वीकेंड लोरेन में क्या होने वाला है	event	35
3139393738353634	IN:GET_EVENT	आज रात पोर्टलैंड में करने के लिए कुछ भी	event	35
3139393738343934	IN:GET_EVENT	क्या ब्रेनट्री में कल कुछ करने लायक है	event	35
3139393738343437	IN:GET_EVENT	इस महीने के अंतिम दिनों में क्लीवलैंड में करने लायक मजेदार चीज़ें	event	35
3139393738343338	IN:GET_EVENT	सवाना जाने का मजेदार समय	event	35
3139393738343034	IN:GET_EVENT	आज न्यू यॉर्क में कोई संगीत-समारोह है	event	35
3139393738323038	IN:GET_EVENT	क्या अगले वीकेंड करने के लिए कुछ है	event	35
3139393738303133	IN:GET_EVENT	कल क्या-क्या कर सकते हैं	event	35
3139393737353131	IN:GET_EVENT	आज रात क्या हो रहा है	event	35
3139393737343433	IN:GET_EVENT	क्रिसमस के दिन कोई भी ईवेंट्स	event	35
3139393737343131	IN:GET_EVENT	इस महीने क्या चल रहा है	event	35
3139393737323633	IN:GET_EVENT	इवेंट का कैलेंडर	event	35
3139393737313037	IN:GET_EVENT	इस वीकेंड पर किस तरह के इवेंट होने वाले हैं	event	35
3139393736393439	IN:GET_EVENT	अगले सप्ताह करने वाली कुछ बातें	event	35
3139393736383135	IN:GET_EVENT	फरवरी में कौन से कॉन्सर्ट हैं	event	35
3139393736373836	IN:GET_EVENT	लाइव म्यूजिक ईवेंट्स	event	35
3139393736373736	IN:GET_EVENT	क्या कल कुछ मजेदार हो रहा है	event	35
3139393736363939	IN:GET_EVENT	कार शो जल्द ही हो रहा है	event	35
3231363735393531	IN:HOLD_CALL	होल्ड द लाइन।	calling	36
